Store,Analyst,Type,Title,Link,Published,Summary
CVS,Dhiraj Manghani,Closing,"Another Lexington pharmacy location is closing. Here’s where, when - Lexington Herald Leader",https://news.google.com/rss/articles/CBMiiAFBVV95cUxQRFUyV3RNTmlVTzVfemYwWlhOQWNEUW01aTZIRXVOd0JOMU1lTTNlTmM2V19DZEdTOGV6Qzctdkt2SVFZRFJCcEZWVW9NaUh1Y1d1WXJMVTJKOUs1bnktUWd0WHpGQmJ2ZzJucVNFR25RSHBJZ25jZ256QmRFTXV0TEtyUlhDelp00gGIAUFVX3lxTE84eTdVYkcwYUZaSUNiWkduYU9hd202andmQURmT3ZlZTloUzhiMG80cDZaT0t4QTB0OWUtUVlNT3RZaUR1MUtsS2JDczhiSUxSa2NHRDQ0ajNKTnMteHRHV0NTWUVKNGtDamJTeFM5a3lxNklPZnFtRzRzeGc5YUU4NVo1WTFKRGw?oc=5,"Wed, 18 Mar 2026 19:00:00 GMT","Another Lexington pharmacy location is closing. Here’s where, when Lexington Herald Leader"
CVS,Dhiraj Manghani,Closing,TN House advances bill CVS says would close 100+ stores in the state - WJHL,https://news.google.com/rss/articles/CBMiogFBVV95cUxPVUFJdHE5VnpzUUFzYy13MTlyUm0ySUFZMTJIMWgwaXlmQV9LYlYzc1hYcEZPQy1YdkhlNWZSVjd4cnFveV9RazR0NVJnUVU3UUxQY3ljUHNOZGZmZDZfd2MxQmJuYkxmTVB3Y20zU25UVHpocVBTZkRKVld0ZEVidFltc05hUW9xdXFrdDN6anMtdmZkaHhlSTl3RFN2UWJ5MWfSAacBQVVfeXFMUHB4d25XWmRieHFWa2g1YWM3ZEFHQk85VW9TT2ZfQWlMbUQwcnZjYTFnOHZhbTdVSzRHdmQyZU9MdU9CbG1FYTVfVWZrNUZ0QUZtV1c3WVBvNWFDdnBvMWZkTlhUUUU2ZmE4eHgtTXByZ2Vlclg5YUNhRXhla3pNOVloeU90TlU3Z1BTek9PZ2xLUlNOX1prOWMwNzF2b2ZMNWZYUVZWTDA?oc=5,"Tue, 17 Mar 2026 23:28:47 GMT",TN House advances bill CVS says would close 100+ stores in the state WJHL
CVS,Dhiraj Manghani,Closing,Rep. Aftyn Behn calls for an investigation into CVS claims that pharmacies are closing - WZTV,https://news.google.com/rss/articles/CBMitAFBVV95cUxQUDVlY0ZtdTNveFVwN1hsSGl5MWppeWNkWmtWNXl1NDdWeWhBQkt0Uk5uWTBZQ2xmNGpQNWF3Ql9JTXI0VUItMzM2WDhYU29GWFBWVU9iN0ZPZjVQRnpDc2lFRWVmVzktVTRXZnBRLVl0TTh2aHU4aG1YX0VfcHlBdF9fTVVCTHAtMjd5M1V5NnQxWXdvb0k2eE5uaUpIcE15UE1YdjRVVl9MbkJxa3BhRVBQdkQ?oc=5,"Thu, 19 Mar 2026 18:33:05 GMT",Rep. Aftyn Behn calls for an investigation into CVS claims that pharmacies are closing WZTV
Domino's Pizza,Dhiraj Manghani,Closing,Domino’s franchisee seeks Chapter 11 protection as closures sweep pizza industry - Irish Star,https://news.google.com/rss/articles/CBMimwFBVV95cUxNWnFBRVpidjRUUk9qSGUtRzE3X2NOSTA2Z3dBc1NNMTRFdHZiVGhjb2d4dy13ZjJFYjB4cmhZM0N2b2lmRkpVakZMLTdOSmtoMkNnV0hHQXMzYTdxcDJSaGZmZ1U4UGVkQ1M5enhKLTNtT0ZXSzEtSk1aa3V2YnZYcVF3aFJjUkhxM1EydUplc09xZ0tIR2VYeU9oQQ?oc=5,"Wed, 18 Mar 2026 20:44:00 GMT",Domino’s franchisee seeks Chapter 11 protection as closures sweep pizza industry Irish Star
Domino's Pizza,Dhiraj Manghani,Closing,Domino’s franchisee files for Chapter 11 bankruptcy as pizza chains face closures - MSN,https://news.google.com/rss/articles/CBMi0AFBVV95cUxPai1xTHBTRXNqTGp1bTVjN0NJbllIZWlBVTQ0dTRSWlFqTjZXMzZ6NzV6bW82YzhLZFlLZWlFWFdHUUFQcGVwQWtVU2RkMDRsSDZtdEFfT3RMLVVvaUdNSVIxUTZfZnZMSzc4d2kyZ2xvQUNUM2dBSHdrVzBJc3RjZTE5TlUyOHJvdDVDVjZJX1g1NTdONHhLUWZSOUZaOFd6eklWcHpuM052MXRFeHpzVnNfYzdBZFlaQks2RURpaF9yOFR2ZjAtUHV6dy1IRWpw?oc=5,"Wed, 18 Mar 2026 17:58:23 GMT",Domino’s franchisee files for Chapter 11 bankruptcy as pizza chains face closures MSN
Domino's Pizza,Dhiraj Manghani,Closing,Domino’s franchisee files for Chapter 11 bankruptcy as pizza chains face closures - The Mirror US,https://news.google.com/rss/articles/CBMiogFBVV95cUxOSzl2WFJab2hidWdDbEw0WGhBZ0hlZXY0bTNLbVdYMjdHc1VIWTZXU3pmdElUcU8zb0V0bm1oMHF4ZHFfOUhTNTZwa0x3clhOaF9rQ181Qi1QYURMQ1NWcE1EX05fTUs4OHBHLVR6TUF3V2tuZjFIZThtc2ZuT2FleURhV0tyZ3NJWnVtaGdQaEk5SFhZZkMwZUJCQjlSLWRya1HSAaIBQVVfeXFMTks5dlhSWm9oYnVnQ2xMNFhoQWdIZWV2NG0zS21XWDI3R3NVSFk2V1N6ZnRJVHFPM29FdG5taDBxeGRxXzlIUzU2cGtMd3JYTmhfa0NfNUItUGFETENTVnBNRF9OX01LODhwRy1Uek1Bd1drbmYxSGU4bXNmbk9hZXlEYVdLcmdzSVp1bWhnUGhJOUhYWWZDMGVCQkI5Ui1kcmtR?oc=5,"Wed, 18 Mar 2026 17:27:12 GMT",Domino’s franchisee files for Chapter 11 bankruptcy as pizza chains face closures The Mirror US
Domino's Pizza,Dhiraj Manghani,Closing,Domino's tightens grip on pizza wars as main rival shutters hundreds of stores - MSN,https://news.google.com/rss/articles/CBMixAFBVV95cUxNZTZXQXdPSmJtcUlxYklqcHpyaEJLNHl0UGw4VUM2OFlsZkNmbW5vcDM3MTRiZDIxU0RPZ2Z3Z0JHV0c2cWw2VnBycnhUWFBBUkkwRHlFNGF5TEFlaDFWUlg5THluWndZVFJLV3VpbVZfVnlDUmdWalU2Q1p3cEJuUXlMa09lUk05NzhRelM5czZQeTRkSHpoOThLUG1qQUFhUGhQdURlVG5TeWtWaEg5SUtzejJFMWhjWmkzTjRINnZzZDVE?oc=5,"Wed, 18 Mar 2026 12:37:01 GMT",Domino's tightens grip on pizza wars as main rival shutters hundreds of stores MSN
Domino's Pizza,Dhiraj Manghani,Closing,Domino’s Pizza Franchisee Files for Bankruptcy Amid Wave of Pizza Chain Closures - people.com,https://news.google.com/rss/articles/CBMifkFVX3lxTFAwbkI2RzcwajFFRmN2Y00yUnhsQ25XUkpVYy1IcWViak9McFFIeUdGaUxrR3NnMFY1Y2xyU0lsdnBQMlJpaEN6bnE0XzZiTUNiVjlaZDFsUnBySExIS0EtYVl5U29OLUxDRUxMWldyWGdpZFJzcjFxdFFlNldxdw?oc=5,"Tue, 17 Mar 2026 20:41:40 GMT",Domino’s Pizza Franchisee Files for Bankruptcy Amid Wave of Pizza Chain Closures people.com
Domino's Pizza,Dhiraj Manghani,Closing,Domino’s Pizza Franchise Operator Declares Chapter 11 Bankruptcy - Meyka,https://news.google.com/rss/articles/CBMikAFBVV95cUxONHNPUjFTYkd3UzdlREVrRENuS1N5eHVUMHo1YkY3aWtlMUJmOFhvcGNuaTVQYWJrQmJOOU5GaENPRHhNZVVOenk5U1hYSU5sVF94Y2pTVC1OUElfbDJpLTdzX1hWMnYydFd2Q1RYc0ctOGRiVzdfZWlVeDgzaElMN0hIN3czNnl2VEVha0EzTGM?oc=5,"Tue, 17 Mar 2026 06:13:59 GMT",Domino’s Pizza Franchise Operator Declares Chapter 11 Bankruptcy Meyka
Domino's Pizza,Dhiraj Manghani,Closing,Major pizza chain’s franchisee files for Chapter 11 bankruptcy - thestreet.com,https://news.google.com/rss/articles/CBMikgFBVV95cUxQWUdfel9Oc1h2dVhOQ1dDYjNKckhmM3FFYWdKakNTMzlIQTlGNDljS2tBTVZUcElYM29UNFVMX2RzUEhGTXZFMEtlWTczMFA2R0FZODROQWZPVW9QNmh1R09QZ2Z0WXdvNEVIVHlFZXd6VGl4LXRTM0I5VlpqeGg4NFItRmxISGs5Y1RSeEhwQ0d4UQ?oc=5,"Thu, 19 Mar 2026 14:43:51 GMT",Major pizza chain’s franchisee files for Chapter 11 bankruptcy thestreet.com
Domino's Pizza,Dhiraj Manghani,Closing,Domino’s franchisee files for Chapter 11 bankruptcy as pizza chains face closures - AOL.com,https://news.google.com/rss/articles/CBMiiwFBVV95cUxOc3htSC1rY0dHQloyZ0h1WVhhZXpyU3FTaXRtQTJsbmwtN0R5SEVXSTFZeFRkMWNtWDR3am1SM19FR0M1SGhMenUtMkJObG1YZTBNVk1YTU40SWM5UC1KbGlnRDU1ZmQ5ZjM0UlUtalRUd2xJLXRIYy04SmtUbnZrYWtMR0NpbkdiSi1n?oc=5,"Thu, 19 Mar 2026 05:54:36 GMT",Domino’s franchisee files for Chapter 11 bankruptcy as pizza chains face closures AOL.com
Ross Stores,Rahul Vasaya,Opening,Ross Dress for Less opens new stores in NY. See where - The Journal News | lohud.com,https://news.google.com/rss/articles/CBMiogFBVV95cUxPS3R1M3ZGNlNleEpfX1cwUkxIMDlIYXhycnNxODVIQlpaR0RkN3NGM1NWdEQxenk5ZWJNQ0QzTnU1dzB0UDZobzRiR2pMR2M3MGlCcHI1LUQzYXk3ZjZYRWtBczRwZmgzbGUzd1Flc0dubGpKcWd0R1FJbVNpTENFelktSFFaUFVLUG9pMlFBUmR5REZPUFgyTVVLcHJNblF6VUE?oc=5,"Wed, 18 Mar 2026 13:23:00 GMT",Ross Dress for Less opens new stores in NY. See where The Journal News | lohud.com
Ross Stores,Rahul Vasaya,Closing,Nordstrom closing 2 stores by end of summer: See where - AOL.com,https://news.google.com/rss/articles/CBMic0FVX3lxTE1MaWl1bWRxajhkTFk3VFNKU05DNXdEWHFoNmxEaEFaMVlVZFpwZS1GeEFxR0s1NXVFcXJaVkpDeXRGUDhWbjUtaGR4WW9LbkU4N1gyQ3F4SE5XX1ZBQU9wUGFQaUVUMVdhUTk4M3Zzei1td1U?oc=5,"Wed, 18 Mar 2026 15:40:58 GMT",Nordstrom closing 2 stores by end of summer: See where AOL.com
Walmart,Rahul Vasaya,Opening,World’s largest convenience chain famed for ‘spotless bathrooms’ breaks ground on state's first location - The US Sun,https://news.google.com/rss/articles/CBMijAFBVV95cUxNNkVvdGJTanVET2dTN1ZIV0JpV095WTd5NUQ1LTd2N0diRWNWa3N3aFZZUV9IRzU0cGNzQTJxUDZGQ0FTWTdUdkc4Y3lkcUV1b1daYkk1SVhzMmpQNHZKb0Vyc1RPbGwxM2JBMTdiVThLM3E5REkwM3NIM0xZZnlrOWhEY1c0dU9JSFVqWA?oc=5,"Wed, 18 Mar 2026 15:31:19 GMT",World’s largest convenience chain famed for ‘spotless bathrooms’ breaks ground on state's first location The US Sun
Walmart,Rahul Vasaya,Closing,Walmart to temporarily close parts of some stores. Here's where. - USA Today,https://news.google.com/rss/articles/CBMipwFBVV95cUxNUmd6LUxnajhSVk1SSXhWMGVQcHVLbXNVY1dyOTJEanl1c2g2cUItX3ZoTnBUcVA3M0JvTHF1eUZ4eEU1OHJkVVV6VHVrU3EtY1NXRkZwVTNzVi1mUnd6WlBQSlktM2tpakJNSi04VDFDWm5mWkx1a05QUGVoT2RNSWFqeEJxY0tVWERLMnpVZ2JudGtZdnZOdW1VaXJaVllscE04OVhWdw?oc=5,"Wed, 18 Mar 2026 18:43:00 GMT",Walmart to temporarily close parts of some stores. Here's where. USA Today
Walmart,Rahul Vasaya,Closing,Walmart closing some Neighborhood Markets for 4 weeks under new program - AL.com,https://news.google.com/rss/articles/CBMirAFBVV95cUxOMF92c1lob19KX0tybHNjWGx5eW1fRXBWMFNaZkNjZjhURG1DTUdkMXZIdXNOWVNkc0htVmJKZjVKX3VzM3diOVFjWXZJRHNzYktxV2VEQjNmLXFQVXJrc2Q3dlZmVVhTS1NEYnZ4WVhhWUx1dDFxTXNROURtUlprV0JnNk01TUxMNnFkQlRfWlcwVGE2R1c5ZWNBOXRSbWxGNFVIdHZQQjJlaEJE0gHAAUFVX3lxTE56NEdkakpaeW5YU1NYUVV3YVVUWGxSakRyRUJEaXZZT0h6dWp6WWFOQ2dJZkhtMlJxQTBNNUVxVEZjdWNteW9fSHlvM3ljNTVfS1JCdlNVcy1kUGx2Y0paUy1xLWZDZ0g4T3EwM0xjMmJtR2xzOWhKYkVsTjFTRTB2MzFtbU0wSUE3cjBIUWlkVENVeW1sbW9rMnRkZk9RTHhHaU5Pb296MGtpTFo0bDJWNlRjNWc2VEpzQ1BKRXV6OA?oc=5,"Thu, 19 Mar 2026 17:41:00 GMT",Walmart closing some Neighborhood Markets for 4 weeks under new program AL.com
Walmart,Rahul Vasaya,Closing,These Walmart stores in Texas are partially closing for renovations - El Paso Times,https://news.google.com/rss/articles/CBMiygFBVV95cUxNOE8zdGpKa2EyelR4MmkzSVp1SVEyREZRWkR1djFpZHN5WE1NS3ZLQ0lYWFZNXzBIWTRFV3ZtdjNIN3dIZnprSkZJV29qRnNVMTJ6ZENQZVBJZXAzVnBlQ2VOZHN3NkhvVzYwRTlOUTVWb0p2QlVkVjVDeUdzdllGZjFmVzgyUUJ5bEp3SGVSbGN2QlZYOU1ySEN2bTc4ZnI3akpQYmJzMWlXeWpmQXdNZ0ZFdlRhZmJQemh6QkV3RkxHcEFHYnplamxn?oc=5,"Thu, 19 Mar 2026 13:05:00 GMT",These Walmart stores in Texas are partially closing for renovations El Paso Times
Walmart,Rahul Vasaya,Closing,Walmart to close some stores through April for ‘rapid’ renovations. Here’s which ones are affected - The Independent,https://news.google.com/rss/articles/CBMikwFBVV95cUxNYlhvek50SHNMUlhxMy1pUTl2U0NpT3VfTEFPY1FsMjBIX1hJOC1HME12TVU2c1ZJR1VsU1dhYXk0d1M5OVkySUdxam5EVmg1UjZoQkwwM1ZUcFhDVXc0cU1POTVVWkRlcGJsclAwRlg3UUV5cV85SVMwWGlLYkVRRTBUUFpYa1gwbXBJYTg5Y2JqSUU?oc=5,"Thu, 19 Mar 2026 12:59:00 GMT",Walmart to close some stores through April for ‘rapid’ renovations. Here’s which ones are affected The Independent
Casey's General Stores,Rahul Vasaya,Closing,Casey's Stock Surges 2.75% on Strong Earnings Despite 448th-Ranked Trading Volume and Mixed Analyst Outlook - Bitget,https://news.google.com/rss/articles/CBMiY0FVX3lxTFBwSTRZY1UwM1M0Z28xZDA4ZE1GSmQzUk5kWkplWGdGT3duRVRJVVY1UEo2ZVQyWDBEUUExS2ZDMkpSWW1FanZXMEozSzdDSlh0ZzBhRW55NGZzWDVHQWc2M2hPY9IBY0FVX3lxTFBwSTRZY1UwM1M0Z28xZDA4ZE1GSmQzUk5kWkplWGdGT3duRVRJVVY1UEo2ZVQyWDBEUUExS2ZDMkpSWW1FanZXMEozSzdDSlh0ZzBhRW55NGZzWDVHQWc2M2hPYw?oc=5,"Wed, 18 Mar 2026 01:05:25 GMT",Casey's Stock Surges 2.75% on Strong Earnings Despite 448th-Ranked Trading Volume and Mixed Analyst Outlook Bitget
Safeway,Rahul Vasaya,Closing,Safeway grocery store closing in Northeast - WUSA9,https://news.google.com/rss/articles/CBMiuwFBVV95cUxOd2tqZDQ0NzlDSWpudWRzc0dtRVZQZVNBeGlCNlpuOUJidWpPS2Y4ZXp3M0JUTmRRU0tSaW1kYzhsa1hCRFpFM25RY3JvcVprU3RqeFkwcjFEeTZMMDhJTmx0NTJEZVlzRjFRRFZlT3IwbmxGbUt2UC1KV0VkT0hRcldiMFZ1bmxabHE4M3IzeG01RHBaSFBTVTEwcGhnZmIzbFE3WndJdEhoUHQ0YWNKZFFaOTlSbk5KbTJZ?oc=5,"Wed, 18 Mar 2026 02:27:00 GMT",Safeway grocery store closing in Northeast WUSA9
Safeway,Rahul Vasaya,Closing,So long to Safeway store after 40 years – retail giant confirms May 16 total closure - The US Sun,https://news.google.com/rss/articles/CBMiiwFBVV95cUxPVHJ0dGpQRGMyd0hLcEdPSF9kR2F4bm9zWVV0TDRpdGcxQU9mMjRoaGp4QWZhZVlaSExHeU5LUERpQ3YyZjd5SV95Sm5sLTVxWGd3dG1jbXY5QU05amM5MHJZTHgxU245WVBmT3hxakhTYzk2R1k5cnFHb1NJSWRKUXFfU19Kbng1bFZF?oc=5,"Thu, 19 Mar 2026 11:02:08 GMT",So long to Safeway store after 40 years – retail giant confirms May 16 total closure The US Sun
Safeway,Rahul Vasaya,Closing,Safeway says so long to its Hechinger Mall location - WTOP,https://news.google.com/rss/articles/CBMiigFBVV95cUxPdHVhclhadGdkdktKNlplOFBwSnNnQmZPU09jSm1JNXItTS0xMmVQclVNTHp3T0hIS0M4VW11Q1QyYWhMcml2UU93SVd5WlFQLUNzOUpKNUhXT0NjNVNNcW9YckpfMTRYZmdsTHJmeUgtTXZuOEowcGc2bHBLZk5kRk84M2d1Sjg1NVE?oc=5,"Thu, 19 Mar 2026 02:11:14 GMT",Safeway says so long to its Hechinger Mall location WTOP
Sprouts Farmers Market,Rahul Vasaya,Opening,Plans for Sprouts grocery store in Jefferson Park appear to be moving forward - Nadig Newspapers,https://news.google.com/rss/articles/CBMiqgFBVV95cUxQV1JldmsxdGJsdHZGTHdSTlktSXR6Zks5WWdURHVnZ01SanpIVThha3QyYjFDN1BqWXhoUVg2UWg3UlA0WmUwOVN3ejBTY0xLMUJWbjFTWWVxNGV6Ql9NREs1SGM3VzRoUUJ0R19FZU0xbmJWSnNrZzU2MlZIbW05SkMtVTdLdXF5MTJhTWNzTDd5WVB6UjJDUlY4bldqMTZ4UXFFclRRakt5QQ?oc=5,"Tue, 17 Mar 2026 20:43:20 GMT",Plans for Sprouts grocery store in Jefferson Park appear to be moving forward Nadig Newspapers
Sheetz,Ankit Rawat,Opening,Sheetz to open new area location next week - MSN,https://news.google.com/rss/articles/CBMiuwJBVV95cUxNWGpDcnE4UVhpeWx0THBXX0R0dEhxbEloanhqWDBfeFotOVgyNEh4RGUxcXFkZHJnTGI1YTlmNnBpMGRJLWZLbTJhMTA4VFJsQ3p0T2R6MnZVZ0xScjYzSnZvcG95cEE1NkxjbXdvZXFYOF93ZVl2VXNuOXZoRlgwUGZGZWlZTEJyUUx3R0h3VHpYLTh5a01wYU9xcno5bFdUTUs4M1d6UXZINDdkVzgwTVhOLXh5ZTVEQUJlZTJSWjJnMjdlS250MDV6b0ttN2RoM25fU0ZnODRYVnVYazQxMDJza3JvQzlwUGItekhLdGNOU0l0WGVrMVBVUExQUC1PcndCV0NsN245VldtNUtsUWZYNUI2SkVBTmpmRlJVWFhQTnBUTUU4T0hnZFdEN2V0SGFzVWNTdWxUZUE?oc=5,"Wed, 18 Mar 2026 21:15:26 GMT",Sheetz to open new area location next week MSN
Dillard's,Ankit Rawat,Opening,Dillard’s opens new store in Beavercreek with ribbon-cutting; hundreds of shoppers attend - WHIO TV,https://news.google.com/rss/articles/CBMi2AFBVV95cUxNWEJYbml1UjRzUjlwYUx6SlAtTUtVbkNWRWpnOFp1Qlg5b2dKUC1mdHJIRHJRWHFQd1JEZ1NyR1lzTXctQlZZV0ZhNmFTRWh2NGNyT0NiN0RtbWMtd21qV0xPLTYyeFdZUm9GdjlwX0JsSVQxMWFLbUxHSkNjajZmRHFfLVR6QTZ5ZHA2ejliLTc0SXJOb3ZBbmhoa0w5UXdBV1VCYUJWMndRc3Z3SG5UZTB3aDZBaTJUcmVvSE1lSFBsV0lVVTBvMTlOeHdmc01pNm4xWlp2Sk7SAewBQVVfeXFMUDB2cjU1bUFheWZiTEg5X1pRN1hIYjU3dDNiVUlxR3RxTDl3bkJtQkFKejdJTFU0RkJxSUxTeERwRDdIem1MYlcybTlvNWMxNFVCUDJ0R1dPTDE4TjNDYjVXN2hscnZteWtOcmdOUkhwUGV4Q3dWUzJCZTdaV3VIWHZSOG5HM0pCWWF6aHZNazNQR1BNZFU3QnRnNlppQkFneW94SWJ2S0hDdzVaVXVEeGNhTXZ4elVtWG5tY0JZLTItR3JhWFdfYzR6bnBqV2dRTTl4Wkg2Y3VaZVh3dWNlcHpUXzQwMXZSWkZKd1c?oc=5,"Thu, 19 Mar 2026 19:52:33 GMT",Dillard’s opens new store in Beavercreek with ribbon-cutting; hundreds of shoppers attend WHIO TV
Dillard's,Ankit Rawat,Opening,Dillard’s to host ribbon-cutting ceremony for Beavercreek location - MSN,https://news.google.com/rss/articles/CBMi0gJBVV95cUxNb2JGYWZOQ1lJVlA0bDNhVElJdDRHYmtvYkVsR2V4ZjY4RGRvWFZETURwdmRTMWltWXNlSmJnZ3hSWGFjRi1QMS1fY2V0c1cwcjVSWFhPZ19tTkRwcXJMRWNobk5RTkVpZzhUNlJYOTdtTUZFbDVibWJwcnhUY0piYmVJMGl5S2tNeTJzS1FYNzI1SHo0akFBNldneHh1Q1dLaXRkdTk4ZThZalRsZElacFFYZ1lHZEFZTEp6enpwSEdMbnh1Slh5Y0FXdzRXMzlscjgzSXVfUWs5SHJWd0NiV3VDSHhOUHJtWkY5djc5NGt3Nzd1bDNnLUV0T3FqYzFVSk1haDA2QzNrVTNRU08tZFFfN0RBLXpCckxQSW5oTjdaTS13V21qcUhzSXpyV042VXlBZExHWHl3TmRWdmppajNUb3ZUWmIwTEc3MmlaMXFZUQ?oc=5,"Thu, 19 Mar 2026 14:28:43 GMT",Dillard’s to host ribbon-cutting ceremony for Beavercreek location MSN
Macy's,Harsimranjeet Singh Ghelani,Opening,Dillard’s to host ribbon-cutting ceremony for Beavercreek location - WHIO TV,https://news.google.com/rss/articles/CBMizgFBVV95cUxPX1h4ZGRuWmp6VUk0SGVJLWdFWGxieWdtZ3phek1pT253czVseE9OZC1EWDN1V3E1T2UwUklENlFSV3ZITHJpTXdya1B1Y19tcjlBdTlFblh0WlVjYWVvR2QzQnlNZ3Nsd3RTaWdNME41eHc1bHFYSnBuc3ZSVERydDFuZmtfMmtRbDhxMWx4RDYyQ1ltRjk3YlkzSmRscWJqQUlwLWhFcVQzRmRnUlY4T0YtOHkwdkdRbEc0MHVYOTZlUTlIWUlLNzJZM0ptUdIBzgFBVV95cUxPX1h4ZGRuWmp6VUk0SGVJLWdFWGxieWdtZ3phek1pT253czVseE9OZC1EWDN1V3E1T2UwUklENlFSV3ZITHJpTXdya1B1Y19tcjlBdTlFblh0WlVjYWVvR2QzQnlNZ3Nsd3RTaWdNME41eHc1bHFYSnBuc3ZSVERydDFuZmtfMmtRbDhxMWx4RDYyQ1ltRjk3YlkzSmRscWJqQUlwLWhFcVQzRmRnUlY4T0YtOHkwdkdRbEc0MHVYOTZlUTlIWUlLNzJZM0ptUQ?oc=5,"Thu, 19 Mar 2026 07:43:18 GMT",Dillard’s to host ribbon-cutting ceremony for Beavercreek location WHIO TV
Macy's,Harsimranjeet Singh Ghelani,Closing,Macy’s CFO issues major update on 150 closures - The US Sun,https://news.google.com/rss/articles/CBMijwFBVV95cUxNbFdOekJzTXphenNpQ1hraVJTRnhIVE5yUHhadUdiR0dWeGQwZXNXcFRkeXJCcElmVmlwVThjYzByOFYzLUJhelRqb1paY0txTlJjb2ctZi1FRGoxMmR2TV9kMDFCZk9sTFNFTVZJdE8waDRRanBqd1A2cVExaloyRU5HR1JnMEFNLTdJX0Yxbw?oc=5,"Wed, 18 Mar 2026 13:23:54 GMT",Macy’s CFO issues major update on 150 closures The US Sun
Macy's,Harsimranjeet Singh Ghelani,Closing,"Macy's store revamp shows progress, but company expects sales to fall this year - CNBC",https://news.google.com/rss/articles/CBMib0FVX3lxTE1HOXZDLXlpT0dkd2Iyd1N0a2R2WlVzaDI4YUgwQ1ZLSVNOMXo0X2QtWXJZcGo2cUN0Zzd2YVI0Y3MtN2ZmWFVGTVFqeTFnUEVqZmJ1b3ZqTlQzMVdCRDR2WmFUcHRFcGFnOG1iSlZhTdIBdEFVX3lxTE5NTlcwNHhhUXliT21ENGl0dzA1QmlHaS1jZmM2ak11TnVDODhJd1I5VXFkTHFqNkoyb29FMEVBMnd3bGRiakVoTnRDdGVnWF9CQk1yYUtwd2JXY1ZTYmZZZVhldkNIeUJOaUdEbklFUnNENHNG?oc=5,"Wed, 18 Mar 2026 11:03:21 GMT","Macy's store revamp shows progress, but company expects sales to fall this year CNBC"
Macy's,Harsimranjeet Singh Ghelani,Closing,"More than 1,400 stores are set to close across the US in 2026. Here's the list. - Business Insider",https://news.google.com/rss/articles/CBMia0FVX3lxTE9SUTdiM1JqclMzakxVV3hnTHU3N0ZOdHQ2UFhvc0RMS0kwM1FQQnFKd3RUb3ctOWpLSHRyc2o4d3pDX2lVQUdRcEJ3bzhKNWZzT1VuNEY0MGk2XzVXLTVHanRNMHBRRWM5aVVN?oc=5,"Tue, 17 Mar 2026 10:22:00 GMT","More than 1,400 stores are set to close across the US in 2026. Here's the list. Business Insider"
Macy's,Harsimranjeet Singh Ghelani,Closing,Macy's store closures update: Doomed locations will shutter over a longer timeline than previously planned - Fast Company,https://news.google.com/rss/articles/CBMingFBVV95cUxOaXU4dmVEN1dBcFF0MVpmdFFPa1NBX1Zob3ZtTU9seF91SjNVdTUtYlg0dlVWeG85VGpHUFN2TU0yeXpORnY0VE5pSlZHRGRWdEMyV0tzcU1IM2Jua0l6UlhwaWVNTWlqSWluUUY0TTBCd3J2Q3hsWER1UWV1ZDVfUWNnckd3YmFzQ2FiemJ4MXB6OE12M1JyOTY4OC1kUQ?oc=5,"Thu, 19 Mar 2026 17:30:29 GMT",Macy's store closures update: Doomed locations will shutter over a longer timeline than previously planned Fast Company
Neiman marcus,Harsimranjeet Singh Ghelani,Closing,"Layoffs, store closures mount but Saks Global sees end to bankruptcy ahead - The Business Journals",https://news.google.com/rss/articles/CBMiowFBVV95cUxORGM2MjE4RmpSYjQ2V0RRVHB1ZWdlWUQzSFpnYXRWZnNRUTQ1dzR5MDViaEJ2RXpMcngwRGdqWVBnMWtaUXJfckRWeERyRC1WYnlkOGpjYUhwbE5Ncjk4bGdZU0dqQjBfbzhTazZ0RjlfbmhYc0pNNlRndE9sa1FDdTRXUkxNQXZ6TzdJbWdzVVBkZmxlOFN2My1oS3Njby1MWjI4?oc=5,"Tue, 17 Mar 2026 11:44:00 GMT","Layoffs, store closures mount but Saks Global sees end to bankruptcy ahead The Business Journals"
Saks Fifth Avenue,Harsimranjeet Singh Ghelani,Opening,Hit by Saks closing: Where will Beachwood Place go from here? - Cleveland.com,https://news.google.com/rss/articles/CBMipgFBVV95cUxNcnNQRWRLWC05LWtGNFNoWmxjczF2YWtKRDE2Y1Y0U2xYaDEya2dOd1ltWjFyclJTazVOaGhZSEw4b1NoNk1PVEdxMjFvcVJlaldQakZ1T1ZLaXVMZ1U1M3p1RWRPakwwRk14Nk1qTzE3V0NwT3RldHBSUTNheS00MWEzMXBuNTJFdGNyMjF5b2hNMXlKQkNxZVlqX3c1LVJ5Vk5EemJB0gG6AUFVX3lxTE9MNXVlNzRLU0FMeEZLQmRqUjJpa1B3UkNrMjhFWHFibUJZcE0wM0taVlZzMmF0R3FMSEgtd3UtMTlEWHloUnZ5UlRCZlpDNFFvc2J0U01YaWdOZ1FfQUtHLUZxLTdZY005Wk9rV2gxaEVENXBKNUhURm5nZzNRSjZ0T2ZLZXNUeVVSUFZ0VUxKNFJaWS1lUW0zbE5yaVhlVUMxWXpSN1JhUFRMQWE1dmlGY3V4RXY0cHREZw?oc=5,"Wed, 18 Mar 2026 13:35:00 GMT",Hit by Saks closing: Where will Beachwood Place go from here? Cleveland.com
Saks Fifth Avenue,Harsimranjeet Singh Ghelani,Closing,Saks Just Filed for Bankruptcy: Should Other Department Stores Be Scared? - 34th Street Magazine,https://news.google.com/rss/articles/CBMiswFBVV95cUxQeGVJSVFkS1ZuMEMyTXRoV3pmR053SzZSNGs1bUhNVWV4dUxKUjVoZHFKMlNlNG5sTjlwOXkwMUl2aDhSaWgyc1ByZ1NnTFpReE5pbHhtUHJmYlBPcUZxOHJNd0prWDdjSFZHZDFzUkd5WFBIM29jcjRKRF9iTGQtTmIxeEtJZjZld1hWbUNjamUyWWN5dlplaktxeURkVThMSkdjT2pwZ0tBT2dmVDVGV0tXSQ?oc=5,"Wed, 18 Mar 2026 18:34:19 GMT",Saks Just Filed for Bankruptcy: Should Other Department Stores Be Scared? 34th Street Magazine
Saks Fifth Avenue,Harsimranjeet Singh Ghelani,Closing,"Saks Fifth Avenue closing PA locations, 205 workers laid off - MSN",https://news.google.com/rss/articles/CBMiyAFBVV95cUxQUHVsSVExeDY1ZlRDN1g5YTlxemJ4YTN3NlFIbDB6U2lqdkJqZjBRWU93Tk9fZWVjM1RpRkdIamlTRWdJUGE2QjFSWWV4TDZjQmtSRXhyb3J0a1dYcXJjNXBjQUtrUnhpUWRMdHFuWnVCVWdlcG5xaW1mLUpTV25QSkdLMGl1M19rYlQ0ZXB5RjgtdjJVOFk5TzJqajhMcWI2eFJHRW8wdmlwenF3ekUwdmlYWjkwLTRyNHNvTUg2UGd5Qnp1SUdNYw?oc=5,"Wed, 18 Mar 2026 15:35:29 GMT","Saks Fifth Avenue closing PA locations, 205 workers laid off MSN"
Saks Fifth Avenue,Harsimranjeet Singh Ghelani,Closing,Saks Fifth Avenue's only Alabama store closing. When will it close? - MSN,https://news.google.com/rss/articles/CBMiuwFBVV95cUxNUVNnbWFBdEQ3NWR0ekpIazBvb0laOWxJZVFSZ0pWalQ1OGtoVlU3M0UzY1ZNdGVva1ZEYnVtWEsxd2hNdUVOaTNqZXBraUlrZG9udVZidFFNY1phMkpaWHoycWJwRkQ1d1c5NHl0RTljd2VCSE93MmN0MUtKaDdOcG5hSHNUSzJycTlwanhCRTBPcElCVXUteXE4OGtPc1IyZ1VXVXUyQzhUVGU4UlpoQ21icWZCY2N5b013?oc=5,"Wed, 18 Mar 2026 14:34:58 GMT",Saks Fifth Avenue's only Alabama store closing. When will it close? MSN
Saks Fifth Avenue,Harsimranjeet Singh Ghelani,Closing,Hit by Saks closing: Where will Beachwood Place go from here? - Cleveland.com,https://news.google.com/rss/articles/CBMipgFBVV95cUxNcnNQRWRLWC05LWtGNFNoWmxjczF2YWtKRDE2Y1Y0U2xYaDEya2dOd1ltWjFyclJTazVOaGhZSEw4b1NoNk1PVEdxMjFvcVJlaldQakZ1T1ZLaXVMZ1U1M3p1RWRPakwwRk14Nk1qTzE3V0NwT3RldHBSUTNheS00MWEzMXBuNTJFdGNyMjF5b2hNMXlKQkNxZVlqX3c1LVJ5Vk5EemJB0gG6AUFVX3lxTE9MNXVlNzRLU0FMeEZLQmRqUjJpa1B3UkNrMjhFWHFibUJZcE0wM0taVlZzMmF0R3FMSEgtd3UtMTlEWHloUnZ5UlRCZlpDNFFvc2J0U01YaWdOZ1FfQUtHLUZxLTdZY005Wk9rV2gxaEVENXBKNUhURm5nZzNRSjZ0T2ZLZXNUeVVSUFZ0VUxKNFJaWS1lUW0zbE5yaVhlVUMxWXpSN1JhUFRMQWE1dmlGY3V4RXY0cHREZw?oc=5,"Wed, 18 Mar 2026 13:35:00 GMT",Hit by Saks closing: Where will Beachwood Place go from here? Cleveland.com
Saks Fifth Avenue,Harsimranjeet Singh Ghelani,Closing,Saks Fifth Avenue in Bala Cynwyd is closing - MSN,https://news.google.com/rss/articles/CBMitAJBVV95cUxPdzNSenZGQmh4ZUltcjB3ZEk4Z3hHdnE5dVFvWXd0dG9qenBCcmJuNGcxVjhOVzQ4a0NpcENCWldHUWZ3YXB5NklXaGRaZkxlaXEyVEZOUmQwR21RWWZBeE5CSVFiNU1jNUtqU202N3h5SGFtdHRzc1B4Z0tkTWdZaVVVQnEwVGh0Ml9BVHF3bDVfSHJnVHFxMVl5MVM1ZFRabTljdVRfTEQwUmJqSG9HQUx2OFRqQTdfMElaaDlzU05mTUl5ZU92V1pvR0FxQi1RdWlwWmxIeHQyQzFjMzJxMDJnYXFsRTlSeXJidUhJLTM2SXdkRm00a1duZFJUVnhmMlM1bk9DM05EOUV6bjdpeUxDLXZBRTRnZVhSaXNKYVZoUG1hZXBydV9wTENyRjhzMm41Sw?oc=5,"Wed, 18 Mar 2026 12:27:11 GMT",Saks Fifth Avenue in Bala Cynwyd is closing MSN
Saks Fifth Avenue,Harsimranjeet Singh Ghelani,Closing,Saks Fifth Avenue closing its one and only Louisiana location. Here's where - MSN,https://news.google.com/rss/articles/CBMixgFBVV95cUxOLWhDenJvUk5NYXVBYU9PMUhQbW5VQ3A1a195MUpKSkpqTkFxek1ERTlSQTZQeHNablBGcEdiOUhFb2taTWlLSjBqamR3RU5zYjQ0TDlQbjF6eFdNLVBNM19URU5VTkdfZ21qNFpPQzY4SU1ibnVDbkMtSVg1bVZITE85N2VTLVlhZVQ0ZDcxT0JpY0VDNUNYc2ZWN09nSjlWVS1CdmVQeGR4X2h5Yk9IX0tjOFpsdEZGTFN2c1dQYS1UR01hT3c?oc=5,"Wed, 18 Mar 2026 11:47:23 GMT",Saks Fifth Avenue closing its one and only Louisiana location. Here's where MSN
Saks Fifth Avenue,Harsimranjeet Singh Ghelani,Closing,"More than 1,400 stores are set to close across the US in 2026. Here's the list. - Business Insider",https://news.google.com/rss/articles/CBMia0FVX3lxTE9SUTdiM1JqclMzakxVV3hnTHU3N0ZOdHQ2UFhvc0RMS0kwM1FQQnFKd3RUb3ctOWpLSHRyc2o4d3pDX2lVQUdRcEJ3bzhKNWZzT1VuNEY0MGk2XzVXLTVHanRNMHBRRWM5aVVN?oc=5,"Tue, 17 Mar 2026 10:22:00 GMT","More than 1,400 stores are set to close across the US in 2026. Here's the list. Business Insider"
Saks Fifth Avenue,Harsimranjeet Singh Ghelani,Closing,"Saks to cut over 1,200 jobs as store closures follow bankruptcy filing - People Matters - HR News",https://news.google.com/rss/articles/CBMivwFBVV95cUxOUV8wMUVfb2Vud2RXTlpPR3BDYWl3bWVVMURKazJRd3NaSjIwSUM5VnRSMzRRN3hNTTM0QWlkTktUcl9STjBySldITFoxa09PclU4MEJiWWptLVdpUUc3Z243ZHhCaFptSVZ6TXZXRGp5ZnJCUGtlWGdQbWRJY0pwSFM2Y1ZWVXVrYXRJUTRPdXQ1czNzd1YyV2UyZ1J1aUQ2eVpRWEl0cTdrWmNFTkViN040TkdHN1ZQM2hibW5raw?oc=5,"Tue, 17 Mar 2026 04:33:16 GMT","Saks to cut over 1,200 jobs as store closures follow bankruptcy filing People Matters - HR News"
Saks Fifth Avenue,Harsimranjeet Singh Ghelani,Closing,Saks Fifth Avenue in Palm Desert closing - MSN,https://news.google.com/rss/articles/CBMi3gJBVV95cUxQLTcya2NVYjhDYVVmMVJubmJxSEI0RmMtN2tYeUl3YkhDS1JubmdxSldObkhrNjE4UjVxMHEtY1dFWHdDLUJydFFIMXdDTEdvRVBjemM3MTJ3UGJqdnNFcTNVRkUzbEpaQmVjbE9HdFhLUWwtVmE3dGV1SVhienpBUmhheVYtcXpUWWphcXRzdVJvbE9XM2wxSWt5TVQybDEzNno3b1JyQWRVc2EzX2l3QUF2VGFjRlVOTVB3VkRKMDNvQzI1dldqVkQ3a1MxOTRHb2dZazRBOHpaZzRncExVU2ZqaGJNRzY2eGRsdEFnWExzYnNZYWdnbXRFa2NZVVFXa0tDYlE2OENjb1BxS0FlUkhpaWJFUURnQkZPS3dZXzQ2aGl2aVBaUDlTbno2STlkeFo0b3pZcE1URGd1WWV2RmQ0aXctMUtNS01pdzVzOEdqRnotTzl3Y0taZndpdw?oc=5,"Thu, 19 Mar 2026 19:32:50 GMT",Saks Fifth Avenue in Palm Desert closing MSN
ARCO,Harsimranjeet Singh Ghelani,Closing,"Director of Arcos Dorados (NYSE: ARCO) reports 4,988 Phantom RSUs - Stock Titan",https://news.google.com/rss/articles/CBMiywFBVV95cUxQRzJ2b1FySVVpRElGV0xsVjdGRndHYWFVQXBienpEVnBOcEI5QzZVR3NjNFJTd1VIMWpaUzVqSGszSHZOVDh6LWpQM19zZDJIV0tPVGZqQjVjb2ZvMzgxMDlWRjJWcWhtTWVlZzhNU19qaXByQlV3TlVpcjd2TmswSUhzZVhQQWtsbTE1VUZWQjEzTWpaNjZkcjNHcG1LSXlEOUFYdFlJMkpFcTNKOE4taGNjaGFSRjdCaUxNSXlNSTJBZVNHU1lDb0tkcw?oc=5,"Wed, 18 Mar 2026 16:15:21 GMT","Director of Arcos Dorados (NYSE: ARCO) reports 4,988 Phantom RSUs Stock Titan"
ARCO,Harsimranjeet Singh Ghelani,Closing,Arcos Dorados (NYSE: ARCO) director discloses share and Phantom RSU stakes - Stock Titan,https://news.google.com/rss/articles/CBMiywFBVV95cUxPNGRlb29oOHp4VmFhM0dxQ2lKNjNfNTdWblVoc3dSUE9nRnNUV1JOSlJuUUlabmowVjA0UklQSkVmNG84UTczbXdYRjFacmIwR1JQaE5LbzRMd0VFM19NQTR4azV2d05Lb1BpQnB5dWVnRWxhb2l5SHNhMVdEeU1BVE5IOVdnU2tRbFUyQTVHWXR4ZmY5RzBkbnppeHFOd2VtYURqR2ctOEU5OC0tdVY1R1JXcUNiYzkyekRZTEM2US1HbEhMVHRnc3RmVQ?oc=5,"Wed, 18 Mar 2026 15:46:49 GMT",Arcos Dorados (NYSE: ARCO) director discloses share and Phantom RSU stakes Stock Titan
