Store,Analyst,Type,Title,Link,Published,Summary
Autozone,Ashwin Nair,Closing,"AutoZone Powers Through Q4 Headwinds: How Analysts Justify a $4,209 Target - TIKR.com",https://news.google.com/rss/articles/CBMingFBVV95cUxQWUtiR2JPNFZ6Skt5VDdib0pvVFV2WmxoNWpoZ0NrVFlUR0VSc2x4cFBJMWNXODJmanpLUmc0QnBWYWxXWHVGMTlPNWVsajJOWW80eTBZTFB2OWE4SjhoblJZNG5adENYUHB4RGRiV3p0TGtNNW1PeVZ0RzgtcDJvQlZCcmdRb3MxSGdCZ1VodEVoSUpSdV9WS01JTWlWQQ?oc=5,"Sat, 07 Mar 2026 14:09:19 GMT","AutoZone Powers Through Q4 Headwinds: How Analysts Justify a $4,209 Target TIKR.com"
Barnes and Noble,Ashwin Nair,Opening,Barnes and Noble opens new store in this Colorado city - kdvr.com,https://news.google.com/rss/articles/CBMigwFBVV95cUxQTTBvSlFRZmFscTJkNEs4NG9pSGJ5bHVPYmthOERQdXJkZ0pDZXBtSktZcDlJYUswdF9MalVmT0hHSFd0M3BCamVWQndGTlBINWtOU3hUR1dacHg3czRucmNkMHBwZ3F0OUdFakdmWWwtZXBicmV2bVVTRWE0MEZiTHZYVdIBiAFBVV95cUxNc0hqYnRlX3pNQ1F2NDRpdnUtVzNSZDM4SFNSeXE3eTlsMHZ5aUZkQ0R4dzJtYjBFSmlhUENQS0xraVNwVXBkN0lKcHBLb3lHWFhiV1ZPWWxRcHBoYnI5UGQwdHJua3VJTmVpZHpRbUJsWGtBSFIxckREa2F3NS1ERUZqZzlISDU0?oc=5,"Thu, 05 Mar 2026 14:47:56 GMT",Barnes and Noble opens new store in this Colorado city kdvr.com
Barnes and Noble,Ashwin Nair,Opening,REOPENING: Barnes and Noble to open Saturday morning - wizmnews.com,https://news.google.com/rss/articles/CBMiowFBVV95cUxPZXRRTWRpS1lRNFZKNFVqLWcyQ3VQTDF0TExEYVhJdUNhVXF4Z1I1cWFNV245ZllJMC11TTN0WGp2UklIeFFUUWlsUF9zaVNObnV0MVlNNDdxeU1aVU9fa2UzbW9WWlZiWkxWWURDWUY3V0JLV0NQSXBhbFpTbFJCOVNYUVJxRkFDN0dldTVfN2Z3THJtcGlWbk84VTBUX2VjTGNV0gGoAUFVX3lxTE43Sm1IaG1iYWFLM0loTDJaOVhDV3JqR3pNdzdfMDVzMG9rMThaV0Yyb0ROTHM2akZkUVY1RDM0Z0NQV0VtQ3RVRVVCM3NJLWg1a2J3S3lUQ0pnN21PaUN4aDhTXzQwbnU3cHZEVFQyYWEwN2RkRENjRzR6SGJ3cXRNWG9XRnVsVXI0eFE0TklzbjZiWDBwWTQxYUlFeFA3YW5SNy1IQlc0UA?oc=5,"Fri, 06 Mar 2026 22:27:01 GMT",REOPENING: Barnes and Noble to open Saturday morning wizmnews.com
BJ's Wholesale Club,Ashwin Nair,Opening,BJ’s Wholesale Club Posts Q4 Revenue Jump Amid Membership Gains - Store Brands,https://news.google.com/rss/articles/CBMijwFBVV95cUxNeUU0d21XVEdjVWI2ampVRmNGR0Ftc0Vudmo0aEN5NVEwUjFkb0Q3VFdjLXJmV01UNmVSVzRwQm1rQkhMZHFUSWNjUm1EbVh2Y29oV0pDaWozTmwwSHlQQi1acURTVW5wbzNhMTRyNlJ3R1JtbktyMnh3aHZxcDVhZk44OE9XaHlWa25WWUppaw?oc=5,"Thu, 05 Mar 2026 20:41:12 GMT",BJ’s Wholesale Club Posts Q4 Revenue Jump Amid Membership Gains Store Brands
BJ's Wholesale Club,Ashwin Nair,Opening,"Membership, digital and grocery drive BJ’s Wholesale Club in Q4 - Supermarket News",https://news.google.com/rss/articles/CBMipAFBVV95cUxPWFZzWmRlSm9zZFgxTFpMSHZyTG1Yd3JhTW1YYVZRV3NVdHI2TTd5SHBxRWRvMHBQaG1qS0JzTEx1bVNvcnctLUI2R1VXMFlYV0hibGE0NmZ0dGQycUJEVEpiby1SQjd6RFFmYjFpRFlZcW9XdFg4VzRnbUs4MHhqc1YyRnJqYkpVU3p4aWJSa212aDR2YW90bXdWWk1jYmlGNlRkTw?oc=5,"Fri, 06 Mar 2026 18:04:19 GMT","Membership, digital and grocery drive BJ’s Wholesale Club in Q4 Supermarket News"
BJ's Wholesale Club,Ashwin Nair,Opening,"New club stores BJ’s, Costco near openings in Dallas-Fort Worth - Dallas News",https://news.google.com/rss/articles/CBMitgFBVV95cUxOUVZ1VmZ1TW04dExSYnFnNkRadjVqbkNzNWlUdlMyT0J4ajIxVHpJTU9LWFBKQ3JYRG9NVS1XMl9IV3VNVjYzakpybkFTbDJaMDZCeUJ6cjRzVmx4X1UzcjkzVEpFTWlWR21aM2lPTE5iMHhRTEZGcm55RnNFaVFTNER3SEpxNklrSUZHYzNWQmszN0JfX1gtYlBoNkx4SVZFLWlEY294YVhyZUZ6YmUwZEM3TXJUZw?oc=5,"Fri, 06 Mar 2026 17:23:46 GMT","New club stores BJ’s, Costco near openings in Dallas-Fort Worth Dallas News"
Costco Wholesale Corp.,Ashwin Nair,Closing,How To Earn $500 A Month From Costco Stock Ahead Of Q2 Earnings - Benzinga,https://news.google.com/rss/articles/CBMixwFBVV95cUxQVjRGRGpJSVl2QWFHNFNVbWcxOFZ5aHFOaFhPUXcwb3dEenBSNWZtVTg2UU5tazQ4cl93QTFmYkQ0eVA5OS01ZTVzY3U3WlZMTFktUkc2LWdpZ0RlZEJ6S3NRWWVhQTV5TWlxSldYTFozcE1ReFYwOE5HajdTcnplamh1OFlvRUtIUzAzQ2dzN2lUMEpKT3JjNWJFU0RTN1RsaGNERlQ5ZmhYUlA4cmttTlJ1T194Z1VDLXV5aVpUWkc2RkY3bFhr?oc=5,"Thu, 05 Mar 2026 12:59:07 GMT",How To Earn $500 A Month From Costco Stock Ahead Of Q2 Earnings Benzinga
Dick's Sporting Goods,Ashwin Nair,Closing,38-Year-Old Sporting Goods Giant Closing Stores - thestreet.com,https://news.google.com/rss/articles/CBMiowFBVV95cUxNQmZDczhvaUxfZHpsYlhRMzFBY2lQR3pTM05uSEczTjM4RTd5dnVsSlU1NTFESGxfc0FpbkU4MXlYdVlTSW1pdHEwN3gtM1V3MmdmTEdua0FLUkhWUjIxYWhnWVo1U0o3c0pSaGlPdmpLcE9XLWdGN2ZXVnJKR2xPQ3R4WmtWMnpEVXFmcGhlSHFUWVduRFBoNnJVOU9sSklsWDlj?oc=5,"Sat, 07 Mar 2026 14:56:52 GMT",38-Year-Old Sporting Goods Giant Closing Stores thestreet.com
Dick's Sporting Goods,Ashwin Nair,Closing,Wave bye to 170-year-old Dick's Sporting Good rival as chain closes 36 stores - the-sun.com,https://news.google.com/rss/articles/CBMihgFBVV95cUxPOTBUc2JHTE5PdXRueWZkWGNBc05odHN2anpXU25DRG85MkMydFF1VHZIa3JoRDVpYjNqTFZXMDB0ekpJZGt1Mzk2Q3BhQTNBeWlROVk5ZmlWR004Q1JyNUpkNEttWFh1YXhvUWw1d0pIdjE3R1RvdmYwTGxfOTBZNS1zMzZFUQ?oc=5,"Fri, 06 Mar 2026 15:05:42 GMT",Wave bye to 170-year-old Dick's Sporting Good rival as chain closes 36 stores the-sun.com
Walgreens,Ashwin Nair,Closing,"Northside Walgreens overwhelmed after store closures, customers say - Action News Jax",https://news.google.com/rss/articles/CBMi0AFBVV95cUxPVmE3Y2dzaDJZN2J1VFRIU2RQUjFQM3FiR0s1a1dLZnRtR2t5MzIwZkktQ3RhNmVxeGRvSGpPTmlNTTVVUExES3VJTzN6ZXpSOXIyd1A1aFVPb0IySThkYndCVkhYS0t6OVFmTXVnNklIRDJYSFBmTXBjNHRnVl8xN2VFVS1Rek43aUVfb3Jmd2ZiY25PeTNlM0J0cXJnSGdLTDBwSEFJS2hNLUVKSHdtU1cxbzNIVldFNEE2V0t3emFkQ2VVX0drS1dfd1o4NmRx0gHkAUFVX3lxTE5PN2hub2RmNV82aUZoTXpQZ2hZVnBSRTBrZXc4WVo0RE1SMUJ6UE05YVZZbGJzNlFpQ3djaWJMbVBab2hwSHZXYzVlTTZ2SUFBSmdJSVQwaGpVUHpKOVVaMTRqN1c1N2FKU2ZERGc4OGNfUldXamVyV080VlU4S3V6aG9rb2VYVzB2RzZrQV83RGUxaWtNMkM2VHZFbzNDMElPaEdQVFlxeVNkSTd5RE9jTE05Uml6ck50YXpOR2l5VHZqa3dXcmVzWFhRdnByVFBMZG44eUZyV08wT21NNEpYS2VqeA?oc=5,"Thu, 05 Mar 2026 16:30:26 GMT","Northside Walgreens overwhelmed after store closures, customers say Action News Jax"
Fred Meyer,Ashwin Nair,Opening,Fred Meyer is expanding with a new Boise-area store. Here's when it could open - MSN,https://news.google.com/rss/articles/CBMiywFBVV95cUxOdmtSbS12d1lfVWY2ZkdBdWJrM1Rkc1gxZS1ub2o0SGZZc3NjYlRzTUFBa1hKb2wyLTFiVXVHZFVYSkZWS1BSbzYySHlvQ1JzellEaVdKT2J4anhraVpmbWhXVDY4bmsyejFDcDRhNmpMUzVSV0Q4QWdfeElDOE5vWDQweHQ1Uk54VG9IMVJuQWU2RjEwN1BZdElxeDEwNU9yZklTUDEwZm1zOWhhc3EwTnJheF92aUhmanBIS1NnUXFpN1R0MmdFcUxoQQ?oc=5,"Fri, 06 Mar 2026 02:49:22 GMT",Fred Meyer is expanding with a new Boise-area store. Here's when it could open MSN
O'Reilly Auto Parts,Bhavesh Phulwani,Opening,Fifth O’Reilly Auto Parts coming to San Angelo - MSN,https://news.google.com/rss/articles/CBMirAJBVV95cUxOdmRhQjZuTjF5U0VnZFZvSVFpSk9QSUJWQS1LaDJBUjhwUGRlNk1VN0FzZld5aDNMOGVQOVlqSkdaQ0Q3MUhjbnVtRVNkQzZtRnZtbnlkOThmeWFUb3NtdHBYV084M2w1MlVQbnBPZmZLVm5FYjdyOEVieWl2MEFrTlNyRGNVN0tXRTNUNWdLdm1pT0NhYTFNTFRINVFKd1p5RGJIZVgtVjUyc180aURKeC1ZQU80ZWdsMFFZWlU3clZSOGRKMnRkTTRzUXpzY0U1ay0wNUZuaXZfWWRvdjZvZVhaa2VRVl9ndnZiQUJaeTh2MmZCZGZCdzk3Vnl6YjI2Y0tfTnVsT2VxX0JjdkRteFpqVzN3cTYtQ1JKeE45Z0dLcXpZTUZBQUFkaFU?oc=5,"Sat, 07 Mar 2026 10:40:42 GMT",Fifth O’Reilly Auto Parts coming to San Angelo MSN
Office Depot,Dhiraj Manghani,Closing,"Iconic national office retailer closing stores, no bankruptcy - thestreet.com",https://news.google.com/rss/articles/CBMipgFBVV95cUxONnBFbVhuVWN1dUxqNWFQQTI2UDU4bUtfUW91SlRLSkdkajFYTDAteGcwQjhibkpCaGJ3U0tZcF9YYktPQzZIWFZXUUc4WWh3ZzgwWW1jVlZsamJmb2NKMEtUSTM3UEIzYnJJclJndEtYRjRWVnJlSGZKaUU1WTZXOV9idDBhTHRwWjRpaFE2cnl3WnBXM0ZwbWR0ZHNOZDJpMzZXS2x3?oc=5,"Fri, 06 Mar 2026 20:43:59 GMT","Iconic national office retailer closing stores, no bankruptcy thestreet.com"
Ross Stores,Dhiraj Manghani,Opening,Ross opens 2 more Long Island stores as shoppers hunt bargains - Newsday,https://news.google.com/rss/articles/CBMimgFBVV95cUxOTXhiQUJxcUJGR09TNm50cl9GUVp0UG9KYy05UTl1Z0UzaW9VWkJsTkcxSEVLdXprZDA2T3Q3MEIxRHhGLXZXa25JenAwWVViUVJtYmtuWTBGMmQ1ZlhsTFJ3aWFZMF9mbUZiQ09PUll6cFFZblUxMGtGTXh1Z0NtQ3Y4WE52QnY3d0Z6VW5aRV9KOWROODFRZHl3?oc=5,"Sat, 07 Mar 2026 14:43:28 GMT",Ross opens 2 more Long Island stores as shoppers hunt bargains Newsday
Ross Stores,Dhiraj Manghani,Closing,Ross Stores Q4 Earnings Call Highlights - Defense World,https://news.google.com/rss/articles/CBMijAFBVV95cUxPZGxjV2hGaDg5NHdILTRyNmNVd0h5TE5FZmlETUlMZm8wNmNxakZDUmJwNmI3S1pDcG1oVHdHenVmMDdkMGszanNkUnR1WV9NMG95dXpVaEVBaFBXcC05UTFSZXY2LXFFM0VwckdzNklvQ3RzeEFVcUlCY0dNNS1SdHFtMEdVc3RidHZxMg?oc=5,"Thu, 05 Mar 2026 08:46:32 GMT",Ross Stores Q4 Earnings Call Highlights Defense World
Staples,Dhiraj Manghani,Closing,"Iconic national business retailer Staples closing stores, no bankruptcy - AOL.com",https://news.google.com/rss/articles/CBMijgFBVV95cUxNcmZLQldXcDM4ZHNKVllzZy1QSnJXZFhLNld6LUZhZzktZktUdFN3QWZNbHlZSnlpSW1RbERYX2k5djcwYkJlN2hyUkxXWU5uVFgwOFRrUE5uTEJfSWV6VkZ5X1ZZQU5Md1QtaEoyME5hbmNRbGNVYjNZeUlWbWFtUHlZS19hRGdYbjBBS05R?oc=5,"Thu, 05 Mar 2026 02:46:59 GMT","Iconic national business retailer Staples closing stores, no bankruptcy AOL.com"
Staples,Dhiraj Manghani,Closing,"Iconic national office retailer closing stores, no bankruptcy - thestreet.com",https://news.google.com/rss/articles/CBMipgFBVV95cUxONnBFbVhuVWN1dUxqNWFQQTI2UDU4bUtfUW91SlRLSkdkajFYTDAteGcwQjhibkpCaGJ3U0tZcF9YYktPQzZIWFZXUUc4WWh3ZzgwWW1jVlZsamJmb2NKMEtUSTM3UEIzYnJJclJndEtYRjRWVnJlSGZKaUU1WTZXOV9idDBhTHRwWjRpaFE2cnl3WnBXM0ZwbWR0ZHNOZDJpMzZXS2x3?oc=5,"Fri, 06 Mar 2026 20:43:59 GMT","Iconic national office retailer closing stores, no bankruptcy thestreet.com"
T.J. Maxx,Dhiraj Manghani,Opening,TJ Maxx set to open first new store in NYC in 10 years in Herald Square - MSN,https://news.google.com/rss/articles/CBMi2AJBVV95cUxNemJBdEdwaERZclpKZGFlYWxFdklFX2diZUZ5MXNucnlNTWVOWEFkRU5tZnlaZDh1VHNoQ0UwYU1YQmJnVXdsY1dUWFl6a3dfRUQ5OElFOUFMZk1UcGh4RGE0dkp5d3d4bHk3Z3hNT19FLWlvUFYwVzExbDZCcEZjQ2hYZFdRS1JaMWpMckxxZE1ZVWFJVklYRFFPTlJleEd4MXRyeVJjU19QLU9YV1JreE9jWTFjUVB6aGphSnJIbk1rbTRIcDB1Zk5DdHJmNHVPNHQxeEZMTnVjelllOTZRTDR1SWdhSUNCTFJlMEVhb0cwT29xOGV2TkFXSmJEUGNOdXR5Qzc2dXFIX290MlFJaW1KMTZHX1IwSXdKazg5WjByUXRPWjM3WF95YmZOaEtUUjhjMU5sbGZGcC1PdmRGS1dRY201d2l5WlpZekdteF9zbk5tWWZ1Tg?oc=5,"Sat, 07 Mar 2026 05:15:51 GMT",TJ Maxx set to open first new store in NYC in 10 years in Herald Square MSN
Target,Dhiraj Manghani,Closing,Grocery Outlet outlines up to 33 new stores and $0.55 EPS target for 2026 as store closures and promotional investments reshape outlook - MSN,https://news.google.com/rss/articles/CBMikgJBVV95cUxNeWJnc1RoM25oV2JNUTR3RW0teUJSbzU4TW1LUWZwNUdsVW1kVk9ETG5yTlNhdHZqVl90RUlJTWFBVXd4SThKOU5GcGJaczRsVVFnS2N1dmxVNHhDbTdRQzJmcUVQR191ajQ3Q0Yta3FPX3F3U2daakY2WW1KTFo2RXFmYU9iczlZc1JNcGlhQlpxcmhYWFUwLVM4NEhZaVlBdjI4TU9hd1dYdlplV0o2RnAzMGNlMzZZeE1Ib3FldTcySWxyX01CVDc0LUNscEpOVlhsRElCMTFkVUFKSnVuMEJmNmdtLUZRLVhkQzhiTFZMa2hlbXJNVW5VdDUyRnpWSWJ4dTBkSVdoV3BHMmc2c2tn?oc=5,"Sat, 07 Mar 2026 08:46:23 GMT",Grocery Outlet outlines up to 33 new stores and $0.55 EPS target for 2026 as store closures and promotional investments reshape outlook MSN
Walmart,Digvijay Singh,Opening,New gas station to open in front of Athens Walmart - rocketcitynow.com,https://news.google.com/rss/articles/CBMi0wFBVV95cUxOOUFNYlpXNUNOWkpMZjlXYTQwYmo2SUE2dV9paHgtdlEybDdrS1BGd1RPc1o1SG91NExEZXBuUEpRRU1MSTViRzdLeWd6VTQ3RXBWWkQyeU9YVU5lVm9aeDBEQXVWdWR5WFZnMDIwWXlKQ291MjU3ajBPQkRnVEw2YnppbHFXUDlyM3BCSEp2S21sb1NTdjR6ZjhPcU1ieHJaNnhPMkZubWpwNzFfYlRTOE9Cd1lLZWhRZUFPTUhaSjZScjNpWjlJR040bldLZm8xNGhz?oc=5,"Thu, 05 Mar 2026 19:30:58 GMT",New gas station to open in front of Athens Walmart rocketcitynow.com
Walmart,Digvijay Singh,Closing,Is Walmart Closing On November 1 Due To SNAP Benefits Lapse? Fact-Checking Viral Claims - MSN,https://news.google.com/rss/articles/CBMiqgNBVV95cUxNYldZbzg0TklPU0x5MjFDMTc1SWxnV3d2UGRUYkNfU3RkcjJfQjlkV05qeWh1a1RxN3hUblFTQ0J3dXZEWjU3NktQX00zMzdhbV9JRUdyMXVYblJ0SzN1c0hyZm51eTNGV2pTdy1KZC0wMS1NZHN5YW9iUXc0R0JxSHF5eGgxNlMtdE11bzNUbmxhNGpmTmpxWlQyeEVfWmh2dDZHTEI2cmg3R3BkZ2NxN0VLTDM0MXZJR1FTX0lybm5fVW9LejBLVkdMTEM1MVRzb2NWWW5Gemxmay11Wi1DUEZvc09BbVRzRlZ6M0Jkc1ltOVVUZFBMZ2k1eXJYR0U0RUh2SVdLeHZjakpNTjF0cllXS25hNG5USVR0QXJlbDZtVzdfTFk0elNsNF9nT2NEVndTODYtTWxYb0NOZk9oSDJ2N1VFRXNPNzFBaHZWSWcwaHhvaVVuUlA5bHE0ZTdMR1lJTU1BT2p0OXVsVV9GUTZrcjV4MEFZZ3lJTC1MdWxtQl9JT0JGOTlYU3NQR2ZxZHVneEQ1RE56M3BIM19ZZkJOYzI5YkhERGc?oc=5,"Fri, 06 Mar 2026 18:19:37 GMT",Is Walmart Closing On November 1 Due To SNAP Benefits Lapse? Fact-Checking Viral Claims MSN
Casey's General Stores,Digvijay Singh,Closing,A Look At Casey's General Stores (CASY) Valuation After Its Strong Multi Year Shareholder Returns - simplywall.st,https://news.google.com/rss/articles/CBMi6gFBVV95cUxQQThzbzRtTTRBZ2RUb2FTSEszUTJSd2NJWjE1cHgyU1I2X3ZoMUpFY1pZMlNXZm81MW8wLTJrbXpVc1o3bjRvYjlrbkdhcjVjdWJ4SlVsT1RISHktWjMwdkhUbTI0aWZVRFY0MEUzNXhkcnVpOXdHaS01ZjN4c1dhMmxxYnZsYTFuQlJHN0NTaWtPMC1rUmpEWk5tR28tU2g5UTEzbFdXSG01c0pFckNhTU1iY0dlcnNYZUxGQmEwSkh5V2dwUGlta1dlQ0JTX2szX0dHWmNEOU1ydmV6MXNnMXU5SFNUdW41R3fSAeoBQVVfeXFMUEE4c280bU00QWdkVG9hU0hLM1EyUndjSVoxNXB4MlNSNl92aDFKRWNaWTJTV2ZvNTFvMC0ya216VXNaN240b2I5a25HYXI1Y3VieEpVbE9USEh5LVozMHZIVG0yNGlmVURWNDBFMzV4ZHJ1aTl3R2ktNWYzeHNXYTJscWJ2bGExbkJSRzdDU2lrTzAta1JqRFpObUdvLVNoOVExM2xXV0htNXNKRXJDYU1NYmNHZXJzWGVMRkJhMEpIeVdncFBpbWtXZUNCU19rM19HR1pjRDlNcnZlejFzZzF1OUhTVHVuNUd3?oc=5,"Fri, 06 Mar 2026 09:57:12 GMT",A Look At Casey's General Stores (CASY) Valuation After Its Strong Multi Year Shareholder Returns simplywall.st
Sheetz,Digvijay Singh,Closing,"New thrift store, rebuilt Sheetz opening in York County - York Daily Record",https://news.google.com/rss/articles/CBMiqwFBVV95cUxNNHhwRFNSYVp6UUUtZHhhV0Q1SllOT3BJQkVydjVoaU1JbmgzRmlOOXNIa0tsX3c0V1VHblY1RHdHSE9yQ3o4Wjh6M1VPakloUk5YYk0xUHhxcHlOMEVSazhKNW1tVjdlR2tWazRtTVR6cGNVdDZDRk5kZzBqZFJrT2xiMnVkdEVqWWw0SjM4OEcyYlZDemZ6Z2dyTUNNRWVFcGtjSE1SWlNweDA?oc=5,"Fri, 06 Mar 2026 09:42:00 GMT","New thrift store, rebuilt Sheetz opening in York County York Daily Record"
FIELDS,Harsimranjeet Singh Ghelani,Opening,Charlotte's Eastland Sports Campus breaks ground with big economic promise - Axios,https://news.google.com/rss/articles/CBMi0AFBVV95cUxNd1owSnBPQnUtUkFSUlltT0lYTHRoRkdaa0cxT0xRWVJWODVGNXZaeFI1RldZNE1vdVE3VUxWQVh6MFZCZ2lLb0ctV2JaeUJlaXBEU3hoXy1pWHE4YUJPd3dZMGlfal9UbEU1OVVPR3lEaENJZ2xTeEVvbHJBTVBNdEhTRWk0NFFxemJGYllxTkE5dU40RlltWENjRk4xejlBNWxqQ1UxemY4eW1YU0YtUkJaakNXalFwVWN2R0luTmN3bmhXeGlFN0ZtTm9KOHdW?oc=5,"Sat, 07 Mar 2026 09:07:45 GMT",Charlotte's Eastland Sports Campus breaks ground with big economic promise Axios
FIELDS,Harsimranjeet Singh Ghelani,Opening,Charlotte breaks ground on $67.1 million Eastland Sports Campus set to open in 2028 - QCity Metro,https://news.google.com/rss/articles/CBMixgFBVV95cUxPVWd6dUs1REl3aTJjcXhlS1dkQ0s0ODRkb0Jmb0tCMURUU2JNU3Q4MDZHT0NrNGJJWU9nUkNEb2pJZ2xnSl9TY3BpbnZpaGtDUXc4RDUzUHlXUU1SUXlLcHRuOXBDY2VvRk9ySEdaTmhLa19YWDROZjV3SzJrc2llWkR5VFJHZTl6Z2xYWEoyOUVHSmt6enk1MWlhMHI5XzFmQ0JLXzAtU0k0N1FUVDAtUkNtOERraVJNOFUyNWJjUzBlNEhJRGc?oc=5,"Fri, 06 Mar 2026 19:01:29 GMT",Charlotte breaks ground on $67.1 million Eastland Sports Campus set to open in 2028 QCity Metro
Macy's,Harsimranjeet Singh Ghelani,Opening,Macy's Backstage hosting grand opening event March 14 - WFMJ.com,https://news.google.com/rss/articles/CBMikgFBVV95cUxOQTJKMllMRVRyRVNFWC1Rb1dNX1pqeTNHd2ZRUjF4TFE0eHBLcGVZUVNyVXRHdTBmNFNPWmtsNU9hbno1alc5QmdLYm44Y0Fha3Rkd0IzbUFDSDMxakV4eEpsZ295ZXpDc0lRUndNd3ZoVllnZGVLRThoZUNTaEVlN0hTb1BlY1I3ZC0xamVMRHZMdw?oc=5,"Fri, 06 Mar 2026 14:11:46 GMT",Macy's Backstage hosting grand opening event March 14 WFMJ.com
Neiman marcus,Harsimranjeet Singh Ghelani,Closing,"Local Saks Fifth Avenue, Neiman Marcus Stores Closing - MyNewsLA.com",https://news.google.com/rss/articles/CBMioAFBVV95cUxOVWhsY1RDUjJUYmVOWkhXVGh5Sml5Q19NRURNcDM1X1FCcGhVZTU4a1Q3NDJUUTlnUGFDYXc0b0pvTDRycW1HMVZZN2RDeEVQYVNVX3ZsREpTUEVzd1hVNl9RMk0wUVQ5eVJzdUpVX25aV1lyeFB6elV6czl6ejRoTmItTzZlaW1nY0ZuVVVUUW1iMTBzQlNhUGx4T0ZHZ2FK?oc=5,"Sat, 07 Mar 2026 19:42:04 GMT","Local Saks Fifth Avenue, Neiman Marcus Stores Closing MyNewsLA.com"
Neiman marcus,Harsimranjeet Singh Ghelani,Closing,"Honolulu’s Neiman Marcus store, Mariposa restaurant to close - KHON2",https://news.google.com/rss/articles/CBMic0FVX3lxTE9sZjVrWTdvWFpjaU1USzZKWDRlTEFrdFlSQzFzS0laXzF5YmxHUEdKNG5McVF4M2pQclNxNk5ERks1YTdEeUFPQmxvZEJzVnQ5MUFadGN5MFQ5UDhXTktDN0wyVmE3QXBBelBXTHExT2ZHTXfSAXhBVV95cUxQUU9qdmwxbzRqSmdoZ3k2YWxyLU1fdmRVcDNya2QyRktFZXdNTV9JY3U3Y1o4dkxpcDZ5NGZPdGV1eDNCTW9INEZKS1Jsd3hMQTVvZy02WXFtdi1yQVQyZklaZEVNdnk1U1RjeU9fcHJnOVBGUjlfTGI?oc=5,"Sat, 07 Mar 2026 06:59:02 GMT","Honolulu’s Neiman Marcus store, Mariposa restaurant to close KHON2"
Neiman marcus,Harsimranjeet Singh Ghelani,Closing,Luxury department store to close after nearly 3 decades - Hawaii News Now,https://news.google.com/rss/articles/CBMilAFBVV95cUxPelMxUE1vQUlDSjBuSGZPSU5ZRTJRSU1icU03dFIxWm9NaktYUkw3eHAwZW1LS1ZwMmU5bFVJWFZCRk9wYUlhV1RoZlk4a1VySFdHSUUzdzkxdU4tNTVua29ER0owRlk4OEtLMllCV3pEZlVoQ3E2aTl2VWlmWjBlR1Y2a0lNS3FfRFMwb0tlZmVCcTFB0gGoAUFVX3lxTE5ITXlBenBWdnhsMUxBVWxnNkE3aDcya29tbHJkcHBOSkowVmQ4dS0yVTNiM2Q4RzdNdUJFX3pmUHR5dmllcXI2T2Zra2tJdkd1Q1lHbkN6MjQ2WHZrWUIwQWdDcnlydXpEWU0wR1BHbW5QTVJKM3ZvanU0QjNnQzhsenZyTWY3eThLZVBudUZaWTBKYmZKLW1aaE11ZGFPekJHbzZwN1VoUw?oc=5,"Sat, 07 Mar 2026 05:15:00 GMT",Luxury department store to close after nearly 3 decades Hawaii News Now
Neiman marcus,Harsimranjeet Singh Ghelani,Closing,Neiman Marcus store at Ala Moana Center to close - Honolulu Star-Advertiser,https://news.google.com/rss/articles/CBMiqAFBVV95cUxOWGwyVzJBM1lkOWdoYlJwU3IxRndadnd3NS1qUzg1OERHRW9HeS1GYVBrUExxRW50N2NTSFQtVzdWSzI0TDg0RndLWllsOThmc3E1MU9ySVRoWFlINEJtcmhIQzNaa0tqQ1lldmtpSFFqbXZFaE41dzlDTlNRMWhvSk5TNDlWZE9YR0JEUkJUbG1nUWNPcGhUVm9EekNaYlM5T1NWbDNWd20?oc=5,"Sat, 07 Mar 2026 02:55:30 GMT",Neiman Marcus store at Ala Moana Center to close Honolulu Star-Advertiser
Neiman marcus,Harsimranjeet Singh Ghelani,Closing,"Saks Fifth Avenue, Neiman Marcus closing several stores: What to know - LiveNOW from FOX",https://news.google.com/rss/articles/CBMinAFBVV95cUxQbkRGU3ZnTGtUNk5tVjJPMTRzY2JYRWMzUmFqWnFuVjRkc1FZQktjWDJyd3U2bDVPdjc2S25qcFhoRWRZSElRTDROSWV2T0FzTUwtMkptMG5kWkpsSXYyX2tpbU1NdUx5dHhsNGk0Wk5STlQtRkp4NVFHMThIZzNoamxTVDFXV2FEYkxwWmQzazVrTW9NNl9DNEYtZnTSAaIBQVVfeXFMTVBBcGhlTFBiQUFRRWlwbTNCSTJkRDA0b0EwX213T01ZU0ZTMjNQd1VweEQzaXF4YUdYM2RxTTNDakhmc0FHUjlJdUZrWldqakVTd2FTY25QT1JydEZUN2dXM0FfZEctVzJMMWJvUTB2VVp4VVJrei14THFrenBRb3VNekdsbF9QM1RtXzRYd3o2YkZuQmdCN1ltMi00OUZ4TlpR?oc=5,"Sat, 07 Mar 2026 01:04:54 GMT","Saks Fifth Avenue, Neiman Marcus closing several stores: What to know LiveNOW from FOX"
Neiman marcus,Harsimranjeet Singh Ghelani,Closing,Saks expected to close Neiman Marcus in Ala Moana by end of May - KITV,https://news.google.com/rss/articles/CBMi4gFBVV95cUxOYUtsNDRsZXdaRXRUQ195VnJGZWJHYWw4OGVxNzJWY1J4M3p4ZUNNT0RzaU00cjl4WUx1UWk4WDlOeEZ4WUlYblJjVTZYa2xJY2FJbnVka3duYnNkeTJzUHFjcU5halhmRjJrR3ZvVWtURUg5WElKb05qZkh0WkJxWE1zYkZPbzJDSlEySTNNamh4YTEtbTJKeFBaSTUzNzBrZGUyc3gyb3c4THFrbWI1cFRwdnhGdlg5QlZYWjUzOFE5NkhkLUp2QTFKNWMzY01RTzVvSmV5em16VU9SLW9iS1ZR?oc=5,"Sat, 07 Mar 2026 00:49:00 GMT",Saks expected to close Neiman Marcus in Ala Moana by end of May KITV
Neiman marcus,Harsimranjeet Singh Ghelani,Closing,BREAKING: Saks Fifth Avenue to close Tysons Galleria store after 38 years - FFXnow,https://news.google.com/rss/articles/CBMiqwFBVV95cUxNbG00SGJaeUVGckx0QmU2cGtQaElLS3l2UHB3NlV0M25zaW5USWpfZkQzcGw3WlR0U0EzS0pLVk92S3YwMnY4RFpOV201OE1jNHJwQ1ZZeHRzYUJMUmZFbjBIMnpXd3Y3Rk5adlJLTmE1UGYzYVczd0NOSF96cEd6eWpKcWFaaW9MU0t5a3VyMjQxN29kTXhRV1lqUGRvdlZPOV9rU29GNHpVY1k?oc=5,"Sat, 07 Mar 2026 00:40:48 GMT",BREAKING: Saks Fifth Avenue to close Tysons Galleria store after 38 years FFXnow
Neiman marcus,Harsimranjeet Singh Ghelani,Closing,Long Island's last Saks Fifth Avenue store to close - Newsday,https://news.google.com/rss/articles/CBMihgFBVV95cUxOS1pxYlFaYUpJdTdyVk52Z1FGYUNOR2JpdmNEb3pWMXhNU2ZGN0lGTVNXQU1pMXFUa29YR3YwaFpPV21YVDRaTG1Yb3pZV1Y3cXB3bXdCR0JUTmNHNHEwdUNXaER1cWRka1R3Y2IyYTNFaWdaXzd3aFJXTnpiaXk4Z09rSmh3Zw?oc=5,"Sat, 07 Mar 2026 00:25:33 GMT",Long Island's last Saks Fifth Avenue store to close Newsday
Neiman marcus,Harsimranjeet Singh Ghelani,Closing,"15 more Saks Fifth Avenue, Neiman Marcus stores to close – here's the list - KREM",https://news.google.com/rss/articles/CBMi0wFBVV95cUxNMlQ3RXdUbzBXQ0QyY3JxZVVSZ1QwaGVvd0RNdE04a2J5bnJFamRfUGdlNThobG83MlQzWWxIbV9SVVJFXzJsd04xeGp2Mnd1TXJSNUNTbFhIVjlaRTlRNmU0aUFhQkFWQWZST1VNd1ppNFF3TFhSTVlFMEs0ZUh1X29PeTA2QVY0VTFYUktzMnhLSTM2eWltQXpvdWxNVG5aOUJOTGxUakpXb2xWaG9lbW0wMHlsRUlQNjFCanQ4UTRud0lWbk83WHNiUTlGd2lVdjVj?oc=5,"Sat, 07 Mar 2026 00:12:00 GMT","15 more Saks Fifth Avenue, Neiman Marcus stores to close – here's the list KREM"
Neiman marcus,Harsimranjeet Singh Ghelani,Closing,News | Saks Global to close 15 more stores across US - CoStar,https://news.google.com/rss/articles/CBMijwFBVV95cUxNVm5aSGxLOVF6SGhWVWs3UHBncjQ1VUlzMlNobThGdjJVLVpvbXFHTXgzcHl1WGc3bUpZMjJsUERfN0NBQmNmZGlzZHQ5UUtjcnBPekZ3YmducWZhcHB6ZEItNWRGT0NBaGs3cHNhWFd6aEstTUNBUHVVY2xzX25KQkEza0dHYXVXM1IyWUdzbw?oc=5,"Sat, 07 Mar 2026 00:08:17 GMT",News | Saks Global to close 15 more stores across US CoStar
Neiman marcus,Harsimranjeet Singh Ghelani,Closing,Saks Global to close 15 more stores. See shuttering locations. - USA Today,https://news.google.com/rss/articles/CBMikAFBVV95cUxQQUtCbjRCbVNqQWxUYThGYnFIRHBkMW1pYU1KSW9IN3k1N0QyNzhoS01sYnJsaXZNN0NCT2FJVFp6a0w5UFZyWXhMaGE0VjlxTHVXb2lFRVBWajNid09vUmlxY2Zkc2haVmdDN1VMWmNxaEMyQ1RzVThaN2ZwNDE5eDdsSWs5NzV4MTFDMWZKcEI?oc=5,"Sat, 07 Mar 2026 00:05:00 GMT",Saks Global to close 15 more stores. See shuttering locations. USA Today
Neiman marcus,Harsimranjeet Singh Ghelani,Closing,"Saks closing Neiman Marcus anchor at Ala Moana Center, exiting Hawaii market - The Business Journals",https://news.google.com/rss/articles/CBMikwFBVV95cUxOU203aFBsV2psaERhTElEYU9sRGY5MjBiTnN1ejBxVTN3dHRqLWtvaUpGUWNuLWNENElrLUJZQTlBM3dSbHZOMVBMQjR6QzRKX0ZsaUhtUGdhTE5YNlZNRm55VHRQNTE5N0JNRWhqNDZnMHdYbUp4cTZVZkplanNVZG9DT0taNHhheW51Njh2akQwZmM?oc=5,"Fri, 06 Mar 2026 23:44:00 GMT","Saks closing Neiman Marcus anchor at Ala Moana Center, exiting Hawaii market The Business Journals"
Neiman marcus,Harsimranjeet Singh Ghelani,Closing,Saks Global to shutter 15 more department stores in bankruptcy restructuring - ABC News,https://news.google.com/rss/articles/CBMitAFBVV95cUxPbFRkbjhNWjQteHBOT01CVXZudmlzUnhhMEpqVXJETXZPQXdPaVVQU3hsanVLLVU5THRIb2dJOXJndFlYby1xM3FxWlB5MmpydWVNTFdYd2l5U1h3Qms5UG1kb1E2SlBXb2h6VkNkWEt5cUtFR3EtbDhSR3B6WURScjlaUUxNN3QyM3VfaWstVVoyck5FYmZ0MTNYWnJXZ0VwdlJfTUpIZkxaMUFESTgtcVM3aXnSAboBQVVfeXFMUGZ3aW5HOHlGUG4wakx6UGFULVpUd2tjdU8zX0ExMEpSYzdmbmhlQXVqNkxTb1dBU3V1bUZ6ZUl6Q3dRbzdqQ1g0dDVKUTZmVVNVd2hXeW1ZQVQwS3ljVmMxNWJBVVFjX2tIYlNxWFFfcTU4dU9kUkxXb21hNk5seTFRaWxjWWZGU01HeDBjMWozbFA2djZSazZHTHZtcE1hYV9oTmZaTmJpUl9yLWJTeXYtMmNFcDNaR2lR?oc=5,"Fri, 06 Mar 2026 23:21:16 GMT",Saks Global to shutter 15 more department stores in bankruptcy restructuring ABC News
Neiman marcus,Harsimranjeet Singh Ghelani,Closing,Saks Fifth Avenue parent closing 15 more stores in bankruptcy — here are the locations - New York Post,https://news.google.com/rss/articles/CBMiwgFBVV95cUxQdGh6ZU0xOEdHMWswOXQzLXp2SjhiLVIyTUk2cG82dGJqU01lWVdaVzV3RHpVTWM1SmJEN3pFOTZTenR4TXh5dTVNdE1zOEVob2FsZ0NvblJIbVZ3QmlMRmFYbzN0VmpyS1lvQ29rcmdWeS1reFJBeWN6YW5pelBUVFNaM3A2X09ieU5NU2NnbVE5Mndqd1R4S254ZXBSTXVhYkhtSGdQbkdLMmpyQk82dTgwZ3pQUjNtTnJ1NDdGelQ1QQ?oc=5,"Fri, 06 Mar 2026 23:13:00 GMT",Saks Fifth Avenue parent closing 15 more stores in bankruptcy — here are the locations New York Post
Neiman marcus,Harsimranjeet Singh Ghelani,Closing,"Saks to shutter additional Neiman Marcus, Fifth Avenue locations in ‘optimization’ bid - Dallas News",https://news.google.com/rss/articles/CBMitgFBVV95cUxQcmZVMFRSV1VFU2M2NXlHazhHNElXU1JjaFVkeENEZ0dCQ3dPbUVSb0ZNa3VFUEF1WEhGWndrd3h0Q1dxeVl3WnI2M3pQTU1MRnc4SlJMUXlEenlMX0h1S0YybFVuN09jYlVmQzIyOWw5LTBPT0hzNkd6MDdHOHBwY2lJV1A2WDJJMXQ0eFNGRFJteE9rZ2hTalNjcjdJdGtpeDFEVGdqQ3JzeVZMZG4zOHB3bzV3dw?oc=5,"Fri, 06 Mar 2026 22:22:59 GMT","Saks to shutter additional Neiman Marcus, Fifth Avenue locations in ‘optimization’ bid Dallas News"
Neiman marcus,Harsimranjeet Singh Ghelani,Closing,Saks Global to shut 15 more stores as part of restructuring - Reuters,https://news.google.com/rss/articles/CBMipgFBVV95cUxQYnQzN05DZlJ2VlU1UVMtWFdfeWljTjAzcGRXSHhoU1I1Y0NYQjNSdHNTc3lURVZuNXpoTDZPdkZZZVROWVh5d1hNbWZjV25ORGVhZlIzUkI3YzlpX0tVMDFnTHo5T1VaRk8xTEtwNWE3LWg1b0dzVlVram9ndmlvbXNYaFRhR2xKeGRfVm5pUkFTTTdQQzFLZFhYX1V4SkxjSGVTN0Zn?oc=5,"Fri, 06 Mar 2026 21:54:31 GMT",Saks Global to shut 15 more stores as part of restructuring Reuters
Neiman marcus,Harsimranjeet Singh Ghelani,Closing,Only 13 Saks Fifth Avenue locations will remain after the latest wave of store closures - Business Insider,https://news.google.com/rss/articles/CBMimAFBVV95cUxPQjhCbXJ6OWtJZURiTDNzWi1BT3NnckZKLWR1Wl9sSGVzRjAxeDhZNVF5d0ZvRHQ3bEpJVTg2M0FwRnJaUkh3a195WUlPRnp0dTdWbWdmcFVJS2RQLXAtbE1idmxXM3VGVFF5Vy1oRmFqODJPN1VHMXVNMFNHcU1iUklTeDc5eTlBVVl5UFJHR2RfUmJ6NW5VWA?oc=5,"Fri, 06 Mar 2026 21:42:00 GMT",Only 13 Saks Fifth Avenue locations will remain after the latest wave of store closures Business Insider
Neiman marcus,Harsimranjeet Singh Ghelani,Closing,"Saks Global reveals more Saks, Neiman store closings — here are the locations - Chain Store Age",https://news.google.com/rss/articles/CBMinAFBVV95cUxNTmFwT0xHN09PNmFLRkpjZ0JiTjJQZmZUS1BXN2kxdTNEeHU4ckV6SV9GbFpEMVUxazlDSF96T25SbFBUb2xHc2J3VjVtN3JfMmJTSG5iY2t4UURqRXBueEI4aERfcW9OS1JZV3hRa2xPUng2NjJpNWhCb2FPTHVuSUxRUnB4M0dNYW5tejVWZVMySGdnYi0za3kyMlU?oc=5,"Fri, 06 Mar 2026 21:06:38 GMT","Saks Global reveals more Saks, Neiman store closings — here are the locations Chain Store Age"
Neiman marcus,Harsimranjeet Singh Ghelani,Closing,Saks Global Sets Second Wave of Luxury Store Closings - WWD,https://news.google.com/rss/articles/CBMiqgFBVV95cUxPZU5nYUc1NmhVVUJ4dUtaV3I3elIwdk9LaE5OVGlDRnFUN3FKdFVTSVNJS1ZFb040dWNQODBzMDF4R1ZsbVUxOUR6MFpBTkFtdzYtS0VPMmhwemM1T19jakVaUl82aEVRSXh0b3NzcmE2WnJ3X0dOLVRlTDVnZm96aVhDbXBvN1pURnFNeXc5WTZRTUNjcmptWGRHNFJnaDg5aHdmTm9UMm5aUQ?oc=5,"Fri, 06 Mar 2026 21:00:28 GMT",Saks Global Sets Second Wave of Luxury Store Closings WWD
