Store,Analyst,Type,Title,Link,Published,Summary
Barnes and Noble,Ashwin Nair,Opening,Barnes & Noble to open new stores in Georgia as part of nationwide expansion - MSN,https://news.google.com/rss/articles/CBMi3gJBVV95cUxPazJhUlFPVi1MaDdXYm0weEdqbWFibGxNeVd0ZlRSY3Zua3hLR0dmY1lESk9yeWtGT1NwdWludjVLRGM1VGJRSWFZUmxrWU9VenU3VTJkbUZ3S3FuNjF6b0RsV3ZJYXRLRXItNkpWbzVsNTUwV0hONm1CUTBHUnZJbVlrZ1NkeHhvd2h1TXZNcU1XcGRYeXc2d0xfeXEyZ01kT21WRm05cUJ4U0JzVW5QY1lKckhKOUd0SC1MY1lOelJWUWExQm5adV9TeGp5MVgtekJmdzZIbUtxSmsxb3MyOXAwbi1QRmFBN0VYV1JuZXlRSEM2dUZQOWZyajVvSFBMdDhCQVpnclNvZXR6QmIxRW0wektia3VqQ1Vld1Z2ajM5YnJNeTF1QWoxSlFtVjBOWERWZ19oaERGVkJadHhRaTltN3MtcWo5emdxQnBwU0JmRVQwWVR1RWY1dTdZZw?oc=5,"Mon, 06 Apr 2026 15:04:57 GMT",Barnes & Noble to open new stores in Georgia as part of nationwide expansion MSN
BJ's Wholesale Club,Ashwin Nair,Closing,BJ’s Wholesale Club extends store hours across Long Island - News12 | Westchester,https://news.google.com/rss/articles/CBMivwFBVV95cUxNLXJRdHVnYWJieVlfTHpUNTFuMTUwRTFWTUV5NDJqM2tsekwyYkNrN3ZYR0VPOC1hYldOaGJMbURVUnNZZURkNm5IQ3lpTC14bktnd1JFZjl2VDhCQUJzYUV4Qk03bVdZLWpxNzIzTVphLUNMVXE4My1Qd3FvTTViS01OUGFBQVhMN3hLTGJXa1Zma09qcGo3dHF6T3c5eUJpZDQ0QWJTQ3I1d3l4SlNDM0JTdU5NZFRtUWJqMXZ1OA?oc=5,"Tue, 07 Apr 2026 16:27:50 GMT",BJ’s Wholesale Club extends store hours across Long Island News12 | Westchester
BJ's Wholesale Club,Ashwin Nair,Closing,BJ’s Wholesale Club extends store hours across Long Island - News12 | New Jersey,https://news.google.com/rss/articles/CBMijwFBVV95cUxQcnY2NXpVZ1dsRTBQTUVXR3BzYThqR1g3dXNscWVTckFOVWRIcVJ4Ml9jbE1XNThRNmFiZE1SZGtGT0tRbG54WGIzQWZJZGI5Mk85bHhFNzhDSm1lOHhWcVZ4MUFITjF2VDFBU3dtRENCWDVOVkVvUU1XOElyR2doaGVabTJPQ1M5LVpaNEpfaw?oc=5,"Tue, 07 Apr 2026 10:47:07 GMT",BJ’s Wholesale Club extends store hours across Long Island News12 | New Jersey
BJ's Wholesale Club,Ashwin Nair,Closing,BJ’s Wholesale Club extends store hours across Long Island - News12,https://news.google.com/rss/articles/CBMikAFBVV95cUxNemJ2ZGdRLVhMWFJReURwNURFZ21LU2VXTGtST1V4MXAtbWZiSzd4LXktbnFFNHlmNUJBZmJhdVBIQ3RERHhwRVFMSXBUeUZuQmZsR2N4c19JbGtLVjBDMXplUnluZ2VoeDBQQ1czdUpjZlI4NmlfcGt5d0x4a242Y1BTVmVqbXhUZy1yekJaTHg?oc=5,"Tue, 07 Apr 2026 10:24:42 GMT",BJ’s Wholesale Club extends store hours across Long Island News12
BJ's Wholesale Club,Ashwin Nair,Closing,BJ’s Wholesale Club expands store hours - Supermarket News,https://news.google.com/rss/articles/CBMijAFBVV95cUxPOVFSWjFWUEtONTFnMFVsTDlqOGZOTVNRT2RscDdOVTlUTHNwMG9DWjNtRzBKV2ZDOVV3ejlub1FuaGJwMmpqQlY1aEdULUFpVEtySVYxRmdvM244eGhzbFlnVlRVSk9JcF8tRzEzV3N6eE9yX2ZSN3lXN2tzTDdQYWIzX0V5cXpRU1hhRw?oc=5,"Mon, 06 Apr 2026 17:41:18 GMT",BJ’s Wholesale Club expands store hours Supermarket News
Burlington Stores,Ashwin Nair,Opening,Burlington Stores announces new location in Rochester - kaaltv.com,https://news.google.com/rss/articles/CBMiigFBVV95cUxOV1ZVRk02VXlGZk50bmplTGdMNjZFa0dIVnlLaTlEaEp0b0ZLM0ZmSEl2X2tkMElnOGJEWENaam5JMFFLODJsNGc1TnJVZVVXRFR0U1ZrNG1jV29mYlZSalJ1NGNKRWZfNVJ4NmRibEhoZHRfblVBRUp0bFZPdW5sczJaYldFXzhleHc?oc=5,"Tue, 07 Apr 2026 14:31:00 GMT",Burlington Stores announces new location in Rochester kaaltv.com
Burlington Stores,Ashwin Nair,Opening,Burlington to open new store at Blue Star Shopping Center - NJBIZ,https://news.google.com/rss/articles/CBMihAFBVV95cUxNZWU0LWdXajJoMkttcGZYemtla0JtOVpYc3NtNy1QYjdjY0xLekJ3SXdoX19PT21jNGNSWXUwNVlqOWZsbGRiZ0w1N1N5cXZNQldzdWxIYUJldWNzbDZncnNZY1U3bXhieDk2TS1LaTJwVk51TVVMaDJzdzR6Ti1FSTIzdzM?oc=5,"Mon, 06 Apr 2026 17:36:29 GMT",Burlington to open new store at Blue Star Shopping Center NJBIZ
Dick's Sporting Goods,Ashwin Nair,Opening,Dick’s Sporting Goods bringing location to Tomball - Community Impact | News,https://news.google.com/rss/articles/CBMiwAFBVV95cUxNemZVQTNCR0RRNEpvenc2a3ZaTjl5VGh1eXVva3IwUl96Q0J2am1WQmoxRVRMQW94Mm55ak9fQkhMV29FSmxLb0N4N0lKemRuVG5TUEt0cVJXTFR3VW8xbFlPb2xFQkNLRFQ0VGZ6UW90MGZxdEhtSVdpTUdZd2taSDFUU01wWXdGWS1udjdoMnhhRVVaZlB5OGRCallTYnE1RTlhTWlPMDRRaUJwbnNvR28xUkdxcURyaWZXUmZKak8?oc=5,"Wed, 08 Apr 2026 16:28:00 GMT",Dick’s Sporting Goods bringing location to Tomball Community Impact | News
Dollar Tree,Ashwin Nair,Closing,Map Reveals Supermarkets That Closed Most Stores In March - Newsweek,https://news.google.com/rss/articles/CBMigAFBVV95cUxOZk1ybF9SRThITDF5MkNyRm5nb2dMWmw5ejJxeXFPcjVfSll5dVBiNGFKV2M1a2FwRXVHYmJqWTdIR2JWUHJMS3RBWThOdzNMZG5wTUJzakNlUkF6V0hiemF3WU9MOTF5YkJzdzRwUXJseVBlbVhQNWRPbVo3VzZ3Tw?oc=5,"Wed, 08 Apr 2026 09:49:00 GMT",Map Reveals Supermarkets That Closed Most Stores In March Newsweek
Publix Super Markets,Ashwin Nair,Opening,Publix Super Markets expanding in Kentucky - WBKO,https://news.google.com/rss/articles/CBMifEFVX3lxTFB1QWpGbGx5Z0g2czdocVFkNVdobkVaZlVlemhlNlRUY2p6OHRPS2xrWXJfM05yRzY0ZU5tU2dPeldEYzBnSmxxYmdMWFRZRVhWRXdUc3kxa3VhcTR2LWZldFNLNDNUYXpWVmhGLVBYVGJqbjBSZ3V4OXBFY3LSAZABQVVfeXFMTkNwU2g5Tkxlbk9oaW5ubWlkS3RHTzM0b3lfdkFxeG9mOFM3NmppTEVqbkowbjl4bFR0aVZDbkh2THNPVjlsVlpsdWtHV3d1T2J5X0h1MzFTUGRhcDFpanR2d2JtZzROTjk3ZW9aemdpOWVOTEhvNWVlRmhOWEtEYnNxMVZJMUxoR3pjbzhFNjdt?oc=5,"Wed, 08 Apr 2026 18:28:00 GMT",Publix Super Markets expanding in Kentucky WBKO
Publix Super Markets,Ashwin Nair,Opening,Publix announces three new locations in Kentucky - WKYT,https://news.google.com/rss/articles/CBMihAFBVV95cUxQZ1FyWTAxd2tmV2REX09mVFE5X1gtaHkzajluZl9Rc0lNRW16dXppNkpzZXJ4aEdMVFNTYk90VVlnNDRXZnhoS0RoUGxJTDVGXy1JWHFWNnJKMlhMRldSSmhWNGRrdWV0UU5fTE1hUzlaYlVqZmZwZGtXWDU0dDdFZ0pzcFTSAZgBQVVfeXFMUGo0R2JQRkNja3RINUczMXJpdXpXNzUtaC1tV1FHLVpuRkU0aVVXYmhqbW14TXBUNjdKcXNELVF4SHJyMWtUakFzUUpTUjlaVjdpZGFEWkZCaHdlSUswRXVUUE1NOFpIc3l1SkpYd1Q0WmdlQWlGbVVEaUhnd3NxSWJmSWJsYUw1cE43WGZLYlJMdkl2TzlWYnI?oc=5,"Wed, 08 Apr 2026 14:56:00 GMT",Publix announces three new locations in Kentucky WKYT
Walgreens,Komal Agarwal,Closing,Walgreens specialty pharmacy in Rockford is closing - Rockford Register Star,https://news.google.com/rss/articles/CBMitwFBVV95cUxPZy10RkQtWW13dnJXbzhHcGFOZGJ6SGtXZVdrcmo2RGNmLWRqeEFmNGR3QTAtZEIzRE9MWWdzOU5QT0s5clVxdy1GZk9zOUxfYUFoMTJBaEpnaVFaMlBQWjdUbUFwTGwwcTFacTRUZWhrN2lBbXdwMEwwc0RQd1BvYWhIakllUUZYNVJlV1BCVmx3c1RvOWtFdU1DdEJzVXY0cjcwc1ZGSXFGTWRkcUY4c2tMSWFFQzQ?oc=5,"Tue, 07 Apr 2026 17:27:00 GMT",Walgreens specialty pharmacy in Rockford is closing Rockford Register Star
Walgreens,Komal Agarwal,Closing,Walgreens and 9 Other Major Stores That Are Closing in April - AOL.com,https://news.google.com/rss/articles/CBMic0FVX3lxTE5wM3V0X2pnYVRKMlE5cVdUQS1DT192VEVkdUZkVEtmaGliYnZ3U001SmN5MjZzM3VmVExQZWpQUnpjU2VYUmx4TlVscjRzWFJadlhVUVltUHhpWjNMX2FuTlNDbVlxVEI1Y3MwSlBEUngzNzQ?oc=5,"Tue, 07 Apr 2026 14:17:51 GMT",Walgreens and 9 Other Major Stores That Are Closing in April AOL.com
Walgreens,Komal Agarwal,Closing,Walgreens and 9 Other Major Stores That Are Closing in April - FinanceBuzz,https://news.google.com/rss/articles/CBMibEFVX3lxTE4tSEtuSVVMLThFc1RmUUZ1NEs4Z2ozcUxoSHVwUkxEN01Kd3hzOVQzT0xFeDk2QWFzNWZ5UEdIdFN0N0VQVms4NHhlMDNfWXRZVFJabEM3T2NETXdGdGdWMVAxaVpaZ3lNNTJTUg?oc=5,"Mon, 06 Apr 2026 10:05:00 GMT",Walgreens and 9 Other Major Stores That Are Closing in April FinanceBuzz
Walgreens,Komal Agarwal,Closing,Walgreens and 9 other major stores that are closing in April - MSN,https://news.google.com/rss/articles/CBMi1wFBVV95cUxNOUpLSWJ6eDQ4WmxYaVJDQ2VPb0owY1dPUkw2ZE91YzJCOVFMU0VvRGJ1YlFhaDJHUkg1aWJlR3ZCMmNMUktyZ2hkMWkzVC1GUk8wZE9kc0tZcGttUEZHNVRpWVpXVmVKRHZVYUlQN19nTjJPanV4a1FhQUNWQVRiSWI3TVc2cHlxWjZ0b1kyV25XVE9jZEx4N0JqdS1vYlVtbVBHZFZtWVB1ZHphZnhzSnFlLVpueUVSdjlUc3RseWZibllPTUlyMnNfRk9vRTJjWVdLYl9idw?oc=5,"Mon, 06 Apr 2026 10:05:00 GMT",Walgreens and 9 other major stores that are closing in April MSN
Lowe's,Rahul Vasaya,Opening,Big new phase breaks ground in $400M Katy retail project - Houston Chronicle,https://news.google.com/rss/articles/CBMiuAFBVV95cUxPM3J0OG1VVnlDZnFTSE9SdTNQTUNkMUd2ZjlSNGtXczUwZUpQVUZONlZJdjJoTFpEamx3aHJ1X1VLU1JGcjVXVWExUGVqTEV2X1lYa1ZzTVkycjNKWWplZEZWejhpRTBXbUNuS29TT2ZUYTJGTUlkT0RFMWVJblc4WnAyenJJV0I0T2k5c2FIa1NHZU9JWGx5aXZsNF9pM3EwYmNUZDRldUxQaHNSLU9oeG9hWHBsRjFE?oc=5,"Tue, 07 Apr 2026 11:10:03 GMT",Big new phase breaks ground in $400M Katy retail project Houston Chronicle
Walmart,Rahul Vasaya,Closing,Walmart closing store for ‘rapid remodel’ in Catawba County - WBTV,https://news.google.com/rss/articles/CBMiiwFBVV95cUxOMHJVUGVIR2dsaWltQjA5OUNCQ1FyeHF2SUhabk12WW1iTHZHbjhCcEpLX1BRa3VTNnh6WGpXTzFtSE1tcmRMV0JHdHphZlZfX0g1LTl2S3dqSzhObnVOZldIMllzRHdKTmxPeE9Cc1NLOHJtbmpQeWVCdEZITF9uRHY5aVlza2VDZVA0?oc=5,"Wed, 08 Apr 2026 11:47:00 GMT",Walmart closing store for ‘rapid remodel’ in Catawba County WBTV
Casey's General Stores,Rahul Vasaya,Opening,A Buc-ee’s rival is expanding into Central Texas — here's where - Austin American-Statesman,https://news.google.com/rss/articles/CBMiowFBVV95cUxNeUctSU1UWDVGMTRYWnF5Mmh0WlY0UlhLZTNSaTJTTTM3UkVsSDIyNGhOUXo2YzlGMXpWQmFMeURGMnRKeXdHRm5XemxVM1NxN0dia1hfeTNISkRoR3RfUzV2cFB0aTAzc1ZmNW9kdkU4Y2NDM3FRY2xPRnhzMjEyVXRLdktYV1dSOW5sbHBSS3A2b0pYeVF3TElFcFY2U0VreGVj?oc=5,"Wed, 08 Apr 2026 16:40:38 GMT",A Buc-ee’s rival is expanding into Central Texas — here's where Austin American-Statesman
Safeway,Rahul Vasaya,Closing,Safeway closing East Bay grocery store early next year - MSN,https://news.google.com/rss/articles/CBMiuAFBVV95cUxOdUdOZnRtVEZRZTQtS2VYZTVrTkk5Z3BuNG5sYXotRVE3Y0dLQ1JFYzgxa1p0UElTb19zYnllXzF4MFpKc2hmTGgza1VZY3JKdXR6ZzhWcVMtaXNQaGd3SG1KdXBxLThscVAtZWFhT1VwaHUxeHFhalRkVEM0RmF4WmZPVmw1ZmRIWnUyaFNpSXB5OFQ2QlpMb25nT3lDVkloVlpvQlFVc2Y5SDgzOHZCX2FSYlNWTFFY?oc=5,"Tue, 07 Apr 2026 16:00:22 GMT",Safeway closing East Bay grocery store early next year MSN
Party City,Dhiraj Manghani,Opening,Party City Opens New Location Inside Staples in Bay Area - National Today,https://news.google.com/rss/articles/CBMitwFBVV95cUxOcUZTeF9FOEo5YWUzczRxNDhNcGhScTVBb0dNZ2ZjWFRxZ3cxLVU0QTdfaTJqWjVzV0U5YU9TMUxVMzNjQTBUSHVEZURmQWR3em9lNndhVXVOV3hoS19nZzRmQTRpdVloZjA4N2FRWUxZdkctN2x5S1VUdXJab1dUU2xCRjBKUzE3Y2hWenNONWs1SzZPLUg3V2k5U0tmdkNuR1JiU3JsVnpUOXhCNXZQYTBKWW5nMjA?oc=5,"Tue, 07 Apr 2026 23:09:40 GMT",Party City Opens New Location Inside Staples in Bay Area National Today
Party City,Dhiraj Manghani,Opening,"Barnes & Noble to open new store in South Bay, takes over former Party City space - KRON4",https://news.google.com/rss/articles/CBMitgFBVV95cUxQVjVnV1duRUJDNDBzRVVlQXVwTGcwMmUzM0Q4QVkyaG9YUlVudzA2YjJTelZUdVgyN3hUeGd1YmpaMVhVaEphdTBZQU82OGtiWGxYSm1nZVhDblNVWDlJOWMyd18tYk9TeHhSQ1ZtTkt0UlpLRUdaRzQ5Rjh5Ry13cFEzak9ySnpqSWdyRnZuRWNBZWphWEhUNTBtYlJxNG9TT2FjRjctUk1YZnZhaklEUzhTRXR5d9IBuwFBVV95cUxQREhJa3ZaN2ZGYjE5Ul92c1Z4MFp5SFdzVXh5bzNEcnhxa2FnaC1DUUhXODBrVGt1UVA2MDJlR1AzT2lqUnNzSFl4Y2VORkQ4Y2o2LVBKbVNsVHJjMEtxWWtzMS1GekRtQ3d0XzNUYWdNd1JMeXpiSUN4d0NjdXdyak5RamdKeTJNazRaZm1xOVpwRHRXZmlHenR4RFRVc3I4TGtEMnUtem84RDd1S1g3QVdranViVnQ5Q0Rr?oc=5,"Tue, 07 Apr 2026 02:52:58 GMT","Barnes & Noble to open new store in South Bay, takes over former Party City space KRON4"
Party City,Dhiraj Manghani,Closing,Former Party City store gets snapped up by retailer with October overhaul - the-sun.com,https://news.google.com/rss/articles/CBMinwFBVV95cUxPNENyQjZ5Qlg5eWNfQzdsTHpxNFEya0ZHWllCY1haci1yVmF2SllTSktJNHFQVDhoRzd0NERNdzVrMkEtSEZpRmlEd3FxZ1VlTEZrc1EwVWdLM3BDWWV1OXlfLWhTLW00eW5TVEdZSjdLSGhMWm5pZ3dEc3pTUFBXWUR6Z1c1Z3NTQVA4OW9md2h4aUQ2Z2N3aktpUFFqUk0?oc=5,"Tue, 07 Apr 2026 18:07:11 GMT",Former Party City store gets snapped up by retailer with October overhaul the-sun.com
Sam's Club,Dhiraj Manghani,Closing,"Walmart warehouse, in former Sam's Club off Route 146, closing - AOL.com",https://news.google.com/rss/articles/CBMif0FVX3lxTFB0LVdwZHdGYWlXaldxajZ3a1MwbGloa0VFUXNJdWgwSzNNT19reFlPN3lPTGN3M21WVGdqcXdGemFTNmxSYUhKQlJ5UjZDQkpBUXhvUVFNZEFPMnZ3TlpBT09vaUhmaGZabHRDN2V5ZlRoWWxEMi1PRUZEMExMMU0?oc=5,"Tue, 07 Apr 2026 11:46:23 GMT","Walmart warehouse, in former Sam's Club off Route 146, closing AOL.com"
Scheels,Dhiraj Manghani,Closing,"Pat's Run in Tempe: Times, parking, closures, and key info for the 22nd annual event - ABC15 Arizona",https://news.google.com/rss/articles/CBMivwFBVV95cUxNZkR1Q2lXY1RmZmI4SkxadlcwMXJILVFlSnRsY0NCVk9EaWtYQmhKSFNCMFpiblQyakFwRU9lcFdxZFRzU0hRY290c0dxYnp5b0hNODI1VHRQLWpSdU5zSFctMy1pVlZ1SzBuV1pYdHNJNENoeXRqQU93U0I2SFJYcEFyZUdaYWJDeDdDODUybWpUd3FyNmMyMnFSQ0RXaHczcG1oM29hLTRDOWVUTGJoU3AzeXhhekZzbHQ0eWExcw?oc=5,"Wed, 08 Apr 2026 10:27:58 GMT","Pat's Run in Tempe: Times, parking, closures, and key info for the 22nd annual event ABC15 Arizona"
Staples,Dhiraj Manghani,Opening,New Party City location opens inside Staples in the Bay Area - Community Impact | News,https://news.google.com/rss/articles/CBMixAFBVV95cUxQTHpnNlAzMFdna0JhcWpVbFBRNUR1VkZjSURKQ3V4R0ZySnFDQUxXS0lHMG9OeUNwX0Rtd196bUtPU2x4cEgtWkFadUJmZ2QtMDJpWlp0U3J4TWJ3U0NpdVU4emp5NmxmbFRvRE5nZVc4b1RMTjdPYmJEY3pBZDhtMlBXSF83bjRndEZ5dWU2NHNKYU5pOC1sZWRPWXAtclppU1lHQ0ZvTjdDNnhtT3RzaC1uMFFjLTFvTHRZYWFhQm52WlNN?oc=5,"Tue, 07 Apr 2026 20:20:00 GMT",New Party City location opens inside Staples in the Bay Area Community Impact | News
JCPenney,Harsimranjeet Singh Ghelani,Closing,Closing down sales reached up to 60% before JCPenney moved into final closure stage - the-sun.com,https://news.google.com/rss/articles/CBMijAFBVV95cUxQUmZqVzd1X1RnbVpyS1lFWnhXcGtoaDBEbVptaGIyRVA3cENIdmIzTm5uSnBUQlFBaldFVnpGVFl2NEJHU0Zsa1hGRG1IZi0zRzNEbmZtb043eUs1UlVYa1BSMVhuY1FrajZRTHdVOHp4bzBKdmtKbEVCT04xLWZYRWMxSlFFRUoxTjFJZQ?oc=5,"Wed, 08 Apr 2026 16:56:34 GMT",Closing down sales reached up to 60% before JCPenney moved into final closure stage the-sun.com
Macy's,Harsimranjeet Singh Ghelani,Opening,Teenage Mutant Ninja Turtles: Anatomy of a Mutant Breaks Down the Science of the TMNT Universe - nerdbot,https://news.google.com/rss/articles/CBMiwwFBVV95cUxONUJObkVCZFozV1JFNExENWtqanNXU1ZNN0lCYmVwTzBNWXFTaXBpQmEyeWltalYyTU9uTWxXM2lRTkxITjNQSWNPSHlJUENVZkhBREotUmQ2RWpBRUxUYVJHZXVWSVJrTXh0ZHQzb0pXRjhRTWtkQ3lUYU1WdmxiUW5WcC1vYmFwZTU4Z3JUS1ZDSml0eFlWLWh5Q0hqQ285LTg2cnpjZ3hVdlptVU5keTR4TUlDanpCa3FTM1JocG45UmM?oc=5,"Wed, 08 Apr 2026 15:21:58 GMT",Teenage Mutant Ninja Turtles: Anatomy of a Mutant Breaks Down the Science of the TMNT Universe nerdbot
Macy's,Harsimranjeet Singh Ghelani,Closing,"More than 1,500 stores are set to close across the US in 2026. Here's the list. - Business Insider",https://news.google.com/rss/articles/CBMia0FVX3lxTE9SUTdiM1JqclMzakxVV3hnTHU3N0ZOdHQ2UFhvc0RMS0kwM1FQQnFKd3RUb3ctOWpLSHRyc2o4d3pDX2lVQUdRcEJ3bzhKNWZzT1VuNEY0MGk2XzVXLTVHanRNMHBRRWM5aVVN?oc=5,"Tue, 07 Apr 2026 14:45:00 GMT","More than 1,500 stores are set to close across the US in 2026. Here's the list. Business Insider"
Neiman marcus,Harsimranjeet Singh Ghelani,Closing,"More than 1,500 stores are set to close across the US in 2026. Here's the list. - Business Insider",https://news.google.com/rss/articles/CBMia0FVX3lxTE9SUTdiM1JqclMzakxVV3hnTHU3N0ZOdHQ2UFhvc0RMS0kwM1FQQnFKd3RUb3ctOWpLSHRyc2o4d3pDX2lVQUdRcEJ3bzhKNWZzT1VuNEY0MGk2XzVXLTVHanRNMHBRRWM5aVVN?oc=5,"Tue, 07 Apr 2026 14:45:00 GMT","More than 1,500 stores are set to close across the US in 2026. Here's the list. Business Insider"
Saks Fifth Avenue,Harsimranjeet Singh Ghelani,Closing,Bankrupt luxury retailer Saks wants to shed a $6 million executive perk to cut costs - Business Insider,https://news.google.com/rss/articles/CBMimgFBVV95cUxQYnJ5ZjZKSFFqUmNTUWxLRXpCcFpEZTMwbjZ6R3A3OXFjanJhRVBnRUFPbUI0RHYtaEg4NG80M09JSXNzdE9MajUyOWM0QlBKTjdHTWo2emdlSFVSWjJjVURzMy1hMC03S2JOVWZldVNrSC0zcjBkVEloSTlBVDRqUl8xaUd5aFh0QTg4aUFMV3dYZy1ickc4WjZ3?oc=5,"Tue, 07 Apr 2026 16:36:53 GMT",Bankrupt luxury retailer Saks wants to shed a $6 million executive perk to cut costs Business Insider
Saks Fifth Avenue,Harsimranjeet Singh Ghelani,Closing,"More than 1,500 stores are set to close across the US in 2026. Here's the list. - Business Insider",https://news.google.com/rss/articles/CBMia0FVX3lxTE9SUTdiM1JqclMzakxVV3hnTHU3N0ZOdHQ2UFhvc0RMS0kwM1FQQnFKd3RUb3ctOWpLSHRyc2o4d3pDX2lVQUdRcEJ3bzhKNWZzT1VuNEY0MGk2XzVXLTVHanRNMHBRRWM5aVVN?oc=5,"Tue, 07 Apr 2026 14:45:00 GMT","More than 1,500 stores are set to close across the US in 2026. Here's the list. Business Insider"
Saks Fifth Avenue,Harsimranjeet Singh Ghelani,Closing,Only 15 Saks Fifth Avenue locations will remain after the latest wave of store closures - Business Insider,https://news.google.com/rss/articles/CBMimAFBVV95cUxPQjhCbXJ6OWtJZURiTDNzWi1BT3NnckZKLWR1Wl9sSGVzRjAxeDhZNVF5d0ZvRHQ3bEpJVTg2M0FwRnJaUkh3a195WUlPRnp0dTdWbWdmcFVJS2RQLXAtbE1idmxXM3VGVFF5Vy1oRmFqODJPN1VHMXVNMFNHcU1iUklTeDc5eTlBVVl5UFJHR2RfUmJ6NW5VWA?oc=5,"Tue, 07 Apr 2026 14:37:00 GMT",Only 15 Saks Fifth Avenue locations will remain after the latest wave of store closures Business Insider
Pilot Travel Centers,Kabeer Pandya,Opening,"Chicopee’s new Pilot Travel Center donates $20,000 to schools - WWLP",https://news.google.com/rss/articles/CBMitgFBVV95cUxPak1jaHR2NUJRWWRQV3c4S2Exb2RuQ0I1d0ppZ0F6RWFYay1fU1lJRjlxTEdFb1RKSVZ2ejdWbVNGZ3RaVHdOOHRmeFNwMmNDc0lCVnViTlRONW5mNW5sTEJsMDYyb3FBTWtFNEFBUEdjOW96anlGdVIzeVVkZUxiLTM1RXVSbzJVUEl2NW9BNDlTakNOanZxTldfLXFmcXNuRXRraG93eUl6Q2JwSVE2UmxIcGxIUdIBtgFBVV95cUxPak1jaHR2NUJRWWRQV3c4S2Exb2RuQ0I1d0ppZ0F6RWFYay1fU1lJRjlxTEdFb1RKSVZ2ejdWbVNGZ3RaVHdOOHRmeFNwMmNDc0lCVnViTlRONW5mNW5sTEJsMDYyb3FBTWtFNEFBUEdjOW96anlGdVIzeVVkZUxiLTM1RXVSbzJVUEl2NW9BNDlTakNOanZxTldfLXFmcXNuRXRraG93eUl6Q2JwSVE2UmxIcGxIUQ?oc=5,"Wed, 08 Apr 2026 12:00:00 GMT","Chicopee’s new Pilot Travel Center donates $20,000 to schools WWLP"
Albertsons,Kabeer Pandya,Closing,Albertsons stores to serve their last customers & lay off workers by April 25 - the-sun.com,https://news.google.com/rss/articles/CBMiggFBVV95cUxNS19VTlJ3eDJYaWljekxBLXRqdk9hRV9Jd3VRYlExX0pNWmNLSHhXUUl2NGQtNGhpTUFvWE1VUU45S3U3SzZlY19QeTQ2VTFvUUtnTkNLdWFtcVVRMWIwUlNqdzBOQzJ4UkZVNFpEMzRaV2kwWmp0RHkxZ21yRm96bFh3?oc=5,"Wed, 08 Apr 2026 13:32:11 GMT",Albertsons stores to serve their last customers & lay off workers by April 25 the-sun.com
Albertsons,Kabeer Pandya,Closing,Albertsons Tarrant County Store Closures Spark Industry Efficiency Drive - Bitget,https://news.google.com/rss/articles/CBMiXkFVX3lxTE9Scm4zYUJIMkZyb0pyZzRHbUp0YlpwRHc0eDlfVnduazZmZE5QNGlCZ0dOU0lEUmJMRlI3RkhHTjE3eDAzYmhEbWdXdGs4eG1KY3AxZS13Xy1BRDAteVHSAWNBVV95cUxNcmNoTkROWTc0ZER4OGZiR0dHQUc5V2JjYW1heGU4QXZDWnhIb3U4Rl9FMTFfbTdGZzN2eVpsZU9GTjJGOW5RMmM0NGlJd3RNUHF2c0hodmZOSXRpbDBQR2hibDA?oc=5,"Tue, 07 Apr 2026 13:00:56 GMT",Albertsons Tarrant County Store Closures Spark Industry Efficiency Drive Bitget
El Super,Kashish Kasar,Opening,El Super grocery store opening in North Long Beach. And they’re hiring. - Long Beach Post,https://news.google.com/rss/articles/CBMimAFBVV95cUxNRVdCN1BaMWpQMllERjYzVlVlMnR1WE1jQ3lwbHJGdGEyZlhmOUF0aWxiZWNHRWRiODd2OU5SSXlYWFc2Ri1iZkF5b0ZmUnVFb1BfYWRrNFdkcXRndVVTbjY5bEltYjdTaWJqeHh6R0JiaUVJTW45NzdEYWtXQ0R4dDB0eHNoRTBmZlM4TUJ3OWxxOVU2V2k0WQ?oc=5,"Wed, 08 Apr 2026 15:53:05 GMT",El Super grocery store opening in North Long Beach. And they’re hiring. Long Beach Post
Jay C,Komal Agrawal,Closing,End of an era for multiple Kroger stores as first stage of 60 closures start on April 10 - the-sun.com,https://news.google.com/rss/articles/CBMiiAFBVV95cUxPSlQyWThVTllWVm5zSGlRUHZjV3BJM2MxYU5OZ3ZiMmRaSW51Tk9udDdzdFJyNktXZk92dkM0cW5WZlFxaERkS3JBb0Q2TVNxbmpNeWpCV1EyYWtWRm1nQzV5eDdKTV9WdG1zY0p3LTRMdjhRbkYwOU9PZndkTHlOdmNlOTVuTGR5?oc=5,"Wed, 08 Apr 2026 15:07:22 GMT",End of an era for multiple Kroger stores as first stage of 60 closures start on April 10 the-sun.com
Kroger,Moksh Kashyap,Closing,End of an era for multiple Kroger stores as first stage of 60 closures start on April 10 - the-sun.com,https://news.google.com/rss/articles/CBMiiAFBVV95cUxPSlQyWThVTllWVm5zSGlRUHZjV3BJM2MxYU5OZ3ZiMmRaSW51Tk9udDdzdFJyNktXZk92dkM0cW5WZlFxaERkS3JBb0Q2TVNxbmpNeWpCV1EyYWtWRm1nQzV5eDdKTV9WdG1zY0p3LTRMdjhRbkYwOU9PZndkTHlOdmNlOTVuTGR5?oc=5,"Wed, 08 Apr 2026 15:07:22 GMT",End of an era for multiple Kroger stores as first stage of 60 closures start on April 10 the-sun.com
Trader Joe's,Rahul Shinde,Opening,Trader Joe’s to open location in Johns Creek - Appen Media,https://news.google.com/rss/articles/CBMizgFBVV95cUxQT3J1bUQyLXROc3RhV1Nud2xiclZpYnhnaEJGRE5UZUNuVFZ5bzRTY2s5blgxTHNja1JZSExUYXllcDlWWnJTcjVSMGhXNzN4Tjg5UGhuRkJvRFBwUmc0bUpxXzl5UDZOSzBiczRnV3B2LWR3NnVUUE1CNml1bjZIZmFmdlBESlFWa2Z6ZG5USDdfczJwU0NkX202RlRnVDJ5VXRrSGFNdEdCNHNfU0d2MW41cHkzYnJaSEpIU3Vnd0FRaUpveU1SaDVHRUQ3QQ?oc=5,"Wed, 08 Apr 2026 14:50:00 GMT",Trader Joe’s to open location in Johns Creek Appen Media
Trader Joe's,Rahul Shinde,Opening,Trader Joe’s set to open new stores across 12 states: Here’s the full list - The Independent,https://news.google.com/rss/articles/CBMiiwFBVV95cUxPbDNuTmhyQ3Rpdkk1Z1J0QUpPS3pXZ1RBcEVWTzNjV2UyamhNYjdFay1sR3QzTGFGWmk5dEl3bFZhZ3lyeFpwVGFLOHVNT0swcDYya2l4cE1YMzJqRnVVbGgxRGF0Q2d1MmtLUnhla2dEd2pURGxhazBXOFhqVFdUMDR5UGJCMkUyTE5r?oc=5,"Tue, 07 Apr 2026 16:23:00 GMT",Trader Joe’s set to open new stores across 12 states: Here’s the full list The Independent
Trader Joe's,Rahul Shinde,Opening,Trader Joe’s to Open Stores in 12 States in 2026 - Newsweek,https://news.google.com/rss/articles/CBMigAFBVV95cUxQc3RMUW1QbWFhU0MzT3I4YjZRQnM1bHRmM1V4eUcwMGFlSEVESnNvVUlJY3JZT2lwZU1EcmYzWWRzcFNaWmlsd2dDWEtCRk13OGNDdVVudTBHOHNUR2EtOHlrQTJsazVCZ0hwSlZKX1RoaGxRRWhKd0RIX253dnFQSQ?oc=5,"Tue, 07 Apr 2026 16:07:00 GMT",Trader Joe’s to Open Stores in 12 States in 2026 Newsweek
Trader Joe's,Rahul Shinde,Opening,Trader Joe’s Announced New Store Openings—Are Any In Your Neighborhood? - AOL.com,https://news.google.com/rss/articles/CBMiekFVX3lxTE1jaWNkVWk5V3lBQnQ1WnhCcUdVbFZ0Nktqb1paS0M2Q2FtMWlKeE9IN2NETWZtVmFURXo0MkFnbTFOSU1IdXVvenctY3JSUC1WLXhkd09rY3VpZnA4dEtTSHVKX1hqOUNwX0ZQUzU3RWpJbGtuMTJ0NWVR?oc=5,"Tue, 07 Apr 2026 07:00:00 GMT",Trader Joe’s Announced New Store Openings—Are Any In Your Neighborhood? AOL.com
Whole Foods Market,Rahul Shinde,Opening,Whole Foods headed to Simi Valley at site of long-closed home goods store - Ventura County Star,https://news.google.com/rss/articles/CBMi4AFBVV95cUxNRFRDRlFvZE54czA0QktIRXdybDlJQ0ZnVzdQM0JvcG9DcVNqY29hTFFDOUVabTRjUm1MTF9OV0tzSHBWTjk1cXNUTUxEdTRsQjVxZHlCcXdoSV9YLXo2WGJ3TFNtcHBPRDVjRzBYaHNmandDOHF4VmJ6T0w5ajlVUVhfR3NKTW10ZjFGMmJHTnFha2FpR05tbS1UNEhpQm5xaUw5U25uM3RMSlNYMTltR0xaejlCSkt3cEZHWFh5OEI0QkY2WGd1dkNjUklqOU1ielBuVWRYb01vX2tlVXROQg?oc=5,"Wed, 08 Apr 2026 17:46:00 GMT",Whole Foods headed to Simi Valley at site of long-closed home goods store Ventura County Star
Whole Foods Market,Rahul Shinde,Opening,Whole Foods Market opens new convenience-focused store in London - Asian Trader,https://news.google.com/rss/articles/CBMie0FVX3lxTE5LcGkydFZCYmxCU00yZHA5NTF5TXBSRUpPcXNGS0xyUUxfbngxRUUtNlZncjV2b1VNY1RJVXpNdllTeXN6V3Z0WjFNclY2S0pRQmRESzNPUG9tZENkX01Fcmo0aUptb2kwc1FiUFJiMjljendlQzU1bFJqcw?oc=5,"Tue, 07 Apr 2026 15:57:27 GMT",Whole Foods Market opens new convenience-focused store in London Asian Trader
At Home,Rahul Shinde,Opening,Devils lose two games on spring break outing - Rappahannock Record,https://news.google.com/rss/articles/CBMic0FVX3lxTFBIWDdPMFNhV2MtMXNzZm05a1Aza1AweEFGbkFvdjNnUFFvMEktUjZnb0FYU1o0ZTBoTENBLVR6QVJsc29mOTlpTTdqLWRESkNlbHhWcmIwX1pGOU1CZXFxc1d2X2FnOTZPWnlZaEVKUTdtRUk?oc=5,"Wed, 08 Apr 2026 14:31:12 GMT",Devils lose two games on spring break outing Rappahannock Record
At Home,Rahul Shinde,Opening,Stay-at-Home Spouses: 5 Tax Breaks That Save Money - GOBankingRates,https://news.google.com/rss/articles/CBMipwFBVV95cUxNMXBpS05CTHpic0llSHRfRmRtTFJJSFI1eVNveEZUcWVKWXhzS2paQTNCR0NPSEYyQzFmejhzd2k1TTJHMHl2UGlia19neGdOQThRUFhFd3dNeU51TFpBT2xGSmdTRERLQjU0Z05KTEIzQ21Ob3hvSDE1eHpDbGxZWndaNnZEcXNBaU9mSnhLTi13V1FYXzFDUVhsYWd6MGpra1lNRTJUWdIB-AFBVV95cUxOVElpMVJaUTFrX1RJVk1mMXJjOGFtY2hrZm1FVXBtdWExQzctc2hIZ2xwQ1ZGOHRaX2lVSjRPZXZoWlRRdjVVM1ZwLUFBTk15UFVZT3hVM1I2Z2I5a0hzaUZmd2Y0VmRfbV9TTHdobTdBX1hoVmlDYk9oT2p1MHpSNTNqSXhJemNJVW81M2RWNTI3T19kaEc2Ym9sRVExOXEyeXlVQXNFem1vMjJWSV9CTlVOZ2ZUOXM3LXhXNHM1Mmh6ODVxTXhGODBkenlacW1CbjFYTnczU0lMYS1kZm5zTW9iVDkwRlZLbGMzODlrMVNSU2ZxUjM3SQ?oc=5,"Tue, 07 Apr 2026 15:47:29 GMT",Stay-at-Home Spouses: 5 Tax Breaks That Save Money GOBankingRates
Grocery Outlet,Rahul Shinde,Closing,Why Grocery Outlet is closing some stores in California - AOL.com,https://news.google.com/rss/articles/CBMiggFBVV95cUxOanZKQUFuLXhKYnR0OVhfZUNfOE1EekFickQ0eGtpU1VwUzJMMVRTNjFkT3dhUDV3eTR1c1RXc21MZUVBeHo2RlpYekoxcDBSM1I3RUdHWDFQSVEyWV83MUptd1BVRzc4V1R1VWJ5ZEpaRHA1blpYd01FRmNNYlZSbzhn?oc=5,"Wed, 08 Apr 2026 06:48:57 GMT",Why Grocery Outlet is closing some stores in California AOL.com
Grocery Outlet,Rahul Shinde,Closing,Portland District 1 City Counselors: Parkrose grocery store closing and the ‘food desert’rastructure issues - East PDX News,https://news.google.com/rss/articles/CBMiqwFBVV95cUxOempXUF9RekJNRVJxbkI3eFloSlBVbHNxdEpoVmprTW45M2cxV3BxVEdWOGRab1dLbFhlYVVqS2FIVDFKVi1KSEFRN0VQVHhZRWFReWpvYzIxNE9CNk8tMFFjWlR2b2Rzc2pqbXpUOE02QmZwUmRuTUhNeW5Tb1N6elFjS2pnSXdEMmJ1VU1rMnJsU00xWENUbmZCbVIzbzJrTHptSWFkWVBFZGc?oc=5,"Tue, 07 Apr 2026 23:04:25 GMT",Portland District 1 City Counselors: Parkrose grocery store closing and the ‘food desert’rastructure issues East PDX News
Grocery Outlet,Rahul Shinde,Closing,"More than 1,500 stores are set to close across the US in 2026. Here's the list. - Business Insider",https://news.google.com/rss/articles/CBMia0FVX3lxTE9SUTdiM1JqclMzakxVV3hnTHU3N0ZOdHQ2UFhvc0RMS0kwM1FQQnFKd3RUb3ctOWpLSHRyc2o4d3pDX2lVQUdRcEJ3bzhKNWZzT1VuNEY0MGk2XzVXLTVHanRNMHBRRWM5aVVN?oc=5,"Tue, 07 Apr 2026 14:45:00 GMT","More than 1,500 stores are set to close across the US in 2026. Here's the list. Business Insider"
Dollar General,Shuvechha Dere,Opening,New Dollar General grand opening - South Alabamian,https://news.google.com/rss/articles/CBMifkFVX3lxTE5KLUk5TDA5cTRFWTZWRW5Za0xBNDdWLTZGTy1JU3dzQWlBalVWWWtwVUI0a2x6bmZ4RDZ2WHNDUGhWZnhjU1JKcEVvUWFVTGFSQXhGcGx1VXVqRko1d3JOb0djdmFoc0hIRW1lSk1wT2FuMzhGM21vdnFLc1Zidw?oc=5,"Wed, 08 Apr 2026 22:06:30 GMT",New Dollar General grand opening South Alabamian
