Store,Analyst,Type,Title,Link,Published,Summary
ARCO,Harsimranjeet Singh Ghelani,Closing,Arcos Dorados (NYSE: ARCO) CFO details share and cash-settled RSU holdings - Stock Titan,https://news.google.com/rss/articles/CBMiywFBVV95cUxQVlBDTnhRQlN2RU9WVkx0ck4xdzB6NWIzelFFeU40Q1VOUG1BWi1qMllGdGhWdlZhX0RXOTB0XzBleVUtWkhsd09nbG1SYXpYZFYyaHdjV0s0YmdfZTYtUjNIX3QwYjRkZ2hRQ1VYeEVZek1mR2piR0Y5dzV5RzFWWXpuWEJhVDlTQ1FZQWI0SFk2REQzYXMzaGJwLVQ4Ym9OaGg3YUhBcGh5YXVWTnI0YWZhbTJiVlRkQ1NrZmhyeFltSzhLblUxWk9CNA?oc=5,"Wed, 18 Mar 2026 15:42:23 GMT",Arcos Dorados (NYSE: ARCO) CFO details share and cash-settled RSU holdings Stock Titan
ARCO,Harsimranjeet Singh Ghelani,Closing,Director at Arcos Dorados (ARCO) reports cash-settled Phantom RSU awards - Stock Titan,https://news.google.com/rss/articles/CBMiywFBVV95cUxPUkVfWTJFcVdiR1MwT1FpMmcxMG1MN2xWS0lmRXBNbUM4RVJ3Mk1vc1VYaFRqSVNjSThCMWJuczB5VXdEbGFhWFNhUnVtSHN0WUZYWkdwZzlwZno0RzZZeGNYbEZta0dVdmd3eUptYkhDeWdFdVRtYXJ5WHNLYWpTM2hrOTZIbkJoRGNzZzVUaFUwb1ZnNUtqOTJGbkpjR255Y3JVNkZ0STRuRmp6UklqTEVXLXVBMTh5dEk2Q2RJbkNPUzZQbE9kb2VTQQ?oc=5,"Wed, 18 Mar 2026 15:38:13 GMT",Director at Arcos Dorados (ARCO) reports cash-settled Phantom RSU awards Stock Titan
ARCO,Harsimranjeet Singh Ghelani,Closing,"Arcos Dorados (ARCO) director discloses 4,988 cash-settled phantom RSUs - Stock Titan",https://news.google.com/rss/articles/CBMiywFBVV95cUxQQlJlRk4ySFNtdl8xTnJyZlNWMGVhcTdaNkE1bjRMQlYyZ1VmQnhELUx4QWhabS1raXUxZWNtczYxR0JXNklfV2kwRnNnYzBobEpVX09EZWU2WHYxeGpDd015dmJIQ211UWNTZWF2dXBrMVVxcExPeW1ja1JDX2tOZ3puQUpzejFJanBGZnVYQTZVQ082NEE5RndGSDdvWDV5T3ZQMEdSaVExSXlJcnFOZ0t4b3VPRFNsUzhOOG9uTjJSbXJiS1JRenExOA?oc=5,"Wed, 18 Mar 2026 15:37:15 GMT","Arcos Dorados (ARCO) director discloses 4,988 cash-settled phantom RSUs Stock Titan"
ARCO,Harsimranjeet Singh Ghelani,Closing,Director Sergio Daniel Alonso details initial ARCO holdings on Form 3 - Stock Titan,https://news.google.com/rss/articles/CBMiywFBVV95cUxOMjF0dE9fZ3pDNW93Z3J5Z05UVWxQUENPaGFXTDV3VURSY0k4cXNsQkdTUFJfNGJpZTJSYkJRSEQ5Wl9XeHVBem00UVVIUjNBTjVpMTBwSTc2MUp2Nm9INklzQnZaV3R2T3JxaUlNbG4tY25COVVtSTYzN1RPb0VqZURlSjhvNGdkeUFnNU41akVsc2VWN0VHNFFIRzJnVVVFbHF0S1V3SHNqV2tIdTBJN3lPQkVUZnk4MjNUZ2t5dVpwSDFreS1keXVHUQ?oc=5,"Wed, 18 Mar 2026 15:27:28 GMT",Director Sergio Daniel Alonso details initial ARCO holdings on Form 3 Stock Titan
ConocoPhillips,Harsimranjeet Singh Ghelani,Opening,Drilling Lease Sale Coming On Western Arctic Lands; Opponents React With Disdain - Alaska Sporting Journal,https://news.google.com/rss/articles/CBMirwFBVV95cUxNMmZmMDRvczY3SG5GSzludlZJLXp0NzRFV3VzbEpOT0lGLXhVdjJsbDFPY28wWURLTVdLWmRfb0JBSjA2c0k1Y2VWRUlDd2lZdWR6N2FiVzRPSThma29scldTS0RxQXRCYW5tRTNoMzJnZFNjUmpuT3I3Z09EZkpIMGZBTUhjb0tJZlJkUWo0dlBXb0pEZllyQmF3TkdHTXFsbWJaR0tyZV9vOGRHUFdn?oc=5,"Wed, 18 Mar 2026 22:52:34 GMT",Drilling Lease Sale Coming On Western Arctic Lands; Opponents React With Disdain Alaska Sporting Journal
ConocoPhillips,Harsimranjeet Singh Ghelani,Closing,ConocoPhillips Encounters 3D Energi Default in Otway Basin—Project’s Delivery Commitment Now Legally Uncertain - Bitget,https://news.google.com/rss/articles/CBMiZEFVX3lxTE1MQTl2WVZtMl8xaVZGZ3p2T3BrZVdKa1Vya2FHR05GMTRfQ2QxeW8yUk9rSDZ4WmJJRFhsOEpxTWNEWkZQXzZXU2xYb3VkdW9SdTdoTHNDeGFQcnZqc1Y2MmlwZzTSAWpBVV95cUxOb0tNRWhvRVRIRGI2RW53SURaSHpCbzNOMHVSNWFqWlFmVHdGS1R4YkJ1V1h4aWdmcThnMFByaEZQbG9KQzJZZWF3emtlUGZZXzQzVlNSbjE2QnA5ZFdIc0xJR1A5WkdHcnh3?oc=5,"Tue, 17 Mar 2026 19:51:50 GMT",ConocoPhillips Encounters 3D Energi Default in Otway Basin—Project’s Delivery Commitment Now Legally Uncertain Bitget
BP,Komal Agarwal,Closing,A digital medicine model that is closing care gaps in BP control - American Medical Association,https://news.google.com/rss/articles/CBMirwFBVV95cUxNaWtQdkpJMHc0MnR3YWJZZFhiYU9Wbm93WkhqTlJSdzgtQ0R0cnVFckQ2aDdBak8xelZaMzJVMkc3ekJ3U0NPbTE0bXEzM3prbkZGeVROeWs4cW5sejczWGpzMWgyRE1fdkVjNEZqUFM3VGItSVd3S3cwLXlESnpSc0xCUkRkem8yTDZRU25wUG1taFQ4SFdJbEhNMThYS1cwYTBwNE92aHRSaXJOcXhr?oc=5,"Thu, 19 Mar 2026 11:05:55 GMT",A digital medicine model that is closing care gaps in BP control American Medical Association
Central Market,Kabeer Pandya,Opening,McLaren Vale’s Never Never to open new cocktail bar at Market Square Adelaide - Glam Adelaide,https://news.google.com/rss/articles/CBMiqAFBVV95cUxPVXZRS29PZEhycDJCeU1QNFdpMDFPWE9fbVk0V0lOUXo0UndVNXR1U3FWSXppcHRZOVVMQzNNWVYyS2E1RW9tMnJVelFXZzl5QV9BY2VWbXdUOXdnR2Jaa1NOYkxYUlpFWDJkczBCYlRfTkdMV0lieFh0WXZjYjVSY2xXNXZiSGdZa3kzMG4xWlhPOHNzX21vRTdSVXdwMmp5RGtzbENBeWg?oc=5,"Tue, 17 Mar 2026 18:35:22 GMT",McLaren Vale’s Never Never to open new cocktail bar at Market Square Adelaide Glam Adelaide
Food City,Kashish Kasar,Closing,Food City Shutters St. Elmo Location - Chattanooga Times Free Press,https://news.google.com/rss/articles/CBMinAFBVV95cUxNVXdLWWd5ejJuTGpKdUYwZlRhMHVSbWdKZF8wajI1TER4M2VPM2FsbkxHcVY4TmMxSDRPRVduT2hiX0pocU5kcFAzNXN4SERwMk5iU0xwTTk4aU9oNHhZemNqNDYtWmlxMnN2U3NWb3ppcm1iQ0gxUmNHeVZfZktYWU5zRm1mUE9HZkZ6NTl5SnNtakl5YTc1R2dGRkY?oc=5,"Thu, 19 Mar 2026 23:14:23 GMT",Food City Shutters St. Elmo Location Chattanooga Times Free Press
Food City,Kashish Kasar,Closing,Food City to shutter St. Elmo store - Chattanooga Times Free Press,https://news.google.com/rss/articles/CBMiiwFBVV95cUxQdlhua2lTZU5EbGhuRnFQUXk5LXJTQk1XblNCdnlIMTIzMGFyOF9MRlVGSTNnN3VudFBvdWtQRVZ3aHFWWFNValFMSUZ5YUlISFZOR2lQUEQ1QVk0eWp1NUIyOU5rNUZZMlppYmRzVkF5MUxqTUljWmtNaTNBUERnTnpaRzFMTF9HY01N?oc=5,"Thu, 19 Mar 2026 22:38:00 GMT",Food City to shutter St. Elmo store Chattanooga Times Free Press
Food City,Kashish Kasar,Closing,UPDATE: St. Elmo Food City closing due to lease expiration - Local 3 News,https://news.google.com/rss/articles/CBMi3AFBVV95cUxOdmYyMURhTUdvZ0prUFNDNU1CcEdqbjBGOFp4UkkxTkxNRzVBNFZ0c25SQ3JmSFhVNDZpQ21QcDRXdmlFM2tCclUwVS1UbGdEOEdLaTlJUmp1bmt5SjEzTWtlbHRFdjNVTk1kd2x5RlpsTndVeFo3R2lodF9MeU9MczV2RmdOc2Z6VTd3THJoT2FWVWdHdXBwOGxHNV92Z200SGc1M3NPTXJBVzN5X0tLUzhiTGxXY285dXNrOExOYTh5U1Q2cFg4RlBYblBrbG9HZExmYW9xTE9GMVJm?oc=5,"Thu, 19 Mar 2026 20:45:32 GMT",UPDATE: St. Elmo Food City closing due to lease expiration Local 3 News
Food City,Kashish Kasar,Closing,St. Elmo Food City to close April 6 - Local 3 News,https://news.google.com/rss/articles/CBMivwFBVV95cUxQQzdPdmdLWjN0UmMwQmE2ek50SFV6UUVjYVpfOWdRRnZ4bXJaZnhLeHBhY1l0VHhxSk05NUd5ZlBXeUNRN3g5U0hubXlWWVJCLUJVUkw0dHBIX1JBYlhWOGo4RlhDNHMtRWZKbi1rZzlOYVBhMlZoZFZyMXk4anhVbW1OWWUxRkN4NHdqV1R4NEVMVmNZMWFSS2lTang0ZEdURXFveUhxdk9IMjRxM1c5VkVoeWd4a25pN3VCajU0cw?oc=5,"Thu, 19 Mar 2026 13:35:16 GMT",St. Elmo Food City to close April 6 Local 3 News
King Soopers,Moksh Kashyap,Opening,King Soopers to open new store in Colorado - MSN,https://news.google.com/rss/articles/CBMirAFBVV95cUxNenhublNLeTF2b0JXSk55Q1B0YUFzOWE2ekpqaDZTdmg1dGJkcDVfZzBTV1drYzBvUjNxR0ZUZ2VGUjJ2SmVZYUhwLVZfdDZPdndPd2xELVhiR2JyekhvbHZ5Q3BnZndfNDhkcWQ3MUtGV0xjVGhTbEQ1bHVHbk43QjN4N1JtSW5sUWJtVENXTnJ3d1drNlFBMkQyT3Q3OVdsbV82ck5oMkJ4MWRM?oc=5,"Wed, 18 Mar 2026 01:40:23 GMT",King Soopers to open new store in Colorado MSN
Lidl US,Moksh Kashyap,Closing,"Streets Market to close after 5 years in Bayview, make room for Lidl US - thebanner.com",https://news.google.com/rss/articles/CBMirAFBVV95cUxOa21PbVhTX1hwQkt2eUdrYVI4WndPLXByaXVSdmIyZjZBVllfbWZVWXJRUWNqcExJV1FRekpyN0NsSGtVTUpHRGhES0M5dnZ3cFc4aE51RTgxWmdUaXBOVVRIWW9vUTM5M0FRTklPTG0wYzVPY0xQcWFxMXpRMW5EY0VLNjI4al91S0VxcjM4S3RKSmpJLXlvbXc4YnE3VXJlMDJUZF9VNk9zanZE?oc=5,"Thu, 19 Mar 2026 18:28:00 GMT","Streets Market to close after 5 years in Bayview, make room for Lidl US thebanner.com"
Lowes Foods,Moksh Kashyap,Opening,"Lowes Foods Opens New Location On Johns Island, SC - The Shelby Report",https://news.google.com/rss/articles/CBMikwFBVV95cUxNNnowRUtPZ0pUekw4NGVCdGEtRW9GWlNZMFF6aEp4aENHWlVNRl9ZQWhrb1hIeWpISXpwSkpYcjh3T1R5OHR3bnZxRjk1aWpDOEJOMjlPaDBTbFNEWU5YaEVTbm1vWmFOZEx3ZlZUYV9EenFYMzhkZEZXS1FvNnNFaW02V1IxQmFScmRZTUdIOFlOZzg?oc=5,"Tue, 17 Mar 2026 15:36:19 GMT","Lowes Foods Opens New Location On Johns Island, SC The Shelby Report"
Loblaws,Rahul Shinde,Closing,Loblaws store in Toronto’s Roncesvalles area is closing to be converted into No Frills - CTV News,https://news.google.com/rss/articles/CBMiwwFBVV95cUxOQzFxaFZZdkFQd0RvNXE3SlU1QU1OblRPYkdWaHlscHZGeGxkS0VPTFVoa3JaQm9pc2ViWlFCSzRsTXQ1N2k3RjZSNVVKcUhrQWNvSlNvN3lFazZnbVFvRkhjZWR3eWNfSDI1TEtwQU9ZMVoyVTBPOGhzclZfcFpLVW9iNUNtaTN3dmpnNkVkcmdSdTNjUGlRY0RJdGpRZ0FKd01CT091aG5RRHhUeDhPNDVvdU1zWm1SUXJsMFdPMXhtNHc?oc=5,"Wed, 18 Mar 2026 19:43:13 GMT",Loblaws store in Toronto’s Roncesvalles area is closing to be converted into No Frills CTV News
Loblaws,Rahul Shinde,Closing,A Toronto Loblaws store is closing and transforming into a No Frills - blogTO,https://news.google.com/rss/articles/CBMijwFBVV95cUxNbzQ0akRvd3N1TU9pM2ZKTl8tQ1lMWkhMV2N5U2RVVXhZLWNpNEFBU0pkdGZxR2s4VE5adlpRZThXS1hMMnpMeEExdDdTaXd0NzJJNk5VY0syVTM0RUJlWXB2QlNSbHE5cldzeXZ0TlFQQ2NoeHFocUJjVHQ5a2FieVM5NjllQ3Z5Wm1KVzAxaw?oc=5,"Wed, 18 Mar 2026 15:29:19 GMT",A Toronto Loblaws store is closing and transforming into a No Frills blogTO
The Fresh Market,Rahul Shinde,Opening,"The Fresh Market Opens New Store In Pittsburgh, PA - The Shelby Report",https://news.google.com/rss/articles/CBMikwFBVV95cUxNQjZJVmJCa24tRGh6OWtWaDdXM202N1g1elVLRk1Db3VwbW4yRktlREd0MFhER0hIOW1LaDcycVZFd0xsdGFmeElRd1BHWlo2S1NhaC1CVXg5WGtmXzljVjZZcElLRVhaWUFGR3hXOFlfUWhLRFJlM3ppcmhUbTJxRGxDMFVLdDFfcW1WelQ1OWVlMTg?oc=5,"Wed, 18 Mar 2026 20:56:22 GMT","The Fresh Market Opens New Store In Pittsburgh, PA The Shelby Report"
The Fresh Market,Rahul Shinde,Opening,The Fresh Market Opens Second Location in Pittsburgh - Business Wire,https://news.google.com/rss/articles/CBMirgFBVV95cUxNVWxBYk5WajI0YnFBQ1Fwdy1aMTlsUTlOUlpELTFKSDJaOThZemZCV01ELXliQjhCbWp6R3ZuWlFfR2RBVWY4R1dMOWFjWXloUWl4T2FITEtDR2RLQlVCcllTMFplazh4aUdrWml2MFFTT1lLSUtiYWlCcEV1MVd0RFNTLUd0eXlaUXptTFB5UkhBSVNGTXVQY1ZOLTc5c0pHVXV0Z3E2UGxNOEFOU2c?oc=5,"Wed, 18 Mar 2026 15:59:00 GMT",The Fresh Market Opens Second Location in Pittsburgh Business Wire
The Fresh Market,Rahul Shinde,Opening,The Fresh Market Opens 2nd Location in Pittsburgh Area - Progressive Grocer,https://news.google.com/rss/articles/CBMigwFBVV95cUxNVTJ4aGZCeDg1THpBMUZzdk4ydDFQdEpJRVJlUGZtM2VCa1RtWWtxQVNrTVpla0tjX1dDWEVZR19sVVlkWmNRLXhnQTVpQ1pIVVd0Z3FTc3lqb0RKTEJoTzI1R2JJLXBDdGlJNkQ4ODFBcmFQRkxVa1huRnl1WWpHLUFCMA?oc=5,"Thu, 19 Mar 2026 11:44:46 GMT",The Fresh Market Opens 2nd Location in Pittsburgh Area Progressive Grocer
Trader Joe's,Rahul Shinde,Opening,Trader Joe’s is opening a new Phoenix location. Here’s what to know - Phoenix New Times,https://news.google.com/rss/articles/CBMiuAFBVV95cUxOVnVvdklGNU1EaVk1WVA3VWd0WER6TDlfZlJuTUl1ZENXZG1XT3VWbGFQOVI4MklZeDQ5c2V5bDdCNm1HU29DaHJ1TTViVTNYOTNLbHU1MjlJNmZWbnpTNEZEd3dPTEJ5TXF6aHVpUU5uWkJGQ0NaN01LRW9lOW9aYVBlNlBwZkdxMnRUUndJZTlkazFmTkVORS16b0h0TTZjdTRMVTVvbzVZSHRmc1hnZ1E5XzRpaFNk?oc=5,"Wed, 18 Mar 2026 20:02:10 GMT",Trader Joe’s is opening a new Phoenix location. Here’s what to know Phoenix New Times
Trader Joe's,Rahul Shinde,Opening,Trader Joe’s vs. Walmart: What Your Neighborhood Grocery Store Means for Home Prices - Realtor.com,https://news.google.com/rss/articles/CBMifkFVX3lxTE5NMk1aUDhUeGxCUzRjZXpXNlpnS1FYd1R6X1FsOXI5d0tsblVoUlpzX0ctT1JmbUFyREZqeEdyNDU0aVVtalo3bHhYQVpOX3BWYWEyM19OR0w4aXY4SGpic2RId0hHUjRVMVpnSjRuWnQ2RXVHbXVRZm5qbG8wUQ?oc=5,"Wed, 18 Mar 2026 09:57:34 GMT",Trader Joe’s vs. Walmart: What Your Neighborhood Grocery Store Means for Home Prices Realtor.com
Trader Joe's,Rahul Shinde,Opening,"Trader Joe's coming to north Phoenix amid major projects, land auctions - The Business Journals",https://news.google.com/rss/articles/CBMimwFBVV95cUxQUzhwSkpaelJKWFE0NnZOUjVUeG9lc3lfR0dhVXpyS2pJdHZvMk5IcnM1YlpwZGwtMFJxaUpUTzRTSkFiVXAwTjV0alFPa0o1OENreUNGdmZMeGJGYXJ0QnRvdlgySVl1ajhkbGt3M0p6bFBxNmhWR2E4Z1hPM1JGRzhTTTdVT3MtUkdIaXZGaUpCbDNEV013VGV0RQ?oc=5,"Thu, 19 Mar 2026 21:10:00 GMT","Trader Joe's coming to north Phoenix amid major projects, land auctions The Business Journals"
Whole Foods Market,Rahul Shinde,Opening,"Whole Foods Market Doubles Los Gatos Footprint With 43,000-Square-Foot Store - Progressive Grocer",https://news.google.com/rss/articles/CBMiogFBVV95cUxNWFJxcjNHaXhtUUFxeGVBNEpuWVd4bHNscThsSlFhSDVjV1lmSUpuc3ZpWGpjMDBFaGVKcHlXOVRfZ0NPZ0REaWJwRXBHeDQwWTF2UUpnUE8zMDZ6UUkxZVR3N1dsVnlEeUNLZDZ5YzRvLTdISGpQWGVkTUk5WndnM3dEd3FOQV83QlhaVGZRMWFfQlUzbnhGb3hqU05nNHhtbHc?oc=5,"Wed, 18 Mar 2026 18:24:10 GMT","Whole Foods Market Doubles Los Gatos Footprint With 43,000-Square-Foot Store Progressive Grocer"
Whole Foods Market,Rahul Shinde,Opening,"New Whole Foods Market in Los Gatos, Calif., to open April 15 - Mass Market Retailers",https://news.google.com/rss/articles/CBMilgFBVV95cUxPYUNkNVRzLVZfNGlVTWxFMEp1YUdpeUd6cEdBM2huUXVOZlVaS045cmNhVHdXQ0xtM3RlM0VhT2lTNFVaTnNtRHJLdHJ0bUFBak9EdEpYc0VabEdyNmFxM2xhXzVuX1JVUWFmdGJ0bUlXV0daOW9CVjFpVDhUZGNJbjJtemFENzd4SEdQSnhkT0FNaW0zX2c?oc=5,"Wed, 18 Mar 2026 14:09:15 GMT","New Whole Foods Market in Los Gatos, Calif., to open April 15 Mass Market Retailers"
Whole Foods Market,Rahul Shinde,Opening,"New Whole Foods Market in Los Gatos, Calif., to Open April 15 - WebWire",https://news.google.com/rss/articles/CBMiYEFVX3lxTFBfcFFMRmVkN2NJdHZBMzJHMm1CWWhGNXlmUTlvbEUzcGxBSWZBd3VYbnVQV0h2Z3JDdG1lS1RsLWQ5MzItaHY3YTlCR2FrNFhEMElXbHlQRXc3NG9JZUNWbQ?oc=5,"Thu, 19 Mar 2026 17:00:33 GMT","New Whole Foods Market in Los Gatos, Calif., to Open April 15 WebWire"
Whole Foods Market,Rahul Shinde,Opening,"Whole Foods To Open 43,000-Square-Foot Market In Los Gatos, CA - The Shelby Report",https://news.google.com/rss/articles/CBMiogFBVV95cUxPQnlsR1FBakZFb1Y3RDZDek13dTUxSkdqSHFfRUZNM1lrbFV6WkpJRlI3Y3d2alE2b195elJNbVdnWWJYRXB1Z28tQVc3NnpUQWt2OV9TZVNRTVBuUE1oSUtEQXZzM25lNTBpUGdEZ0d4WDRlUmFJUS00anlFRXdNRTh5ODJ2c2w0Sms0M2JtS0xJOEE5cDJ2bVl0LVVzS2sydFE?oc=5,"Thu, 19 Mar 2026 16:37:08 GMT","Whole Foods To Open 43,000-Square-Foot Market In Los Gatos, CA The Shelby Report"
Whole Foods Market,Rahul Shinde,Opening,"Whole Foods Market to Open Relocated, Expanded California Store - Store Brands",https://news.google.com/rss/articles/CBMiiwFBVV95cUxNMDFxUUFGZkJFWllaTnhKbEVFYkVOWGlsNi1WRXJpaDZwdkFiZEFJTnN0WUZfUjFNR25GZmdIY0tEMnNNcUNjbk5XNjh0dk0wRHJQSUFRVGdUbDhqOFhWUkxJQXJ0aU1iSUVGMzB6SGx3eW85bHlMdHJhdmNUTGNpaEYzUWE5MEZmcl84?oc=5,"Thu, 19 Mar 2026 16:03:25 GMT","Whole Foods Market to Open Relocated, Expanded California Store Store Brands"
Whole Foods Market,Rahul Shinde,Closing,Whole Foods supplier closing warehouse in Racine County - The Business Journals,https://news.google.com/rss/articles/CBMiowFBVV95cUxQUTlNVVVYSFU2OE9rTmhyanctWnpCT2JtNTR2bzdYbjhnVjVxM25xMko1Rng2aWh5OTl6RFR2emV1anI5RFVoelFMejN0TlJaeDJ0WTJ0SkxfU05Md3JLYmJBT3Q4R3h1Nk9FVVQ4VEdZR0dBM0dlZmVjUDg4R1JWRERRYmFraHEzbThFY1Qzd2dwU3Q1MDFQakpMSlhnMl9qcFdB?oc=5,"Tue, 17 Mar 2026 19:55:00 GMT",Whole Foods supplier closing warehouse in Racine County The Business Journals
At Home,Rahul Shinde,Opening,Orioles partner with Corona for new bar on Camden Yards’ flag court - Baltimore Sun,https://news.google.com/rss/articles/CBMiiwFBVV95cUxPSG1MdEtMbHViLXp4TFZJajF1UkhUOFZvTktZVWI2VHFvTk1FSmZYU28ySDFVc29hT2NuQl9ndTFGNUZsaFZUZk5sVGFQMU9qYnE0dGZoSmdhZmVNUjZ3UE1ONnZRdDM2V01sUXhvUE9WOTYxZ0cyYmpfSk5odkM4RF9iVFdjLXBBY1VN?oc=5,"Wed, 18 Mar 2026 19:53:45 GMT",Orioles partner with Corona for new bar on Camden Yards’ flag court Baltimore Sun
At Home,Rahul Shinde,Opening,Manistee DDA backs tax break for proposed wellness center - Manistee News Advocate,https://news.google.com/rss/articles/CBMipAFBVV95cUxOc3B3NXRlT1M2MXh5X0JKUW9KbTZpRHZndGtCUG9RVFZack92UzFoaTZyb3FQU1RCaHNSZlVaSnA0SXAwTGNvdmVaMEoxSDVrZGRpMW54dXdUdFpvWlpZYmFMR3gxOWxaeGo2N0x6YjNkX2tnRlhNWF9CcTdSTnFnMS1iVmI2TTZGYzhHZ2JEbDFSMUUxYzZadGhuR1JseXBaNFlMaA?oc=5,"Wed, 18 Mar 2026 14:23:18 GMT",Manistee DDA backs tax break for proposed wellness center Manistee News Advocate
Grocery Outlet,Rahul Shinde,Opening,"Amid nationwide closures, Grocery Outlet bets on Bay Area with new store - Yahoo Finance",https://news.google.com/rss/articles/CBMipwFBVV95cUxQUnl6U3g4R1NEUFhTZDlKWk13VF9BYVdkQWZqUXRieGxjRmRmOGUtejR3QXR3azg5RU90aDg2T0p2QTVsS29mSXlMbTRfaEJnalpNYVp2djQwbmN5M2tJR1o4RDZMYVhOc2xkSVRFcGd2WERwQVVEVlVUa21VN1V3Z2lWTjdEMjhoM2RLMENyb0FxQWQyams4MGw1ZnNqTnlSNWZnRUlkUQ?oc=5,"Thu, 19 Mar 2026 12:00:00 GMT","Amid nationwide closures, Grocery Outlet bets on Bay Area with new store Yahoo Finance"
Grocery Outlet,Rahul Shinde,Closing,Grocery Outlet abruptly shutters 36 stores after expanding too fast - MSN,https://news.google.com/rss/articles/CBMi4AFBVV95cUxOUDhWcTRwRXhTSWJuenZic1ozbkVLNHppSl9RbFd2VXBOWkh0UTVnYWpDdWJxN184S0IyZDYwT1VlZFR0UHJXM2E0RC1Zb055YnlQbnRac3E3ZkotLTlQT1pnZzliVFJKUXJJYkZuY1pkUmRYTk1vcTZ4NmwxRE5GLUdkZmpZZld5RHhWWlk1dEtVaXhSeUUtTm1TOTNqQVE4YS0wWUlqejM4QWE0ZE5sYzhuNnh1TUJYcHR5VE1Tb0UxcUdQSlFHTERhVlFFTTd6TGw1d3ZFQi10ZEx6SzQwSg?oc=5,"Wed, 18 Mar 2026 06:23:48 GMT",Grocery Outlet abruptly shutters 36 stores after expanding too fast MSN
Grocery Outlet,Rahul Shinde,Closing,"More than 1,400 stores are set to close across the US in 2026. Here's the list. - Business Insider",https://news.google.com/rss/articles/CBMia0FVX3lxTE9SUTdiM1JqclMzakxVV3hnTHU3N0ZOdHQ2UFhvc0RMS0kwM1FQQnFKd3RUb3ctOWpLSHRyc2o4d3pDX2lVQUdRcEJ3bzhKNWZzT1VuNEY0MGk2XzVXLTVHanRNMHBRRWM5aVVN?oc=5,"Tue, 17 Mar 2026 10:22:00 GMT","More than 1,400 stores are set to close across the US in 2026. Here's the list. Business Insider"
Grocery Outlet,Rahul Shinde,Closing,Grocery Outlet is closing these San Diego County locations - MSN,https://news.google.com/rss/articles/CBMi8wFBVV95cUxPWnRKalNtam0wYVJIbVNJRnFqdWZTMTRYUFR0SllmSmhrSUE1TW52TV9nbkczbXdmUS1yWXgxZTU5MmNVcW9RSl8yYUNtbUpaemlzdHhRbnZZX09kMHh2Vm5xMEVrUzJvX1F0V0s5eDg1RVJ6SFgtOHhTdk1KX2lJVXFFaUllNWxwdkxlbGd6QnVtMFoxeEpXc1FFbU1YeGpuUVo0UGhSR0FaUUtlTnZMdzZuWTFaX2ZnMjVlakxndDNoNGJFWFItd2dKbS14SkJBS1Q4eFhIVFVjN1l4ekVQSlpEWEl0V2FEU25FU2g3TkdpY0k?oc=5,"Tue, 17 Mar 2026 03:11:05 GMT",Grocery Outlet is closing these San Diego County locations MSN
Grocery Outlet,Rahul Shinde,Closing,"Amid nationwide closures, Grocery Outlet bets on Bay Area with new store - Yahoo Finance",https://news.google.com/rss/articles/CBMipwFBVV95cUxQUnl6U3g4R1NEUFhTZDlKWk13VF9BYVdkQWZqUXRieGxjRmRmOGUtejR3QXR3azg5RU90aDg2T0p2QTVsS29mSXlMbTRfaEJnalpNYVp2djQwbmN5M2tJR1o4RDZMYVhOc2xkSVRFcGd2WERwQVVEVlVUa21VN1V3Z2lWTjdEMjhoM2RLMENyb0FxQWQyams4MGw1ZnNqTnlSNWZnRUlkUQ?oc=5,"Thu, 19 Mar 2026 12:00:00 GMT","Amid nationwide closures, Grocery Outlet bets on Bay Area with new store Yahoo Finance"
Dollar General,Shuvechha Dere,Opening,New Dollar General on Aiken's Southside to hold grand opening celebration March 21 - Post and Courier,https://news.google.com/rss/articles/CBMizwFBVV95cUxQRmVvaFRYcEpELXNJRlZRWlBza3N4S3RqWGUxNmRMbDlTN3gteDhtQlpoQ20teFR4aWl3X2pPeS1EVGNZZUpEYXJTYUF6YlpzUXljWUlXYWpaV1VYcnJsSk9lcDlKUm1MRm5ERVBKN2h0NmZIdm1jTHN5SjVJM1hGM00ydzJHUXFqSThNeW1IQmJqYXNib05kVkN1LUhrSFRpUFEzUjYybjlQdENpLVRFM005VndQUElUS3VCVXpFT2Q3UWU4QUwtMU8yUXdLLWc?oc=5,"Wed, 18 Mar 2026 10:00:00 GMT",New Dollar General on Aiken's Southside to hold grand opening celebration March 21 Post and Courier
Dollar General,Shuvechha Dere,Opening,Dollar General Just Announced A New Store Concept—Here’s What Shoppers Can Expect - Southern Living,https://news.google.com/rss/articles/CBMivgFBVV95cUxOVG9ZZmtja2thMkdIdFIwTmN4bFlYSGZrdThSQW9walUzazZUYkcyRk5qMk5XMi1PanZWZUloUWFlQlRWbXpheDhwdEVLX0g2a002ZWNJUm9rUTRsV3pkVE1jQ2hWVW9DNmx1eHZMTU1UVldYcjBhMXlaaVZHSDBDWHgwY3h6dWJiZVhOU2NtaUxLMHh3R2paRU5UeWdmQnpyTXJXVzdWNjl4cEV3N2NOVS1NVWs4aFpRenJYMmNB?oc=5,"Tue, 17 Mar 2026 19:05:24 GMT",Dollar General Just Announced A New Store Concept—Here’s What Shoppers Can Expect Southern Living
Dollar General,Shuvechha Dere,Closing,Dollar General announces nearly 100 store closures at popular discount retailer amid retail bloodbath - MSN,https://news.google.com/rss/articles/CBMi-gFBVV95cUxPdDZQYzNJMnZrd2hfdS1HYUFRVmhoU3lxRmNzRFJ1VXMyQlA2YmkxNmRlNmdSdDhiVG1ibUtIb015RTNvTzI3eFNTT2xWUmd5ckpSVnZpWFJ1NHRoRGRSZ3B5bVd6V0xQOWNsY2pmVnE2NHFKMXB1Nk9pOThFeFd0aVR3RllJbVYwT09hRG9EZjV4YWRaSWpJYjFtbUxUdkY1ZDFnb1B1MlQ3MVpISmZYZnFHZXJ3WEN3UmxrUnRkNEFvbE9OZ0RXSmpuTElKVzd2ZkUtdlRPOS16YTZ2SGpnTFFPMWUyTFFtT0ZjUzNQMjRRTHhuWlN1RkhB?oc=5,"Wed, 18 Mar 2026 23:34:15 GMT",Dollar General announces nearly 100 store closures at popular discount retailer amid retail bloodbath MSN
Papa John's,Vishwas Shah,Closing,Papa John's closing 300 restaurants as US pizza sales slump - MSN,https://news.google.com/rss/articles/CBMi2AJBVV95cUxQS3paTWJlUkxiYmR3M1ZWd1I5ZFRIM1AxVFIxQ3VYZWZVVUg1QV9oZlNHRTd3Ulp5OU9tSjBaYzJhT2loUHJ2WDNGcV9ubGNuYnI3TVhPUWhnNXotTHlHbFpha0dfWHRRMWVCbDBESWFwSUJLNlpSYnoxLWRvRWtKX3JsS1lXSjB3ZERHSlZpQzl5N1pNdnZRTG1rTWxWeHdfbERGZGJmNUFPV1JVQW1RSFdIZG9wRjdQTVlsYy05NnY0MEszTndlMGYwLTVnNjBlaHkwTVdvNTJ0c29UYjhPeTE2OHZ0eVJ2WlFGbDhLSktLN0hWWTRBRWZ6d3hrUGhWMzJZczNyVVdGdTlhdWFzSHpkTk51eVRMU29aMVZkaS1Ob3FkcVZSV2t3aDRsdVRRT21zOFNUMXExdFlhVk9MVGVndkxRSXFKZmdtN3VYeW9pSlBwRFZSdA?oc=5,"Wed, 18 Mar 2026 19:46:59 GMT",Papa John's closing 300 restaurants as US pizza sales slump MSN
Papa John's,Vishwas Shah,Closing,Papa John's closing 300 restaurants as US pizza sales slump - MSN,https://news.google.com/rss/articles/CBMiigNBVV95cUxPVWF6ZzlsLUQwQkU2MmlyTGNRUHQxVjVvNXh3WktJdk9Nd3IyMFNZUHQ3bWV4MnpuOThxVE94b29vQzFEd2M3WEo0YklLR1hGcEVZalNFZUoySVpIRGFaZ2xualMtaDNEeWRibVJIN2gwZlBGZXhOSmxRc0lfekIxbm5xQ2IxYmtZOThvN1lqOWk1Qm1zbm4zT2pNXzlkb1JwRGpZM1VOY0pRRVprdVFsVTZjY0hrNDFiSlMySGNSNUhNYUpfWFFPXzFZSUpIMVVzalJjMGZpYkN2amZjdmZLcnotOEVWVUJiYVF2R1BobTRtOUlTeHFYOWdoa3hWQmFrOHJLZ2xNaC1pbXM5SDBxSmNPT0w0NUYycGUzTGs0cExObzhfSWxqRzhVRjFYYUdYaTdwdXE1NHBfVmtieXc3dkRGQ0xXMmdJd3ZEaWhPcDJaRjBTYWpoMWl5TndPc2U1bkZENGd4YzNGS3NvZFBVaGlSWFZ6VGZEUmZ6NFVLaENCd0xjUE1qckhB?oc=5,"Wed, 18 Mar 2026 15:05:14 GMT",Papa John's closing 300 restaurants as US pizza sales slump MSN
