Store,Analyst,Type,Title,Link,Published,Summary
Saks Fifth Avenue,Harsimranjeet Singh Ghelani,Closing,Saks Fifth Avenue on Palm Desert's El Paseo to close amid bankruptcy - The Desert Sun,https://news.google.com/rss/articles/CBMi7AFBVV95cUxPX09BUl9pNEYwdFNKVzJYbUNnS1ZTX1YtQURLOXFTdmZRcV83eUxDY3lWZk5NTDdwOHQxeUpVZUlhd1VsUEdlUWpxTmljemg2Skx4bmtJcXp5aWRPd0JwelVhRW9wUFp3UWtyRHlpZDYyb1BScEEtY0hKMnFZT3hMdDJqeGZRWUNnc1NKcnJzeGRCTUpiRFJ4UG5uS3VhTWF3aGhHZVpOcjB1TUdDQ2wzbTU0a0NJSDFnSWY1VURybTFTWmV5b0p1ZDJDYW90d3psNGpaNkJfRGdYUVc5bXlnQV9kOHBxeENfdElWUw?oc=5,"Sat, 07 Mar 2026 20:18:00 GMT",Saks Fifth Avenue on Palm Desert's El Paseo to close amid bankruptcy The Desert Sun
Saks Fifth Avenue,Harsimranjeet Singh Ghelani,Closing,Saks Closing 15 More Stores by May—Here’s Where - inc.com,https://news.google.com/rss/articles/CBMikgFBVV95cUxQS1FQQ2VTOTZ5TUdId0FiU0hDYkZfZTdzVmVuM2FrRzZERXpBY0FwT1MzMHpkZnQzTWtZaGxPNGVPY3RKTTczbnozNF9Yc05VbncwR2wwM2E1MVJfd09IT2RxeElhVGtTaGdILXR6d3AzdktQeE9VdXBUVF9kODR6bVVmb1VyeHJMY1JxMngyNzBrZw?oc=5,"Sat, 07 Mar 2026 20:03:45 GMT",Saks Closing 15 More Stores by May—Here’s Where inc.com
Saks Fifth Avenue,Harsimranjeet Singh Ghelani,Closing,Saks Fifth Avenue in Palm Desert Closing - MyNewsLA.com,https://news.google.com/rss/articles/CBMiiwFBVV95cUxQYXdBTGtUamlhWWd4ODZlc1VIVFYwU3pXeHhlWHlPUHlFX19CRW80ZlNvMExTOWthSmhYR2k0VU5GRTlZUUlvUmNBcnJQT0F0cFFwQzdCaW9lRFMtMzJldFVOY3UtVjdfQ1JoLUdFRHdGUi1Kb0ZQSlZQdm1jZW94XzYyYl9seWhoVnVF?oc=5,"Sat, 07 Mar 2026 19:42:15 GMT",Saks Fifth Avenue in Palm Desert Closing MyNewsLA.com
Saks Fifth Avenue,Harsimranjeet Singh Ghelani,Closing,"Local Saks Fifth Avenue, Neiman Marcus Stores Closing - MyNewsLA.com",https://news.google.com/rss/articles/CBMioAFBVV95cUxOVWhsY1RDUjJUYmVOWkhXVGh5Sml5Q19NRURNcDM1X1FCcGhVZTU4a1Q3NDJUUTlnUGFDYXc0b0pvTDRycW1HMVZZN2RDeEVQYVNVX3ZsREpTUEVzd1hVNl9RMk0wUVQ5eVJzdUpVX25aV1lyeFB6elV6czl6ejRoTmItTzZlaW1nY0ZuVVVUUW1iMTBzQlNhUGx4T0ZHZ2FK?oc=5,"Sat, 07 Mar 2026 19:42:04 GMT","Local Saks Fifth Avenue, Neiman Marcus Stores Closing MyNewsLA.com"
Saks Fifth Avenue,Harsimranjeet Singh Ghelani,Closing,Saks Fifth Avenue leaving the Mag Mile - Crain's Chicago Business,https://news.google.com/rss/articles/CBMikAFBVV95cUxNRkRrTS1rb0wwZ3dxa1ItaEMwRlBMYXVUczQzQzF5Z0lzYUNHQThuUFRyV2R0aWUyQW5jWUxBWno3NEJUekg1LXJMakpVbG1yX0VTVFZ4ekFUNXdhUVdXY2stdG0zSXoyTk9XRGlOQW44MjBLVHM3LVA1TVc3ekVpOWdfbnVhTnZhUUxfVXZlODc?oc=5,"Sat, 07 Mar 2026 18:28:17 GMT",Saks Fifth Avenue leaving the Mag Mile Crain's Chicago Business
Saks Fifth Avenue,Harsimranjeet Singh Ghelani,Closing,Beachwood Place’s Saks Fifth Avenue store to close - FOX 8 News,https://news.google.com/rss/articles/CBMie0FVX3lxTE5OVnlObTh2SXRTRkNxLVgyQnBzMTRsel85a1JfZndWNlpoOHJpVEJQVDFzXzA2Z1lSaEF4OUJIU1NxOG4xT3BzRXEwUmdyVmx6c3FQWndVRGtrOFdYRE9FNnhPYWdtTXpyRHNSVnRNVXNYcFFEZjVDVlp6QdIBgAFBVV95cUxNZ29nQ1RXdjdmX2dIVU1kSTJhTE9CeXBaWFV3UndUVFdpbXIxNnBsa0dLaEpPdmdWcEVLNC1Vd0RjN1UzN1JuS0xmczhjaGhSMlVpVndhUUtsMkZjNmR1b1c2QjdPVjJ1d0lGd1Q0N3RkNkxHcjNUNlZnNWppUmtTdg?oc=5,"Sat, 07 Mar 2026 17:29:39 GMT",Beachwood Place’s Saks Fifth Avenue store to close FOX 8 News
Saks Fifth Avenue,Harsimranjeet Singh Ghelani,Closing,Saks Global to shutter 15 more department stores in bankruptcy restructuring - DC News Now,https://news.google.com/rss/articles/CBMiwAFBVV95cUxOLUg4THFBN29QTFQyOTdVYUVTSV9DYzdmQWxNUkJmWlVmQlplUGFvTkRsSlF5UERSVXJuLTBxRkVZZGNCUVJCWGI2c1E0T0VXWkpuTy1VYzFDVEE1d0RHdXpKVjBoRVVIMHZUV0xnT1NwRmhUcmxaTUVnaUtvY09kMWJwelhRZE9JU1BOY1FTRjMxeXk3Q0Q4b1B2d0ZEMXVoZTZ1eXFBUTAzczUzbmF5Umx3VTFiZENwNkxEVldPMXjSAcABQVVfeXFMTi1IOExxQTdvUExUMjk3VWFFU0lfQ2M3ZkFsTVJCZlpVZkJaZVBhb05EbEpReVBEUlVybi0wcUZFWWRjQlFSQlhiNnNRNE9FV1pKbk8tVWMxQ1RBNXdER3V6SlYwaEVVSDB2VFdMZ09TcEZoVHJsWk1FZ2lLb2NPZDFicHpYUWRPSVNQTmNRU0YzMXl5N0NEOG9QdndGRDF1aGU2dXlxQVEwM3M1M25heVJsd1UxYmRDcDZMRFZXTzF4?oc=5,"Sat, 07 Mar 2026 10:37:05 GMT",Saks Global to shutter 15 more department stores in bankruptcy restructuring DC News Now
Saks Fifth Avenue,Harsimranjeet Singh Ghelani,Closing,Saks Global to Close 15 More Department Stores in Bankruptcy Restructuring - National Today,https://news.google.com/rss/articles/CBMizgFBVV95cUxNbFRCLWs3N0Q3Z1JDMkpiQ3JLemlvSmVPQWcxbXF3bWpOZVFKYXlabEN5NVRqMHhxZk1xRXF3ZGZLUmVwaGdaUUkxXzdISFJJeTFCVmNpRVRpR1hjUm9fb2VSbG41UmNFTk1qTGphZTZHMXd1c2hPdzVDWGtJSFp0LVpUUmZkU01LS0pSeG9Kd1JYcHVuR3JoN2xLczloZm42dGdNR3FPZXZWNVhDN0tZYXd1U1FaMnBUVnpqWFVFOUVfS3YxR2FVSkkyeDVIQQ?oc=5,"Sat, 07 Mar 2026 07:11:17 GMT",Saks Global to Close 15 More Department Stores in Bankruptcy Restructuring National Today
Saks Fifth Avenue,Harsimranjeet Singh Ghelani,Closing,Saks Fifth Avenue in Raleigh to close for good - AOL.com,https://news.google.com/rss/articles/CBMigAFBVV95cUxPeEk2a1oxNkhPRExscndGbWZ2M01BWmZwTjNoNGM4UTRON2FzaTluQk9fYmlFeElEcTZKZXluTlR6N0JNRFNlbjBhTjBNQXhFNkVLMWN0by1VMnBhX29ScTRkUXdsNXZyRkVmdTJLUjdheVZFNU5zbnlNSEtfQ0FzUA?oc=5,"Sat, 07 Mar 2026 06:15:18 GMT",Saks Fifth Avenue in Raleigh to close for good AOL.com
Saks Fifth Avenue,Harsimranjeet Singh Ghelani,Closing,Saks Fifth Avenue in Raleigh to close for good - ABC11 Raleigh-Durham,https://news.google.com/rss/articles/CBMieEFVX3lxTE5OaTlXVEtIWTY2cldXN3VUOEF5amd2RHNIUGgtckJ0MHhFRmpLSElqdVpHNEtWTWZ0NkhBOXdkMHRnZHlxRjZybGZvLWNtMWh4ZjJGUVlFMHh0bHVTS243TnAzRVZMODhVSFZDZzYwTXh3bXg0RzFvNtIBfkFVX3lxTE96TUwzeDc1SXlRWldsRkxIUVVnLU9uaFl4ckNHeDNWT1JLQ0c2N0lYcXBYRkZxaDVERlp2SFlObVVTcU9EaFRfdENndThCN1AxN2ZtTnlDZmktNDF3YUFSbEhRakVYYU5RVnhFd3FueHdyNjFjUGRyX1BuaFRyZw?oc=5,"Sat, 07 Mar 2026 05:04:45 GMT",Saks Fifth Avenue in Raleigh to close for good ABC11 Raleigh-Durham
Saks Fifth Avenue,Harsimranjeet Singh Ghelani,Closing,Saks Fifth Avenue parent closing 15 more stores in bankruptcy — here are the locations - AOL.com,https://news.google.com/rss/articles/CBMifEFVX3lxTE9xWF9odnd0TXVoOXc4Ny1fUjFTOUY1bWVOMXRhWTZWRDhBeU8zcThnUktfdEJiS2NSbUF1bUFaZWxnTnlYNnh5b21sQ3hnZ0dqTXBZX0pZcEgxMzFrOW9WTmprc2kyNE9DX0FsV2tvaGdaRzBtOTVPMnkzNXY?oc=5,"Sat, 07 Mar 2026 03:41:54 GMT",Saks Fifth Avenue parent closing 15 more stores in bankruptcy — here are the locations AOL.com
Saks Fifth Avenue,Harsimranjeet Singh Ghelani,Closing,Neiman Marcus store at Ala Moana Center to close - Honolulu Star-Advertiser,https://news.google.com/rss/articles/CBMiqAFBVV95cUxOWGwyVzJBM1lkOWdoYlJwU3IxRndadnd3NS1qUzg1OERHRW9HeS1GYVBrUExxRW50N2NTSFQtVzdWSzI0TDg0RndLWllsOThmc3E1MU9ySVRoWFlINEJtcmhIQzNaa0tqQ1lldmtpSFFqbXZFaE41dzlDTlNRMWhvSk5TNDlWZE9YR0JEUkJUbG1nUWNPcGhUVm9EekNaYlM5T1NWbDNWd20?oc=5,"Sat, 07 Mar 2026 02:55:30 GMT",Neiman Marcus store at Ala Moana Center to close Honolulu Star-Advertiser
Saks Fifth Avenue,Harsimranjeet Singh Ghelani,Closing,Saks to close Raleigh store as slumping mall loses another department chain - The Business Journals,https://news.google.com/rss/articles/CBMipwFBVV95cUxNNjJEeGs4OEhBOFIwOUs3N21BZXhKTkJYTFNMcVlnNWE5MW51QVZQeXR0OHN2OEdCdXNUUXZZa1pjRkxlTERZMjUwR2RyV09TbmV2ZmNvdVdRV3dOLTl1aGFNYmd4UURQZmh5NUFsU3JQQmZkRE8yRVo2aElpSW1pMkxGTVRnTFVsTzR0QjBjZFpYT3JOdVY3NEdfQnRJd2pWbEFsekJjZw?oc=5,"Sat, 07 Mar 2026 02:15:00 GMT",Saks to close Raleigh store as slumping mall loses another department chain The Business Journals
Saks Fifth Avenue,Harsimranjeet Singh Ghelani,Closing,"Saks Fifth Avenue, Neiman Marcus closing several stores: What to know - LiveNOW from FOX",https://news.google.com/rss/articles/CBMinAFBVV95cUxQbkRGU3ZnTGtUNk5tVjJPMTRzY2JYRWMzUmFqWnFuVjRkc1FZQktjWDJyd3U2bDVPdjc2S25qcFhoRWRZSElRTDROSWV2T0FzTUwtMkptMG5kWkpsSXYyX2tpbU1NdUx5dHhsNGk0Wk5STlQtRkp4NVFHMThIZzNoamxTVDFXV2FEYkxwWmQzazVrTW9NNl9DNEYtZnTSAaIBQVVfeXFMTVBBcGhlTFBiQUFRRWlwbTNCSTJkRDA0b0EwX213T01ZU0ZTMjNQd1VweEQzaXF4YUdYM2RxTTNDakhmc0FHUjlJdUZrWldqakVTd2FTY25QT1JydEZUN2dXM0FfZEctVzJMMWJvUTB2VVp4VVJrei14THFrenBRb3VNekdsbF9QM1RtXzRYd3o2YkZuQmdCN1ltMi00OUZ4TlpR?oc=5,"Sat, 07 Mar 2026 01:04:54 GMT","Saks Fifth Avenue, Neiman Marcus closing several stores: What to know LiveNOW from FOX"
Saks Fifth Avenue,Harsimranjeet Singh Ghelani,Closing,BREAKING: Saks Fifth Avenue to close Tysons Galleria store after 38 years - FFXnow,https://news.google.com/rss/articles/CBMiqwFBVV95cUxNbG00SGJaeUVGckx0QmU2cGtQaElLS3l2UHB3NlV0M25zaW5USWpfZkQzcGw3WlR0U0EzS0pLVk92S3YwMnY4RFpOV201OE1jNHJwQ1ZZeHRzYUJMUmZFbjBIMnpXd3Y3Rk5adlJLTmE1UGYzYVczd0NOSF96cEd6eWpKcWFaaW9MU0t5a3VyMjQxN29kTXhRV1lqUGRvdlZPOV9rU29GNHpVY1k?oc=5,"Sat, 07 Mar 2026 00:40:48 GMT",BREAKING: Saks Fifth Avenue to close Tysons Galleria store after 38 years FFXnow
Saks Fifth Avenue,Harsimranjeet Singh Ghelani,Closing,Long Island's last Saks Fifth Avenue store to close - Newsday,https://news.google.com/rss/articles/CBMihgFBVV95cUxOS1pxYlFaYUpJdTdyVk52Z1FGYUNOR2JpdmNEb3pWMXhNU2ZGN0lGTVNXQU1pMXFUa29YR3YwaFpPV21YVDRaTG1Yb3pZV1Y3cXB3bXdCR0JUTmNHNHEwdUNXaER1cWRka1R3Y2IyYTNFaWdaXzd3aFJXTnpiaXk4Z09rSmh3Zw?oc=5,"Sat, 07 Mar 2026 00:25:33 GMT",Long Island's last Saks Fifth Avenue store to close Newsday
Saks Fifth Avenue,Harsimranjeet Singh Ghelani,Closing,"15 more Saks Fifth Avenue, Neiman Marcus stores to close – here's the list - KREM",https://news.google.com/rss/articles/CBMi0wFBVV95cUxNMlQ3RXdUbzBXQ0QyY3JxZVVSZ1QwaGVvd0RNdE04a2J5bnJFamRfUGdlNThobG83MlQzWWxIbV9SVVJFXzJsd04xeGp2Mnd1TXJSNUNTbFhIVjlaRTlRNmU0aUFhQkFWQWZST1VNd1ppNFF3TFhSTVlFMEs0ZUh1X29PeTA2QVY0VTFYUktzMnhLSTM2eWltQXpvdWxNVG5aOUJOTGxUakpXb2xWaG9lbW0wMHlsRUlQNjFCanQ4UTRud0lWbk83WHNiUTlGd2lVdjVj?oc=5,"Sat, 07 Mar 2026 00:12:00 GMT","15 more Saks Fifth Avenue, Neiman Marcus stores to close – here's the list KREM"
Saks Fifth Avenue,Harsimranjeet Singh Ghelani,Closing,Luxury Retailer Saks Global Announces 15 Additional Store Closures - Fine Day 102.3,https://news.google.com/rss/articles/CBMiwgFBVV95cUxNZnBrbUE5em9KNm5kSktGYlRGSmlLWW1uaE9kVUVFYlRCTTJ5bTRnOGhjeUVnRTg3azJZUGNfSTdmQ0YwWW5qdmxCZ1dOamFBSzZCeWxqc0Ytbk0wa29oMXF3aWpaLWF6NE50M29STGl0d0RhUVVjZ2pYU0M0QTBCdHEzbi1LOHN2a0FmNy1LaHAzS2I3Mk04b05ncnJJT25DWWxzalU3NENlakIzNXNIMlprTDlaZVk1ZjM4SGZtUDN4UQ?oc=5,"Sat, 07 Mar 2026 00:10:33 GMT",Luxury Retailer Saks Global Announces 15 Additional Store Closures Fine Day 102.3
Saks Fifth Avenue,Harsimranjeet Singh Ghelani,Closing,News | Saks Global to close 15 more stores across US - CoStar,https://news.google.com/rss/articles/CBMijwFBVV95cUxNVm5aSGxLOVF6SGhWVWs3UHBncjQ1VUlzMlNobThGdjJVLVpvbXFHTXgzcHl1WGc3bUpZMjJsUERfN0NBQmNmZGlzZHQ5UUtjcnBPekZ3YmducWZhcHB6ZEItNWRGT0NBaGs3cHNhWFd6aEstTUNBUHVVY2xzX25KQkEza0dHYXVXM1IyWUdzbw?oc=5,"Sat, 07 Mar 2026 00:08:17 GMT",News | Saks Global to close 15 more stores across US CoStar
Saks Fifth Avenue,Harsimranjeet Singh Ghelani,Closing,Saks Global to close 15 more stores. See shuttering locations. - USA Today,https://news.google.com/rss/articles/CBMikAFBVV95cUxQQUtCbjRCbVNqQWxUYThGYnFIRHBkMW1pYU1KSW9IN3k1N0QyNzhoS01sYnJsaXZNN0NCT2FJVFp6a0w5UFZyWXhMaGE0VjlxTHVXb2lFRVBWajNid09vUmlxY2Zkc2haVmdDN1VMWmNxaEMyQ1RzVThaN2ZwNDE5eDdsSWs5NzV4MTFDMWZKcEI?oc=5,"Sat, 07 Mar 2026 00:05:00 GMT",Saks Global to close 15 more stores. See shuttering locations. USA Today
Saks Fifth Avenue,Harsimranjeet Singh Ghelani,Closing,"Saks closing Neiman Marcus anchor at Ala Moana Center, exiting Hawaii market - The Business Journals",https://news.google.com/rss/articles/CBMikwFBVV95cUxOU203aFBsV2psaERhTElEYU9sRGY5MjBiTnN1ejBxVTN3dHRqLWtvaUpGUWNuLWNENElrLUJZQTlBM3dSbHZOMVBMQjR6QzRKX0ZsaUhtUGdhTE5YNlZNRm55VHRQNTE5N0JNRWhqNDZnMHdYbUp4cTZVZkplanNVZG9DT0taNHhheW51Njh2akQwZmM?oc=5,"Fri, 06 Mar 2026 23:44:00 GMT","Saks closing Neiman Marcus anchor at Ala Moana Center, exiting Hawaii market The Business Journals"
Saks Fifth Avenue,Harsimranjeet Singh Ghelani,Closing,Saks Fifth Avenue to shutter Plaza Frontenac store - KMOV,https://news.google.com/rss/articles/CBMikAFBVV95cUxNSi1wOGo1Z0dMNUZZVk1hekUzRTZ0ZGxJSUxkTXYzZXNvTVVhU0FmYzE5eUxzSzA2LVRvOXM1X3o4Q1dyaEhQUHJTb2RwS0h6MTlNeWxiRE5LX3Z2c2JwWWpwYms0NFVLZHJDOXpfdmx6c1RlVDhUbEFmSHBZdXNMNjBHTzc0T2ZQNFc4dXlXZzDSAaQBQVVfeXFMTzZNSWRkYnVPQWh6U2xCNmVoSEZRWTRhcmFEYUVXT1l1SWlaYlh3M2ZQUnpLSWM3MG1mUndOZHJYbUVycVFxVHhSUHpyLUxzMjhWaWJpNWhubFZPOFRtSjY5emt2YWM5bXBtTnZNWWZ5aEhramVFUG1qNlZVNzY1M1N5bE9IV3BkeExPLXA3d0ZsekNhYW5GWnhCdlNTVFdWLVVFWmI?oc=5,"Fri, 06 Mar 2026 23:34:00 GMT",Saks Fifth Avenue to shutter Plaza Frontenac store KMOV
Saks Fifth Avenue,Harsimranjeet Singh Ghelani,Closing,"Saks in St. Louis, Missouri Closing, 65 Workers to Lose Jobs - 101theeagle.com",https://news.google.com/rss/articles/CBMia0FVX3lxTE5PRVdRLVczaV81Q2VtVjB4T3FWaTQycEZHTUo2N0UwUjk5ZWNiYTJUeU84SXJoUG4xVFdFSWZOeHg3c29vUlNDUW1CVXc4OXVacXJuVzJ3a2F2dDl4eDV5QWxkSDd1dl80VUZn?oc=5,"Fri, 06 Mar 2026 23:26:57 GMT","Saks in St. Louis, Missouri Closing, 65 Workers to Lose Jobs 101theeagle.com"
Saks Fifth Avenue,Harsimranjeet Singh Ghelani,Closing,Saks Global to shutter 15 more department stores in bankruptcy restructuring - Messenger-Inquirer,https://news.google.com/rss/articles/CBMijgJBVV95cUxNUXFEdWtMNDVMbzRPWlFvblVCX2FZWlNXaTBZWENGcXBfWHZZR21MSzNSallnVWgySlZ3Q0ZtODhQbzVJMnBtQnJXRmFITUczbFdUcEhKWVFQVlhzdWdqSGJ6X0lNRHVpYkVPbGZUUkl3R19Pcnh0b2lKSm1WeEQxMFJKOU1DWDRxdHFlZm4tTDg0bGp5WWJtSGRxeEpFZHdpTzAyemJxa0hDMGppN0VZNWdNREVBNktqSVlVVWVLOUxPdkF5bUF4LVhhbGptelpjd29MSWhJNXJoZDBjOWVCZWNYempKMnB6WG0tcDR3azR0UGhic0FUNExVSXVOUkplWHY1XzNrY1dsUEs1bWc?oc=5,"Fri, 06 Mar 2026 23:15:47 GMT",Saks Global to shutter 15 more department stores in bankruptcy restructuring Messenger-Inquirer
Saks Fifth Avenue,Harsimranjeet Singh Ghelani,Closing,Saks Global to shutter 15 more department stores in bankruptcy restructuring - The Independent,https://news.google.com/rss/articles/CBMiqgFBVV95cUxOM2Rtd3MtSEgxYXV5V21McEpFUXhsOGxMbDkydEZpLWEwbDZBTzllTk9BRWJ4RU81TXlzOEpaaUx4MGc4cnktNGhKdnI3ZEZLSEUxV3FvTzlBWGRQU0dxalBwQVdGODlmcFBlZmFySjh0UGEyNG8xVzBuMnZNXzJ2SllBOXplZFNmQkdhanJGN016aXhlRW43RHlwZ3MtdzEzSTdDZUlodnBMQQ?oc=5,"Fri, 06 Mar 2026 23:15:00 GMT",Saks Global to shutter 15 more department stores in bankruptcy restructuring The Independent
Saks Fifth Avenue,Harsimranjeet Singh Ghelani,Closing,Saks Fifth Avenue parent closing 15 more stores in bankruptcy — here are the locations - New York Post,https://news.google.com/rss/articles/CBMiwgFBVV95cUxQdGh6ZU0xOEdHMWswOXQzLXp2SjhiLVIyTUk2cG82dGJqU01lWVdaVzV3RHpVTWM1SmJEN3pFOTZTenR4TXh5dTVNdE1zOEVob2FsZ0NvblJIbVZ3QmlMRmFYbzN0VmpyS1lvQ29rcmdWeS1reFJBeWN6YW5pelBUVFNaM3A2X09ieU5NU2NnbVE5Mndqd1R4S254ZXBSTXVhYkhtSGdQbkdLMmpyQk82dTgwZ3pQUjNtTnJ1NDdGelQ1QQ?oc=5,"Fri, 06 Mar 2026 23:13:00 GMT",Saks Fifth Avenue parent closing 15 more stores in bankruptcy — here are the locations New York Post
Saks Fifth Avenue,Harsimranjeet Singh Ghelani,Closing,"Saks Fifth Avenue closing stores in Tysons, Chevy Chase - The Business Journals",https://news.google.com/rss/articles/CBMipwFBVV95cUxOVFJGTnkzZXhYZHQ2WFMyM3dzbDBBa0ZJZjlHWWFaWHhYQ2Z6VlM3MEIyR3V5dmtLT0xuZFNzYlotbXNRSjkyazFjSHRUZ1lKbkJOaTFQaktZRHVZRF9lUXI0d2JxSXdxSGRad2gzWl9NY1duQWZuZElOemwtSGVKZUpmVmtpTWhFc0ZRTHVhOVFDbTEtaU1qeWhpbl9CbjVGd2FselFIRQ?oc=5,"Fri, 06 Mar 2026 23:12:00 GMT","Saks Fifth Avenue closing stores in Tysons, Chevy Chase The Business Journals"
Saks Fifth Avenue,Harsimranjeet Singh Ghelani,Closing,"Saks Global to close more stores, leaving 13 Saks Fifth Avenue locations - Traders Union",https://news.google.com/rss/articles/CBMilgFBVV95cUxOTm9RTlppZUg1VkFka2Z4ZFRoRmgzczBEczRKQlpyY19HamFvQzZ5UHpaUDMtS3RVY3hYNWNGdlpnODdTMnVJdjV0UHgzYUN4bmRRWmxQNm1Xb3lhQzVBVEY2T2t0cTNMbGRINFI5U3VueDJLaGpOS01Wc21ONGZXV1pSb1hUei0yOVNTRVNjWUNoTWFDbkE?oc=5,"Fri, 06 Mar 2026 22:26:08 GMT","Saks Global to close more stores, leaving 13 Saks Fifth Avenue locations Traders Union"
Saks Fifth Avenue,Harsimranjeet Singh Ghelani,Closing,"Saks to shutter additional Neiman Marcus, Fifth Avenue locations in ‘optimization’ bid - Dallas News",https://news.google.com/rss/articles/CBMitgFBVV95cUxQcmZVMFRSV1VFU2M2NXlHazhHNElXU1JjaFVkeENEZ0dCQ3dPbUVSb0ZNa3VFUEF1WEhGWndrd3h0Q1dxeVl3WnI2M3pQTU1MRnc4SlJMUXlEenlMX0h1S0YybFVuN09jYlVmQzIyOWw5LTBPT0hzNkd6MDdHOHBwY2lJV1A2WDJJMXQ0eFNGRFJteE9rZ2hTalNjcjdJdGtpeDFEVGdqQ3JzeVZMZG4zOHB3bzV3dw?oc=5,"Fri, 06 Mar 2026 22:22:59 GMT","Saks to shutter additional Neiman Marcus, Fifth Avenue locations in ‘optimization’ bid Dallas News"
Saks Fifth Avenue,Harsimranjeet Singh Ghelani,Closing,Saks Fifth Avenue Is Shrinking to Half the Number of Stores in Bankruptcy - WSJ,https://news.google.com/rss/articles/CBMipwNBVV95cUxNS2NHZ21yb3dlR281bnNjaGc4dkZzQ3VDVEE4LU1EbkR1OG8tQlNxdVBNTVliRUpxTVEwSGdXcU9tM0JORDJzdUZDNVpzdXZGUkR2Vjh5RlAxXzBxakJzSFc3M2EyMHhLSGV1QVIyci1JYWwtWWMtNjItM0w5WHBxOXlXZTJfWXRsMThTWHlGZ0lJU3JvWlhidnBnY0MzdkVkT3ZRQlpJSlNjRC05T2ZWbjRqb2x2V0pyVEM1NUlLMjIwMFl3eFNiZmVTU2ROSGVNN21VMlNGa1pkQUNLV1EyeHhlQ200ckk5VXF2QVotdVlLQWFHbDZMb3A5Y3NXQWtpNDIyU28zS1RvY1RMLUhER2szU0hKbTNWdnRrWGIwUHZ3YXdJa0tFUFpJVTVhTTZfdXc2Zk1PelRVTXpHcC05amNjSlBmRTVrZ1hSZl9pa09JV2pCMmVtRFM0TEJ3UHBKaktVR2FWb0oyTWg0ZEhrWmRhSUhxdEFPOFBnTFZMS3FxbkRQZTJwS0xQVWZielNFRlZsQ0NXRW9VbURyem0wUjgyWHpGd1k?oc=5,"Fri, 06 Mar 2026 22:19:00 GMT",Saks Fifth Avenue Is Shrinking to Half the Number of Stores in Bankruptcy WSJ
Saks Fifth Avenue,Harsimranjeet Singh Ghelani,Closing,Saks Fifth Avenue closing in St. Louis - Spectrum News,https://news.google.com/rss/articles/CBMinAFBVV95cUxQRXo1dVR4clFVUzJlS2Q5TjgtVjRoYUNNck1lZ01EX2Zza3NSVl85STBHc2N1Y2p2TW9iMFJSN3RrOVRtUWd0dF9XaWlseHptNi0tMGRUZmp2SG1BYWFHMUJmbDFYU0JYOGx5YUVJZnVLR0Z4MjBHQlNLYkNrMkk0TmZEVXB2TzNTZVVlZ3V4N1RNdTNzc1NNUGk2S1E?oc=5,"Fri, 06 Mar 2026 22:09:00 GMT",Saks Fifth Avenue closing in St. Louis Spectrum News
Saks Fifth Avenue,Harsimranjeet Singh Ghelani,Closing,Saks Global to shut 15 more stores as part of restructuring - Reuters,https://news.google.com/rss/articles/CBMipgFBVV95cUxQYnQzN05DZlJ2VlU1UVMtWFdfeWljTjAzcGRXSHhoU1I1Y0NYQjNSdHNTc3lURVZuNXpoTDZPdkZZZVROWVh5d1hNbWZjV25ORGVhZlIzUkI3YzlpX0tVMDFnTHo5T1VaRk8xTEtwNWE3LWg1b0dzVlVram9ndmlvbXNYaFRhR2xKeGRfVm5pUkFTTTdQQzFLZFhYX1V4SkxjSGVTN0Zn?oc=5,"Fri, 06 Mar 2026 21:54:31 GMT",Saks Global to shut 15 more stores as part of restructuring Reuters
Saks Fifth Avenue,Harsimranjeet Singh Ghelani,Closing,Only 13 Saks Fifth Avenue locations will remain after the latest wave of store closures - Business Insider,https://news.google.com/rss/articles/CBMimAFBVV95cUxPQjhCbXJ6OWtJZURiTDNzWi1BT3NnckZKLWR1Wl9sSGVzRjAxeDhZNVF5d0ZvRHQ3bEpJVTg2M0FwRnJaUkh3a195WUlPRnp0dTdWbWdmcFVJS2RQLXAtbE1idmxXM3VGVFF5Vy1oRmFqODJPN1VHMXVNMFNHcU1iUklTeDc5eTlBVVl5UFJHR2RfUmJ6NW5VWA?oc=5,"Fri, 06 Mar 2026 21:42:00 GMT",Only 13 Saks Fifth Avenue locations will remain after the latest wave of store closures Business Insider
Saks Fifth Avenue,Harsimranjeet Singh Ghelani,Closing,"Saks Global reveals more Saks, Neiman store closings — here are the locations - Chain Store Age",https://news.google.com/rss/articles/CBMinAFBVV95cUxNTmFwT0xHN09PNmFLRkpjZ0JiTjJQZmZUS1BXN2kxdTNEeHU4ckV6SV9GbFpEMVUxazlDSF96T25SbFBUb2xHc2J3VjVtN3JfMmJTSG5iY2t4UURqRXBueEI4aERfcW9OS1JZV3hRa2xPUng2NjJpNWhCb2FPTHVuSUxRUnB4M0dNYW5tejVWZVMySGdnYi0za3kyMlU?oc=5,"Fri, 06 Mar 2026 21:06:38 GMT","Saks Global reveals more Saks, Neiman store closings — here are the locations Chain Store Age"
Saks Fifth Avenue,Harsimranjeet Singh Ghelani,Closing,Saks Global Sets Second Wave of Luxury Store Closings - WWD,https://news.google.com/rss/articles/CBMiqgFBVV95cUxPZU5nYUc1NmhVVUJ4dUtaV3I3elIwdk9LaE5OVGlDRnFUN3FKdFVTSVNJS1ZFb040dWNQODBzMDF4R1ZsbVUxOUR6MFpBTkFtdzYtS0VPMmhwemM1T19jakVaUl82aEVRSXh0b3NzcmE2WnJ3X0dOLVRlTDVnZm96aVhDbXBvN1pURnFNeXc5WTZRTUNjcmptWGRHNFJnaDg5aHdmTm9UMm5aUQ?oc=5,"Fri, 06 Mar 2026 21:00:28 GMT",Saks Global Sets Second Wave of Luxury Store Closings WWD
Saks Fifth Avenue,Harsimranjeet Singh Ghelani,Closing,Saks Global Advances Store Portfolio Optimization to Solidify Position as the Premier Luxury Destination and Drive Sustainable Growth - PR Newswire,https://news.google.com/rss/articles/CBMimAJBVV95cUxOdVdybmJRcTBFWVdfbWh4c09EQ0FwaElRemFMMVdDcW1FaTl5QV8wUUhoU09ObTdRNS1jXzg0eEJYbGNiX3VCeXYtcDhqQXlCRjBqYk8xSU1RZjRfYks5d2dGMFdPYTZiMHE2U2w5MU81VVB5VGU5Y1ZQOV93cWtuWno3ci1abVlVV0VGS1U1NGs4S0V4UzRITmpPLTJfaThsU2I4QndwbWZMZXBZczZqNF9DSldDSUJjcjRnT2VhNkZkMElyYmIzREw1WDViRjRqSGZWaWFsU1FRSFQ5NUo4bG9fQWU3TjcxLUZMVjY3SGQ5YjNrY0ZkNG5NWHlQNk1JakNXdHVWUjZUWUwwWWNaVmhGaE1kcWI2?oc=5,"Fri, 06 Mar 2026 20:51:00 GMT",Saks Global Advances Store Portfolio Optimization to Solidify Position as the Premier Luxury Destination and Drive Sustainable Growth PR Newswire
Chevron,Harsimranjeet Singh Ghelani,Closing,California gas prices face pressure amid refinery closures and global unrest - ABC10,https://news.google.com/rss/articles/CBMi7gFBVV95cUxQYktROHpkUHJLUFlTQXNuV3lMNGN0c0lGNlMtbWxsT2dmZTk3X0xsZFNhVDBqQ0F6N2k5YVF1TXR3LXdYOXQyTXJmRktOQmpTbEtWd0pqNTNYS2FjX3NnNkE5QUxISUphRG42cnk4Z0ljSUpfcGVzTC1YakhIbExZOFFDRjF6UDBKamxaVDA0eTJWeUNqQ2FXOXFDUm1CNUNkX2hZRFFYdFB3cnhZS2I3aG9oUFV2aUlDZjBZc09OeDVPMzRpZUNkNHRwTDkzdkc5ZDgxRHJ2d2drbHJSdXI2S1RDc25RUng5dGhfaVV3?oc=5,"Thu, 05 Mar 2026 01:31:00 GMT",California gas prices face pressure amid refinery closures and global unrest ABC10
Albertsons,Kabeer Pandya,Opening,The United Family opens new Albertsons Market location - Mass Market Retailers,https://news.google.com/rss/articles/CBMikAFBVV95cUxQY0c3YjExanZvSE5TSnRzYTBFeXlaVU0zTTc5TDY2T2tyb3FTWWRsUTF5TzBXbjlZWlNkWmtlUzZPQ0o5aHdONGVtWXhOZGJ5MVU5NnppeTMwcjI1WHoycndvcnZTZmlsY25LUnhlNU1xUXVnckhqTnpUVnBLeXEwZWhqTGhaQWpVb3I0eUVsVHI?oc=5,"Fri, 06 Mar 2026 20:34:32 GMT",The United Family opens new Albertsons Market location Mass Market Retailers
Amazon Go,Kabeer Pandya,Opening,Amazon to Convert Fresh and Go Stores into 100 New Whole Foods Locations - AOL.com,https://news.google.com/rss/articles/CBMigAFBVV95cUxQS256ZVBEXy15Unh6QklTTGVJbk96WmsybEMtNFplcmZ0dFNPbnhYdU1OZTJCdFlnSjRCaVBTSkxkaGNBZTVFTzNnWklkNzlieGhzOWdaUmFWTi1iQV9rLWV5VjdYQTRMLUVUTDg0S04wblpEdXduSFRsMVhiTnUzcg?oc=5,"Thu, 05 Mar 2026 04:21:42 GMT",Amazon to Convert Fresh and Go Stores into 100 New Whole Foods Locations AOL.com
Central Market,Kabeer Pandya,Closing,"Taylor Chip plans bankruptcy; Mr. Bill's Fresh Seafood to close stand: Restaurant openings, closures for Feb. 2026 - LancasterOnline",https://news.google.com/rss/articles/CBMirAJBVV95cUxQaXd0eWZNM2c5YzByTDk1bUdvTkdzQWJhZlEtWmdUMWZiQ1pyRkk4amdDeExHQ0loT2p2VDlHWWoyTG40MU9veGRKd05SM0w5M00zUnRNWEZpeTB4dy11NlNBdHpMVXRiSTV3Sm1OZnNrWHFTSEZLT2hLdFFfRlRGc0VMdnhnczdHSS1jMmZOQ0N1SzJOSG1nbXp1dXJRaFhVZ2V4NGE4TjlOTlBiYWk3QnR3VmxTNUMxSm1KQUdZZUtxMDBIRzhHNTM0VUppWVk5R3h0OUVvbnNoZ1RpdUdrX0RCX3JQamd2Q1BrWnF0bmFubGtYQkhlYUdMUEpKQ0FwRklzd1dUQXY4b3F2N2NEQU4zdExWYzdoOWh0MU9HVGRiSkJxZkFKZjJTeVE?oc=5,"Thu, 05 Mar 2026 10:00:00 GMT","Taylor Chip plans bankruptcy; Mr. Bill's Fresh Seafood to close stand: Restaurant openings, closures for Feb. 2026 LancasterOnline"
City Market,Kabeer Pandya,Opening,"A grand opening was held Wednesday, March 4, for Oregon City Market, a new micro-grocer in downtown Oregon City. - OregonLive.com",https://news.google.com/rss/articles/CBMickFVX3lxTE1DTkE2YVgyRWxDMUZkaEdVSmpRYWVLZGVmdWFLRGpfclNMcld1SnYyS2lwc1BydDY3U0NvWHdwSzB2bDV4ZFdKV3RYdEdlbUZJaXllemZLeU1zeldnYmpoUE9KY3gydWRvdW9zV3JnSEF4Zw?oc=5,"Thu, 05 Mar 2026 20:18:59 GMT","A grand opening was held Wednesday, March 4, for Oregon City Market, a new micro-grocer in downtown Oregon City. OregonLive.com"
Harris Teeter,Komal Agrawal,Closing,Grocery chain confirms April closure date as it prepares to lose 60 locations - the-sun.com,https://news.google.com/rss/articles/CBMilAFBVV95cUxQWWJaYXpvMGkwMU9vMS1pNFN4Q2NWV0QwRDV6bHhzczBNRXhWdlZLaENhOVNmR1VOVWx6NlhLQ3RrWTNqRFFJT0NCTW8tbUVkREpnRVZxb1ZBYUpPV3F5cDdEdXM0U2NUQWFxVlRuaDluUXoyUVo3SHk3Ukx6OXhDdGhxYzdsRmU4b1JZdm1wZlVUbWI3?oc=5,"Fri, 06 Mar 2026 12:58:47 GMT",Grocery chain confirms April closure date as it prepares to lose 60 locations the-sun.com
Jay C,Komal Agrawal,Closing,Kroger is closing stores: See the updated list that shows shuttered locations across the country - Fast Company,https://news.google.com/rss/articles/CBMijwFBVV95cUxNT291TzFYczdYMk04RTJaYVRnRTQxQ1g5VE9pX015aldWUDdVMUJFZEVHTEpVdTZtYUxkN0JhcXVKZEhvZjhJMkpzU2dVY2JXN1FLQTdQTXVtYUFwYVNRT1hWSzdDdjFkaE9KMkJhMXVMRm83dnpZTjBtYmM1ZmthbDY0SlZsMWtkeEtWbmtuaw?oc=5,"Fri, 06 Mar 2026 19:36:09 GMT",Kroger is closing stores: See the updated list that shows shuttered locations across the country Fast Company
Joe V's Smart Shop,Moksh Kashyap,Opening,"H-E-B to open 2 new grocery stores in Garland, including Joe V's - AOL.com",https://news.google.com/rss/articles/CBMiZ0FVX3lxTE8zSnNNdkVIUXk1S3g2V3RlQlNJM1FKa0RWUXk1YzVBUFdLR202Sy0wM2l2djcwS1JQRVlBTWRQS3NaTUtwRldxR3Jfbi1IY1BxaHJHc0pvdWg5cHpqb0hHQmIyUUNQRWM?oc=5,"Sat, 07 Mar 2026 04:15:48 GMT","H-E-B to open 2 new grocery stores in Garland, including Joe V's AOL.com"
Kroger,Moksh Kashyap,Closing,Kroger is closing Little Clinic healthcare locations in Indiana - IndyStar,https://news.google.com/rss/articles/CBMi1gFBVV95cUxNUEpZV2FDX0dEQ3VwNnphbTYzWER2MGl5S1UxTXZETmMzSEl4UjdNMmN1YWV0cU1nVXJ6LWRSWExnU3dPb19KTVBSbHpHeUhCd0k4dU9SMHozZmUtenY5cDk4dUhlM1R4NHNjcy1NLV9pM0xJSV9naGRyUG82OXJQSkJ5MDFwSV9iVVZybE1GZkJ5emxoREtFMndvTDc1Y2k2WGZUQWRiSWgwSHhvclZLWFB5OHVTOHpteGgtYmEtd2FIcUtTVlVFRGluWExtQ1hEUi1KS09B?oc=5,"Thu, 05 Mar 2026 18:04:00 GMT",Kroger is closing Little Clinic healthcare locations in Indiana IndyStar
Kroger,Moksh Kashyap,Closing,One of Houston's biggest grocery chains is closing stores. Why? - Chron,https://news.google.com/rss/articles/CBMiiAFBVV95cUxOZkQtX3dqZTlLcHhTMDFDVGpnZFAzNzc2SjBhWjh3UGFDTjQtRTFTSWJ1MUVZU3VZVkRHSVF6SnZuQkZzQ0FYTFQzR21nU1FPbTVnQlJEQlZGUlhwRFY5VkloSlJiVnJwNGMyTU54N2lVT3A2c19TQ2Q5VWx5d3BrVzRSTTJaN2w4?oc=5,"Sat, 07 Mar 2026 11:17:32 GMT",One of Houston's biggest grocery chains is closing stores. Why? Chron
Kroger,Moksh Kashyap,Closing,Kroger is closing stores: See the updated list that shows shuttered locations across the country - Fast Company,https://news.google.com/rss/articles/CBMijwFBVV95cUxNT291TzFYczdYMk04RTJaYVRnRTQxQ1g5VE9pX015aldWUDdVMUJFZEVHTEpVdTZtYUxkN0JhcXVKZEhvZjhJMkpzU2dVY2JXN1FLQTdQTXVtYUFwYVNRT1hWSzdDdjFkaE9KMkJhMXVMRm83dnpZTjBtYmM1ZmthbDY0SlZsMWtkeEtWbmtuaw?oc=5,"Fri, 06 Mar 2026 19:36:09 GMT",Kroger is closing stores: See the updated list that shows shuttered locations across the country Fast Company
