Store,Analyst,Type,Title,Link,Published,Summary
Academy Sports + Outdoors,Ashwin Nair,Opening,"Academy Sports and Outdoors plans up to 25 new stores in 2026, including several in Texas - KHOU",https://news.google.com/rss/articles/CBMi6gFBVV95cUxNYVY1VjZkZDZzeGptLV9qbDdJaFl2U0JXa1dWWlNGQUQxaEtlUmVfVWtXZjlyOHFxSWFlVzhaTC1UcXpvdFZ4bm13WmdYYUttNm14S2hENXhfYVNBRVdxSEN3UVFhZUw4ZWg4ZmxvbFZ1WjBsSXVXQzdEYWNnN05DV0dlc0RVaHNQeHl0N01KOFJWWVJhQk1EMjdzejNSZWE5Y2ZFa01yMnFqcWNjSHQ2RWZEM2pwcWVmOEF6RjI2Mkp1QThtTG5VN211SThOTzc3bXNyMEEyanZSTzlfblNLX0RxOHhNVTk1SGc?oc=5,"Thu, 19 Mar 2026 15:23:00 GMT","Academy Sports and Outdoors plans up to 25 new stores in 2026, including several in Texas KHOU"
Academy Sports + Outdoors,Ashwin Nair,Opening,"Academy Sports and Outdoors plans up to 25 new stores in 2026, including several in Texas - The Business Journals",https://news.google.com/rss/articles/CBMipAFBVV95cUxPUXNlaUZYYUhvczdqNXd6NV83dTNQNTY3Um9YZTJSd1c2NlpiZEhVUm5ueV95ZGJES2hXNl9ULWl5dlplMGxid0N3WTIzV1ZES3JpODVxOTBBZ1ZSdjcxWndLZU1KZUxJaXNCcFpROWxHWHdhMVFwTVE3VmlENTFQX0p1QzFwdm9melNyNGhRbVpHeGVKQlYwdmZXcUcxUDVCNDVtQQ?oc=5,"Thu, 19 Mar 2026 08:00:00 GMT","Academy Sports and Outdoors plans up to 25 new stores in 2026, including several in Texas The Business Journals"
Academy Sports + Outdoors,Ashwin Nair,Closing,A Look At Academy Sports And Outdoors (ASO) Valuation After Recent Share Price Softness - Yahoo Finance,https://news.google.com/rss/articles/CBMingFBVV95cUxQLVZ3Y3dRcUowSmhiSlF3aUl3MjQxNE1ZWWlkWFA0NE42SW9SVm56YzJBYVlsdXRDZU1Gb2VQMGxaYWEwT2ZkRy1QLXEtZ0NlR1pxWU1XUy13UGxxUWVoZ2FFODJnWFZKeUZWUmY3eGFkUEdwTUNWWU5ETFZRS0dZYVZ3UjBTMDVBZ2d4eF9qNFA0QkFoenZvVHpHT3A1UQ?oc=5,"Thu, 19 Mar 2026 05:07:00 GMT",A Look At Academy Sports And Outdoors (ASO) Valuation After Recent Share Price Softness Yahoo Finance
Burlington Stores,Ashwin Nair,Opening,"Burlington Stores announces new location, bringing deals on top brands to Darien, Illinois shoppers this spring! - MSN",https://news.google.com/rss/articles/CBMijANBVV95cUxQWUVQMUF5cEIyeFZfTWlYS3NVSXdlQjZJMC1FUTh0d1Y5LW9aY2hCenQtNTdId0R6TmNvMzE1NmlOdi1pcGJWRGtNT1NMaF9pQlRBV05LNTFPZm9ybUNlbTVWRlZqSzdKUWtxcFpKcVdsZFB4SnlyZ3VZdzdUdjNja3EzZkpvWnBWQ1lhWjZqQjhCV2JmZ2FPenA3S2NXR1FVRlkzcEFqLU9zeHlDZ0FGdVhjR1JaSWRGYm1IRjFJcm5GR3dWTk9fNVV6SmFIdmVWZmkySFB0NDlzN0Z4aG5MYmE4M0trTXFrc2l3cVZ1YW9xTklkWDdCYl96ZWhSc1JOcktCSUkwMjdaYXJMMU1QZ1hoRk1Td2lIcFhqNzlSRWs3ZWFfRUttdWVURlA5VmJkc3BWejgyZkJYTm1aM01ZdXl1TjktYTZwdnBjVm1VMWFxd19CX0lLVDJ4RHFGUmFjV3JVazRpZXA1Uk1pTXlNMURlaTRidVFDS2NYVkJ6ZmlpcThqd2luYzJzdTE?oc=5,"Wed, 18 Mar 2026 14:42:09 GMT","Burlington Stores announces new location, bringing deals on top brands to Darien, Illinois shoppers this spring! MSN"
Burlington Stores,Ashwin Nair,Opening,Burlington opening in Oshkosh this spring will have a new store design - Oshkosh Northwestern,https://news.google.com/rss/articles/CBMi0AFBVV95cUxQY3A3aWJFaHk5SGJfeU5BUnNpY2V2LUtWNnpPanQ2M0J5MDFEZ1phU256d0hwU2ZwYmRBc1VnTVdwSkp5QlQwazY2SlNDUWZjM1Nlb20zcG41S3ZqUGRLY3otMHdYbktZT3Mxa1ZMeEhjbWlaa2U2MWlKMFNEeGRoR0xDbko4YnFpSmVSajlwNXVoOVVmYUY2WWJiWTB1dTAxZFZSbERIWFFOakpJYmlLWmNQdW9qX0Q5Z0RrRGh4QWIwaXlOaVlsbzhVOGFzNFNy?oc=5,"Tue, 17 Mar 2026 16:42:00 GMT",Burlington opening in Oshkosh this spring will have a new store design Oshkosh Northwestern
Burlington Stores,Ashwin Nair,Opening,Discount retailer Burlington to open new store in Avondale - KTAR News 92.3 FM,https://news.google.com/rss/articles/CBMigAFBVV95cUxPaGZCRldZRFBrbDd0QVBTVDVoYWRlbmF6bEs0cXVHOXZqQlg2VE8yQVVGdFE5c3RkZVJwUDhmM3pGMkRCbTlkR3JaWWhQUTlSQjJZakRWY3Frc2FqSWgzZi1jdUNMUmUyOFFkLWktLUJRMi1POXFyWUtISUFRYzVaWA?oc=5,"Thu, 19 Mar 2026 18:12:28 GMT",Discount retailer Burlington to open new store in Avondale KTAR News 92.3 FM
Burlington Stores,Ashwin Nair,Opening,Burlington to open Eau Claire location spring 2026 - WEAU,https://news.google.com/rss/articles/CBMihwFBVV95cUxOVkZEdFA4MGZIUllMOWUxQ1ZXUFRzWGZlaFZYc2VUbnBXZUtWdDR3S3QzamNQZ1pBSTN1ZDFiOGRxV09lM09VT09CYWZQSFlxdUVSZDZxN2tEX2E1Xzk4ZHZabldMU0dzMUR5blVndmdDZ3JzMTFtbVhpSC1CT1g2OGhaY3lyU03SAZsBQVVfeXFMUFhEdFltdERaZzN5aXVXcWJjd3JwSC1pU2twY3ktVUpEQTUzTHRpM3EtLV9taXh5QXlnNFZGMW00UFZnVVpsNExBbWJjTEtMeWZSTU9rTjVZa3h5QnY4NU9Od1ZXWXNNZkl2SkhVc2toM2dnZ2cxMldXaThSRS12eklRR05XNlhwTG5hV2R0X3FqT1RLOXd1aHZwdDg?oc=5,"Thu, 19 Mar 2026 15:42:00 GMT",Burlington to open Eau Claire location spring 2026 WEAU
Dollar Tree,Ashwin Nair,Opening,National discount store chain 'cheaper than Dollar Tree' to open 150 new locations - MSN,https://news.google.com/rss/articles/CBMi5gJBVV95cUxQVlE4X1puZ3B5RTREcnliRzJHWlhpSmFlYlZ1ZmNEb2ZWaFYtcDhLd2NzeHBQdVlQMG5PRVBiTkVUYlM4S09EOVdkcWZEZU9oLS1FcXhjTW1jeGtKV1pxdEV6T0FkS1ZMOTFpUTRZRC1GbUYtd3BhZklsd1hpWmNiSlVGcjFDWTZqT0VfQ050VUxRRDc5SmRRVkJLMTZyQ092ZFZEcVpKU05jblZQbDdxOFlYcUgtMmF4QmdGdGRjZzh1NkhHdmdWeGt4cEhVbnJuVC1HSGNDNjRrNlJMUEdITDYyQnpyczhxUW0tWkgtd0d5d3V4UTF1dnp4WjVSOUpDaEpiek1LQ0t2SFlGNlpESThCcUVQTWJXY3VFYlVPeGhkRWxjLXFySkFqNlBFZDBkOU5kZl9hMnVUUjlNbFNLU3lweXJtY3BDMTFJX3NaYTVkQ2JsMHZJQ1VCUzhnSWt1Z2pweW9R?oc=5,"Wed, 18 Mar 2026 23:12:05 GMT",National discount store chain 'cheaper than Dollar Tree' to open 150 new locations MSN
Dollar Tree,Ashwin Nair,Opening,Are new Dollar Tree stores coming to Ohio? 400 planned in 2026 - Cincinnati Enquirer,https://news.google.com/rss/articles/CBMipgFBVV95cUxPTW5BalBuaFlkSzE3V2xZWk5LYWxYVFVDQTB6RkZkVzA0dDFfbW5Oa1p2ZXdZbThtSnFtWnY5WGZQNGtUOWN2aWg3ZlZ2Yk11YXdLczFWaTdkdVFTMkJZVFNTSXMzUkZYZHpKVGpESS1YcHlvQXJKejBuaGhHWlJxb2NDaVhlZTRkYmxXYUgzSE10V2lXc0dIQnV4ZVA5OGF1alRvU0dB?oc=5,"Tue, 17 Mar 2026 19:06:00 GMT",Are new Dollar Tree stores coming to Ohio? 400 planned in 2026 Cincinnati Enquirer
Dollar Tree,Ashwin Nair,Opening,Dollar Tree confirms 400 new locations to open up in 2026 - The US Sun,https://news.google.com/rss/articles/CBMigwFBVV95cUxNSUNTYzFUY0c5aHpRMmdET25CUHVNMGgyZmwwQUdSQ0F2SEk5T3Z2UExqZU40MDlyR2JuZWZxeFVINmtVRnRPNWFvdVB5a1d4N2s2RktxMlI0bEs4VldzcFVUd2lXSXRsWmhXY2xzeHF4dV9wM3pYTU5RQjFMWDRtUkQtZw?oc=5,"Tue, 17 Mar 2026 13:07:41 GMT",Dollar Tree confirms 400 new locations to open up in 2026 The US Sun
Dollar Tree,Ashwin Nair,Closing,End of the line for 75 Dollar Tree stores as 2026 shutdowns confirmed - The US Sun,https://news.google.com/rss/articles/CBMijAFBVV95cUxObGFuNWJWMlRLNGZXbVJneEJZbEpNaFIwMEJ3NDFKRGRuTzVOMFA0QjVHRE82R1pMazVYZmlINWR1ck14MjBKTkM3X3Q5UzVrcmxZdjJrV0NmenVSNC1kLVJ2TVpLQUZFVnVXMTFmUV9WQ0xCckdBRHI1TVp3b0RxaFl6bjJzUnNWT01vZA?oc=5,"Wed, 18 Mar 2026 15:06:53 GMT",End of the line for 75 Dollar Tree stores as 2026 shutdowns confirmed The US Sun
Dollar Tree,Ashwin Nair,Closing,Are new Dollar Tree stores coming to Ohio? 400 planned in 2026 - Cincinnati Enquirer,https://news.google.com/rss/articles/CBMipgFBVV95cUxPTW5BalBuaFlkSzE3V2xZWk5LYWxYVFVDQTB6RkZkVzA0dDFfbW5Oa1p2ZXdZbThtSnFtWnY5WGZQNGtUOWN2aWg3ZlZ2Yk11YXdLczFWaTdkdVFTMkJZVFNTSXMzUkZYZHpKVGpESS1YcHlvQXJKejBuaGhHWlJxb2NDaVhlZTRkYmxXYUgzSE10V2lXc0dIQnV4ZVA5OGF1alRvU0dB?oc=5,"Tue, 17 Mar 2026 19:06:00 GMT",Are new Dollar Tree stores coming to Ohio? 400 planned in 2026 Cincinnati Enquirer
Publix Super Markets,Ashwin Nair,Opening,"Publix plans to open 55,000-square-foot store as part of mixed-use project - The Business Journals",https://news.google.com/rss/articles/CBMisgFBVV95cUxOam5wVUVrSVdUVVZaMUd6N0doQlpEQTRSOVNVRzVPQnhsZ01KQU1OVGpJWWtaMk15a2FuazdGTTZpMzYzWTkwMXQ2aVlSdmF0QUcxaWcwY1h3eXcza0czMDhLRUp0WVBjNHJ2SURFenk3aVNmQ0ZNT2FTN25tQklncFlSa1o1cF9VZGw4aEw3SDNYc1c3QkhwUExudnduT2xkZURhX18xMVhpbmJvYVpYM3ZB?oc=5,"Wed, 18 Mar 2026 19:11:00 GMT","Publix plans to open 55,000-square-foot store as part of mixed-use project The Business Journals"
Autozone,Komal Agrawal,Closing,'We went to Walmart': Man goes to AutoZone. Then he learns something shocking about Fram - Motor1.com,https://news.google.com/rss/articles/CBMikAFBVV95cUxQc1dpRXdWQWlJbkF6amlGdHBwaHVoMFFCLVFrRjhWTWktaXRwNXd6aV96VGRfUWp6TU04TEh3SGdYYWJJQWg5SFVtRUxacU9oVjRoaUpCLUFrMlB0WnZxM09VZElrZUFJZFhHTUNWZ2w0THBNa3BMSXZvY3B1bzZvald2allMbFRFaEo0X2l0bWo?oc=5,"Thu, 19 Mar 2026 22:00:21 GMT",'We went to Walmart': Man goes to AutoZone. Then he learns something shocking about Fram Motor1.com
Harveys Supermarket,Komal Agrawal,Opening,Winn-Dixie banner: 7 Harveys supermarket locations in Florida and South Georgia - FreshPlaza,https://news.google.com/rss/articles/CBMi0gFBVV95cUxNTjZkZVMtQ0FUR0x2ejlLdGVTRmI3UDhCRlRjbjRJeV9XbGhHbGdnYlI2YUYtZXd6QnVTekw5RHhjc0gzdlJyX3JDVlAwVmpqR3VyQVdaZkxxNkpaaFZkbVhnZWN3MGJrY0dLLUJPXzZxVTZFUFJJbENySVhtS0pIOVN0eEdnaTNSZjY3UmUwQjFURm1WanJhOEhVbkdCcnJiSjBCRERZR3FlUFNBY2xBeWlUUDljakw1X0c0cDZHWGtoTUs1Wl9WQzc2UU1Bd2tTN3c?oc=5,"Tue, 17 Mar 2026 14:13:03 GMT",Winn-Dixie banner: 7 Harveys supermarket locations in Florida and South Georgia FreshPlaza
Jay C,Komal Agrawal,Closing,Major grocery chains are closing stores across the country - see which areas are affected - MSN,https://news.google.com/rss/articles/CBMi2AFBVV95cUxOT0haVlhudXlrekNkOWVRaEdYZGwzUWJlM1VkQlR1cDdnMVN0ekdsc0V3RmtIdlJaRHpRWHllVHlTcW42cC1NXzM0TkFBaVlwSnY3cVVIQzZZV2M1ejEtdFVDNGJ4Ny1nb0h0NzltRXd0WGxJYVphV3AxVWVKcW9OSDNNamdwejUteUo3UEtsVW0tZzVXX0ZZSVR3OVhhd0k0SW1zZDJNNVRkME52R0htUFZrTlAyT0dGWWo4dVNERVhxV2g2N01EXzJNNW1Gd1ZsdE9NaWw3REM?oc=5,"Thu, 19 Mar 2026 04:54:26 GMT",Major grocery chains are closing stores across the country - see which areas are affected MSN
Family Dollar Stores,Rishi Nagar,Closing,End of the road: Beloved Family Dollar warehouse to shut down in August - The US Sun,https://news.google.com/rss/articles/CBMinAFBVV95cUxQajA0R3dyaGYwaVlhUl9JM3Z2SENLZm9UTWVVN2JYWUczRHh0TjRjN1dWMmdvbGJQei0yRkh3c21fcU5fV3hWRHhRbVByT19VU001dldkUExNUi1XNEJ4SmwyV0xRZmJROUFmRjRLdVc3V1E3ZFJxbndFNGNkMkFfS19DSzAyZjctbDQtLUtOcmRKbndFRkVJVW44Zko?oc=5,"Thu, 19 Mar 2026 16:12:25 GMT",End of the road: Beloved Family Dollar warehouse to shut down in August The US Sun
Family Dollar Stores,Rishi Nagar,Closing,373 people losing jobs as Family Dollar distribution center closes in North Carolina - FOX8 WGHP,https://news.google.com/rss/articles/CBMivwFBVV95cUxOVC1lSVh1WEVzd0w3S2haSkFxS1lpSENZMkhXYTJVb3pYRXdFc2dQenNGajlmNlUzS1QycGJIYVQ2RmNvUVZzMTJqZklvS0pZRGNVUjA5NFhMbTJOOGE4dWhFZjNEdWZyelI4ZnQ4TWZidGctcl92NjdCU2ozZmJaTHVGSGhLOXUxNEpIS3lzUmxrYWJOa2lIbWQ5NHpHZllyX253VGg0N2tyVGxvWm5GdnBXLTlmV0xSR3FoSlBUWdIBvwFBVV95cUxOVC1lSVh1WEVzd0w3S2haSkFxS1lpSENZMkhXYTJVb3pYRXdFc2dQenNGajlmNlUzS1QycGJIYVQ2RmNvUVZzMTJqZklvS0pZRGNVUjA5NFhMbTJOOGE4dWhFZjNEdWZyelI4ZnQ4TWZidGctcl92NjdCU2ozZmJaTHVGSGhLOXUxNEpIS3lzUmxrYWJOa2lIbWQ5NHpHZllyX253VGg0N2tyVGxvWm5GdnBXLTlmV0xSR3FoSlBUWQ?oc=5,"Thu, 19 Mar 2026 08:24:36 GMT",373 people losing jobs as Family Dollar distribution center closes in North Carolina FOX8 WGHP
Nordstrom,Rishi Nagar,Closing,Nordstrom Closing at Galleria Dallas - People Newspapers,https://news.google.com/rss/articles/CBMiiAFBVV95cUxNZGczLVE4WDlacmlJWFNxYjNhZUNKVkp1OUJ1MWxKb1V5RDl4dUlEZS1nSlgwckpWZFB5T2lkSnNoRUJuMF9pdHN6VmhNb1JmaUItVWxDb29sNUpZODczNHdjVFFhN2ZjSUtIZUlZd2lvOGptWGZvb2duenFRX0ZFSHZXRFlJMmlB?oc=5,"Wed, 18 Mar 2026 20:32:07 GMT",Nordstrom Closing at Galleria Dallas People Newspapers
Nordstrom,Rishi Nagar,Closing,Nordstrom at Galleria Dallas will close in May - FOX 4 News Dallas-Fort Worth,https://news.google.com/rss/articles/CBMiekFVX3lxTE9Qb3FBc0NMNzF4YU5Db0pZbUM3RGVzaElNb1ZocnBpODFYeE5JY3pMSFlhdHhsZHhiaHNxMHBvbGtOQ2RYU0RKUy1EZ2RCSUQ4Vkp5VThsNlo0Nm5fVm16WDBjLXF5TTdIRm9rQnRUWkt0UUM0QUxsQkNB0gF_QVVfeXFMUDhFYmZHeFdMY3N6bEk1Q29hbHNpSGNHcU80dFpNS05jOHBjRXRvcmozV2RHOE45Rk95dDhMSURqb25WcDhtbC00NEdPb1R2c3pUVzRzX0FNQ29MSzNDSHBzTnJrWmpMSndhMkFGaUkyQ1I1SFhYaWRobVZUQWllRQ?oc=5,"Wed, 18 Mar 2026 17:54:08 GMT",Nordstrom at Galleria Dallas will close in May FOX 4 News Dallas-Fort Worth
Nordstrom,Rishi Nagar,Closing,Nordstrom closing 2 stores by end of summer: See where - AOL.com,https://news.google.com/rss/articles/CBMic0FVX3lxTE1MaWl1bWRxajhkTFk3VFNKU05DNXdEWHFoNmxEaEFaMVlVZFpwZS1GeEFxR0s1NXVFcXJaVkpDeXRGUDhWbjUtaGR4WW9LbkU4N1gyQ3F4SE5XX1ZBQU9wUGFQaUVUMVdhUTk4M3Zzei1td1U?oc=5,"Wed, 18 Mar 2026 15:40:58 GMT",Nordstrom closing 2 stores by end of summer: See where AOL.com
Nordstrom,Rishi Nagar,Closing,Major department store at Galleria Dallas to close this spring - CultureMap Dallas,https://news.google.com/rss/articles/CBMiekFVX3lxTE9qcXU5bXQyWl9DNXpyX0tMWGJzUlJWT3VPN29teThwNTAxTV9IY01HRVVZRjZkS2t0cWREdVdZdDBKZUZ2dXBqbkREWFllaV9zeFRPTWVEYUh4V0x5WDZGN3hoQ2phRVR0NFkwX2NJVzFQRUZUdldsZS1R?oc=5,"Wed, 18 Mar 2026 14:43:00 GMT",Major department store at Galleria Dallas to close this spring CultureMap Dallas
Nordstrom,Rishi Nagar,Closing,"Nordstrom at Galleria Dallas closing, department store chain confirms - WFAA",https://news.google.com/rss/articles/CBMi3gFBVV95cUxNUHVVM19FZFpkWVREY2lnRnN6bU50c0JwNXVQYkhTcC1xaHNuVGdRWnR5VWZld1I0NVlXbm1oaXI3U0t0VTlFTWVIVUJQbTRKT1d2NjlsaEhXSk5PNVQxMXBudUlyYl9fbUZ3c2VkOWEzUXdjWmhYa05hNXBxWU9DMHM3UHMxX0RrZjhGcnNTR3VUT2p1R1dzLXdkZVRsWGtiLXU4RTEwazcydnM3cUctcjRXX0YyR2pKZzRBLUdkc2tqVUUyYnN2VFJzZVdjOEpLTmJySW9HN1hJSnRMNnc?oc=5,"Wed, 18 Mar 2026 02:29:00 GMT","Nordstrom at Galleria Dallas closing, department store chain confirms WFAA"
Nordstrom,Rishi Nagar,Closing,End of an era as iconic retailer abandons Dallas Galleria - Chron,https://news.google.com/rss/articles/CBMiiAFBVV95cUxQZHZySkFMNmNCNERUeEIxTHZRY0traXFxUVBGZjBvOXk4NnVEQU02SHFEMjlDekZfY2hDUU5MSWZGUnNnN1J3dVZHclN0N054ZEVBR0pnTnY0NFdLWldTMDFwZE9oLWZsWlZFNHhVVDEzX0kza0dCLUNJbXAzRWl0cEN6RkZKdXct?oc=5,"Thu, 19 Mar 2026 15:34:13 GMT",End of an era as iconic retailer abandons Dallas Galleria Chron
Kohl's,Bhavesh Phulwani,Opening,Kohl’s mulls new store openings in 2026 after turning around its financial outlook - AOL.com,https://news.google.com/rss/articles/CBMif0FVX3lxTE5xWDRIQ3phdzhlTjQ3OWo5Umc4em8xVkR2UmVEaTJBMXVsT2JveTFVSzBGT1NtWk1HN0psU19KdGZwRWZLS2ZhdEpzM2N1ZGcyLTg0Z1JhWGlfTDJKTGcxTk5pcVJfVjVaLURreHdPQy0zdkpMWlpKQ050Ymx6ZVE?oc=5,"Tue, 17 Mar 2026 19:58:05 GMT",Kohl’s mulls new store openings in 2026 after turning around its financial outlook AOL.com
Kohl's,Bhavesh Phulwani,Closing,Major Department Store Shares New Update After Closing Dozens of Stores - Parade,https://news.google.com/rss/articles/CBMickFVX3lxTE1Qejhyem1WNXdCMnk0U3JIU0NHQnljWFBJTUE4b0pfaDdseS1zOUdZYWRfTHdYYmI4dzhidFFCWFI5Z3E2OGVJOTZZVERBaWl6bVpzV3cySk8xaUZkYWxHMjVJb3JkQmtQOXBYQmU3T0puUQ?oc=5,"Wed, 18 Mar 2026 22:42:14 GMT",Major Department Store Shares New Update After Closing Dozens of Stores Parade
Kohl's,Bhavesh Phulwani,Closing,"Kohl’s CEO reveals big decision on closing stores after 2025 shutdowns, sales drop - New York Post",https://news.google.com/rss/articles/CBMivAFBVV95cUxPelEwclRSUkQ3MGpCeHJIN1ZueXRIZ1UzSmd1bGZuT2VvcnhMTE9lazFMS0pISFBMTG1Ld1VhR2xqQndPSm5SWEw2b2tCX3BmQkF0M1plNE9PN0tjUnVDbjR4SXp2dklnaEtMN0Nqc2tKRjFrenRtQkRqWXZMNjNjRldWM0NPNDFtWVRoOTg3QjFubk5EclBUaTcxVmhtOHhseFJ4eUNEdzR3RGpGbG9GSXZTNEdTcmZ5dG50dg?oc=5,"Wed, 18 Mar 2026 20:28:00 GMT","Kohl’s CEO reveals big decision on closing stores after 2025 shutdowns, sales drop New York Post"
Kohl's,Bhavesh Phulwani,Closing,Kohl's sets the record straight on future of all stores and closure decision - The US Sun,https://news.google.com/rss/articles/CBMijAFBVV95cUxQb0ZxZy12YlIxaklRMzBzaGZTUmR5cVkyRUdjRmZMSDk5YlNfdXhGd1A5ekFaUzhFSGZZTFFCNXdMSUtfNG1nYTJ6UzN6bUNyTmE0Tk9ZTF9GM2JUczlDV29NdnAxaXJBY19Jb0lJdXlOR3l3ZnlEY2dPR3ZyR21BdjAyczNtUEprUXNCVQ?oc=5,"Wed, 18 Mar 2026 19:16:30 GMT",Kohl's sets the record straight on future of all stores and closure decision The US Sun
Kohl's,Bhavesh Phulwani,Closing,Is Kohl's closing more stores? Here's what we know. - USA Today,https://news.google.com/rss/articles/CBMiiAFBVV95cUxOMmtsWHZLOXFoTTJ0Zy10T3pULWJuUk1uN2VSSzBobGRvYTdjWUhLdFJWclFhcDgycU1hRkRHaml6SjE5ZzJCT1FmUjhjUW1NcjVvNmhyLUd2UG16Z1VCNFhRUW1KM2Ixb3IwS1JjSEp3RlMtSEJ2TjdxallLOHVnU1QwZzh0U2pt?oc=5,"Wed, 18 Mar 2026 19:10:00 GMT",Is Kohl's closing more stores? Here's what we know. USA Today
Kohl's,Bhavesh Phulwani,Closing,Kohl's CEO gives update on store closures - Newsday,https://news.google.com/rss/articles/CBMidkFVX3lxTFBXdFE4V2VaazhKZUR3RnFHMW1LSzdObFdHc0o1N2pyQk1WYlBKaVVZR3FUTUNOYXRraDFZeHg0OXdGbzhJNXdkNGdsWnV2dkRiV0NPUmhIb0xtWFMzMzZXU2RGZTFmRVhoZnNlWXlSQzNJQWh3d1E?oc=5,"Wed, 18 Mar 2026 16:44:57 GMT",Kohl's CEO gives update on store closures Newsday
Kohl's,Bhavesh Phulwani,Closing,Is Kohl's going out of business? What to know about Michigan closures - Detroit Free Press,https://news.google.com/rss/articles/CBMitAFBVV95cUxNSXdxMWpQMFZyUlBIQzZxM09vcDl6bFJVTlpJQzBLVnF5MW9pVmYwZzlzTTI5M1BYUmtPWmktNTFFRDNzQ1Y3Qnc2LTByVEtQbU81M3pDQUxQS1k2T1EyTGxlSTU2UXRUdUdDU0VtZVBJTXBLNHhUc1NJenc5YmRrck5oVVRCeUY5Y201OEZ3RXRLNHpCZ29GZkpZLU1lVnBvcWZQUFZfV1Nnb01tRnZRYW1XSng?oc=5,"Wed, 18 Mar 2026 14:20:39 GMT",Is Kohl's going out of business? What to know about Michigan closures Detroit Free Press
Kohl's,Bhavesh Phulwani,Closing,Kohl’s stores closing update: CEO reveals what happens next after dozens of locations shuttered last year - Fast Company,https://news.google.com/rss/articles/CBMilgFBVV95cUxOUDJNLVFyY291bUx2c05ySmowUVdTVG9JcjNVRkVLM0NPNzhWMGFpWkdMSzBuYVJRYklFQkJWd0RJR1dhLUc0QW1HOC10eVQydnV1aHpUWVMzakNyTm1jNklWMVJRWVg1a0pNQWxSN3B4Xy1VT0ZlckRIcUs0WFo3cGtUeWpITTNnYl9sWXJ0djNvclFQbmc?oc=5,"Wed, 18 Mar 2026 11:56:43 GMT",Kohl’s stores closing update: CEO reveals what happens next after dozens of locations shuttered last year Fast Company
Kohl's,Bhavesh Phulwani,Closing,"KSS Stock Today, March 18: Kohl’s Pauses Closures, Eyes 2026 Openings - Meyka",https://news.google.com/rss/articles/CBMimgFBVV95cUxPbmtCRTVJTWw4UTlPbzc0M2FTeDY1NmVVYWltbmtQbmtobm9vd01lLUFwMDlWRG5sQ0l4RVl0QS1EbXVnMTVNTG83dF92eV91WTVJcjIwM0JEVEcxSFhLcGhhM3VEcEctdXhmVjVMbUJKZW5RRE9GelpRRXkweHI5WnltSUdoc3NGaGt1UjlKQk9wX2oxQWIyZ0RR?oc=5,"Wed, 18 Mar 2026 07:33:08 GMT","KSS Stock Today, March 18: Kohl’s Pauses Closures, Eyes 2026 Openings Meyka"
Kohl's,Bhavesh Phulwani,Closing,"Kohl’s halts closures, eyes cautious 2026 growth - MSN",https://news.google.com/rss/articles/CBMi4wFBVV95cUxOaFVJUTZSUjNCU0t4VS13RURDVWpyX0tVRk1HMXpxanphRy1lNE9HRkxMazZnRHRlZkpPTTNZOHZmdW5tUXhpR1JlcmNOVlZCMlB1SHdmZVVkWlBHYk1WQzR5NVpiSzR4RXBMTkxJR2RqajdzaEhhTXBBbFJBYnJvM3BDaEd4bENJSGVmeWNldU1iTmhrdUZ2Z0oweWgycVdfU0RUWk1FRUF2ZzlMSTlGSUdad2k4RVdSTEdZMWZ6ZmUwY1ptNVlZbXR3UzlsOHV3YUJuZk1Ja2lXaENwYUxTajdlbw?oc=5,"Wed, 18 Mar 2026 00:14:37 GMT","Kohl’s halts closures, eyes cautious 2026 growth MSN"
Kohl's,Bhavesh Phulwani,Closing,"Beloved Retailer With 1,150 Locations Announces Major Decision on Closing Stores - Men's Journal",https://news.google.com/rss/articles/CBMijwFBVV95cUxOQi1yQTJBdzM3Y28wd3J0Rm9qRVhTREpNQTdaR1NrdUs1QS05YTR4NXN1T3NULThyTmE3ZVNITWlva0ZCV21DcnFLRkNCSGYtZTQwV1FQbjY2TUlsZDlLY1FZWEx3OGU3NkdVdDNUQzFzT0lSSHhSd054dGd3Z3hMVlBzR2hNWXMzVTJKNGNTbw?oc=5,"Tue, 17 Mar 2026 23:48:02 GMT","Beloved Retailer With 1,150 Locations Announces Major Decision on Closing Stores Men's Journal"
Kohl's,Bhavesh Phulwani,Closing,Is Kohl’s Closing More Stores in 2026? CEO Gives Update - Newsweek,https://news.google.com/rss/articles/CBMihgFBVV95cUxOal9ZUWctYm1lTW1Sd1JmU21ORU9jOWNJVzY3Z3lPQkk3ZmZ5cFRWZ3cwam9VeHo0MGxGcUhwakRHMmZIdG44dWFqcWlnMy02ejF1UnZkWWliN0wtclNDMXp2ci03ZDhnb0htXzB6bzJ5VEM3RjhYTkRvOG40eVh2aDRSMkx4QQ?oc=5,"Tue, 17 Mar 2026 22:11:00 GMT",Is Kohl’s Closing More Stores in 2026? CEO Gives Update Newsweek
Kohl's,Bhavesh Phulwani,Closing,Kohl's store reaches the end of the road and closes down - days after confirming all sales are final - The US Sun,https://news.google.com/rss/articles/CBMihgFBVV95cUxOYmllUmlGbjVXQUVWS19sTml1OTBVa3Q4dnJpTHh1b0RBaUJsSFZXNF9vNUlqRTlhUFhUZmNnRVlzUHpIU243TnRBSU1fR3pWRFV3eXlmR1plU3VmSjJpY2VmbWI5OW9salNYSUFZejV3SWZCdXZNRmpXWktTeDI4ZUFRMnZvQQ?oc=5,"Tue, 17 Mar 2026 17:24:36 GMT",Kohl's store reaches the end of the road and closes down - days after confirming all sales are final The US Sun
Kohl's,Bhavesh Phulwani,Closing,"Kohl's improved performance means no store closings, openings expected - Milwaukee Journal Sentinel",https://news.google.com/rss/articles/CBMi0AFBVV95cUxQNy03bEU1WktOQ1dJT2owbHZZOWQ4LTQ1RXdUbGwzUENhT0twVWh5R0U0MnM4WUZFV1pWUTJsTXIyZXp6a1JKT1JJc3Z0MXktZTZJa2MzWHoydFAtenZoZ2JVSnpLNmZDTDNSdWRnMGJUaFcwaWFkMzYzOGhZYnNQejhORll3LThUdnJ0M3d3dThQNWlmM1FqM0R4bDRkT0lTMHNjaktGdC1IZVVoSDNQSDZnZ3dLZTQ0dEpLekpuenA2LUJXQmFLNGFKMFNtMFZj?oc=5,"Tue, 17 Mar 2026 01:24:00 GMT","Kohl's improved performance means no store closings, openings expected Milwaukee Journal Sentinel"
Kohl's,Bhavesh Phulwani,Closing,Kohl’s CEO signals what's next for stores after several closures - Fox Business,https://news.google.com/rss/articles/CBMimgFBVV95cUxNemR4aVBKSmdJTzUtSU9RVlJ6YjJ2MXBCLWZ5Y0Y0aEpHeXVZVk55YXZ4MnJ2aTR1WFRQMzJJWWZkU2hFT05WdVBiZ1FRckEwNmdtcVhfdDdSVkxyLVd0V2Ffa2dNSERvWndScUwzNFoxS1hFa3V5UXdBZnlHcUlBZnV3ai0xbVo0dmoyQm5mNE9sOERZTHB6NmJn0gGfAUFVX3lxTE01M1NQanF1TnBQS1BQYkpJdUU0ZGItTVlBNTJMYVhQZXphZE1LMkxNYS0wOXd0dkVQU0FublNGWDVFeTBzREFiUi1reWRQR05BdnlSdFNLZEdCX2Q3WXRpeENMdVJqUElyT05PSTZGeHRmN3RSamxfSjVkTEkwSGd0UTIybFhBZ250d1VQQWh5VlZOMEtLSjJDUUxxcFpGWQ?oc=5,"Thu, 19 Mar 2026 17:14:00 GMT",Kohl’s CEO signals what's next for stores after several closures Fox Business
Kohl's,Bhavesh Phulwani,Closing,Kohl's CEO Michael Bender Rules Out Widespread Store Closures in 2026 - International Business Times,https://news.google.com/rss/articles/CBMingFBVV95cUxOTU90NGE3V2xpQkxtTHExUENGVTRjVkxJOWZ2aFQyR1ZwNzVmYTFSOENkQ3JWSXdWSnhsRHBFcXdYWEZFX2V0UVJfTEhXMVVmbmpXR3dfMUdrbmJTSWI5d3d2dWlzcS1wSUp5TlVSWkJkYVFfdWlpX1RIYVFDeE5VR1pFcDFHZ29vWWhqRmYwS3NKM1l0N21pNnEzVXkxdw?oc=5,"Thu, 19 Mar 2026 11:40:45 GMT",Kohl's CEO Michael Bender Rules Out Widespread Store Closures in 2026 International Business Times
Kohl's,Bhavesh Phulwani,Closing,"No 'grand plan' to close more Kohl's, CEO says - Courier-Post",https://news.google.com/rss/articles/CBMiiAJBVV95cUxNandyTkpDUjdSNTE3eEh5RmdZZ3JSR2ozMUFnSUJfZmJuVEJEY3ZlVjBYLXlTYUZNaWk0UFd1ZUNhdjkwbFVzdVR4bndXaEdUcElwbDNseU1VQ0ljblNsSUVnLTNrMzlTQ29nSzVSU2k2RUh6RzA5NEN3N09COXZUbVk5MlI4c19fVWtNZWxZSXNHQk43WU5JakFaRjcxdjdnMl85NGVwTHNpOHRFaHZYMUhOaTE5ZEJZWlVQYktUNS01NG5wem1kbDh2QkpFOGkzSmp1QUNIaDBTMnNpX0M4VjU5d25vMk5UYldaSUxfVU50Ym5kU3l5UXRjTHcya2xEWFlfWHJqOHk?oc=5,"Thu, 19 Mar 2026 10:05:00 GMT","No 'grand plan' to close more Kohl's, CEO says Courier-Post"
Kohl's,Bhavesh Phulwani,Closing,Is Kohl's Closing More Locations? Here's What To Know - Blavity News,https://news.google.com/rss/articles/CBMiekFVX3lxTE1qcldiWnlPdWZNZGVEVThQUkRXcUNfZk4tcmRXTm5OSFpjOC1aME9ubVNLN0dPUWttNnZBb2JWeklpUERzaHFoUWFEZmtUYS1YMzBfYlo3cmV4VkRLMHhFOUx4cGNhQUhxLUlpeFZ5RGZGanFEN09oYUpR?oc=5,"Thu, 19 Mar 2026 06:50:26 GMT",Is Kohl's Closing More Locations? Here's What To Know Blavity News
Kohl's,Bhavesh Phulwani,Closing,Kohl’s halts closures despite sales drop - MSN,https://news.google.com/rss/articles/CBMi2gFBVV95cUxNNDAxNFlYd1paUmF3d0hUajVkazF1OGs4RVNBYzEybUo4dGVmdXFRQU05enV6WEdYeFFjMjB0RDdUaEw3cDZyLVNIS2NUY2pWTFV0akh6UTdtR0RQdmhoS21fNFdnWl9GcVA0a3VRMG5Ra3Y2dWFiLVJQb21pT3dQaXJaMWJzOWtJWVFpRHNMQ3prYV80OWdhM25FWkluX011Wkk1Mnpvd2pwRkItNTlOQkNrNEFQTDV0UmhCTHpzNE8xS2RCYXRVZ3oyZjdEZzhMcXliWXJlT05aZw?oc=5,"Thu, 19 Mar 2026 05:25:41 GMT",Kohl’s halts closures despite sales drop MSN
Marshalls,Bhavesh Phulwani,Opening,Alleged attempted break-in at Marshall’s Country Store - Franklin County Now,https://news.google.com/rss/articles/CBMinAFBVV95cUxQek5Ia19hZDhMR2w4eDFzN1ZKWmdiSnRNbTdTMmtpWV93czllQ19kdUVQVXVJVk1QLUtXT21tUzVMc09lUEhoQ283Q1ZWUlk3VkZKVlBVRV91SzBYN2R0eE5jc1p1S2plTUlpdHFRZkhSNE9kMmFMYzMwUVpRVlFmZE1nVFpaMDIzRXR5VFY5ZUt6RVN4eFlhSDdXa3U?oc=5,"Tue, 17 Mar 2026 11:58:11 GMT",Alleged attempted break-in at Marshall’s Country Store Franklin County Now
Meijer,Bhavesh Phulwani,Opening,New Meijer store in Rochester Hills set to open in May - Detroit Free Press,https://news.google.com/rss/articles/CBMitAFBVV95cUxPVDg1d0Z2VlBtTVZNbklwYVdMT3hnYXgxVnR6UUxKZGhtVGJZMHh3Snp0MDJYUVI2bDNDcUgtLUdWZzd5SnFVblRodTV4NVgwb3NoN1ZERW5hUlRZaUhLU3dJOE5UUHUxbmZPcklrLWJnQXlaUTdDNzdzM2thODNfZXNueHVoMzE2Y1piZHhPRWFfN25XdkV2NXZqM19zMTNIQlFYNm5kWU42RGVGb1RMcmNpN00?oc=5,"Wed, 18 Mar 2026 19:54:00 GMT",New Meijer store in Rochester Hills set to open in May Detroit Free Press
Meijer,Bhavesh Phulwani,Opening,Meijer Grocery to open in Rochester Hills - The Oakland Press,https://news.google.com/rss/articles/CBMijgFBVV95cUxNeGhjU1d4VWpuMm1wVHFHX0hhdEpodjhLR2xINlp2TERlSmVUXzZSWjYycmYzeHBic3ZmeGtoNEJqSmxLeHZvSDdUZzdiLVlqa3F1UE1qV0ptd3ZhRno5MkNGcHNKTmIwYTVsWXgzNlRZbGZQZDBDcnlYLS12UWFndnZWWDlheFZ4SWJSVGNB?oc=5,"Wed, 18 Mar 2026 15:36:20 GMT",Meijer Grocery to open in Rochester Hills The Oakland Press
Meijer,Bhavesh Phulwani,Opening,Grocery chain hailed as ‘superior to Walmart’ sets May 6 opening for new store - The US Sun,https://news.google.com/rss/articles/CBMijgFBVV95cUxOaDFKWlF6Q2JmZ21YelpUN29yRFM0QUx5MVFNTVUtZXZlVWczQjNzYnUwdnRvSHpYTjhYNEdCUl9mV1k2dW50Y3pkZmpvNi1TenVFVnlVa2ktdEp1WWI1U19pSHZtNEk1QkV2SU1JYnBxVW5KdGlYd0ltOUFCRVRHRjQxRTd5dG1GZW1pUzln?oc=5,"Tue, 17 Mar 2026 17:23:07 GMT",Grocery chain hailed as ‘superior to Walmart’ sets May 6 opening for new store The US Sun
O'Reilly Auto Parts,Bhavesh Phulwani,Opening,Timpson’s O’Reilly holds grand opening ribbon cutting - Center Light and Champion,https://news.google.com/rss/articles/CBMikwFBVV95cUxQaXdhWHRnWHMyX0N2Ym5oSnN6R0xsbE5rUWMwYXJyYWN6Tk9YNnoxSzlDUGprcUFqZS16YnE1SjZkaFd4YzNTS3Zid2JVSUZjTzVRdkxDcDNFUTdxeVJDZkNtNzR6dUhfRWZURWhOTXY1aW1udEFzd2cxT1ZaZjBENDZnZ1dqRW5GZ3NXSER2M0liQVU?oc=5,"Thu, 19 Mar 2026 10:53:19 GMT",Timpson’s O’Reilly holds grand opening ribbon cutting Center Light and Champion
REI,Dhiraj Manghani,Closing,The Real Reason REI Is Closing Some Stores In 2026 - AOL.com,https://news.google.com/rss/articles/CBMigAFBVV95cUxPblBVSG5lTWNGSUY5RlVENkVPUm5PWDFocU5Jbmcta3F0VFRTQnJUWWtaS05jZkgxODF6R1VwU1BXUlBGeGxfZFF1cmx6SG54ak9zLTZaZTh3RERDQ3ZTb056Rk53bzEydDBPaVp6STZPUHZxN3cya3IwUHk1eWNBdw?oc=5,"Thu, 19 Mar 2026 19:09:20 GMT",The Real Reason REI Is Closing Some Stores In 2026 AOL.com
