Store,Analyst,Type,Title,Link,Published,Summary
Papa John's,Vishwas Shah,Opening,Popular national pizza chain to open second Onondaga County shop in Cicero - Syracuse.com,https://news.google.com/rss/articles/CBMiwgFBVV95cUxORU5KZVM3Z2xNc0N6NzNWVVJjWWNHUXZvTTZRMmRyN3RhZktrNjdoTjNNaGtpUkZJWnpiZ2lHaEwtby1zRFNSZG1lZC1Qc1pNM1RaMnJJTGttTl9nc2ZQRXJZQTVSejctSG93SVliLTdwYWctSW01R01rWnlnazdVVDdmTUVpeUtsU1ZjWWd2cjlBc0p1TXd0N3g3a3dRaUMtYnljRjd2M0QwWndqNzBERTh5b21QVnlGcVZaXzVlYVptZw?oc=5,"Fri, 13 Mar 2026 19:14:00 GMT",Popular national pizza chain to open second Onondaga County shop in Cicero Syracuse.com
Papa John's,Vishwas Shah,Closing,Papa John's closing 300 restaurants as U.S. pizza sales slump - AOL.com,https://news.google.com/rss/articles/CBMif0FVX3lxTE95eE1lUGpSQjZZZTNSbUVVcEo4ZUctQXlDOXpHUmxCb1pWaTNrUEdaZjlFQnl1R3ZOcEgwYTh5ZnpENWJkTDBjaC1PcjBWRzJNamV6MWdwZFd2MmhiYnRRc0JjTmpWZlV6RlprNDF6Q3NLUTl2eDl2b0NhYmlIbFU?oc=5,"Thu, 12 Mar 2026 00:00:43 GMT",Papa John's closing 300 restaurants as U.S. pizza sales slump AOL.com
Papa John's,Vishwas Shah,Closing,Papa John’s Plans to Close 300 U.S. Locations by 2027 - AOL.com,https://news.google.com/rss/articles/CBMieEFVX3lxTE9HdkMwTkJ3SWM4UHFQR21ZbnU4US04RGxnajFrOXF6SHR2Mzl6QTAtV21xODFlM1pwcmtXMkZacnZKbVNnX21ZUW54c1BzUHhDeVBBbThreDJvZk1EMS1Gb1N1WGwzbHJ4UXlUcHdISG91S0VoZHI0UA?oc=5,"Sat, 14 Mar 2026 11:33:27 GMT",Papa John’s Plans to Close 300 U.S. Locations by 2027 AOL.com
Papa John's,Vishwas Shah,Closing,Papa Johns is closing hundreds of locations - MSN,https://news.google.com/rss/articles/CBMingFBVV95cUxQeTVhbkp0Yy1QWnp4NDNMVTh3MnFvME9wa0hRYUt0WG9LeTZPZGdia2ZBdFZQOHF6czZHTkgtOEhZU3ptY1huZFRqTHMwZXZfQS0yWWRkSkgyZ0FfeHlIY2VKLVBTc1FQRkkxeE9zcDBGblg3RzJSLWktSWd0LTdWNWw1UU9oTDBzVVZXRkJBZHRFN25JSi1BN3BVMjRkdw?oc=5,"Sat, 14 Mar 2026 01:27:04 GMT",Papa Johns is closing hundreds of locations MSN
Papa John's,Vishwas Shah,Closing,What does closing 300 Papa John’s restaurants mean for prices and delivery? - MSN,https://news.google.com/rss/articles/CBMi2wFBVV95cUxPTk9jZGFDTEFaajZoQUJWQ21EdkdtNF80Z3VGVlA4Mjd6YWZJcXY5eEhQTXNUYWZ1cGtLWFFGMEJPUXlTZDVpM1dzREFkQzVtSWxyUnNPVmhUYjNOZmpMQTQ4RFdZdWpJMVM3XzFyZWhfRkVtX1ZBTV9hdTRkS1BvdWVtRTRBS0JUT0ZJaHZHd2VqdjEwYUNXb05oOXNST0wzekJialZnSk9FLWVPMnE2aFNsVDM1WnhfQ1VTa3RidXRzUEhLbVBmWTFYZHcwbC01REZVRjFqMnBVWFE?oc=5,"Fri, 13 Mar 2026 15:53:46 GMT",What does closing 300 Papa John’s restaurants mean for prices and delivery? MSN
ULTA Beauty,Kashish Kasar,Closing,Ulta Beauty shares plummet on mixed earnings - CNBC,https://news.google.com/rss/articles/CBMikAFBVV95cUxNdlI4QjV3UkpncktYSGlaN24xZF91SlpGc0RweUYwd0hISVJzVGtPR3NQSVA5OUZHdG1ZaF9tUUpwTTQwVzc3aVlIelZNbTFhd2VMV3ZjY3B3em9ubllpbHBETGp6b0sxdzAzZ2Z5a19TaE03ZFdrV3BlNEwxTjRYWHQ1S2tPblQ2TFNCODNyaHY?oc=5,"Thu, 12 Mar 2026 20:38:00 GMT",Ulta Beauty shares plummet on mixed earnings CNBC
El Super,Kashish Kasar,Closing,The only Food4Less in Inglewood is closing for good and advocates say the closure will increase food insecurity - LA Local,https://news.google.com/rss/articles/CBMikwFBVV95cUxNSzlGVlV4dHFwdDBTdFlPdDRYdFd4YUF0MDh1NUhuOWN5SF9Ua2xfWGhDWUZEU3lZXzZoeklVZFBHZERpVDl1WkU3ZDZJZVN1YWNpdW53VTFGTlkwbkpkSUFjQW1jRGJBaEpHcDg2LXRVUkVVT1dDbWd0aU9QWEVNb1RsZUgwRE5Vcm9BZTRnbGRmd1E?oc=5,"Fri, 13 Mar 2026 15:00:00 GMT",The only Food4Less in Inglewood is closing for good and advocates say the closure will increase food insecurity LA Local
Fiesta Mart,Kashish Kasar,Closing,Fiesta Mart brings giveaways for Go Tejano Day at Rodeo - CW39 Houston,https://news.google.com/rss/articles/CBMikgFBVV95cUxOcVZEUm53enNVVlF1QWJOT0w3cWV1amxlMG4xX2ZVaHlkWmV1NFBscUxjTm9sdTdEVndDWTNFS1JYTnJtWTBvNEQ1V1U1alpacXFRLVM4OHlOaDR4RDJYaXdNcHdELXhaMXRKelBhNnNUTkV6Mjg1NWRiZnB0blBCY2psLUVKSjRRN0J3TG1SYk95UQ?oc=5,"Fri, 13 Mar 2026 17:47:40 GMT",Fiesta Mart brings giveaways for Go Tejano Day at Rodeo CW39 Houston
Sheetz,Ankit Rawat,Closing,Blasting work for new Sheetz to cause brief road closures - MSN,https://news.google.com/rss/articles/CBMivAJBVV95cUxPc0I3SHNGeUMxYzVMOTNjZUYyR3ZnSWpvbUhfVzVHN3JVX3hvbmlxRy1KMGlndFNJSEV5aHBWdF95LXZNSFdhLVZRZWVNNExRaU84SWlMV1JYOGJWTUt6anNidjZNeTB6VFQwMGtDaF9DbHdfSEs4MUhzV0t6REM2UG42RG9obUdXWTFVZUpZdHlxNDUyUVk3Y0RVWDNMOFNfc3FIS1duaHNjMkItNF9hZGF2QnU1SldPN3V0QUFfYUJrVGswZDE1aEp4S2xIcnp0WU1sR0NlR3lMWm50ZWdSZ05acy1ia2JjaWl0SjNtNWFXbDlSU1VEUzBiRV83NWY5NEF3emItbUgzMk1qaTNhMHZTV2ZUMnJmNlN0dUlLVHA5WjdCb2ZrWGJ4M0VVNzJidVpoYUZpdDJYTjMz?oc=5,"Fri, 13 Mar 2026 02:27:28 GMT",Blasting work for new Sheetz to cause brief road closures MSN
VCA Animal Hospitals,Ankit Rawat,Closing,Four Corners Property Expands Beyond Restaurants: VCA Animal Hospital Acquisition Signals Strategic - AD HOC NEWS,https://news.google.com/rss/articles/CBMixgFBVV95cUxNWGdreGFXZERSTWJ4dEVDcnRkWkxpbUw0MGFfYng5cERuOVNTbzNvMEZGRHducW1MRmhpT2pKZ0pLSWlDaXlEVFpDYUhZYTMycnUwREczMktnRjR6WWF4M2VwRHdJd2VtTkhPZkZvNEhEQmtoSFdCOHZtSFM2UUx5NDc4MTdfN202WGM0eEFfQncxbWd5SndkQ1JxVDRsbWJONUFScGpNRFcyWUk3ejBPSUFKaFluRHBHS0tEajAxN0ItUkVLQkE?oc=5,"Sat, 14 Mar 2026 04:52:15 GMT",Four Corners Property Expands Beyond Restaurants: VCA Animal Hospital Acquisition Signals Strategic AD HOC NEWS
FIELDS,Harsimranjeet Singh Ghelani,Opening,Charlotte Breaks Ground on $67M Eastland Sports Campus To Open in 2028 - Country 103.7,https://news.google.com/rss/articles/CBMiqwFBVV95cUxPd0JjRE1oOEdJek90UjN6TGZOODBfOWxkUHF5RDZHUzg4SHNXTVQ5WkJfNWIxQmVTTTh6LXo4WEhkTElBT2pwTVJMVnNSeEd4ck5xeGttTjhWYnQ0ZzQ2cl9lbWhNTnJFOTR4M3pQYlQtLTRCdkNrbkdvblpuWTdaMUI3TXdzdUx4YlEyMXlOcWVFcGF0bkFBRGFFdmJVOGVMQTR2QzIwWU5jQXc?oc=5,"Thu, 12 Mar 2026 20:26:25 GMT",Charlotte Breaks Ground on $67M Eastland Sports Campus To Open in 2028 Country 103.7
FIELDS,Harsimranjeet Singh Ghelani,Opening,Charlotte Breaks Ground on $67M Eastland Sports Campus To Open in 2028 - V 101.9 Charlotte,https://news.google.com/rss/articles/CBMioAFBVV95cUxQR3Nkcm8xNGNnZ2VyVUJXdFNmcjhLeFZqUV9JWEltU2t0X1VEWmkzUVNoV2tOTnJGVmxTdGtVeHV6UjFzT2x4Rk9GMjVDVERDVzNrTnptZFhPU3hhU2tFd05qYmVhZmMtN2cxSGFtLUIxb2VURDd4a2x2ZDlDLWdHU0N2VHNoeUl2bm1yTmozdGJWX2J6dGhlWXRtRXJ6aFRv?oc=5,"Thu, 12 Mar 2026 20:26:25 GMT",Charlotte Breaks Ground on $67M Eastland Sports Campus To Open in 2028 V 101.9 Charlotte
Macy's,Harsimranjeet Singh Ghelani,Closing,"More than 1,300 stores are set to close across the US in 2026. Here's the list. - Business Insider",https://news.google.com/rss/articles/CBMia0FVX3lxTE9SUTdiM1JqclMzakxVV3hnTHU3N0ZOdHQ2UFhvc0RMS0kwM1FQQnFKd3RUb3ctOWpLSHRyc2o4d3pDX2lVQUdRcEJ3bzhKNWZzT1VuNEY0MGk2XzVXLTVHanRNMHBRRWM5aVVN?oc=5,"Fri, 13 Mar 2026 10:09:00 GMT","More than 1,300 stores are set to close across the US in 2026. Here's the list. Business Insider"
Saks Fifth Avenue,Harsimranjeet Singh Ghelani,Closing,"News | Burlington, Ross among bidders offering $36.3 million for half of Saks Off 5th leases - CoStar",https://news.google.com/rss/articles/CBMiwgFBVV95cUxOZlJzQ1FwemRKeF9QOXNNY1E4ZnhnUlNSRkpZUTFiQ3BnZWFzRjk4SnZ2X2E0SFd0cFA2S0hfTTd2US1pbDdXVXR6UkhNd1dLcEl2SWZTQUFLNy1hcldWXzhvUTlaSU9GaDVCZmEwbC1yNnhaMVYtc1F3WTRGQXpObVZ2Y3ZXa2swY3VNQVBNdHA4SDJ2S3VObWdjdDNWRDV6alhhYjBfOS1aT1pORE55SjZtNGRMbWEzc3J1dXZnTVhhUQ?oc=5,"Thu, 12 Mar 2026 22:06:54 GMT","News | Burlington, Ross among bidders offering $36.3 million for half of Saks Off 5th leases CoStar"
Saks Fifth Avenue,Harsimranjeet Singh Ghelani,Closing,"Saks Fifth Avenue Closing PA Locations, Hundreds Of Workers Impacted - AOL.com",https://news.google.com/rss/articles/CBMid0FVX3lxTFA1ckZhUEpEdUtyWTh6bFQtYV9oenZfRFF3b0h6a1ItYTRRc1lUcTlXbTdJSGh3X01Cb2Q4NHNCWU8wSDdVcWQ4a3BWV01wREpZMGhhenRCQk5tZzFqSnhMSm5TM25KT3JZMEZYUzhPSGh0UUNZRGlJ?oc=5,"Thu, 12 Mar 2026 11:52:55 GMT","Saks Fifth Avenue Closing PA Locations, Hundreds Of Workers Impacted AOL.com"
Saks Fifth Avenue,Harsimranjeet Singh Ghelani,Closing,Last Saks Fifth Avenue on Long Island set to close in May - News12 | Long Island,https://news.google.com/rss/articles/CBMikAFBVV95cUxNXy1hQWttOG9XSmk3ZGdrRnhObjF2YkY1WnJ4WWRvVWU4WFVRWHBMR2lRUFVrWVdrRWNReVVGQ2RtUkYteWJPOXZmVzk1bkMwMHhtekotRk5zLU5feE9Oa3QybW1oNUpfQXFtUl9xempRbURTZlFfal9HNjdnb25ucGFvTWt0MWo5UmNVSWlJTEI?oc=5,"Thu, 12 Mar 2026 09:44:53 GMT",Last Saks Fifth Avenue on Long Island set to close in May News12 | Long Island
Saks Fifth Avenue,Harsimranjeet Singh Ghelani,Closing,Saks Fifth Avenue Closing At Fashion Show Mall In Las Vegas - Hoodline,https://news.google.com/rss/articles/CBMimwFBVV95cUxNbnZIZjlqRFJXMVIwS09VOU9EVXk0ZEhqLWNKVWR5SUNqdWFyYUxLSUp0bzkwTjI0WThmM2Y4U2pQTlRKMTJXQ2dpejZtSEZCZWRTS3VERHZfeUZJTlhzUG9yOWpOT3NQZlJRQ0EycV9SUjZnRW9feDFUdW5tRXQtMzlqR19jY2N1UDBMT1NZa3NPOENCcTJmZEFzYw?oc=5,"Sat, 14 Mar 2026 20:41:38 GMT",Saks Fifth Avenue Closing At Fashion Show Mall In Las Vegas Hoodline
Saks Fifth Avenue,Harsimranjeet Singh Ghelani,Closing,Saks Fifth Avenue closing at Las Vegas Strip shopping mall - KSNV,https://news.google.com/rss/articles/CBMi2gFBVV95cUxQVnJDRHBEdjlnOVpkSlFVLUx6MkxrOXh5Rnc5YUtqaFBYT2p3WC0zVmI1OHd0Z2tGR2ZVMWRBakJnM3VyVXAzTnpoaGhvR2pRZ0pVWXNrWjR5VlRxWnNIXzUxX1VIeFpGNEtzTDd3TkdLMjJSTG9Zd3U4TUtCRXdkRVNlM1BuNU5oRV9mcVBYNTBQM25VUThqV3haV0FfQ2VTelA2Zm1jTlpSZG91TjU0bnJhS3BYMzFBM2VycENOT1lDOEN0RG95a2pLWS05Ym1fZkhFaE9SSkJRZw?oc=5,"Sat, 14 Mar 2026 17:28:37 GMT",Saks Fifth Avenue closing at Las Vegas Strip shopping mall KSNV
Saks Fifth Avenue,Harsimranjeet Singh Ghelani,Closing,Saks Fifth Avenue in Bala Cynwyd is closing - MSN,https://news.google.com/rss/articles/CBMi9gJBVV95cUxNVms0Wnd3bVlwZnlidDZBU0FMVmlqMk10NzBfNmZsdHlqdkpldEdCQzRzeXdpcUtieldnSUpYN3g5UEE2ajUweXEtMW45VkRzNDN2RWUweVk2Wl8xWWRjbWFNRUdpeURUTmlxeTJRaXlhTlVqTUszdFdWT1ZsUEtnbHhUTWNoc1huWGpsMVJuZWZyNG9ab1FDTnRRS2lhVkxiMEpwX1Z2UzBLMjJLWFZGLUc5LS03RENCTWhHd1o5bXMxV19sUW5wOG43SW9ySmZkekU4enlGRjJMal9nai10YlN4YldKajB3NjAybWxDYlNXYzZBVWliamFFa2xZZDNxYkc3blZ2Y1ZzSHZpTG8tR3lmZVA1MVR1OHBVZnJGY19ITG1mWmhzR2dfTURyaUJlSEZvLW1UT0I2TFFkOU1XOEJSSDJ5OTRkN2w4cHFnMklIUFJ6OVA0UDBxQ1Z2M1J2UFp4SmdvT2w4VG5mRzM3MW5lZjc4Zw?oc=5,"Sat, 14 Mar 2026 14:40:19 GMT",Saks Fifth Avenue in Bala Cynwyd is closing MSN
Saks Fifth Avenue,Harsimranjeet Singh Ghelani,Closing,Saks Fifth Avenue and Nieman Marcus closing several stores across SoCal - MSN,https://news.google.com/rss/articles/CBMi7wJBVV95cUxQa0RuR1paN2tka1ZkdFVzakVQTXRpOGJMakZxcktzX1pYOGFEaFpxdmZ4dnVSWEY3eDBVUlU0czZZNWpLYVZpdUxvOFFTR1JjbzNVNEFBQXE0UTlmQWhtY1JkXzkxQTYwbjNGc3RvcHZGOGtySlJjbUh0TjIyTGdYZkdIaktDM2RkaTFCWjg0cUgtMk9zS2swOXh5MXdBUTJjRlZDTkxBOG5Pb25zVUNKTGRvNGZHdlNXSGdVa1BUbnFNbE8zZzMwS3FNOUNxUm1pWXBKVWRaalh1Zng3MFdkb3djMHVpUTRGMEpnaDI5WnZvdGY5cXhwcGxWdkJGVU14alllVW53YnA0Z0c4YWpfbHJMaTdLSWRaOUpyeEx2SVkxOGNBODM3RWNPSENMQXV4b2JKTV9nc2thR1EzNF80WHVMWEJpeFZ5NVZPTG8yVnlYRWNhSEwzZFJneU5FcVJRZ0lpVFdXVFpEVTRPLUp3?oc=5,"Sat, 14 Mar 2026 13:41:07 GMT",Saks Fifth Avenue and Nieman Marcus closing several stores across SoCal MSN
Saks Fifth Avenue,Harsimranjeet Singh Ghelani,Closing,"Saks Fifth Avenue to lay off 71 workers, closes San Antonio store after bankruptcy - San Antonio Report",https://news.google.com/rss/articles/CBMigwFBVV95cUxQMzhFVnVyTl80SGEtdkdRV0g5QlZLSjhxeWNDU1J6ZTFhTUtkNC1XU3JrdzJhaXUwUVhrMk5LQS1ZNnk2RDNBZ2ZCQ3loUENPaDRVaUlrNU95b0ZOYmlRY0xxNlJwRTdhY2ctZEYzanZoS1lJV0VmNUZSSm81OFpLd25rbw?oc=5,"Fri, 13 Mar 2026 20:59:55 GMT","Saks Fifth Avenue to lay off 71 workers, closes San Antonio store after bankruptcy San Antonio Report"
Saks Fifth Avenue,Harsimranjeet Singh Ghelani,Closing,Is Waterside Shops' Saks staying open amid parent company reorg? - Naples Daily News,https://news.google.com/rss/articles/CBMihwJBVV95cUxNQnhuQUVNazc5NWNkWlNBWHM0UU52N1NyMXNreHJQTEVxSkRLZU11MnJ2eU1STVVNSXNxQUdZMTZYVUZ4UWlwSFllLW1vZ0czUlRqTFhPNFE2b01xX2d1SHNhSmkzTGZta2hhZlZtUDFqbzdxaHhvLWd2LUJZTDhUT2txT2w4Wm15eElqYXdZVk5VdVd0Q21YNExqVl9tV3gzTkpsQmlLUUYwVWp4OWo1X3BVSllXY0dPb2pSRXBTMHVMblBKN25DcEI3ZGpIWmtWM1RPZjM4eVBPbXZvRlVzcWFoR19wcUNRSmJKcWJrWURFNU1ZRUJEOUpURzRST0Jqckd1dWd5Zw?oc=5,"Fri, 13 Mar 2026 20:50:00 GMT",Is Waterside Shops' Saks staying open amid parent company reorg? Naples Daily News
Saks Fifth Avenue,Harsimranjeet Singh Ghelani,Closing,Saks staff laid off amid North Star Mall exit - The Business Journals,https://news.google.com/rss/articles/CBMihAFBVV95cUxNLUl1Y1lxM0ktY2pzQ1VVOFlMQWo2X29YMjdHVGgtS2dmSlhWalE5M09nSUxPd0VNcVZkZU02THV3U0NhV2xvaVNScGQ2b2hmRWF4WHdmZkpXLWtLZkJ4NTE3bGJhd004ekpGdzBlTGtIcGhRQmxpZDlGMWNuTXVsa0paM3k?oc=5,"Fri, 13 Mar 2026 17:23:00 GMT",Saks staff laid off amid North Star Mall exit The Business Journals
Saks Fifth Avenue,Harsimranjeet Singh Ghelani,Closing,Saks laying off 71 employees as it closes San Antonio store - San Antonio Express-News,https://news.google.com/rss/articles/CBMipwFBVV95cUxQYkx2WWQ5YkNjY3BJbjlNVEJDelZjY1kxbmFGX1Q2Z1g1S3ZpaDNRdmZzemFFVjAwbG5RUHRhX2xnQURjSU9GQTFPbWo3ZXRqZllVei1IOHBTWEFoUFg3UTRwMzJ4d1JZMmVQc0hlWm50eDNnd2gwUjRKYjBPV2RtMndKUmZJRENVMDN6MlVRZlk5VF85S1owTEtJM2preGhHcjJEdEpxSQ?oc=5,"Fri, 13 Mar 2026 14:34:10 GMT",Saks laying off 71 employees as it closes San Antonio store San Antonio Express-News
Saks Fifth Avenue,Harsimranjeet Singh Ghelani,Closing,Saks to Close Additional Stores as Part of Portfolio Optimization - Shopping Center Business,https://news.google.com/rss/articles/CBMiowFBVV95cUxNTmRoY1ItYl93OEZiTDhuNlFITGVhbkxXTkRXblMwbjZfc3NCdGNpN1c1T3hQNFNiV2ZvbDNiZmk0N3ZKZzQzNktLTUFvN2RnZVJfSUV5OHp4YlYwRjI4NDN5X1c4UXlyZ2xSdDVVanFrcnBmUlNvaDJQSWwzN3B1aVE4NEdSWmlzWldwVEFLRUJDY2dtM1hEbFZjbkxRYXduSzlN?oc=5,"Fri, 13 Mar 2026 13:26:12 GMT",Saks to Close Additional Stores as Part of Portfolio Optimization Shopping Center Business
Saks Fifth Avenue,Harsimranjeet Singh Ghelani,Closing,"4 Triangle businesses are closing, including a grocery store. What to know - News & Observer",https://news.google.com/rss/articles/CBMickFVX3lxTE5WblFLN0lRa1FoSGNNTWF5ZVFZRU1lT0hDZF9hSG1yNWY1N1RnQUJaajNaTjZfVnNmdUhiZmhBM0ZpdThxcXB3OGdTQk93VG5uQVQyU3BJa3lVZ2oxeVlPSkMxeXFMcTdiRzJua2p3TXZqUQ?oc=5,"Fri, 13 Mar 2026 12:00:00 GMT","4 Triangle businesses are closing, including a grocery store. What to know News & Observer"
Piggly Wiggly,Harsimranjeet Singh Ghelani,Opening,See photos of the grand opening of Piggly Wiggly on Vaughn Road - Montgomery Advertiser,https://news.google.com/rss/articles/CBMi3gFBVV95cUxQQWdpbTllOWN3dlExNjU3STZJN09wbWRaRFk5REVjMC0wRWVmSTNsTEtJd09TaHhkU2Z5RnNjREJBWE5YWVhMOXBwdGpNSEdHSHBiUXRDS1JKZFlwSWFKSmF6QkdpVmM0czhSU25rT0xMaHRtSW1YcUZoTkNEQ0Q0Zk9sZFNBZFV2dkNwWUdxdmxYQ3V3dGN3WmpHMVNNTFFsUER4dXpiZmp0TjZpa2dzRWR3TTBfY1VjellGaVYwdkRYV0RsZ2lrcTVwdHlDTVNtZ21ZenFmRjZ2bmFOQnc?oc=5,"Thu, 12 Mar 2026 23:26:00 GMT",See photos of the grand opening of Piggly Wiggly on Vaughn Road Montgomery Advertiser
Piggly Wiggly,Harsimranjeet Singh Ghelani,Opening,New Piggly Wiggly opens in Wetumpka - WSFA,https://news.google.com/rss/articles/CBMie0FVX3lxTFA1WXRWQ1VpN1QteFdtbEIxT2VFc0xuNmZzRmRwX0JTVVdpdWNuaHF4N2szaC1Rck9oZmI5QWJSWmc2UFgwaEl0QmU2MklxN2J5R2R3ak0zemFMSWNydmtHVnJIRzE0aXNITE9KLXNyTGFWRWc0ZW52NDQzVQ?oc=5,"Thu, 12 Mar 2026 23:00:00 GMT",New Piggly Wiggly opens in Wetumpka WSFA
Albertsons,Kabeer Pandya,Closing,Albertsons to close Las Vegas store for operational efficiency needs - KLAS 8 News Now,https://news.google.com/rss/articles/CBMisgFBVV95cUxNekFFaUdMbW13UktCWjJTNUQ3cmgwXzQtY1J5OTRUYlNsejdhOFEtcVVkbC1zUUptQ09kNlRaMnRDaEo0QXU2WmJQSUZ4Y0RGTFpkR1EyQ0FxNmVkdkxPSE9WcklZb0tWM2R5YVY5RUV6ZjZ0Z1JfS2VXRDUxbHo1b0pBazZjeFJNM0ZuUHNaMFM1M3hpVGZOMUg5cnZndFNBeXlnQlYtV29lenVTMGgwN0hR0gG3AUFVX3lxTFBKeWtpVkZ0S09uX3lxZTdRLXpHa0o0RHQ5MmEwNElDeG0zdl96cDUtQkpmVTVtNndIS0NQbjlKSUFEZWdKc3B1VXZ2ejFYNzhUQlFIQzlKQlRCVHk1dFdOQzRNeXRVYVlOV2kzZ1ZVRW1TaE9jVW01Y21vVWVIZGp1SWZZbjJRWWItT2NQOFZPYVAyR2RFVUV3c2hQeU5MbDhOWXNfMG1Tc0l6SWpVME5jaHFkQkxYSQ?oc=5,"Thu, 12 Mar 2026 23:08:40 GMT",Albertsons to close Las Vegas store for operational efficiency needs KLAS 8 News Now
Albertsons,Kabeer Pandya,Closing,Las Vegas Albertsons holds closing sale with 50% off most items - FOX5 Vegas,https://news.google.com/rss/articles/CBMiogFBVV95cUxOT21uTFJtZ25XU0JEaHJLWEJRd0ctWHFqSC1FcU1BY0JFbngyZWVnXzMzSDEyRmE3SDRhc0JFYUNLSzRJLUpzRklyLXpoSENNNXhRMDBEaVBoRHRha2Y1ajhpcXBOb3lFcTJWb3hVNUowczBnNXZaZmZVTU1QUkY2QlhDYlRzbmRKbmhncGlPRjNXazZWcGExS1I1SzkwV0xNVGfSAbYBQVVfeXFMUEVaa0JNb3c4Tzdud2tQS2p4czFRdDhBOVROX3ZDV0UxM2ZHWHpRRllhN1VXZVhER3ZOUk1xempyRzFlMkJYUi0xZEZGcU5Gb2VQV2tGOUloYjJIaG5FcU5EOUd6QzM1bHFYYU5yUDJKb3lndVhidHJybVF2Z3d3WGlCdzRLU3VVNWkwRnZSX0FUS0JBZ1pMZXA1NzBCQVlhbHV4dGI2R2dvcFB6cG9KbW1Lbk1kQXc?oc=5,"Thu, 12 Mar 2026 21:58:00 GMT",Las Vegas Albertsons holds closing sale with 50% off most items FOX5 Vegas
Albertsons,Kabeer Pandya,Closing,Las Vegas grocery store holding 50% off closing sale - Las Vegas Review-Journal,https://news.google.com/rss/articles/CBMioAFBVV95cUxPS09XSWkzN2NxQVV1LUFYbjlXOU5JN0w2ZF9zVl8xNkptaG9JeGJHRjdnWU5Pd2FROEotQV9DTndHVHZlSWh3YzNzbnVodmg0SEZKLWltdHFvc0J5ZlJnT1d4QXpKRFdNU1ljMDBueGJJR0dvclFyMnBDcDAtNUJ3Z1RvdEJteWlkZjhzWEZJLWFTQXE5bWxMWGFvaWgtc2tH?oc=5,"Thu, 12 Mar 2026 17:53:00 GMT",Las Vegas grocery store holding 50% off closing sale Las Vegas Review-Journal
Albertsons,Kabeer Pandya,Closing,Las Vegas Albertsons closing sparks shopping rush – KLAS - KLAS 8 News Now,https://news.google.com/rss/articles/CBMilAFBVV95cUxNRWRiNGppYmpDb1JNNWktSlFCdFlWUXNUbWsyNUJWSzNTR05SckN5djlhVFhFRmRncm5MVjgwZGQwaGkwTS1rdVo3dGk5dXpBcXI4alRzUTZHWDdPRVJMb2hVckFwbjJMRjFmX0dXSkpzNWpXXzdiU2lLZ0JJeHJKaWFtdTdmRlI1Z25Rdy1FRWYxVHVy?oc=5,"Fri, 13 Mar 2026 23:29:25 GMT",Las Vegas Albertsons closing sparks shopping rush – KLAS KLAS 8 News Now
Albertsons,Kabeer Pandya,Closing,Las Vegas Albertsons closing sparks shopping rush - KLAS 8 News Now,https://news.google.com/rss/articles/CBMilgFBVV95cUxNWHhjNnh5RHl0Rk5BMGY5T3c5d0NTSFR3b1F1NGJrckYybFJaNjI3cjk3bzM2bkpqdnBzVXJQdnM1dUMtZUZpd0FGZVBzX1QwaEtfc1BMbHJDbkJRdGMybWhCX3NvSTdYTEpseDlYSFZrYWVwTS03aGZqU2lkdEhSOWQ1MWtzd3ZjZ29HV09LeHRCRTNLQnfSAZsBQVVfeXFMT2g5QW5NZUljR28waFN0cWFEWTVsTE9vdUZHbjRaNjlqZnljWU5hWUtLSlZRekg4amhBV1VNLTVfeGxTSXNXR25FUGtmeUhEemlwQnpreWhUcHhNTGI5aU9EZ3VEUV9MMEJmbkotOUpYVkFrNXhrejRQbWFiVFZBSnBNTFZxSnc2TC0tcHpxQmg1LVZiMndyOUpxQWM?oc=5,"Fri, 13 Mar 2026 22:37:59 GMT",Las Vegas Albertsons closing sparks shopping rush KLAS 8 News Now
Amazon Fresh,Kabeer Pandya,Closing,"Amazon is closing its Fresh grocery, Go convenience stores - MSN",https://news.google.com/rss/articles/CBMizgFBVV95cUxQUktxaE9QaTdlQktIYmNUNUhxZVlPbVJMZ0lMNDJPSjVGRGc1VjJNRGpjbXBGdFFiN3J4NTIyUTJPc2o3bDN0MFNCbGU2MXR1a09lbVZsTnE2ajRwdjhLR0hxc01WaXp6N3pFLWY1NmdvMkk3QXhSSGZNOTRZU1RTaVhzaV9IZ094Y3EyMEtBbC14Z2t3bXdUMXlDaHk3bkYxckhmYXZGS0hqZlFIUDUwenotWHRWeHpGLXpZaEdSREVBal82Tzc4cEF1NWtTQQ?oc=5,"Sat, 14 Mar 2026 01:23:17 GMT","Amazon is closing its Fresh grocery, Go convenience stores MSN"
Amazon Fresh,Kabeer Pandya,Closing,Amazon is closing its Amazon Fresh grocery and Go convenience stores - MSN,https://news.google.com/rss/articles/CBMi7gJBVV95cUxPZnlJdVpJX05IdWxpZUFwNGVMY05XZXdzYzZaeVg0cWlxNFNCRllVZV9YeFlvT1Byc0ZLT2VvZlNqLVR3WnQ4RHhJYkNLTzh6N1UyUVZkUVYwSGF2Y3RvbnY4NGxOSmtiVFV2dDB4b1VSR3ZTc0ZrUmtqa3RLeEtHYmxJX2JrbnczaEt2RE0wWXgxNVRxRHNkbzVOU0M0XzNWVHdsYnVXcEVoMU5hUXdYcGE4Ym05UmdNaW5nYy1oQ3E3OTBQdXlxQ1ZOZzRRUWU3NTNKTUN4RWFxX1A0eEZhZzFQdFhNSTA5aDI0Zm9lYllXV1FRbnVsN1NBX1RETXNuN0dURUtzZmhzQmMyWHYzelBzNmptdHRSSEdpRkFjcS1sVW1YUW93Z01iXzJURGZJbEVNS2o0M0dUT2doV05UeTRrRlEtZ3VhcFRhdDREZ19oRGFncFhuQ0x2NnA3amQyVTIzS0l6X0ZRWUJQclE?oc=5,"Fri, 13 Mar 2026 23:07:50 GMT",Amazon is closing its Amazon Fresh grocery and Go convenience stores MSN
Amazon Fresh,Kabeer Pandya,Closing,Amazon Fresh Stores Closing Across California - ABC10,https://news.google.com/rss/articles/CBMi1AFBVV95cUxPbG04cDNnRU0tdFRXblQxdGxZQk0zN29VdGNQSm5pUnVOaEdMZkdpclFHcWNwSE50aWl2SDAzaTFqWVNFM0tBdEM5VTJ5WU9sZlBySjJiT0UyaDNFMFV5d25EUDNUMmZOU3U4cnhBVGZ3M0FvZHdlVEVHN1V1Q1RCVWlWbkhfSlFhZ1o2ZnlOc0xHSzJEMjBoZFl4a3hyZFhMc0dyWk1lSlhFV3k0NTRnelBPN2EwSy1UTy1ncHRyaExfMS0yNUMyTmdoOU80ZzJmQldORw?oc=5,"Fri, 13 Mar 2026 19:06:00 GMT",Amazon Fresh Stores Closing Across California ABC10
Amazon Fresh,Kabeer Pandya,Closing,Today is the last day for Amazon Fresh across California - ABC10,https://news.google.com/rss/articles/CBMi6gFBVV95cUxOLXFLbFM3QUxaaktqaU1GM1J6d3llY2p0cDE1ZnB0WHRQbk9vUV81bVd0SDJBc2UzdjhTTlNGdDdTd1BrbXpwbGhvT1ducTB5TFhPX09vQ3RxaWZIb3FoUEp3UllDRU1xLXk2MGk1QnFfTWUzdVQ2M0dvb3pCaElPOWJKZ1Y2TENrZTY1QXVkc0lwcnNkVlp1TXVUT2lZSldhS0lKeWJFYXU2emJfWHdkYm9ub1JCd244UDlweGNzcDVCRTlrSjFIc0NXMHZrU3hGaUlSOU5LYVUtVzVEUXRHM2g5SG5tallzd0E?oc=5,"Fri, 13 Mar 2026 18:02:26 GMT",Today is the last day for Amazon Fresh across California ABC10
Amazon Go,Kabeer Pandya,Closing,"Amazon is closing its Fresh grocery, Go convenience stores - MSN",https://news.google.com/rss/articles/CBMizgFBVV95cUxQUktxaE9QaTdlQktIYmNUNUhxZVlPbVJMZ0lMNDJPSjVGRGc1VjJNRGpjbXBGdFFiN3J4NTIyUTJPc2o3bDN0MFNCbGU2MXR1a09lbVZsTnE2ajRwdjhLR0hxc01WaXp6N3pFLWY1NmdvMkk3QXhSSGZNOTRZU1RTaVhzaV9IZ094Y3EyMEtBbC14Z2t3bXdUMXlDaHk3bkYxckhmYXZGS0hqZlFIUDUwenotWHRWeHpGLXpZaEdSREVBal82Tzc4cEF1NWtTQQ?oc=5,"Sat, 14 Mar 2026 01:23:17 GMT","Amazon is closing its Fresh grocery, Go convenience stores MSN"
Amazon Go,Kabeer Pandya,Closing,Today is the last day for Amazon Fresh across California - ABC10,https://news.google.com/rss/articles/CBMi6gFBVV95cUxOLXFLbFM3QUxaaktqaU1GM1J6d3llY2p0cDE1ZnB0WHRQbk9vUV81bVd0SDJBc2UzdjhTTlNGdDdTd1BrbXpwbGhvT1ducTB5TFhPX09vQ3RxaWZIb3FoUEp3UllDRU1xLXk2MGk1QnFfTWUzdVQ2M0dvb3pCaElPOWJKZ1Y2TENrZTY1QXVkc0lwcnNkVlp1TXVUT2lZSldhS0lKeWJFYXU2emJfWHdkYm9ub1JCd244UDlweGNzcDVCRTlrSjFIc0NXMHZrU3hGaUlSOU5LYVUtVzVEUXRHM2g5SG5tallzd0E?oc=5,"Fri, 13 Mar 2026 18:02:26 GMT",Today is the last day for Amazon Fresh across California ABC10
Dunkin',Kabeer Pandya,Opening,"Dunkin’ to open in Greene Co., offering free coffee for 100 days - MSN",https://news.google.com/rss/articles/CBMizgJBVV95cUxNOHZXa1poaXJJLVZnS2JSdVpCTmd5YmJLcFVoNm0xY2tIZ2YxNlBsZDA1eHkwbFktVF94WlVLNm5nNm92SXY5TzJBRjlwUjRVU29LTUdyQl9CMDljUjBkaHVqWm9aSzRmdVo5NWFQLU5XM2RiaUU2aUdOT0hsM1htSlp0SzFqY0Q2YUFMY3R4cXdLMGVMTVFsTW52TUliUHdScGk1MkIyZ0h4RmVTVmRuSVFIckFoN0N1ZDFuM1lObmVSdVppUTJ4ZEpubUNGWEx0aTNzN056RG5LSHNONGRxZzJRY3VuQURtRDhRYU1KdEV6N0dqalVicGxIanNnMWIzTTVfdUFWYjZTRzE2VXQwaVJiZUdXd0wwM2VVaXFvYmJJTmNXSkxOdTVIYl9kV21XYVRSekRtN29Ic2t4QlMyckMtRUlDOGI2MWdDWmFB?oc=5,"Fri, 13 Mar 2026 15:02:42 GMT","Dunkin’ to open in Greene Co., offering free coffee for 100 days MSN"
Joe V's Smart Shop,Moksh Kashyap,Opening,"H-E-B to open 2 new grocery stores in Garland, including Joe V's - AOL.com",https://news.google.com/rss/articles/CBMiYkFVX3lxTE1MaThobEF1XzI3dk9Cc3FQXzE5bG9KT1VTVjBHV2VwS2pDRjYxVmdobGJCMGhqZTN2U0RKV0NoVE1tNldYWVdMN1gzY2ZSZFBaOTVNUjliVDFBaDRadDNUMlZB?oc=5,"Sat, 14 Mar 2026 03:53:46 GMT","H-E-B to open 2 new grocery stores in Garland, including Joe V's AOL.com"
Kroger,Moksh Kashyap,Closing,Kroger plans to shutter 50 Little Clinics - Grocery Dive,https://news.google.com/rss/articles/CBMijwFBVV95cUxPUHpsci1yR0RsOVlGNVRFSEhPTzdwMnhORmdmQmVKWklOSjFhRFFKcVRYYlJSRDFMaFhqeWpHYnpRSnNseXQxbnZodEhZREIxZ2xTWktud0FkVTUza3ZSaW9XSm9GV2dQYmRXaE9hR2Q0cDFpLWlkNkNCTHNsYTYzUndPclF4d1hDOTZ6TlA2UQ?oc=5,"Thu, 12 Mar 2026 15:40:59 GMT",Kroger plans to shutter 50 Little Clinics Grocery Dive
Lowes Foods,Moksh Kashyap,Opening,Whole Foods is planning a new store at Preston Corners in Cary - Axios,https://news.google.com/rss/articles/CBMimAFBVV95cUxQRzZyR3JWVldMRDhNRmhZSC1pdjNRMURGT3RDM0lIOVdPTHlMTkJPczRvaW5MQkNIbTNucF9ZUjhmdHQ4VlpMckszZExWUzlMNEkzaTFFUEJVU05obGdIZGJvcnBtTkdmOWtiNVQ2d1B1UGhILXRHbnhpb1hwWjY2cXBYYWpBazhKRjUtNkFaQmpNOGsySms3Nw?oc=5,"Thu, 12 Mar 2026 17:32:43 GMT",Whole Foods is planning a new store at Preston Corners in Cary Axios
Lowes Foods,Moksh Kashyap,Opening,Whole Foods to add Cary location in former Lowes Foods space - The Business Journals,https://news.google.com/rss/articles/CBMiqwFBVV95cUxOTzdjaVJqbmNVQXY3d2tEeFVWYzFPc1Z0SWlCeDZMUXljRkpiQ1BkU1dPNUwyam9MWHZIQ2dXQVVRaUlhbGdoZUpkVmhXa1dkZl9sQ3dRM0lpOE1HQWZRQ2U1RXo5c296eGEtdFVINDdPZ2RvV0lGSEZDcWs0bS1DN0FrMVVQUjV6SGdmTWRqMEI2bk0zRjhHanRHSTZ2bG12YnpfeVhITnU0elE?oc=5,"Thu, 12 Mar 2026 11:25:00 GMT",Whole Foods to add Cary location in former Lowes Foods space The Business Journals
Lowes Foods,Moksh Kashyap,Opening,Lowes Foods to open Johns Island store on March 12 - WCBD News 2,https://news.google.com/rss/articles/CBMilwFBVV95cUxONkEzZ1k5QUdWdTlLZXZ0bVFRVkxESFREODh2THlFS2JrVE1EREtBMGxWZWxkUEtqakJvZTRLZWZWUTBkdTUyTndFaUw0QnRWVTdkRUJzV3Rydks2OG1UaF9DWnlTdDQ1TzVKU0dZVWRuVlZ6eGFYdTNpTURZU2xsd1c4VWZaMlNPMzROOTJza19USmhaZzVr0gGcAUFVX3lxTE11b3dnVDBySmpiZUFLSzlvU0pNaURiSWYyVnVtWE8wRnNVelp1SWY0NW9aWmV5cm1hTEEzWUgyZHl2dGNWclRaZWdncjBBM21US1BxTFpxcXdjWHBjRUJTODU4S04xQ1o4ME5MaXBHZ0ExMWFhcjhBMWdCOFNaWDJtWmx4RWw2UHdITzlWd1NXWnIzcnp3M0RPcWVmZQ?oc=5,"Thu, 12 Mar 2026 09:29:23 GMT",Lowes Foods to open Johns Island store on March 12 WCBD News 2
Lowes Foods,Moksh Kashyap,Opening,Popular grocery chain plans a new store in Cary. Here’s what to know - News & Observer,https://news.google.com/rss/articles/CBMickFVX3lxTFBYSm9xSDRrbFQtVkg3TDNQUFdIckwyckFKU3UtV21QUE4xcmlTZ0dPSWVHWkRzNEJIRlI4S2xPLXlGSDBhMHNEWlMwdFF4akVEbUVHVzAwV212WndWSWdqekdnLVRrNEJBQ085dk9qZUhTUdIBckFVX3lxTE9GYjlVNTU1STFQTkt0Mmp1SHpMd3lSRUlqeXZydGhnb1Utb3E0Y0ctV08yT2txVTQ1Y2hvQzBVZ2I5Q00tV0d5YjNpbHpBWFJERlBRZnFKM2w3UzBvU3djcGRUVDNNLWRITDJ5TzRkbmZvUQ?oc=5,"Fri, 13 Mar 2026 14:26:09 GMT",Popular grocery chain plans a new store in Cary. Here’s what to know News & Observer
Lowes Foods,Moksh Kashyap,Closing,Whole Foods is planning a new store at Preston Corners in Cary - Axios,https://news.google.com/rss/articles/CBMimAFBVV95cUxQRzZyR3JWVldMRDhNRmhZSC1pdjNRMURGT3RDM0lIOVdPTHlMTkJPczRvaW5MQkNIbTNucF9ZUjhmdHQ4VlpMckszZExWUzlMNEkzaTFFUEJVU05obGdIZGJvcnBtTkdmOWtiNVQ2d1B1UGhILXRHbnhpb1hwWjY2cXBYYWpBazhKRjUtNkFaQmpNOGsySms3Nw?oc=5,"Thu, 12 Mar 2026 17:32:43 GMT",Whole Foods is planning a new store at Preston Corners in Cary Axios
