Store,Analyst,Type,Title,Link,Published,Summary
Grocery Outlet,Rishi Nagar,Closing,Grocery Outlet to close dozens of stores after overexpansion - Los Angeles Times - Los Angeles Times,https://news.google.com/rss/articles/CBMirwFBVV95cUxOMUVwMm5OaVBiZFNEMkg2VnAyLXhhQU9YbkpTZFRlSXFzMHZTWm9zZ0hNYjJWU0tFd2F3ajNHcURHOGh1QWNmanBZZkVrVFo4am5JRGRMSVZJNENUc0ZoR3NFVkUwOGw4dFRhNDZ5aVlrZzVpSkZrRzhHVU8zMVpZRXNfZjJmZGQ3OWpyZTY5UWg5TTFFZzhHcmxremVJTGJhaGdrLVhMTHNKZ09PcUww?oc=5,"Sat, 07 Mar 2026 11:00:00 GMT",Grocery Outlet to close dozens of stores after overexpansion - Los Angeles Times Los Angeles Times
Grocery Outlet,Rishi Nagar,Closing,Grocery Outlet outlines up to 33 new stores and $0.55 EPS target for 2026 as store closures and promotional investments reshape outlook - MSN,https://news.google.com/rss/articles/CBMikgJBVV95cUxNeWJnc1RoM25oV2JNUTR3RW0teUJSbzU4TW1LUWZwNUdsVW1kVk9ETG5yTlNhdHZqVl90RUlJTWFBVXd4SThKOU5GcGJaczRsVVFnS2N1dmxVNHhDbTdRQzJmcUVQR191ajQ3Q0Yta3FPX3F3U2daakY2WW1KTFo2RXFmYU9iczlZc1JNcGlhQlpxcmhYWFUwLVM4NEhZaVlBdjI4TU9hd1dYdlplV0o2RnAzMGNlMzZZeE1Ib3FldTcySWxyX01CVDc0LUNscEpOVlhsRElCMTFkVUFKSnVuMEJmNmdtLUZRLVhkQzhiTFZMa2hlbXJNVW5VdDUyRnpWSWJ4dTBkSVdoV3BHMmc2c2tn?oc=5,"Sat, 07 Mar 2026 08:46:23 GMT",Grocery Outlet outlines up to 33 new stores and $0.55 EPS target for 2026 as store closures and promotional investments reshape outlook MSN
Grocery Outlet,Rishi Nagar,Closing,Several Grocery Outlet stores closing in Philadelphia region - NBC10 Philadelphia,https://news.google.com/rss/articles/CBMiugFBVV95cUxNQTloRmI0UmswektCU05FaXJSMERyVjYtSlo0QTdHeVZPNS1UZ1ZLR09hcXpSMUFzUk1sNTRzQWxWLVdzOUFyQWNRT3B0MmJ6akFteTRSQVItVjRSdG5xckp2NG1SbkhVTWNUTVNaLWlvWE1xLS1uV2l0ZGtQdVFEX3RLbVRjd3gtWkppcEkybFNXWFdEU3hzSTF2RGloVW9IYm5LTkpocVNwdVJlZWlGTDhTaUZTMXFheWfSAcIBQVVfeXFMUHBlQ3lHMFV0dE9YQVZjc3k2RER3MDI0T1JjMk1FTjBUM25wYlBxR3dDUUlnMmlmcklkVC0zWDNiZlpVNEZVYUlQcXZlYUZRZEFiZ0VsdnNkN1FsTGZIa3RwX3puS2dVcDdVZXhNcm5RbVg0ektTRlNwVFRLd3Y1dFVQUUZTYWE2Y09lRWo4cENlWEFFMVJYZkxGbmVfVUJBNkRIVGpMM3hWZF9Ia0RIVmItVmljZkxQdTRwUWcyeG95ZGc?oc=5,"Sat, 07 Mar 2026 04:15:29 GMT",Several Grocery Outlet stores closing in Philadelphia region NBC10 Philadelphia
Grocery Outlet,Rishi Nagar,Closing,Grocery Outlet to close dozens of ‘underperforming’ stores - San Francisco Chronicle,https://news.google.com/rss/articles/CBMijwFBVV95cUxQbXpOTHVKREZEREIwNV82LWRrdzl0UTJJYlZMdzlvOGNqdUFRdFR3bGdtZzhLd1JRMFlwdW1OdG9mbEZDWEdpbXBWTldyOFBwMW9icGJCMHFydGN2aURZejA4d3JZVncyTXNWbTVxZlBScG9mNVY1TkxOdzNzR0stM3NqTHRIenJnaUR2MlN2SQ?oc=5,"Sat, 07 Mar 2026 03:40:51 GMT",Grocery Outlet to close dozens of ‘underperforming’ stores San Francisco Chronicle
Grocery Outlet,Rishi Nagar,Closing,"8 Grocery Outlet stores closing in Pa., NJ - NBC10 Philadelphia",https://news.google.com/rss/articles/CBMiqAFBVV95cUxONDIyVXNtTGxyV09fdmx5X290bUNKOWozazFReEZRLUxDVlZfb0FLazY3OUk0cXBfLWZVM045WVMwMEtYVUwzUF9JOFM4ZV9vVWpwazBtaXlOUGFrUnlONXZva3pObmxYZWZjRjRvWmVGejBBbUl6cERaZ0xnU29aRDB6RnJRVHVkTW9SRDkya2NNQW03U1BMZHpDaHU4YUlWdXRYV0JHa3LSAbABQVVfeXFMUGhwdkMxM1BEbWk5NVc1bVFlcUx6bWZ3NE13Rnc4MTlkTFJJdGZncDIxQzFIUTE4ZkV1THNRUG5SV214b09vbFlscDZwWjhYem1GbF9lVU1YdldUN25FLWg3UDlaNTU5NHZYSGoyUEVMS0gwYjY5SHAxYkdaM0NnNkV0RlFIX3F1U0t0QzdvdTEtXzZlcERhOG1UQ09wNVVsZElDRzV1a3lDMzh6T2VpSE0?oc=5,"Sat, 07 Mar 2026 02:53:50 GMT","8 Grocery Outlet stores closing in Pa., NJ NBC10 Philadelphia"
Grocery Outlet,Rishi Nagar,Closing,Ontario Grocery Outlet to close March 21 - WMFD.com,https://news.google.com/rss/articles/CBMigAFBVV95cUxPR29HYkZIbjNjUy1zSzN5SktVNXVNRTVZVy03bV8xWDI5VldyaHdTWW91eDNhQXZOTXBLTjlJdndpdlFMV3hGQlRsa3U5dC1YQk40MnBuUXFKWE9tMk5LckpuLUpwc3BJdU1MbWZpZzdVWXZLVUFVX29ndWxLYXZLaA?oc=5,"Sat, 07 Mar 2026 02:06:59 GMT",Ontario Grocery Outlet to close March 21 WMFD.com
Grocery Outlet,Rishi Nagar,Closing,"Grocery Outlet Bargain Market Shutting Down 36 Stores Nationwide, Unclear If Any Are In the Bay Area - SFist",https://news.google.com/rss/articles/CBMiyAFBVV95cUxNWFVhQTBzZDRITTViMXllcGZWX0FjN0ZrcS0tTVYyalhKOUZvRDhWbUFPQm9pZTg4WVJONWl6ZnF2MUtNaXJEQVVHcWZIRFNMN0tXaGlKQkpxcmxpUHpfWXNPMzkyQ1dPQk5qbndMVzk2NGJWMEZtS0ZxN2U1Y3hqMTV3N0lXUmRsN1l5Rms5QVhhNG84YzRtMUlJclFDYWtrMEttM2YxNWFTc3dWRlA0azdCV3NrWW0tOHZHYVhpZjlJQzNJZXYxbQ?oc=5,"Fri, 06 Mar 2026 23:12:10 GMT","Grocery Outlet Bargain Market Shutting Down 36 Stores Nationwide, Unclear If Any Are In the Bay Area SFist"
Grocery Outlet,Rishi Nagar,Closing,Here’s why Grocery Outlet is shuttering 36 stores in 2026 - PennLive.com,https://news.google.com/rss/articles/CBMioAFBVV95cUxPQlNmMHd3Y2pnYnBJMm9TTGFYU3VhZjBabGU1SjFMUUtQSlRQX0JPMmpnV2hzdXQtTmVNODZXM3h3TERPeHRIdnVUVmNGVkhzbnRSMGl4cy1jTXAxaUYzY05XLUVMY0Z0RVk0UlphWTZpWUJ1eVpqOFVnZEM2QVJVS0hCMG43SVdPajZsNXlQREpjMWN2LUh6U3RQb2owNkZW0gG0AUFVX3lxTE54WG51bHVYVDNjYUJGRjlXbnpNZWNwVS1IVUlfTG40bWJKOVQ5TFR5am9kRDlzbGhlZUVrUi1FRXRreXMzOC1FX2d0UWtpZUliWDVfaFdfSnp2N3MtWlRKbEhSWUpBYWx2azNjNXBOYzFWSFhQeklQamwyLV9scWNKOEwwRFhoR0FHVXJPQ3JYZklSa2hva3ByZ3phbXh4S0p2bmpKbFZIM25iNl92SGgyTHRWRA?oc=5,"Fri, 06 Mar 2026 22:20:00 GMT",Here’s why Grocery Outlet is shuttering 36 stores in 2026 PennLive.com
Grocery Outlet,Rishi Nagar,Closing,Grocer to close 7 Baltimore-area locations as part of national pullback - The Business Journals,https://news.google.com/rss/articles/CBMiqgFBVV95cUxNUWRRUW9ERHRNUFJaZFMyOXM0RlZpTkVhbU11c0pabVZnOXBEa0t3RVFOWk1vUE9tRkdoZHk1T3Z0LVBfRzFNRndOd1laQmp4eDVLa1M1MWV2eWpfRWdqZ1RJeV9TQUpOVmhQMEEzQ2xJd053czMyY0lrcVhJSkVXVUtyemExam9vT0JMZW1ZMGpSU29pVXBmMFJ2S3MyMFJrbFRFekJveVlZUQ?oc=5,"Fri, 06 Mar 2026 22:08:00 GMT",Grocer to close 7 Baltimore-area locations as part of national pullback The Business Journals
Grocery Outlet,Rishi Nagar,Closing,Several Grocery Outlet stores closing across Delaware Valley - CBS News,https://news.google.com/rss/articles/CBMipwFBVV95cUxQaFkzZjlEM0tPemVUY213X0hzMHhUdGJNS1FwbUlpZTZRLTNDOHpFaFZWSlZGU3VCU2R4ZE85ZUNvMlNqbXNqQnVoZnNHRmJkc01vMFNFM0xoank3Qk1BNjV6QVZWejNRaS1mdzVTQUF5NEdaa0tPNHhMajFSUmRWb3A3N0xhVTVocEpyZnNqcTdqTm0tTWd5TU15cER2UFhSS3U2X3F2WQ?oc=5,"Fri, 06 Mar 2026 21:48:00 GMT",Several Grocery Outlet stores closing across Delaware Valley CBS News
Grocery Outlet,Rishi Nagar,Closing,Grocery Outlet CEO Bets on Bargain Merchandise to Reverse Sliding Sales - Progressive Grocer,https://news.google.com/rss/articles/CBMimwFBVV95cUxOc1J2SGdSdHRkQkplOE8tdGpuZkxNT3QzeWJ0UlhNRm5hQWt5aFM5Y2cxRlJnTkV2VFFWOUwzamdJcllNckFqZ3lCeGFpYnhybXI4YXNzQ3RrWXkzWm1Cb2ljNXFZVEZ5Y1RUVzJxSWZqTkl6M3hSMTZMOVlaY1VkR0pDYjlRNDQ2SHYxOUNmdWNtb0xVaWpIVVE1SQ?oc=5,"Fri, 06 Mar 2026 20:19:12 GMT",Grocery Outlet CEO Bets on Bargain Merchandise to Reverse Sliding Sales Progressive Grocer
Grocery Outlet,Rishi Nagar,Closing,This Popular Discount Grocer Is Shutting Down Dozens Of Stores - Tasting Table,https://news.google.com/rss/articles/CBMif0FVX3lxTE42SHUtWkxmMTdkM2NWaFUxcEd6WmFGZGV2MUs4VXI5RUJLT2Nld3ZqVDBjamh4MjR4cDNCaHROS1FUX3h2RElqR1M4ZmhBVHB2Vm8xY0FyYmtSeGk5ZEV0cTdFNk5WR1N5Sk5pT2JxSk9KTFFjWm5WZk0zRDNqaVU?oc=5,"Fri, 06 Mar 2026 19:55:27 GMT",This Popular Discount Grocer Is Shutting Down Dozens Of Stores Tasting Table
Grocery Outlet,Rishi Nagar,Closing,Grocery Outlet to close 6 Philadelphia-area stores as part of national pullback - The Business Journals,https://news.google.com/rss/articles/CBMinAFBVV95cUxNQlVVRWYxcEM4MGdabFRabmljTWpBNjdXRjc1X3dza3pBYkdYQzkxNWNHRkNoSmwxN3FOT2wzbU1nb0VTb2tDcTZ6aUl4N2l6emYweDl0cldDZjBEN1p3TVNxMFBzaDB3SjdIQ0pEQk9KTkRoY2o3bE5ZdkhyZjlwcm9Cd0wwMTRPVmdOV0R2WlBWdUxMdXpRRnpxWFE?oc=5,"Fri, 06 Mar 2026 19:45:00 GMT",Grocery Outlet to close 6 Philadelphia-area stores as part of national pullback The Business Journals
Grocery Outlet,Rishi Nagar,Closing,"Grocery Chain Closing Dozens Of Stores, Including Mays Landing Location: See Full List - AOL.com",https://news.google.com/rss/articles/CBMigAFBVV95cUxOSkJqQUV6N2lSdU1zTDltaDd1X0lkRGtjRm5lc3dUU2U5NUlXYzNOVHVNXzNLSUVQQ01DRzhSSXZMN0hoZ1VkQk1QbzZaTHlwUmZkRmhqakVPOXlrTzA1eG5jZlRjaDFrSW9qZ3pFQTUwQkp6RVIydVZpbjdLaEVRRQ?oc=5,"Fri, 06 Mar 2026 19:39:30 GMT","Grocery Chain Closing Dozens Of Stores, Including Mays Landing Location: See Full List AOL.com"
Grocery Outlet,Rishi Nagar,Closing,Grocery Outlet supermarket to close 8 Maryland stores - Baltimore Sun,https://news.google.com/rss/articles/CBMickFVX3lxTE42djdXa2hHa3lBTHZkd3ZhVy14TDdwemQyMnljR1RFX3FsTEpsTldiV0dyOGtpZ0dYYVN2UTFzeW5CYjNMd3R4dGZoTVFhaGRWSE9GMHRDTW5HbkpvYUlrNjVzX3R5MVU5RHVkVU16aGdqdw?oc=5,"Fri, 06 Mar 2026 19:24:31 GMT",Grocery Outlet supermarket to close 8 Maryland stores Baltimore Sun
Grocery Outlet,Rishi Nagar,Closing,"Grocery Outlet is closing stores in South Jersey, Philadelphia, and Kennett Square - Inquirer.com",https://news.google.com/rss/articles/CBMilgFBVV95cUxQUU9UYVE5Um1nd2ZtbzJHNjlYM3oyQWJkaW5EWHJXVGZXVzJYaTBrY2ZYdmV6d2dQMmpHYWlzR3ptbmF3QXpFWmM0VmYxUWxGM2dSUmpBVVFkMjFPTnhOajJfZ1VBSDBSVU85NXFvTEp2TXQ2ZWtVekdTVUJReXN5LS16alN1b3djNTNsVVR6dmlHM2FHb1E?oc=5,"Fri, 06 Mar 2026 19:05:54 GMT","Grocery Outlet is closing stores in South Jersey, Philadelphia, and Kennett Square Inquirer.com"
Grocery Outlet,Rishi Nagar,Closing,Grocery Outlet to close six stores in New Jersey and four in Pennsylvania - New Jersey 101.5,https://news.google.com/rss/articles/CBMiZEFVX3lxTE5IU1FwNHQ1X0psVEVzVU5yb3p5cXptbm9yV0k2ZThKV1BhZm1kOXRpTjhmOWN6Rk1GMG9wVkVnRjc3MzhHZW83d0MtVE9uV0JPVXJ6UXJtSHIzeC1nVElYazNYSEc?oc=5,"Fri, 06 Mar 2026 18:38:08 GMT",Grocery Outlet to close six stores in New Jersey and four in Pennsylvania New Jersey 101.5
Grocery Outlet,Rishi Nagar,Closing,Six Grocery Outlet stores in NJ among 36 closing nationwide (updated) - NJBIZ,https://news.google.com/rss/articles/CBMiYEFVX3lxTE43SW15TzBRdnpJU3NOWGlMNVBqN2RyUS1tS0lhbTNlTnNYbmlEcEpNLWVaelJQZ3hKZ3oza2x6RFJ2eDl5UFM2TGNDZWFxNWFOaFhQRjc1ZDN0N3FndEdwcw?oc=5,"Fri, 06 Mar 2026 18:10:55 GMT",Six Grocery Outlet stores in NJ among 36 closing nationwide (updated) NJBIZ
Grocery Outlet,Rishi Nagar,Closing,Grocery Outlet Is Closing 36 Stores Across the U.S. - Cheapism,https://news.google.com/rss/articles/CBMiakFVX3lxTFAxNlVfTVBVMXdnaXAtM20xTWxpc2lnWG0wT25hdFJWNkNuRFhUZDVJeGRDNDRWZ0lfaWpEaldSQkI3bjFPZl9ORVNQemt3NTFRR0VCYVdhUEQ1bF9PeE40UXNIMUkza3RWNVE?oc=5,"Fri, 06 Mar 2026 18:08:09 GMT",Grocery Outlet Is Closing 36 Stores Across the U.S. Cheapism
Grocery Outlet,Rishi Nagar,Closing,"Grocery Outlet closing 5 stores in South Jersey, see SJ stores impacted - Courier-Post",https://news.google.com/rss/articles/CBMi9wFBVV95cUxPbDJuYWZGWXFZaWNvVlFoWFdYMzFzMG5hdThjMDQ1ZVFkenQ0TGtJUFh6WVVNN1dIeWRZUnRGd19qdHo4V1VxZ1U5WVdURmxzaWJqYjFGMHlGOWRpdVQ0OEU0SEd3OGhrNGxNdDA2Umdzei1adFo1UmNCV05uSGdSNDl2ZzVuR2hhTGRiTTFtQXRTX0VqQWR3R21IdmhVaEYzTHNOTS04T0lxazRJa2FtYV95SmpFNU1OYWlYQV9wcU90TWtVVEJvb3l1MmZKeUtKczY3OHRldGNSRjJZZkNFTy1vWVQyM0NWeHQ3cW45enlfSTBtYlF3?oc=5,"Fri, 06 Mar 2026 18:08:00 GMT","Grocery Outlet closing 5 stores in South Jersey, see SJ stores impacted Courier-Post"
Grocery Outlet,Rishi Nagar,Closing,Grocery Outlet closing several NEO stores after growing too quickly - Crain's Cleveland,https://news.google.com/rss/articles/CBMilAFBVV95cUxPTU13SmdjOEF5YW4tQnRoM2t1cTd6bmp3Vmk1VjU1V0w2dzlxYTBRSFhWZmQ0UUpaeGdRczVSNXNfUUZoYTJXeHBKYXk0SkRfZEd3UmdLbVVCSlVWVTN2TzR1d29OSWJ2TTYzc2VyWUJpSW5hTGswQmVxS3o4Y2ROTEdjUl93OEFyYk1pRk94MmdNRl9l?oc=5,"Fri, 06 Mar 2026 18:02:00 GMT",Grocery Outlet closing several NEO stores after growing too quickly Crain's Cleveland
Grocery Outlet,Rishi Nagar,Closing,"Grocery Outlet is closing stores, joins growing list of retail chains shuttering locations in 2026 - Fast Company",https://news.google.com/rss/articles/CBMilgFBVV95cUxNdFl1MHBYRWd2ZUtyNkJNWFp5S1R4eHF3aDg3Rnd3TnVhcXVoZXM4czNNREh4SFpweGNacDVKVVdleU9LN1FSMzJySnRUU0tSaGp2Z3RnRkJmVkZISjVIV1FSMkJoQU9uYmhJbUdNMWE5OC1LVUtkemc1WUJnam44VXR0TEpqNWdtT29nOWJ3Q0JQVVB4M2c?oc=5,"Fri, 06 Mar 2026 17:51:06 GMT","Grocery Outlet is closing stores, joins growing list of retail chains shuttering locations in 2026 Fast Company"
Grocery Outlet,Rishi Nagar,Closing,"Grocery Outlet to close 36 stores, including 2 in Philly - PhillyVoice",https://news.google.com/rss/articles/CBMif0FVX3lxTE1YTDExQjlDRDY1UG9LemhOQXU2UkFodXNEcW14TE5XZjBZMVN6Wlc1RGJxcHFRajZoT3lNekR4QTJ4Y2UxdVE5MGpEam1xQ2dOV3dQc1BmUnpZWi1oLTdPMjZkVGhpajdYOHlFRDVtS2F2b1RtaG5Nd1dZU1pTYTA?oc=5,"Fri, 06 Mar 2026 17:34:48 GMT","Grocery Outlet to close 36 stores, including 2 in Philly PhillyVoice"
Grocery Outlet,Rishi Nagar,Closing,Major national grocery chain closes 36 underperforming stores - thestreet.com,https://news.google.com/rss/articles/CBMijAFBVV95cUxNMWliSkJTbzlKSG91a3p3OGZocHVESkZtU2xsbTFfTldtMFRObDlvNHRFUV9Xc3c1d2JncDJFZlZ0ZzBIZ2pYbUpDUy1zZXYzQWlZRW13OTJwX0s2WDRXTXFZLXJQeWk0LURXRVA3X19tdG9uVDAtSEgyWWN3bVVJUl92WjAtSVhtSjdzag?oc=5,"Fri, 06 Mar 2026 17:23:41 GMT",Major national grocery chain closes 36 underperforming stores thestreet.com
Grocery Outlet,Rishi Nagar,Closing,"Grocery Outlet to close 36 stores this year, including 8 in Maryland - WMAR 2 News Baltimore",https://news.google.com/rss/articles/CBMipwFBVV95cUxOSF9Md2o5b1hheDJXbzlKd2tBN3FmcWZmTnhyU2dWVUxOM2FkTzZJd2FkRnlQZWc1WDVnRWJ6c0lPYVlYX3dqMzZJRThjclB3NEVtUk1Dd1BteU13T0k5VG5mTG10aG1jVGFiVkMwWi16NXJLZXUzZzNva2RwZFp4S3ZzamtVaURIRWlZOTZBenByRXdjdDZqNWhpcDNJUlRKYmwtQ3dqMA?oc=5,"Fri, 06 Mar 2026 17:14:49 GMT","Grocery Outlet to close 36 stores this year, including 8 in Maryland WMAR 2 News Baltimore"
Grocery Outlet,Rishi Nagar,Closing,"Grocery Chain Closing Dozens Of Stores, Including Mays Landing Location: See Full List - dailyvoice.com",https://news.google.com/rss/articles/CBMiqwFBVV95cUxNMGxLanVqX1Z5V1lsbnBUWmR3VGd6bUNtcHhtNHV2VTZ6N2s1VEF5QWNGUHlfd0QxWXNDMDFDREg5MTV4aG9la2RzaENMZEw5SDIxSUxPQ1llMUdhTkVSNWZXbElMbWF4LTFXVlBJSW9KbXFJc2NXdUFzX0hzWnFpTlhDSnd6TmJsLVlBSFJxdGhTWFRiU194djFTRVRWSlhmRlVNM3BBNWltdVU?oc=5,"Fri, 06 Mar 2026 16:57:57 GMT","Grocery Chain Closing Dozens Of Stores, Including Mays Landing Location: See Full List dailyvoice.com"
Grocery Outlet,Rishi Nagar,Closing,VA Grocery Chain Planning Dozens Of Store Closures - Patch,https://news.google.com/rss/articles/CBMijwFBVV95cUxQazNWTVlPOEVMY1BFcUxXMUg3TGk2SmxybW9DUVptT1g2SGs0aTdqbEV6Rk5QY0JKakxkeDl0WWRLNDQwdmQ1MHltQ0FVU2lQSGw3LU8wbHlsbFFVU0tTSDVNeWhDbXNYMTFPMlJ5Tm9NZllfM1NBdmV2Z0U4YTV4S0xJd0RUSW81eGx4Z1hva9IBpAFBVV95cUxPRHdMTzc4YjJLcjlEbGdVTmtLeHB4azlZWE9zMWUyV1VOQXNyM0podXBub3oteGZwbm5pUWxaeXhNaHQ2VUNpWVFYWEFkREpJbFBEY2d1eW03bENyd1llUFZycnJjdmlUX2R6LXlaaFFJMEJLWXlfQnNtRGRCdEE2N003N0NuYlRoRmxUOVhTdG1tbG5TUi1wemFhbWdPUGdyMHl3Sg?oc=5,"Fri, 06 Mar 2026 15:39:54 GMT",VA Grocery Chain Planning Dozens Of Store Closures Patch
Grocery Outlet,Rishi Nagar,Closing,"Discount Grocery Chain To Close 8 MD Stores, Dozens Nationwide - Patch",https://news.google.com/rss/articles/CBMijwFBVV95cUxQMDllbjVKWjRtcm9TLS12bDk1VmRJS0tXajVsODItNTdCY1g5ZWRrV2dmdl9YRVJGb2tlLS1CdGFOT0ZzQlprbUNhODhReU5lY25JNms2M0RoaWtfU2M0VU1xb2R3ZzJvOXNCckpRbzQxZzRsWHNUMll3SFU3MnJjQUtGN1hfMW9FTG9RY0xjZ9IBswFBVV95cUxNcjYtUUFqNUU1d0tPZ01VVTNOczVSTFZ5MmkyNGhXV185UGZKZ2JJX1BDODlPVjIyNFRuWUhSaE1QalRJakFWcmNPTHptLW85VnZISFdpUzVjZ2tWZHFtSW9CVDRnNTVNRkxMY3huaEc2Z1cxbU1RbWNETk9wUkxMZUJLLUlxczhMRnRGSUtDTDZUZmNOMjRBejJ1WklXdWxHUjM3Q0JsTU1DZWY2NlR4QmV0Zw?oc=5,"Fri, 06 Mar 2026 15:28:58 GMT","Discount Grocery Chain To Close 8 MD Stores, Dozens Nationwide Patch"
Grocery Outlet,Rishi Nagar,Closing,Grocery Outlet Bargain Market in Austintown to close after less than a year in business - WFMJ.com,https://news.google.com/rss/articles/CBMiwAFBVV95cUxOTkJaOEZKcjVYZEROQko0ZU9LUkx0bEROR0d6dDlsclB0ODJEb2Z5SDl0RXZXMG5zdWUtNk44N0ZMbnN5bm1oTGlzZ1Q4NzhUek9TNXVfQnJjbDhOQVk2cTJWMzFSZS1QWERKbVhrYXNGS1AtUl9zRkRYaFVQQUVUd0lfOXhaWDZNVFpFdVNlUmxBVk1SRldNVkRKZmxNTUFYRWJoNEVaUlhhUDlBbjJMZzRKd2VRMW5oc25YcXVCRGM?oc=5,"Fri, 06 Mar 2026 15:25:42 GMT",Grocery Outlet Bargain Market in Austintown to close after less than a year in business WFMJ.com
Grocery Outlet,Rishi Nagar,Closing,"Grocery Outlet Bargain Market closing 36 underperforming stores, including several in Pennsylvania and New Jersey - 6abc Philadelphia",https://news.google.com/rss/articles/CBMi0wFBVV95cUxOenNzVUJyZW9jRUhpUlhvbGxJNDAxWHJxY2pRY1ZIcWsyQmpjSk9WalNNUmRpOEM4MVNadDZvN2sya2hfRkVSU1NYX2pzTURLM0I4T2t3cjVYS2tVc2dvUTJtY2hJM1JSVXI4Q0w5NXRPRUNIa0FQMGoxM085VDFUakhzOUJDSmxHY3lwVGstdlhpXzBkQ083YWdsSDdBTEVYbXBqY2R0QzRyTGVXZmZFcmtONUJ5bjY5MEpMV1ZUWmhjSGRjVXFXS3YxSDlwZVVvdElZ0gHYAUFVX3lxTFBaWUhHN05nV0RsVHh4X1loVVI1QVJveHRmbG9yU3hpWURYeWJqZ0RUbDlDUVJPUWNOQTB1NUowT1BWaWEyenpwS0dleXUwUlRDQ1dNNFNjS1ZTTGxBUW5Ka29uRloxeXRWRzljOWZXMF9MbjV5dDdSY1ZQLTdYVkQxV3lfd29GVFRwazNBREFZWjYteGpuY3hLRVRoYllweWplUnBHWXI5SFZDZXR6NmgzQTFJLXFxZ0JBTDNSeFI2bDRNbjZNQ1c4UDEwdU9kMVdLNld1UHBUeg?oc=5,"Fri, 06 Mar 2026 15:18:26 GMT","Grocery Outlet Bargain Market closing 36 underperforming stores, including several in Pennsylvania and New Jersey 6abc Philadelphia"
Grocery Outlet,Rishi Nagar,Closing,"Grocery Outlet Bargain Market closing 36 stores, including several in Pennsylvania and New Jersey - AOL.com",https://news.google.com/rss/articles/CBMiiAFBVV95cUxOclJkUzRVLW81Z3VkUDBSM2lXM0s1Y3lWVnpPUHI3RjhJSDlTWVBCbUJXamJoRWY2MzdDS01zc3M1ZUFVczd6RzhOUWRCOHFsbU5XRGctZDk1RHlWVHgwcWNSSlFYUHpiQVBEejZOdGZCVlZqMGNqVHhRa25tenlzcDhDZmhGVmNi?oc=5,"Fri, 06 Mar 2026 15:11:45 GMT","Grocery Outlet Bargain Market closing 36 stores, including several in Pennsylvania and New Jersey AOL.com"
Grocery Outlet,Rishi Nagar,Closing,5 South Jersey Grocery Outlet Stores Closing Soon - WPG Talk Radio 95.5 FM,https://news.google.com/rss/articles/CBMibkFVX3lxTE1IaE04SkhiaEVCanhQUEFJYU9SNGRVODRveEZZb0kwNl96OXo2YWtIZHdGWk1wUDR4WFJESThsNjRfdlZuLVFJOWljNm52S3hPNHZ6c2JfcEJWakpSUDJNY3FPbHB6VU4xQmxicDh3?oc=5,"Fri, 06 Mar 2026 14:35:39 GMT",5 South Jersey Grocery Outlet Stores Closing Soon WPG Talk Radio 95.5 FM
Grocery Outlet,Rishi Nagar,Closing,Grocery chains shutter dozens amid retail slump - MSN,https://news.google.com/rss/articles/CBMi4wFBVV95cUxPczVYMkhNcGFfeWtwMUVBcmpFUzN4eW5SNWlsNk13YTBMbWJ5ZmRidkRBVFZ3Rm9faUVaU19qWFBJNVNHM3E0aUNsQkE5aWpsQjJ0cXZsYXRoU2R0YmI4QkpTUUUwRDVsT251SWlJVWJBMVduR2RQeXQtZkxueHFvNWpSSjlOQkVrR0g4WFVyRGhwNjBoeG1BZ2c4WjBveTlmaWpGUWowbUtGaDVOU2ZBMUNBUkQwM1lXSFUxQlY2UUhlb1JvMXEzclFacmxYMFQtS2J0aXVNY3NwU0JheEotSzdmNA?oc=5,"Fri, 06 Mar 2026 14:10:41 GMT",Grocery chains shutter dozens amid retail slump MSN
Grocery Outlet,Rishi Nagar,Closing,Grocery Outlet to Close 36 Underperforming Stores After Sharp Quarterly Loss - www.whatjobs.com,https://news.google.com/rss/articles/CBMiqwFBVV95cUxOU0xVdGd4WDZkeHNjZWF1cmY5TTVnekVSWkZEOG5Lbl85ZlRYdm9JQXVoYnVra19naXk1Q3ZtUFoxNXQ5UHZyRndGOGd4ZFZYdkpKTW5IMTZ0cGZkU25iUllBclFOVENCQWV1Q3ZxcFQ0Qk9LU25yUnFSU0ZRMmxaSi1weU5mMmZjSnlrUXRKbnJ1TTZTbmU4WTlSeUhNRjV2bThVZm9QdUxFZms?oc=5,"Fri, 06 Mar 2026 14:00:57 GMT",Grocery Outlet to Close 36 Underperforming Stores After Sharp Quarterly Loss www.whatjobs.com
Grocery Outlet,Rishi Nagar,Closing,"Grocery Outlet closing 36 sites, are Bucks County stores safe? - PhillyBurbs",https://news.google.com/rss/articles/CBMi7AFBVV95cUxQdjhoal8xUTZHY3lad0JVOEk3T1p6ZXlwaVRpRnhKTGVDaFNnQjBSWjVwS20wVzlsRFJURWE5eDF4LXBVRXF0ak9tRzUxVURXWmhra0hfQzYyUV85X1pESmpkaTlvTzN4LTRMbjlYYnIxeV9RSGhNdElEOWU3SGw0a3ZxU0pyUjZJYjdoNHF5SGp3UVEydGl4d1h1OXBERm9uU3hUdUZad2hiQ0hxRnNnZnV5dkhZSVJkX3lrQUc1N05Rd1U4OEZ3YWw1RTBEZEp6NjRBS3hPQnhkOC1BdnNPR054cmR5OHVQc3AySg?oc=5,"Fri, 06 Mar 2026 13:46:00 GMT","Grocery Outlet closing 36 sites, are Bucks County stores safe? PhillyBurbs"
Grocery Outlet,Rishi Nagar,Closing,Grocery Outlet in Austintown closing - WKBN.com,https://news.google.com/rss/articles/CBMilAFBVV95cUxPZXVCMmhRa0ExODE5MUxLMXJ5WTZsdVVsTTBVVUFtWFR5ZHZUUE9HZkgtajJtR0UyLW1QVUZzamZROU9HdFlYY0hmSXpmejI1dS1lWGxRNHRQNnN4cmVDbG82Ym9OQTlsazNpczQtNU84bHNEN2tjaWtwcUprZXRfRHd4OHhKcHl3M2dCTlY2bU5ocmsx0gGaAUFVX3lxTE1kazF6ODUzYWt6bkJUa1dyRVRjUWZ6alhSWTlwQ0E5UTdXcUdrcHdPV0VFNy00OFlYTnhFaFlFaFBNaGp1eFkwSkdRN2phZ1JJd1RGdGd2Qnk2ZkFXVGhwU2M5VG50X0QzeU5pRy1wVGNNcWZuSjVyQmVaTmd1andLa3N3aW05NXJVVlBGVHQtU2FQOThpbUYzb2c?oc=5,"Fri, 06 Mar 2026 13:16:36 GMT",Grocery Outlet in Austintown closing WKBN.com
Grocery Outlet,Rishi Nagar,Closing,Grocery Outlet in Austintown closing - Yahoo,https://news.google.com/rss/articles/CBMijAFBVV95cUxQVDBWejRuZWNFQmNnbDNQeDVGV3JINGJxUUNIa05rb0NYMklQWFp6WWxOSVRBYUlDaGs1M0tQWEpUblZmRUJyRndRWVlLbjlRc0NvLXZteGhvWHpvY2tsblZVU0dYT2ZvZFJkaHB4S2VBMzNZRnNIYXhZWk1tdU5UY0RiM1l5akRkN0daYg?oc=5,"Fri, 06 Mar 2026 13:16:36 GMT",Grocery Outlet in Austintown closing Yahoo
Grocery Outlet,Rishi Nagar,Closing,"Popular grocery chain closing dozens of locations, Alabama stores not impacted - AL.com",https://news.google.com/rss/articles/CBMiqgFBVV95cUxNWFBPR01GQjN3QmRrSXpIckxVS2NLUjd3UTB4WGIyaVhETG5ZbnZlejFFZGE0SHYyOXZRN0pnLVJvWmdGTzVYOEVVa2lodjBHaUs0elNoTGI3eGhxc3duMDNvb1pPMk9nbFVxN3dpR1ZQRExGVGJNQUgwUENBQUNselVnZ3FrdUhWQzVaV3JwVjJ0LW9mbkVqbDF0MnE3WUFHNkpQSHdueHVuQdIBvgFBVV95cUxPZlM0NXlvajZYUVFfRldCNU1QSkpTSW5GSGhuSEhGeXBOZVlOeGhiLVJ5RTl2Yk5IdlloMXZMbGhXY2xGUjVzeXJkU0w2V05YMkVoOVRsRm91QlBSNTFRS25OTVNEQzdZR1dFZ2hwNkFBbmJmek0yZzROb2EtbXVjbnZZMlk2eU1PZjMxemVRVDZ3ekJFRHIxQjVDdlpuWFN1V0JwOERxXzlYenBFbS1BT1hpNG9XS1REbTNZZHlB?oc=5,"Fri, 06 Mar 2026 13:10:00 GMT","Popular grocery chain closing dozens of locations, Alabama stores not impacted AL.com"
Grocery Outlet,Rishi Nagar,Closing,Grocery Outlet to Shut Down Several Struggling Locations Across the U.S. - Meyka,https://news.google.com/rss/articles/CBMimwFBVV95cUxQcDYwVXhpemVpQkladHhoUHhjWFJLRTJkQTgtUWd4clN0bzM1SHprWjJ4c0wxSTVOal9oQWt5bzR0TFVXRkJKUTdZaE1nN1JsOWYxcE5wdmFnZHNlS3NxZ2hkZVpBWHpzeHV4WGVYQmRiWXIybmRCUHkzbTFGSm5yMWl0ZURMYlFfLVIwRlpDQmZpWEZqQUJienRwVQ?oc=5,"Fri, 06 Mar 2026 11:38:01 GMT",Grocery Outlet to Shut Down Several Struggling Locations Across the U.S. Meyka
Grocery Outlet,Rishi Nagar,Closing,"Grocery Outlet is closing stores, joins growing list of retail chains shuttering locations in 2026 - Yahoo Finance",https://news.google.com/rss/articles/CBMiiAFBVV95cUxPWktUcE1JWXRLOU9lUE9vMm0waTV4MF8yM1JrMk9XcUl5eHZBUi1VZEM3Ul82S1RXSDdxQUF2M0VxaW9JeHY5X0ZJODBmX3VTQzAwNXg3U2F3TTY0TTU5WEh3NXdGLXd3WnBQZHhQWU9kX3FOLUlLMHJ5c2g4TUpoSnRLTWRkd0VZ?oc=5,"Fri, 06 Mar 2026 11:31:00 GMT","Grocery Outlet is closing stores, joins growing list of retail chains shuttering locations in 2026 Yahoo Finance"
Grocery Outlet,Rishi Nagar,Closing,"Grocery Outlet to Shutter 36 Stores, Admits It ‘Expanded Too Quickly’ - NTD News",https://news.google.com/rss/articles/CBMioAFBVV95cUxNRTA4LVR4VGNBNlJRODJhMXYwR0tSMVNCNE1xOGprSklBQjgzaUE0Mk1ueURINzBNUHFmWWxVWGhaaVZUS2VoVmN2djlGWVVOMnUzbXlmbHlLc2dXOGxXb2ZoUEpZX0p4clc1eFpRVG5GTHprelhyRFhPdE9UMmJUR3lWLWxmNnM2eFdaNTgtYUNxdDZOZ1E1MzZNSExvbVpU?oc=5,"Fri, 06 Mar 2026 10:45:45 GMT","Grocery Outlet to Shutter 36 Stores, Admits It ‘Expanded Too Quickly’ NTD News"
Grocery Outlet,Rishi Nagar,Closing,Grocery Outlet closing 36 stores. Will Delaware be impacted? - Delawareonline.com,https://news.google.com/rss/articles/CBMivwFBVV95cUxPUTFmalZnXy1xd2RzSWg4UDhtMGxsX29QVm1yd083dkx4amw3LU43LWFkQkJzUHZad1R2eVFFcHdSR2xKaEpyZktpNnU3Y2R4MlgyNXRPOTFzbDBCQlh4X3l3SFd5NWNucFh5NEZMc2t1MFB3TXQ0S2hyYTFLSXZ6d1FCUlZSZkl1emo2WVFtS3hfeXhSd2V1dTlTRWIyVDJWbDM2cXFQOVFNb09lQXk3RmE0Mkl5ZG1OdDlFa0Nxaw?oc=5,"Fri, 06 Mar 2026 10:41:00 GMT",Grocery Outlet closing 36 stores. Will Delaware be impacted? Delawareonline.com
Grocery Outlet,Rishi Nagar,Closing,Grocery Outlet planning to shut Hazlet supermarket and 5 others in NJ - Asbury Park Press,https://news.google.com/rss/articles/CBMi3AFBVV95cUxORFk2dHJkLThBVHV6OEJ2eXBMakgzOFZXV3M0cm84SmdhOGlod1MzRmRfdmFDTk9VTV9jMnVmN3ZxYUFaenJpb09Ec0VtRV83YVJxX0NoSnEtb3ZncFZHbFZOTnBaYXhVREVPbkszcC00dnFXVU1KUE9wcHIxQ045ZWhSV0FGTjlCYUxWbmN6YkVWYk5UV0k4NnhuMEZnLU4taEltaDFlQUJWYzVjOWNqUWZwOHliSml3a1NoOVpwdUw4UUpzS2pSN25oTS1pTFJDMGE4U2lCNkY2WW1Q?oc=5,"Fri, 06 Mar 2026 10:15:00 GMT",Grocery Outlet planning to shut Hazlet supermarket and 5 others in NJ Asbury Park Press
Grocery Outlet,Rishi Nagar,Closing,Grocery Outlet Closing Rio Grande Store - Wildwood Video Archive,https://news.google.com/rss/articles/CBMifkFVX3lxTFBwb3kyYkRJSy1YckRjU21Pb2h4U0oxeEU3TmE2dWxhOGtBVGhNN2dhRmRuSDI3Ri1IZzdYaGFQRVJlZnJuMTRpWUJtLW80X2oxSjFORS1pY2FlM0RYUWR6WDJaMTF4ejZsdG5IcHJqTW5UQ0hSV1B1M09BaUMyQQ?oc=5,"Fri, 06 Mar 2026 04:47:42 GMT",Grocery Outlet Closing Rio Grande Store Wildwood Video Archive
Grocery Outlet,Rishi Nagar,Closing,Why Grocery Outlet Stock Crashed Today - The Motley Fool,https://news.google.com/rss/articles/CBMiiAFBVV95cUxQTHVYcTdBWXFFa2JEUGNFbmF2ZlpDV2ltdzdUbGtDLXFwUVdVWkh3ajc3enFPNHRlU3MxRlB1QUdqSVE0RHE5LW1qd2RJVURmMTREaGtuNF9yUWtoREpzTUtQMDh0aWJHOHA4YTV6eXhFakZVVDRwdnpFQmVUTGJNV0t0WHNYUkhv?oc=5,"Fri, 06 Mar 2026 03:27:00 GMT",Why Grocery Outlet Stock Crashed Today The Motley Fool
Grocery Outlet,Rishi Nagar,Closing,Grocery Outlet to close 36 stores - KGW,https://news.google.com/rss/articles/CBMiuAFBVV95cUxPNkhkWFA3bzBiSGtvNlFkNHROX2QtdnpBQ002WXBNazZxc3pIY0NTdkswU2N0Yk1sQVgxZzNpX2FMN2hNVlJUeUgxLTVnVDN0cVVLSk8wRW9nZXN6U3JLbUd0UjVfZ2o5Y3JiLWUxQVBkR2FsSWRhYmljNnpTelllZ1RyM2ZUb0wzX2thY0swenpMLUxVVEUxT2NjdDkwdFYybGVLRk9uMW94dFg0STVoWmFDX2ptMk0z?oc=5,"Fri, 06 Mar 2026 01:42:00 GMT",Grocery Outlet to close 36 stores KGW
Grocery Outlet,Rishi Nagar,Closing,Grocery Outlet to close 36 stores - KTVB,https://news.google.com/rss/articles/CBMiugFBVV95cUxObl9ZSWtPVmhWUDR5SGJ1SndHR3dKcEhoSDZUcEp0UGhkQk5sejRXOU8xZWFNTFc0R1l6djc5dVBZT0N1b3d3ZGhzWmlxOXhGdmdsUUNpY09zY21yWHpCTmFPXzJlY0pKYkxSM2JjdFc1R2VhQVowT3B1Ny1YUHBrUWxVQ3UtU0JMS2hkSUZqdEI4XzB1MkVXczJheC1qVV9ucHM3MW9fZTVyOE85NlAtOWg1Rlg1N1R5ZlE?oc=5,"Fri, 06 Mar 2026 01:42:00 GMT",Grocery Outlet to close 36 stores KTVB
Grocery Outlet,Rishi Nagar,Closing,News | Grocery Outlet’s closing of three dozen US stores marks rare retreat among discounters - CoStar,https://news.google.com/rss/articles/CBMixAFBVV95cUxQQmVXbk5ySjdsd3RVQUp6MW1ucklsVmQyTUhnUEV6OFFiUE1UODdtUWhraGpYLXFpZXBPdFZTSWdTb1JxSGRja1N2TEN4c0lDZmFTY01WZW1lRC1ESTJzY1AwempkbDVCWEVLSEgzbHI4eXRSSXVaeUs4RFVyWkk5MFJ4SDlrYmlXVUhMZ09pYWNCc2ZkSWVfNVlYeEpSc1duQ3ltSGZOUlZWaUNaaXhKVllxZU9QVlEycWlZaGI4b1hrQXNB?oc=5,"Fri, 06 Mar 2026 00:01:58 GMT",News | Grocery Outlet’s closing of three dozen US stores marks rare retreat among discounters CoStar
