date,title,address,url,Date_Appended
2026-05-06,La Catrachita Expands to Northeast Philly With Halal Twist,"8016 Frankford Ave., Philadelphia, PA 19136",https://whatnow.com/philadelphia/restaurants/la-catrachita-expands-to-northeast-philly-with-halal-twist/,2026-05-06
2026-05-06,Floretin Rooftop Bar Pairs Signature Cocktails with Stunning Views,"617 S Spring St, Los Angeles, CA",https://whatnow.com/los-angeles/restaurants/floretin-rooftop-bar-pairs-signature-cocktails-with-stunning-views/,2026-05-06
2026-05-06,Smalls Sliders Slides Into South Denver With Seven-Unit Deal,,https://whatnow.com/denver/restaurants/smalls-sliders-slides-into-denver-with-seven-unit-deal-its-very-forward-its-very-gen-z/,2026-05-06
2026-05-06,Another Broken Egg Cafe Headed to Bandera Pointe in Northwest San Antonio,"11625 Bandera Rd, San Antonio, TX 78250, USA",https://whatnow.com/san-antonio/restaurants/another-broken-egg-cafe-headed-to-bandera-pointe-in-northwest-san-antonio/,2026-05-06
2026-05-06,NYC Staple Joe's Pizza Expanding to the Fenway,"1363 Boylston St, Boston, MA 02215",https://whatnow.com/boston/restaurants/nyc-staple-joes-pizza-expanding-to-the-fenway/,2026-05-06
2026-05-06,"Wine, Darling! Bringing Joyful Wine Bar Concept to Pioneer Square","313 1st Ave S, Seattle, WA 98104",https://whatnow.com/seattle/restaurants/wine-darling-bringing-joyful-wine-bar-concept-to-pioneer-square/,2026-05-06
2026-05-06,Dessert Café Planned for Hot Plaza in Baton Rouge,"7474 Corporate Blvd, Baton Rouge, LA 70809",https://whatnow.com/new-orleans/restaurants/dessert-cafe-planned-for-hot-plaza-in-baton-rouge/,2026-05-06
2026-05-06,Owner of Trompeau Bakery Preparing Third Location in Cherry Creek,"3239 E 2nd Ave, Denver, CO 80206",https://whatnow.com/denver/restaurants/owner-of-trompeau-bakery-preparing-third-location-in-cherry-creek/,2026-05-06
2026-05-06,Chamblee Tap and Market Secures New Building In Kennesaw | What Now Atlanta,"2881 N Main St, Kennesaw, GA 30144",https://whatnow.com/atlanta/restaurants/chamblee-tap-and-market-secures-new-building-in-kennesaw/,2026-05-06
2026-05-06,Denver Restaurant Leaders Gather at Trybal African Speakeasy for WhatNow Accelerate Event,"1670 Champa St, Denver, CO 80202, USA",https://whatnow.com/denver/restaurants/denver-restaurant-leaders-gather-at-trybal-african-speakeasy-for-whatnow-accelerate-event/,2026-05-06
2026-05-06,Nutmeg Bakery and Cafe Aims to Open its Third Location,"4120 Napier St San Diego, CA 92110, USA",https://whatnow.com/san-diego/restaurants/nutmeg-bakery-and-cafe-aims-to-open-its-third-location/,2026-05-06
2026-05-06,Burnet To Receive New HTeaO Location | What Now Austin,"1408 S Water St, Burnet, TX 78611",https://whatnow.com/austin/restaurants/burnet-to-receive-new-hteao-location/,2026-05-06
2026-05-06,16 Handles Expands To California; 2 Units Planned for North County,,https://whatnow.com/san-diego/restaurants/16-handles-expands-to-california-2-units-planned-for-north-county/,2026-05-06
2026-05-06,El Palacio de los Jugos is Opening in North Miami,"12500 Biscayne Blvd, Miami, FL 33181",https://whatnow.com/miami/restaurants/el-palacio-de-los-jugos-is-opening-in-north-miami/,2026-05-06
2026-05-06,Sake Bar Gaga to Debut in San Diego Next Month,"634 14th St, San Diego, CA 92101",https://whatnow.com/san-diego/restaurants/sake-bar-gaga-to-debut-in-san-diego-next-month/,2026-05-06
2026-05-06,New Orleans Restaurateurs and Industry Leaders Come Together for What Now Media Group’s Accelerate Event,,https://whatnow.com/new-orleans/restaurants/what-now-media-groups-accelerate-event/,2026-05-06
2026-05-06,Cook Out Expands Footprint With Thomasville Land Purchase as Charlotte Location Takes Shape,"10820 Woodland Beaver Rd, Charlotte, NC 28215, USA",https://whatnow.com/charlotte/restaurants/cook-out-expands-footprint-with-thomasville-land-purchase-as-charlotte-location-takes-shape/,2026-05-06
2026-05-06,Popular Alpine-Themed Restaurant in Portland Set to Close,"3384 SE Division St, Portland, OR 97202",https://whatnow.com/portland/restaurants/popular-alpine-themed-restaurant-in-portland-set-to-close/,2026-05-06
2026-05-06,‘The Cafe at MOTO’ to Offer Coffee Spot for Artists and Innovators in Ferndale,"721 E Saratoga St, Ferndale, MI 48220",https://whatnow.com/detroit/restaurants/the-cafe-at-moto-to-offer-coffee-spot-for-artists-and-innovators-in-ferndale/,2026-05-06
2026-05-06,"Born as a Coffee Cart, Barakah Beans Plans First Brick-and-Mortar Location","3262 Vineland Rd, Kissimmee, FL 34746",https://whatnow.com/orlando/restaurants/born-as-coffee-cart-barakah-beans-plans-first-brick-and-mortar-location/,2026-05-06
2026-05-06,Tropical Smoothie Cafe Headed to Neptune Beach,"628 Atlantic Blvd, Neptune Beach, FL 32266",https://whatnow.com/jacksonville/restaurants/tropical-smoothie-cafe-headed-to-neptune-beach/,2026-05-06
2026-05-06,Al’s Yum Yum Opening in Fruit Cove,"126 San Jose Blvd, Fruit Cove, FL 32259",https://whatnow.com/jacksonville/restaurants/als-yum-yum-opening-in-fruit-cove/,2026-05-06
2026-05-06,Better Blend Making Tampa Bay Debut on June 6,"955 E Brandon Blvd, Brandon, FL 33511",https://whatnow.com/tampa/restaurants/better-blend-making-tampa-bay-debut-on-june-6/,2026-05-06
2026-05-06,Two Parents Introducing ‘Mini City Play Cafe’ for West Town in Early Fall,"1701 W Grand Ave, Chicago, IL 60622",https://whatnow.com/chicago/restaurants/two-parents-introducing-play-cafe-to-west-town-in-early-fall/,2026-05-06
2026-05-06,New Coffee Shop Planned for Holmes Beach,"5400 Marina Dr, Holmes Beach, FL 34217",https://whatnow.com/tampa/restaurants/new-coffee-shop-planned-for-holmes-beach/,2026-05-06
2026-05-06,Butcher & Thief to Debut a New Brunch Menu This Mother’s Day,"8670 W Sunset Rd, Las Vegas, NV 89148, United States",https://whatnow.com/las-vegas/restaurants/butcher-thief-to-debut-a-new-brunch-menu-this-mothers-day/,2026-05-06
2026-05-06,Sushi by Bou Coming to the Financial District,"11 Stone St, New York, NY 10004",https://whatnow.com/new-york/restaurants/sushi-by-bou-coming-to-the-financial-district/,2026-05-06
2026-05-06,A Popular Tennessee Barbeque Brand to Open Its Largest Location Yet in Brentwood,"710 Old Hickory Blvd Suite 305, Brentwood, TN 37027",https://whatnow.com/nashville/restaurants/a-popular-tennessee-barbeque-brand-to-open-its-largest-location-yet-in-brentwood/,2026-05-06
2026-05-06,Harland Brewing Co. to Open Harland Clubhouse at Mission Bay Golf Course | What Now San Diego,"2702 N Mission Bay Dr, San Diego, CA 92109",https://whatnow.com/san-diego/restaurants/harland-brewing-co-to-open-harland-clubhouse-at-mission-bay-golf-course/,2026-05-06
2026-05-06,CeOs Coffee Plans for Sunrise Manor Opening,"5130 E Charleston Blvd, Las Vegas, NV 89142",https://whatnow.com/las-vegas/restaurants/ceos-coffee-plans-for-sunrise-manor-opening/,2026-05-06
2026-05-06,Turquoise Wine Bar is Coming to The Woodlands,"7 Switchbud Pl, The Woodlands, TX 77380",https://whatnow.com/houston/restaurants/turquoise-wine-bar-is-coming-to-the-woodlands/,2026-05-06
2026-05-05,Field Day to Bring Foraged Cocktails to Philly's NoLibs,"923 N 2nd St. Philadelphia, PA 19123",https://whatnow.com/philadelphia/restaurants/field-day-to-bring-foraged-cocktails-to-northern-liberties-hyper-local-hyper-seasonal-approach/,2026-05-05
2026-05-05,Ajua Mexican Kitchen & Bar Brings a Flavor-Driven Experience to Jacksonville Beach,"107 2nd Ave N, Jacksonville Beach, FL 32250",https://whatnow.com/jacksonville/restaurants/ajua-mexican-kitchen-bar-brings-a-flavor-driven-experience-to-jacksonville-beach/,2026-05-05
2026-05-05,"Las Vegas Jerkys to Open in the ""Mini Mall at Charleston""","3100 E Charleston Blvd, Las Vegas, NV 89104",https://whatnow.com/las-vegas/restaurants/las-vegas-jerkys-to-open-in-the-mini-mall-at-charleston/,2026-05-06
2026-05-05,Johnny’s Kitchen and Tap in Glenview Shifting to New Concept This June,"1740 Milwaukee Ave, Glenview, IL 60025",https://whatnow.com/chicago/restaurants/johnnys-kitchen-and-tap-in-glenview-shifting-to-new-concept-this-june/,2026-05-05
2026-05-05,Restaurant Opened in Memory of Cousin Announces Unexpected Closure,"954 US-6, Mahopac, NY 10541, United States",https://whatnow.com/new-york/restaurants/restaurant-opened-in-memory-of-cousin-announces-unexpected-closure/,2026-05-05
2026-05-05,Phil’s BBQ Planning First Arizona Location in Chandler,"3440 W Chandler Blvd, Chandler, AZ 85226",https://whatnow.com/phoenix/restaurants/phils-bbq-planning-first-arizona-location-in-chandler/,2026-05-05
2026-05-05,"Eldorado Cafe Expanding, Planning Renovations | What Now Austin","3300 W Anderson Ln. #303, Austin, TX 78757",https://whatnow.com/austin/restaurants/eldorado-cafe-expanding-planning-renovations/,2026-05-05
2026-05-05,Jacksonville Restaurateurs and Industry Leaders Connect at What Now Media Group’s Accelerate Event,"107 2nd Ave N, Jacksonville Beach, FL 32250",https://whatnow.com/jacksonville/restaurants/jacksonville-restaurateurs-and-industry-leaders-connect-at-what-now-media-groups-accelerate-event/,2026-05-05
2026-05-05,New Restaurant Slated For Tech Ridge Center | What Now Austin,"500 W Canyon Ridge Dr, Austin, TX 78753",https://whatnow.com/austin/restaurants/new-restaurant-slated-for-tech-ridge-center/,2026-05-05
2026-05-05,What Now Portland Turns Breakside Brewery Into a Meeting Point for Restaurant Operators and Leaders,"1570 NW 22nd Ave, Portland, OR 97210, USA",https://whatnow.com/portland/restaurants/what-now-portland-turns-breakside-brewery-into-a-meeting-point-for-restaurant-operators-and-leaders/,2026-05-05
2026-05-05,16 Handles Slated To Join San Fernando Valley Amid Entry Into California | What Now Los Angeles,,https://whatnow.com/los-angeles/restaurants/16-handles-slated-to-join-san-fernando-valley-amid-entry-into-california/,2026-05-05
2026-05-05,Good BBQ Company Expanding To Hudson Bend | What Now Austin,"3519 Ranch Rd 620 N, Austin, TX 78734",https://whatnow.com/austin/restaurants/good-bbq-company-expanding-to-hudson-bend/,2026-05-05
2026-05-05,Amore Mio Builds Momentum in St. John’s County,"4021 County Rd 210 Ste 3, St Johns, FL 32259",https://whatnow.com/jacksonville/restaurants/amore-mio-builds-momentum-in-st-johns-county/,2026-05-06
2026-05-05,Pizza Shop ‘In Crust We Trust’ Set to Open in Fishtown,"965 Frankford Ave., Philadelphia, PA 19125",https://whatnow.com/philadelphia/restaurants/pizza-shop-in-crust-we-trust-brings-southern-inspired-slices-to-fishtown/,2026-05-05
2026-05-05,Italian Bakery Giulia Expanding To Alpharetta | What Now Atlanta,"2001 Commerce St, Alpharetta, GA 30009",https://whatnow.com/atlanta/restaurants/italian-bakery-giulia-expanding-to-alpharetta/,2026-05-05
2026-05-05,Beloved Asian-Inspired Restaurant and Cocktail Bar in Denver Set to Close,"800 Sherman St, Denver, CO 80203",https://whatnow.com/denver/restaurants/beloved-asian-inspired-restaurant-and-cocktail-bar-in-denver-set-to-close/,2026-05-05
2026-05-05,Table 42 to Serve American and International Cuisine in Downtown Farmington,"32821 Grand River Ave, Farmington, MI 48336",https://whatnow.com/detroit/restaurants/table-42-to-serve-american-and-international-cuisine-in-downtown-farmington/,2026-05-05
2026-05-05,Dive In Food and Spirits to Open Neighborhood Bar Downtown,"525 Meeting St. Charleston, SC 29403",https://whatnow.com/charleston/restaurants/dive-in-food-and-spirits-brings-new-neighborhood-bar-to-charleston/,2026-05-05
2026-05-05,Läderach Chocolate to Remodel Its Galleria Mall Location,"5135 W Alabama St, Houston, TX 77056",https://whatnow.com/houston/restaurants/laderach-chocolate-to-remodel-its-galleria-mall-location/,2026-05-06
2026-05-05,Summer Moon Coffee Files Papers for New DFW Location,"4325 W University Dr #10, Prosper, TX 75078",https://whatnow.com/dallas/restaurants/summer-moon-coffee-files-papers-for-new-dfw-location/,2026-05-06
2026-05-04,"Breakside Brewery Reflects on Growth, Challenges, and Staying Power in Portland’s Beer Scene","1570 NW 22nd Ave, Portland, OR 97210, USA",https://whatnow.com/portland/restaurants/breakside-brewery-reflects-on-growth-challenges-and-staying-power-in-portlands-beer-scene/,2026-05-05
2026-05-04,Cozy Italian Restaurant Coming to the East Village Location,"435 E 9th St, New York, NY 10009",https://whatnow.com/new-york/restaurants/cozy-italian-restaurant-coming-to-the-east-village-location/,2026-05-04
2026-05-04,Hamsa Mediterranean Grill to Open Second Location,"2101 S Decatur Blvd, Las Vegas, NV 89102",https://whatnow.com/las-vegas/restaurants/hamsa-mediterranean-grill-to-open-second-location/,2026-05-05
2026-05-04,"Blue Ribbon Sushi Returning To Palisades Village, Adding Omakase Concept | What Now Los Angeles","15225 Palisades Village Ln, Pacific Palisades, CA 90272",https://whatnow.com/los-angeles/restaurants/blue-ribbon-sushi-returning-to-palisades-village-adding-omakase-concept/,2026-05-05
2026-05-04,A Houston Neighborhood Restaurant Known for Loaded Fries Has Closed,"5322 Antoine Dr, Houston, TX 77091",https://whatnow.com/houston/restaurants/a-houston-neighborhood-restaurant-known-for-loaded-fries-has-closed/,2026-05-04
2026-05-04,Crumbl Expanding To Edgewood Retail District This Summer | What Now Atlanta,"1250 Caroline St NE, Atlanta, GA 30307",https://whatnow.com/atlanta/restaurants/crumbl-expanding-to-edgewood-retail-district-this-summer/,2026-05-05
2026-05-04,Pali’s Ice Cream Co. to Open in Northeast Philadelphia,"7302 Rising Sun Ave. Philadelphia, PA 19111",https://whatnow.com/philadelphia/restaurants/palis-ice-cream-company-to-open-brick-and-mortar-shop-in-northeast-philadelphia/,2026-05-05
2026-05-04,Tacos Frontera to Open in the Marq-E Entertainment Center,"7620 Katy Fwy, Houston, TX 77024",https://whatnow.com/houston/restaurants/tacos-frontera-to-open-in-the-marq-e-entertainment-center/,2026-05-05
2026-05-04,Dish’s Bagels and Other Atlanta Restaurant Openings We Uncovered Last Week (April 27-May 1),,https://whatnow.com/atlanta/restaurants/dishs-bagels-and-other-atlanta-restaurant-openings-we-uncovered-last-week-april-27-may-1/,2026-05-04
2026-05-04,A Popular Café in a Detroit Suburb Has Shut Down,"770 Woodward Heights, Ferndale, MI 48220",https://whatnow.com/detroit/restaurants/a-popular-cafe-in-a-detroit-suburb-has-shut-down/,2026-05-04
2026-05-04,Call Your Mother Expands to Philly's Rittenhouse Square,"262 S 19th St., Philadelphia, PA 19103",https://whatnow.com/philadelphia/restaurants/call-your-mother-expands-to-rittenhouse-square-in-former-metropolitan-bakery-space/,2026-05-04
2026-05-04,A 46-Year-Old Seafood Market Has Closed in in Dana Point Harbor,"34665 Golden Lantern, Dana Point, CA 92629, United States",https://whatnow.com/orange-county/restaurants/a-46-year-old-seafood-market-has-closed-in-in-dana-point-harbor/,2026-05-04
2026-05-04,Soda Club to Open at Denver’s Ramble Hotel This Summer,"1260 25th St. Denver, CO 80202",https://whatnow.com/denver/restaurants/michelin-recognized-soda-club-to-debut-in-denvers-ramble-hotel-this-summer/,2026-05-04
2026-05-04,New Coffee and Donut Concept in the Works for South Shore,"7104 S Jeffery Blvd, Chicago, IL 60649",https://whatnow.com/chicago/restaurants/new-coffee-and-donut-concept-in-the-works-for-south-shore/,2026-05-05
2026-05-03,Murphy’s Law Brewery & Pizza Readying Burleson Debut,"309 W Hidden Creek Pkwy, Burleson, TX 76028",https://whatnow.com/dallas/restaurants/murphys-law-brewery-pizza-readying-burleson-debut/,2026-05-04
2026-05-03,Ritual Bistro Brewing up May Opening,"505 S Main St, Memphis, TN 38103",https://whatnow.com/memphis/restaurants/ritual-bistro-brewing-up-may-opening/,2026-05-04
2026-05-03,Giordano’s Pizza to Help DC Greet the Heat,"600 14th St NW, Washington, DC 20005",https://whatnow.com/washington-dc/restaurants/giordanos-pizza-to-help-dc-greet-the-heat/,2026-05-04
2026-05-03,Latest from TEKILA Group Nears Opening,"181 Norfleet Dr, Senatobia, MS 38668",https://whatnow.com/memphis/restaurants/latest-from-tekila-group-nears-opening/,2026-05-04
2026-05-03,Burleson to Trade Tacos for Chicken,"205 NE Wilshire Blvd, Burleson, TX 76028",https://whatnow.com/dallas/restaurants/burleson-to-trade-tacos-for-chicken/,2026-05-04
2026-05-03,Cafe Momentum Bringing Good Food and Social Justice to New Flagship Location,"3001 Greenwood St, Dallas, TX 75204",https://whatnow.com/dallas/restaurants/cafe-momentum-bringing-good-food-and-social-justice-to-new-flagship-location/,2026-05-04
2026-05-03,Playa Bowls Sets Grand Opening for Collierville Location,"1335 W Poplar Ave, Collierville, TN 38017",https://whatnow.com/memphis/restaurants/playa-bowls-sets-grand-opening-for-collierville-location/,2026-05-04
2026-05-02,Kirby Ice House Hoping to Establish Irving Presence,"1251 W Royal Ln, Irving, TX 75039",https://whatnow.com/dallas/restaurants/kirby-ice-house-hoping-to-establish-irving-presence/,2026-05-04
2026-05-02,Cooper’s Hawk Winery and Restaurant Preparing for Woodbridge Opening,"14901 Potomac Town Pl, Woodbridge, VA 22191",https://whatnow.com/washington-dc/restaurants/coopers-hawk-winery-and-restaurant-preparing-for-woodbridge-opening/,2026-05-04
2026-05-02,Café Monet to Prove Great Dining is an Art,"6910 Fleetwood Rd, McLean, VA 22101",https://whatnow.com/washington-dc/restaurants/cafe-monet-to-prove-great-dining-is-an-art/,2026-05-04
2026-05-02,Angelo’s Pizza Pasta and Deli Heading to Gaithersburg,"18251 Flower Hill Way, Gaithersburg, MD 20879",https://whatnow.com/washington-dc/restaurants/angelos-pizza-pasta-and-deli-heading-to-gaithersburg/,2026-05-04
2026-05-02,Chef-Driven Ramen Shop Coming to the East Village,"218 E 10th St, New York, NY 10003",https://whatnow.com/new-york/restaurants/chef-driven-ramen-shop-coming-to-the-east-village/,2026-05-04
2026-05-01,New Café Concept Evolving in Loehmann’s Plaza,"2543 Fair Oaks Blvd, Sacramento, CA 95825",https://whatnow.com/sacramento/restaurants/new-cafe-concept-evolving-in-loehmanns-plaza/,2026-05-04
2026-05-01,Hold Out Brewing Takes Over Turnstile Bar and Restaurant | What Now Austin,"10025 Burnet Rd, Austin, TX 78758",https://whatnow.com/austin/restaurants/hold-out-brewing-takes-over-turnstile-bar-and-restaurant/,2026-05-04
2026-05-01,Far Cry Opening in the Former Bad Habit Room Space,"5433 N Michigan Ave, Portland, OR 97217",https://whatnow.com/portland/restaurants/far-cry-opening-in-the-former-bad-habit-room-space/,2026-05-04
2026-05-01,Sip Fresh expands to Orange County,"20 City Blvd W, Orange, CA",https://whatnow.com/orange-county/restaurants/sip-fresh-expands-to-orange-county/,2026-05-04
2026-05-01,Bluto’s Working to Reopen Beaverton Location This Summer,"12555 SW 1st St, Beaverton, OR 97005",https://whatnow.com/portland/restaurants/blutos-working-to-reopen-beaverton-location-this-summer/,2026-05-04
2026-05-01,Otori Sushi Plans Second Location for Late Summer,"40101 Monterey Ave, Rancho Mirage, CA 92270",https://whatnow.com/orange-county/restaurants/otori-sushi-plans-second-location-for-late-summer/,2026-05-04
2026-05-01,Harmonies Pizza and Ice Cream Replacing Gracie’s Apizza,"7304 N Leavitt Ave, Portland, OR 97203",https://whatnow.com/portland/restaurants/harmonies-pizza-and-ice-cream-replacing-gracies-apizza/,2026-05-04
2026-05-01,Better Buzz Coffee Interested in Expanding in Vista,"1650 S Melrose Dr, Vista, CA 92081",https://whatnow.com/san-diego/restaurants/better-buzz-coffee-interested-in-expanding-in-vista/,2026-05-04
2026-05-01,Kusi Opening First Permanent Home in Chinatown,"77 Grange Ave, Toronto, ON M5T 1E2, Canada",https://whatnow.com/toronto/restaurants/kusi-opening-first-permanent-home-in-chinatown/,2026-05-04
2026-05-01,Owners of Two Lansing-Area Food Trucks Debuting Brick-and-Mortar in Okemos,"2398 Jolly Rd, Okemos, MI 48864",https://whatnow.com/detroit/restaurants/owners-of-two-lansing-area-food-trucks-debuting-brick-and-mortar-in-okemos/,2026-05-04
2026-05-01,Fat Rabbit Expanding Existing Site in St. Catharines,"34 Geneva St, St. Catharines, ON L2R 4M4, Canada",https://whatnow.com/toronto/restaurants/fat-rabbit-expanding-existing-site-in-st-catharines/,2026-05-04
2026-05-01,Pickled Pig Kitchen & Bar Expanding to Garson,"3098 Falconbridge Hwy #2, Garson, ON P3L 1J4, Canada",https://whatnow.com/toronto/restaurants/pickled-pig-kitchen-bar-expanding-to-garson/,2026-05-04
2026-05-01,A 33-Year-Old Southern California Seafood Spot Is Closing,"17260 17th St, Tustin, CA 92780",https://whatnow.com/orange-county/restaurants/a-33-year-old-southern-california-seafood-spot-is-closing/,2026-05-04
2026-05-01,Faraway Joe’s Looks to Be Opening in Tarpon Springs,"320 E Tarpon Ave, Tarpon Springs, FL 34689",https://whatnow.com/tampa/restaurants/faraway-joes-looks-to-be-opening-in-tarpon-springs/,2026-05-04
2026-05-01,A 141-Year-Old Texas Candy Chain Announces Closure of Its Stores,,https://whatnow.com/austin/restaurants/a-141-year-old-texas-candy-chain-announces-closure-of-its-stores/,2026-05-04
2026-05-01,Buddha Bowls & Rolls to Take Over Former Chando's Tacos Space in East Sacramento,"5644 J St, Sacramento, CA 95819",https://whatnow.com/sacramento/restaurants/buddha-bowls-rolls-to-take-over-former-chandos-tacos-space-in-east-sacramento/,2026-05-04
2026-05-01,4 Rivers Smokehouse Opening in Orlando International Airport,"9102 Jeff Fuqua Blvd #1521, Orlando, FL 32827",https://whatnow.com/orlando/restaurants/4-rivers-smokehouse-opening-in-orlando-international-airport/,2026-05-04
2026-05-01,Phinista Cafe Bringing Vietnamese-French Fusion Fare to Packard's Corner,"1092 Commonwealth Ave, Boston, MA 02134",https://whatnow.com/boston/restaurants/phinista-cafe-bringing-vietnamese-french-fusion-fare-to-packards-corner/,2026-05-04
2026-05-01,New Eggdose Planned on West Colonial Drive in Winter Garden,"12615 W Colonial Dr, Winter Garden, FL 34787",https://whatnow.com/orlando/restaurants/new-eggdose-planned-on-west-colonial-drive-in-winter-garden/,2026-05-04
2026-05-01,Cosa Nostra Italian Deli Plans Winter Garden Opening,"32 W Plant St, Winter Garden, FL 34787",https://whatnow.com/orlando/restaurants/cosa-nostra-italian-deli-plans-winter-garden-opening/,2026-05-04
2026-05-01,Kawa Bringing European Café Charm to Boston's South End,"655 Tremont St, Boston, MA 02118",https://whatnow.com/boston/restaurants/kawa-bringing-european-cafe-charm-to-bostons-south-end/,2026-05-04
2026-05-01,"Matices Bringing ""Ingredient-Driven"" Dining Experience to Truckee This Spring","10164 Donner Pass Rd, Suites 2 & 3, Truckee, CA 96161",https://whatnow.com/sacramento/restaurants/matices-bringing-ingredient-driven-dining-experience-to-truckee-this-spring/,2026-05-04
2026-05-01,New Restaurant Concept Quietly Taking Shape in Downtown Truckee,"11197 Brockway Rd, Suites D1-D4, Truckee, CA 96161",https://whatnow.com/sacramento/restaurants/new-restaurant-concept-quietly-taking-shape-in-downtown-truckee/,2026-05-04
2026-05-01,Evolution Nightclub Set to Transform Former Chando’s Cantina Space in Downtown Sacramento,"805 15th St, Sacramento, CA 95814",https://whatnow.com/sacramento/restaurants/evolution-nightclub-set-to-transform-former-chandos-cantina-space-in-downtown-sacramento/,2026-05-04
2026-05-01,Chilly Philly Ice & Bites to Bring Cool Treats to the Valley,"5560 E Lake Mead Blvd, Las Vegas, NV 89156",https://whatnow.com/las-vegas/restaurants/chilly-philly-ice-bites-to-bring-cool-treats-to-the-valley/,2026-05-04
2026-05-01,Thalassa to Bring Mediterranean Cafe and Culture to Philly,"918 N 28th St. Philadelphia, PA 19130",https://whatnow.com/philadelphia/restaurants/thalassa-to-bring-mediterranean-culture-to-phillys-fairmount-neighborhood/,2026-05-04
2026-05-01,Farrelli’s Pizza Expanding to Enumclaw This Summer,"1324 Roosevelt Ave E, Enumclaw, WA 98022",https://whatnow.com/seattle/restaurants/farrellis-pizza-expanding-to-enumclaw-this-summer/,2026-05-04
2026-05-01,Matthieu Pepper Launching Bagel Shop in Hochelaga-Maisonneuve,,https://whatnow.com/montreal/restaurants/matthieu-pepper-launching-bagel-shop-in-hochelaga-maisonneuve/,2026-05-04
2026-05-01,Every Little Thing Expands With Cherry Creek Location,"2810 E 3rd Ave. Denver, CO 80206",https://whatnow.com/denver/restaurants/green-collective-eatery-rebrands-as-every-little-thing-expands-to-cherry-creek/,2026-05-04
2026-05-01,The Abigaile Opening in Auburndale,"117 E Lake Ave, Auburndale, FL 33823",https://whatnow.com/tampa/restaurants/the-abigaile-opening-in-auburndale/,2026-05-04
2026-05-01,"Obon Bringing Ramen, Sushi and Cocktails to PV in North Phoenix","4568 E Cactus Rd, Phoenix, AZ 85032",https://whatnow.com/phoenix/restaurants/obon-bringing-ramen-sushi-and-cocktails-to-pv-in-north-phoenix/,2026-05-04
2026-05-01,Straightaway Cocktails Opening Full Cocktail Lounge at PDX This June,"7000 NE Airport Way, Portland, OR 97218",https://whatnow.com/portland/restaurants/straightaway-cocktails-opening-full-cocktail-lounge-at-pdx-this-june/,2026-05-04
2026-05-01,Experience Social Bringing Large-Scale Pinball and Arcade Venue to Ottawa,"250 Greenbank Rd, Nepean, ON K2H 8P6, Canada",https://whatnow.com/montreal/restaurants/experience-social-bringing-large-scale-pinball-and-arcade-venue-to-ottawa/,2026-05-04
2026-05-01,Chez TJ and Two Other San Francisco Eateries Close in April 2026,,https://whatnow.com/san-francisco/restaurants/chez-tj-and-two-other-san-francisco-eateries-close-in-april-2026/,2026-05-04
2026-05-01,Clarke’s and Two Other Established Boston Restaurants Close in April 2026,,https://whatnow.com/boston/restaurants/clarkes-and-two-other-established-boston-restaurants-close-in-april-2026/,2026-05-04
2026-05-01,"Bourbon Steak Nashville Renovation Underway at JW Marriott Nashville, $2.4M Upgrade","201 8th Ave S, Nashville, TN 37203, USA",https://whatnow.com/nashville/restaurants/bourbon-steak-nashville-renovation-underway-at-jw-marriott-nashville-2-4m-upgrade/,2026-05-04
2026-05-01,Ascension Coffee Brewing New DFW Location this Summer,"100 State St, Southlake, TX 76092",https://whatnow.com/dallas/restaurants/ascension-coffee-brewing-new-dfw-location-this-summer/,2026-05-04
