Store,Analyst,Type,Title,Link,Published,Summary
Trader Joe's,Rahul Shinde,Opening,Trader Joe's Eyes New Location at Historic LA Landmark - National Today,https://news.google.com/rss/articles/CBMitAFBVV95cUxQWkRJbmNYQm92M3VZRTlTQVlvQnRfVUFZcWlLaVA2dmhPOHFVR2IyNEVQUjlPYjdUUmNRck1Xczk0OVoxVjlLN2FlMEZaT0wtVmZTd1ZJbXI4N0lZZGVaejNFdjVRTGdLaVJtZy05a3pPSkJLOUVicEwyVE00d0NDZEVwNkZESk5lVWp4RDJDZHdfTlZoLUJocGFrMTFtdUNzcW5xQVRKRldvWXIzN28yYUhidEw?oc=5,"Wed, 15 Apr 2026 21:54:11 GMT",Trader Joe's Eyes New Location at Historic LA Landmark National Today
Trader Joe's,Rahul Shinde,Opening,Trader Joe's plans to open new location in Spring. Here's where. - Houston Chronicle,https://news.google.com/rss/articles/CBMikwFBVV95cUxNQjYwWm9SMlFEQTI5SUJGRk9BMW9UclhMeEtyWU44YkhHY3RVMWFJaUtleFhsSUgzbkZHTVVVVWp5MjhMMEhfMkNpTVRZY3BWUXdGbnBXZno0ME1SZ29YeWFfNGZ5NlFFYWtzLVp5Y2Z3YnNFMmlfNEMzX21vQ0lBbFczR2YxdDR2YksxLXhRaHJ3Z2s?oc=5,"Wed, 15 Apr 2026 21:06:59 GMT",Trader Joe's plans to open new location in Spring. Here's where. Houston Chronicle
Trader Joe's,Rahul Shinde,Opening,Trader Joe’s eyes new location at this historic LA landmark - FOX 11 Los Angeles,https://news.google.com/rss/articles/CBMihgFBVV95cUxPcjhtbWlpYmFHY2lOTUYweXFlckpTY2V2cG1uMTkxLWM5d0JEZEg0MUtFZG1ZNk9NX0RPZ1FUUE82WldtZjhocmRSbThROEdGdGtRelpMQnNVZXJoZWFiWGJUNWJ2UnFpN3VXSW9Bb2lJNTJlcERWZ1Fzb0FVUlVocWJxZm80UdIBiwFBVV95cUxOcFNOQ1pjTm5FN1p1emFOR1RDakFCakVpSTVJVXJPOVhZdDhzNE1uMFp1eHFueVRsblNrZXVsOExUZmRPME9XZS1vbWUzWDktSXk3OG44SkRGUFFtUDNDOG43bGctaWliWHgzSk10d2ExdkpneVA4Wm5jc28zSTdtN0FNa3BzbnQwVWlF?oc=5,"Wed, 15 Apr 2026 20:04:08 GMT",Trader Joe’s eyes new location at this historic LA landmark FOX 11 Los Angeles
Trader Joe's,Rahul Shinde,Opening,It's really true. A Trader Joe's is coming to Quincy MA - The Patriot Ledger,https://news.google.com/rss/articles/CBMiuAFBVV95cUxPZXFKMENDUU1sRy1GaGJNNGtyV29RWFJ1dExmUlNfYzdDLVRJUzN3WVNlOGFzR2VvTEtkenM3d0g3clR5UDFKVm1FSERVOFBWR1B5ZE5jbDQyaXYwMDZ3RDR5a2Uxd0NXUzljOTJjMzQ2SVc4WFNIWGNBT0FleHJ0QzhYcUg0LWRTR2o4YTRBQ3VUYnBXdFhfcHFSSnUtMElqMjU2VTBXbFJlWE5RQ2FUbXpzZXJaU2Jp?oc=5,"Wed, 15 Apr 2026 19:12:00 GMT",It's really true. A Trader Joe's is coming to Quincy MA The Patriot Ledger
Trader Joe's,Rahul Shinde,Opening,Trader Joe’s sign going up at new Uptown New Orleans location - WGNO,https://news.google.com/rss/articles/CBMilgFBVV95cUxQbjdjQXB4aGRuTnViWkRDbHRQWmxYdDFaWkZtemxyb2hzem4xbzBleUJkWld1OXVzaElZWnM1Zk1LcXlsN0RUZ3NWRnFCWUdxZFhpZDlsN2lXQnRGckwzYXJxXzNab0ZJcVhYX0ZTTDdOeUlvYk56c29ud0l3cVhpMGxncUx0d2E4MTNUZnhjeFRfaVZySEHSAZsBQVVfeXFMT1Y4c2RXS2RWQ19SbnQ4TWgzeTVmdjRMSEJTMmtIaXBWc3Bna1BSd1hibE9wazY5S05KVkRZWUV2ZVVndzBzdWJCemNzb3BVemNfS0pHMHYtQjlWdmxDRXhnekFQUDltNjY1RVp4THFYbnhBY1Z2dnY0SW9rOGI4UGtqZlFoQlREQzJwUkRtcGk1YzFrallBNTBqWXc?oc=5,"Wed, 15 Apr 2026 18:40:11 GMT",Trader Joe’s sign going up at new Uptown New Orleans location WGNO
Trader Joe's,Rahul Shinde,Opening,Trader Joe's coming to new part of town - KHOU,https://news.google.com/rss/articles/CBMi6wFBVV95cUxOMWZJQTBZcDl0ZGw0Y1VLMENTRWVBa0FzcUpnanZndUxJaXRUbjd6ZEtDMk1VaVVwVG1GRExCTFBGX3drYUx4ZlhYSlB4TDktZHR4S0VtMW9VVXlYUDJvdzFPN01WZlQyMnF6M0RDM0pfbEd6TDFpZnNNTmhTVzh3a0l4TmVZQ09IU1NrT2ZvZXRkdXpycFNSRVM4MVZYaDJhRWZmcXV2VnRiTVNSUWRDWlNzZFdmZEpVNDdSWnE3MFltU1YxSjBfejFFTUR5aGhUSjNRMnd3Sm9TUFpKM3ZoTUt5QkxlNnFScVV3?oc=5,"Wed, 15 Apr 2026 17:46:00 GMT",Trader Joe's coming to new part of town KHOU
Trader Joe's,Rahul Shinde,Opening,Mega popular California grocery chain eyes north Houston suburb - Chron,https://news.google.com/rss/articles/CBMihwFBVV95cUxPb0gxZ1VUaVB0dzVGWHNKWFViaG9XZUVFZFdsVXRhbUlFeTdra0I3LW9MVlY1cFY3cDd6djdxQmdMekxXRW40UU9ZV2cxcVp0S3NkZ0ZRdWlQYlhpVUlOa1BabG5uR1ZKbmR0Zi16QXExRm5BX0JTZURnNTNsM05RaDJvQzFQRDA?oc=5,"Wed, 15 Apr 2026 16:16:47 GMT",Mega popular California grocery chain eyes north Houston suburb Chron
Trader Joe's,Rahul Shinde,Opening,Trader Joe's Is Opening 18 New Stores This Year—Did Your City Make the List? - Better Homes & Gardens,https://news.google.com/rss/articles/CBMiZ0FVX3lxTE5TSW9RZFFsVTQ5LS1FRU9GS25SaWpHZWlqakJNclJ3M3poLTI1UUh1enpLaDNZZlRyTE44dUhaZnJHNUpzeDNDcU5abHVhXzNDc19SWTcySUVqRE1mcFZrdFo0UnpFQVE?oc=5,"Wed, 15 Apr 2026 10:34:00 GMT",Trader Joe's Is Opening 18 New Stores This Year—Did Your City Make the List? Better Homes & Gardens
Trader Joe's,Rahul Shinde,Opening,Trader Joe's announces plans to open Spring area store - Community Impact | News,https://news.google.com/rss/articles/CBMiwAFBVV95cUxOMjdDb01zRlg0MVdTb3dLSTRvVDJ2am5jTE1RYnE5a1BCTTdTQlMyOUFLQXlaa19ZMnNheGVneVRIcTJldzdkT0pfU3VfeGNYTEhMTVZpOEtVaFVLRG1temtjdHprLUtMV3lzaEtfdDlRTktBTVpYcmhIQzBhUm9lelFBSzh3RTRrVjRqbmlCMFhGWW1RcXVObGhyTzFyQV9JV09EOURrWTBCbXNld2FZWFlRQkViTmJEb24zSHdIcFM?oc=5,"Wed, 15 Apr 2026 05:00:00 GMT",Trader Joe's announces plans to open Spring area store Community Impact | News
Trader Joe's,Rahul Shinde,Opening,Trader Joe’s set to open new stores across 12 states: Here’s the full list - AOL.com,https://news.google.com/rss/articles/CBMibkFVX3lxTE1JQzhmWXhPMnVmMnVYXzFxQ1hpckZ0UDIzYkdVbi15SGkyQ0REcUowVlZiZUZTMTBmWFZpQVQwaFZVRzRlcjJOOVpTOXRxNWdnT3ZmbWhpZVI1MVhyVXBvVVVlaHU3UXRxekVLTGlR?oc=5,"Wed, 15 Apr 2026 04:25:25 GMT",Trader Joe’s set to open new stores across 12 states: Here’s the full list AOL.com
Trader Joe's,Rahul Shinde,Opening,"Trader Joe's to open 2 new stores in California, 16 more in the U.S. - AOL.com",https://news.google.com/rss/articles/CBMic0FVX3lxTE9JdWtRcTNWVU9lM0IwTlpBdmFpem5TZlE0MkhsR1hzRUNYdU5RVnZndkNybFo0Y0NFazh2aTRka0tKM3A3VmdOdWZEcDlKWGlySTBkaWFvMHgtal9tLUZDQVFzRDFOOWZ5MWRiNUgwdnNyVEk?oc=5,"Tue, 14 Apr 2026 00:17:45 GMT","Trader Joe's to open 2 new stores in California, 16 more in the U.S. AOL.com"
Whole Foods Market,Rahul Shinde,Opening,"Beyond Meat Debuts Latest Beyond Breakfast Sausage Lineup at Retailers Nationwide Including Kroger, Sprouts Farmers Market and Whole Foods Market - Perishable News",https://news.google.com/rss/articles/CBMikgJBVV95cUxOai16TG03R2Q1SEVlV3h6c3RuOTRkUElZZDZOTkpIaUlNeThPTWo5Zk5teDBFbWdIVlFGOWdnQmVxVHN5Z0tGbmFsYXRXcFJXWi00bS0wSkFDX2hTSVRteURmZWJOUEFPeGZzV0k3OXBQaDNZRG1maHc0ZnRoVG9oQktCS0Zra3Nzc3ZKNlM2Y29VbVpkWGI3QmN2M2RNRFk5MmthYW9VNkxreFJIX1YzS1Mzc194T2c2T3JoQjlRWHhuY2NtcjdEM0ZsZlRSMHBRQWhENTVJSU0tTkVidGNFazJYTUFCZ0kxM2w2Z0hNelhZb2JmejVOelpIVFhDOXJ6YTdnRjVLUlN4SWtEUnFhQnRB?oc=5,"Wed, 15 Apr 2026 17:31:45 GMT","Beyond Meat Debuts Latest Beyond Breakfast Sausage Lineup at Retailers Nationwide Including Kroger, Sprouts Farmers Market and Whole Foods Market Perishable News"
At Home,Rahul Shinde,Opening,Storm weather the Wildcats to open post-break slate - the-messenger.com,https://news.google.com/rss/articles/CBMirwFBVV95cUxQZjBoNzUteTBYa3J6RFVrZWM3MFBOemdKU1FvVDg0Mk52VmNxeHdkc2lQQnJBakZzYmtSQXFudzBicXBvM2JmVmpHbHdXVUZPMjlFbDBCWnFfTGZPeXhkZlkxV0JsMGNvVGZYNnBJSmFuZnBzSGREVVRtc0llUFBiNFRGeDVPRndDV3FjRERzVGctX19faWJWbHgzLUVFLVc3VnViOTRhSXJteDF1VU9N?oc=5,"Wed, 15 Apr 2026 22:30:00 GMT",Storm weather the Wildcats to open post-break slate the-messenger.com
At Home,Rahul Shinde,Opening,New Dual-Branded Hotel Development Breaks Ground in Mesa - National Today,https://news.google.com/rss/articles/CBMiswFBVV95cUxQR3pqS1NOQjVTSDdlZWI1ZTJXaTJHeVNwUUdlcXNydDBKeG1qd1U3UmZRU1djd3JRUlFvS2Q1Z1FFUTJyVkRyYUxDRk9aa2hiV0xETTNyTnE5R3o2SE56eEsyX09YSXoxX3pENmdMNUh4S19iSUpLR3hxUVh4cmZvVTFma2N1UExTU0ZKSHQ0d2F4em44RDh5QVFJUmxvbDhuMFdkVV94Nm1ZV3dUOTFHcFJPWQ?oc=5,"Wed, 15 Apr 2026 06:23:13 GMT",New Dual-Branded Hotel Development Breaks Ground in Mesa National Today
At Home,Rahul Shinde,Closing,Closing down sales begin at popular Home Depot rival as store to shut in weeks - the-sun.com,https://news.google.com/rss/articles/CBMimwFBVV95cUxNaHNPVjlxZ01VUDBrM1N5X004MTZCTGJPZjZpRG5hc0ZvUmRnMWZNZUVTaEZSQ2QwS1VpNjU1R3J2QWxNSlNLVkJuZ1YwTlUyRXloa2JHUWJLTXVqckhtc1ozd3RQVlk1akxMYUJVVnFXcFcydDdaSkJOcWFWeENUbHpjeGxXNGFCY0J0MnV1eDRJdmFScllEZU51WQ?oc=5,"Wed, 15 Apr 2026 14:17:58 GMT",Closing down sales begin at popular Home Depot rival as store to shut in weeks the-sun.com
Grocery Outlet,Rahul Shinde,Opening,Kuna’s New Shopping Center Is Filling Up - 104.3 WOW Country,https://news.google.com/rss/articles/CBMiY0FVX3lxTE1oVlktQ19IcHZRbVcySlZjem5oZ0xXdEE2NVdwVHFnMXhmX1Z5WW94SU9iZEJkZW1iM1FPM3Q4SkdmbHJ3a2xyM09FVTAtckhwcEFsQVJ3ZGdjd2R3dVNiMDNtUQ?oc=5,"Wed, 15 Apr 2026 21:57:20 GMT",Kuna’s New Shopping Center Is Filling Up 104.3 WOW Country
Grocery Outlet,Rahul Shinde,Closing,Lily Bee’s In Downtown Pullman Closing Following March Flood Damage-Pop Up Sale This Weekend Next To Grocery Outlet - Pullman Radio,https://news.google.com/rss/articles/CBMi1wFBVV95cUxPRzBpSjFld3FuekdydzNjNFQ5b010eVAtazlEdzVjakNfUGxTWmUzSUcwM2RwWXRtR1R3ZzM3ZFg2YWtKM0ZTUnV0Y2c2T1pnUmY1UzVKMk1FT0VvVHNiMlU4R25pLVU0M0FvYk5BbGJXNFd1Q1kxMnJ5bTF4RWpkc1pDc2lqbW1FNDdsQ0Vua0JsbE41ZXFmRGg2d3N1Wm94MW5CemdMUU5CbXFlT1cyUi1OZUZIcVlMMDVqZ0FDV0xRR1d4YTZEUXdaNWd4aVljN1o1TktHNA?oc=5,"Tue, 14 Apr 2026 21:23:04 GMT",Lily Bee’s In Downtown Pullman Closing Following March Flood Damage-Pop Up Sale This Weekend Next To Grocery Outlet Pullman Radio
Grocery Outlet,Rahul Shinde,Closing,Why Grocery Outlet is closing some stores in California - AOL.com,https://news.google.com/rss/articles/CBMiggFBVV95cUxOanZKQUFuLXhKYnR0OVhfZUNfOE1EekFickQ0eGtpU1VwUzJMMVRTNjFkT3dhUDV3eTR1c1RXc21MZUVBeHo2RlpYekoxcDBSM1I3RUdHWDFQSVEyWV83MUptd1BVRzc4V1R1VWJ5ZEpaRHA1blpYd01FRmNNYlZSbzhn?oc=5,"Tue, 14 Apr 2026 19:25:02 GMT",Why Grocery Outlet is closing some stores in California AOL.com
Grocery Outlet,Rahul Shinde,Closing,"More than 2,000 stores are set to close across the US in 2026. Here's the list. - Business Insider",https://news.google.com/rss/articles/CBMia0FVX3lxTE9SUTdiM1JqclMzakxVV3hnTHU3N0ZOdHQ2UFhvc0RMS0kwM1FQQnFKd3RUb3ctOWpLSHRyc2o4d3pDX2lVQUdRcEJ3bzhKNWZzT1VuNEY0MGk2XzVXLTVHanRNMHBRRWM5aVVN?oc=5,"Tue, 14 Apr 2026 15:21:00 GMT","More than 2,000 stores are set to close across the US in 2026. Here's the list. Business Insider"
Grocery Outlet,Rahul Shinde,Closing,"Grocery Outlet investor sues board over expansion, store closures - Daily Journal",https://news.google.com/rss/articles/CBMirAFBVV95cUxQRDFqZGFuTlpUN0piekV0WXJCR1pzdHRWdHNFd2F3aEZWVlpQdlE0VGRRSVk4ZVgzQ3AxVDY4N1dreHhiby02dHJJQzBET2V2TE0wNUN1R3ZvbXZjNl9vSjJiem0zbE1VMllyd2tHcFZWZmg3Q29WdWQyVFBFLWhIenVvdDdZWDhIQ1VndTg1S1hud24ybmg1c2ZuUUtFR0taX0NrM0hiU2pHb3NG?oc=5,"Tue, 14 Apr 2026 02:26:14 GMT","Grocery Outlet investor sues board over expansion, store closures Daily Journal"
Save-A-Lot,Shuvechha Dere,Opening,Save A Lot revamps its value-focused Hispanic private label offerings - Grocery Dive,https://news.google.com/rss/articles/CBMinAFBVV95cUxQSndmNHdEUnBlNS0xZm11VUNoRzJHRmVUN1RaRDJFa2FaNUo2T052Ym10ZThwU3BuTHRtRGNiTjZTd2k1ajRYc0xPcDZLbTBZdDVqS3NXLUQtUHN4WV9zd080MnZINVFJTDA2R1VBYTc5c0R4eEdKQkx4cElMNGsySWhwYWdnMDVmM1RzYkQzUjZYMWhBU2Uzd0lHUWs?oc=5,"Wed, 15 Apr 2026 14:03:08 GMT",Save A Lot revamps its value-focused Hispanic private label offerings Grocery Dive
Dollar General,Shuvechha Dere,Opening,Dollar General’s 2 major changes hitting thousands of locations in 2026 - the-sun.com,https://news.google.com/rss/articles/CBMipAFBVV95cUxQMTdkTWlxcGtGN0FqOWZMNzVYc3lUNnBhSVA0RTZzTDJKdGYtWFhiTzhpQTZLdzdWcEplXzkyX201Qkd3UVF5UWJMVVNqVmk0c1l3Qm5jM3RzUDFhN2x0LURmcmZ6ZzBRMUlNbU5uSy1xbllDRm9hZDN0X2FNelJUTHZYSHBIc0FDZEIwa3V0UTJVSUFUSkg0RlZlWmJaVEFLbGFmUw?oc=5,"Wed, 15 Apr 2026 14:03:42 GMT",Dollar General’s 2 major changes hitting thousands of locations in 2026 the-sun.com
Hollywood Feed,Suryakant Rajput,Closing,"Painted Tree Boutiques closes all stores, vendors left scrambling - The Arkansas Democrat-Gazette",https://news.google.com/rss/articles/CBMingFBVV95cUxOb1B1S3RteGZ5YjdaWXVFT01ZdWJzazdyVEZfckJRT2FQT0ZZbTRpTE01YzJMYndIcUw5Wk02NG9UMUNud0ZNRThKQ2ltSS13dzFuc3FCVkExUml2S2pnYU9kd1psSnNuRzVqd3duQVBZLVR1TTRIa1RpWDlBV29oYzZPeERfRlVZdTgxVVhINHA1bXRLWHZaYTRmX0d4QQ?oc=5,"Wed, 15 Apr 2026 21:45:00 GMT","Painted Tree Boutiques closes all stores, vendors left scrambling The Arkansas Democrat-Gazette"
Mud Bay,Suryakant Rajput,Closing,"Olympia drivers to see lane closures and delays on US 101 this week, WSDOT warns - AOL.com",https://news.google.com/rss/articles/CBMifkFVX3lxTE1sN3UxMUwyMFNqU1RicWxCdlJwRkh2bHdDbi0wNDVieWtLaTREMVRLSHdVaHpWUmFWZ2lFMXNjNDRHSVM3V09NMzZDRWFxSlU1dTlEU2lXY2hYN3BvWEk1ZEdqYU56WU5hTHFIbmZsN1oyNmlxZlJwdWhxRTIxdw?oc=5,"Tue, 14 Apr 2026 15:00:50 GMT","Olympia drivers to see lane closures and delays on US 101 this week, WSDOT warns AOL.com"
