Store,Analyst,Type,Title,Link,Published,Summary
Dollar General,Shuvechha Dere,Opening,Dollar General grand opening celebration set for Saturday - Cleburne Times-Review,https://news.google.com/rss/articles/CBMi5wFBVV95cUxORVdZS2xicVlaUVVnTWltMmRCV0FhQTczZXhHOTY4LTRUS1E3T0NwcUtFWTNtcFlKZkFLX2lMSmdkY3dTanVmQXh2VHhURUctR3BwSE9JWld2U0xLQkpXbXI2aEJ1aXAtRUJOald3bkhwR3pQS2hHcGI0QTlFUENWbVV2M1BFQ3hVYlNQV0FoM2VwRXI0ZnNhR3lIRnNqM2h1SEFBZkd2NmtKREJYSzRHVlFnTW4wMGdTNFpQT3FwWVhWUUpRMkRhT2thUy1nS0R6NnEzZVlZaEZ2YlQtQzluNkh5ckZJNWs?oc=5,"Tue, 21 Apr 2026 11:00:00 GMT",Dollar General grand opening celebration set for Saturday Cleburne Times-Review
Dollar General,Shuvechha Dere,Opening,Dollar General NOW OPEN IN Aberdeen - Beech Tree News,https://news.google.com/rss/articles/CBMidkFVX3lxTE4ta1Jna1hSWTdRSkUtWFBPNWZfaWVjSkRDVmdSM2MzT2JaLU9XSE1uMGljdTFoT29BWXloZFExcVB4S2p3RGM4M2FwVGNvU3ozaG1JWF9mWU9sUTZkUXNNeWpmYU5zMXpiT0tlRUhLZDVWSkVBUGc?oc=5,"Mon, 20 Apr 2026 19:22:55 GMT",Dollar General NOW OPEN IN Aberdeen Beech Tree News
Papa John's,Vishwas Shah,Closing,Papa John’s Is Closing Hundreds of Stores Across the U.S. - IMDb,https://news.google.com/rss/articles/CBMiTkFVX3lxTFA5RHJFM2FCZ2VwN3U2WjNwSVo2d3NWelJJSXd6NDRHZ3NDLUxXLVBwMi1jTHZqVjhhcnlXVTd2UnM0ejlMWmNlOG1mLThDUQ?oc=5,"Mon, 20 Apr 2026 14:53:03 GMT",Papa John’s Is Closing Hundreds of Stores Across the U.S. IMDb
Taco Bell,Kashish Kasar,Opening,Applegreen To Open Northern Ireland’s First Taco Bell - checkout.ie,https://news.google.com/rss/articles/CBMilAFBVV95cUxPZ0Y2ZWpTbFpidDVmT2J4T1NockFtZ1BYSlUybTlzUW5lOXZZZXJmWDg4VU9Xb042S3NHRGlQUUVyNFNTbm1sZ2tFZDdFNHlPTTF0OFhXaDNJdG5vZEtOeGNMdG9xT3hZRk95b2UweG82Sk8wUjd2NTNLZ3AwenRibTJxcFd5a0w4aWt0di1fMGctRU9U?oc=5,"Tue, 21 Apr 2026 10:30:43 GMT",Applegreen To Open Northern Ireland’s First Taco Bell checkout.ie
Taco Bell,Kashish Kasar,Opening,NI’s first Taco Bell to open ‘next month’ - Belfast Telegraph,https://news.google.com/rss/articles/CBMivwFBVV95cUxQY01lLUk5OWJzbzYyamNST2VLQnFyNWJhRllMTnNsT1haby0yaHhrV2hrX3hrOWgzRTFMdTRnbXNBU1dCM1BrV0RaZGlZUThHQVQ3NTU5MHprYmotRjJIN0s3UHNRUGUxWk9sallOS0VWa2RYT2ZPRDBUbkhxajJmMFBxS0VPY0FYUWY2MGF0cEhvMWxZZlFwM0FnT1BfQnFOc2lMTXQ5NDdtYkQzNXRWdzVvR284c09fQVVfM0RBMA?oc=5,"Mon, 20 Apr 2026 19:45:00 GMT",NI’s first Taco Bell to open ‘next month’ Belfast Telegraph
Taco Bell,Kashish Kasar,Opening,Tex-Mex fast food giant Taco Bell to open first Northern Ireland outlet - MSN,https://news.google.com/rss/articles/CBMi5gFBVV95cUxOS0pwa1d3ay1RUG9CeEtjVHg3R1JzY0dtTUxPVENpZ1gyNGx1VVppUjAxcURucG9kZVdSY2RQZWdQTDdEOFJHYko3Ym5EOVdPbzVDSEZDNHN3TTZTSnFmQ1V0TS1tNTB4YzE4TFQ4WjVCUXdicXBGVmIyVXdmZGZYdmltRVB5bFdCS2N4QVYwQV9WaHBZWGw1NFRYMEJsUTgzazFRYlhMUWxCYkp1MkdpNm04Q2RPZG9BMGY5Z0xHN3d3UzloY3JaSk5YNm9DNjYyVUJ4Sks4YkswQnJyMnFLeFcxLTZ0dw?oc=5,"Mon, 20 Apr 2026 13:29:08 GMT",Tex-Mex fast food giant Taco Bell to open first Northern Ireland outlet MSN
Taco Bell,Kashish Kasar,Opening,Applegreen To Open Northern Ireland’s First Taco Bell - Business Eye,https://news.google.com/rss/articles/CBMikgFBVV95cUxOa2xUTjdEeFdxekhxNmdqRTh3dVJSblZWVTRDZUVUQjZiRmVVb1V5MWNRY3lKVVpHZ2lkODYtY2ZrWmZVd1ZLcmN1QV9FRHhiazVBOE56ZFpBNEpscXB5WXRZcTUzdkhiWmlHTnlVVHZ5eGFkMTR4UmMyVXNQeEdzRTRMRzgzbGZPQ0QzRzdaOTUtZw?oc=5,"Mon, 20 Apr 2026 12:18:04 GMT",Applegreen To Open Northern Ireland’s First Taco Bell Business Eye
Taco Bell,Kashish Kasar,Opening,Applegreen set to launch Taco Bell in Northern Ireland - RTE.ie,https://news.google.com/rss/articles/CBMiogFBVV95cUxNbHJmbE9fbHk2QnVhMElRQWJqZDFMTVJxeVg4b05IeDhyQVBiOGhkQXI4MGVpcjFMYnVpbjlMcFoydFlWUVQ1cnFZcWhIMEhTc19HeXoyaEFjWkNmbEl1RzUxSERBZ3Zta2U5c0JIQmpiTVlYOHRoZ2F3QXBKNVBLYWFyNDNjaTcyVzhBRE9hNy1tdFF5Rko2SVN2NGhPQUpMdUE?oc=5,"Mon, 20 Apr 2026 10:53:38 GMT",Applegreen set to launch Taco Bell in Northern Ireland RTE.ie
Taco Bell,Kashish Kasar,Opening,Opening of Northern Ireland's first-ever Taco Bell location confirmed by Applegreen - Belfast Live,https://news.google.com/rss/articles/CBMiogFBVV95cUxOb21fckdKUXVIRHhLcXVMTnIteDZCX0ZiZVJxc1J2VDMyTGcxRV9kTlQtOTVpanRDeHZELUZwbkZNOEE1VjNxOGZjZWRQR2JQcFVJakN3X1pnVjlsdWNfMjFfdHpJbDZlVEpPWVdfMDltQ3REY0NZc0U3MEhjX1hEWnFpSzVBSkpTOWRwUnB2SWVlUm05RkhBdi11Q0dIZGYxSHfSAacBQVVfeXFMTXJWVS1lNjVuRXhpaHdEYW8xR2Zrd0hoQ2pMVzZiVWFOOGNuZUFFX01FTzlxTzBkNV92TWwyREVJajRfeEVvN09XUjNzVlNoZ1ZkRHhWWDdoWlpGRlFDb1VTTndfdzQ5cFRvZFNtbURONnNzdzRoMVgya0FlSkJFc0sweWNmZmppeGJ2ZHlyVU4wWHR5TDJZbGxWTEMtMERuZTBNcWtKRkk?oc=5,"Mon, 20 Apr 2026 10:45:00 GMT",Opening of Northern Ireland's first-ever Taco Bell location confirmed by Applegreen Belfast Live
