Store,Analyst,Industry,Type,Title,Link,Published,Summary
BJ's Wholesale Club,Ashwin Nair,Mass Merchandisers,Opening,Discount chain BJ's Wholesale Club to open first Texas store in Forney - MSN,https://news.google.com/rss/articles/CBMiwgFBVV95cUxOS2ZmNHdQR0Y2NE5DenhUNnMwOHdRaWkxdVZNb1QyQXc0VFlVbFRMVHlLNnY4ZHc0ZnpKRWpKdG9tOUdsWWs1MGdtV1E3MEEzQjZwYUtSbzZ5V29hM0xoLTNBYkpMMy02MlR6UEZ4azY4cnZ0d3dyNTZnTFdKUUxZUE96SUxzaGE1V3hyUlZtZnB6aGVHc015MFVJcFkzdklFdHJVZUN1VkpKMF9mdUlhXzkxemxkdjBmS3lncnZIbHhmZw?oc=5,"Sat, 25 Apr 2026 02:07:02 GMT",Discount chain BJ's Wholesale Club to open first Texas store in Forney MSN
BJ's Wholesale Club,Ashwin Nair,Mass Merchandisers,Opening,BJ’s Wholesale Club will open soon in Fort Worth - Fort Worth Star-Telegram,https://news.google.com/rss/articles/CBMiggFBVV95cUxNcTZNUEF3SUlKOEdoWVdaM0JGdTd3RjdoZ3dKRjVhYjRDdGxtOWRjdVlUT3VKTFBOWTVlMC04STA3OWlmbmhHX05NcHRTZVh6eEJjWUx0VDZiRkRxM204bVNqRW5fWno3SUFTTlRTNkxlWkV4VEV4a1l2eS1IN05La0hB?oc=5,"Fri, 24 Apr 2026 22:15:03 GMT",BJ’s Wholesale Club will open soon in Fort Worth Fort Worth Star-Telegram
BJ's Wholesale Club,Ashwin Nair,Mass Merchandisers,Opening,BJ’s Wholesale Club will open soon in Fort Worth - AOL.com,https://news.google.com/rss/articles/CBMidkFVX3lxTE02MWRFY2pIUHFOWnlueUFkR3dyVzk5Q2xPaC1mbExmZG96UjZQREJpcHV6eXlfM3NZSHA1VE1NcFNoQ2x2MEpKd1ROT0ZVVlFJdUxudTlRWXI3WkV2V1BrVXF4bkFrMWppMVRzaldieTMxNHlFa0E?oc=5,"Fri, 24 Apr 2026 22:11:06 GMT",BJ’s Wholesale Club will open soon in Fort Worth AOL.com
BJ's Wholesale Club,Ashwin Nair,Mass Merchandisers,Opening,BJ’s Wholesale Club is about to open in Fort Worth. Take a look inside. - Fort Worth Star-Telegram,https://news.google.com/rss/articles/CBMiggFBVV95cUxNYUJzcjdXWHlDS2JONmRFeUlZZlk3bGxnMldDeGxwTEYyM0xLZnZZTWhxSmZfTm1XVDhJM1lWMUNhM3V0blAtQWJMNTBIaTg3b2lYQmh6dEZBUF83MzJjcTZCSkh5eEh1NFlMWUJNTjFocUtkZUg1bEFBMHY2STUtRXBR0gGCAUFVX3lxTFBCeUZIOXB1UzFHNUttcWZlUzJLelJWQWJmb09LNWpFbm1IQkp3MTlCQ3Q1TDAxZDNVVGZNeFB6SEh2S1Q1ZzQ4UnBIS0ZHMGxia19mc1dMLW45YzZvZVd6MUJjcS1vZkx3WW5qMzRjTUUwTWFvcmxJY3ozU1h0Q1MtSFE?oc=5,"Fri, 24 Apr 2026 21:10:00 GMT",BJ’s Wholesale Club is about to open in Fort Worth. Take a look inside. Fort Worth Star-Telegram
Fred Meyer,Ashwin Nair,Mass Merchandisers,Closing,"Kroger’s Fred Meyer closures in Puget Sound region spark debate over retail theft, impact - MSN",https://news.google.com/rss/articles/CBMi1wNBVV95cUxPRXdXX2E0RGFvalhpRlE1UHV3YW9Oa2o0SmZ1eWpDOE1RbEc3d25VZzYxRndMME5uc0ZBMktDY05BakZvLXJTaHFjRlNraVM3SmFLVmxqNWFMMWI0NUJtdlJOVjY3S1hrZ0NfMFdLV2daSHVEemduMTE1ODNXRGVwaVdiU1VwTDdOOVRPX3pUdG1sRXBVRGp5VW5RVFpNQkRrTHI2d3BrSkR5VTh5YjZRX3lsRVgzWjBLUHhWQlh0QmNEa3NNaHlOYzVXcEQxamc0blJFLUNqRGVXdFdzLWgtYy1lYlRXcHBXY1VaUGRLZ3RyOVpVYUFiUTBFXzdsa3lxZjR1TXludzBEM3VqaU10SnhKUHo4dUx5RTRlWC1YbkY3dFlPaDN0RWRpc0pFVlhLWGRnNlhQUGo1STFrTGUwNGtBT05aVm9QaFAwOFV4UF9rMi1CMDN0WGR3b3p1S2Y3YzBCdTlEUFNUc1BkNTNJRG9Ba3l6MFRCOUxwd3BOZGdKV1huOHJBdmxyLWVKRlBTVVpnTk41Z01GSU9DRVpqemZWdzNRMjZIUzJ5OTJmWUdCczR4RzFPdDFnaURWVWhBSy1JVkdNalNwLXlWVUNoaUZpdWg2X28?oc=5,"Sat, 25 Apr 2026 17:50:36 GMT","Kroger’s Fred Meyer closures in Puget Sound region spark debate over retail theft, impact MSN"
Harris Teeter,Ashwin Nair,Grocery,Opening,Harris Teeter: ‘More plans to be involved’ - Jacksonville Daily Record,https://news.google.com/rss/articles/CBMikgFBVV95cUxQcWdwWF9WM3B2MHVCeG85VDVkWWlCN0hiQUdfZGl0dW5fZXM5MWxFQW1iYWZoZ2JtNkl4UWg2S2UyWXJrT3g5NVdpbDZKWGZwN0pZRFg4MjQ0MmVwOUV4QUlHV2JRLVU2MzhLR0pyYlhlT1dfak5CT0s5Y25xVWNuTEVPeHlOQ05kbTdXbGJUUmplUQ?oc=5,"Fri, 24 Apr 2026 19:14:00 GMT",Harris Teeter: ‘More plans to be involved’ Jacksonville Daily Record
Harris Teeter,Ashwin Nair,Grocery,Opening,Harris Teeter thinks it's found the perfect spot to reenter Jax market - The Business Journals,https://news.google.com/rss/articles/CBMijAFBVV95cUxPM3UxUW1sMlhPYW9kTkh3QXFVMEV0WVY4ZXRVSDBmc0xBYXVyTmQtZU10V1FvdjFZTllJM1YwU3kxS0hIU0lmc0JqY0FzdXc4YlgxZ0Q5Vm5zM1RUVWwtWHd4cE03TURPcEFGNUlrSzg5VHNwYnFSYnM3aTB0VGI3SkxRTGZGN0lsQndZaA?oc=5,"Fri, 24 Apr 2026 18:49:00 GMT",Harris Teeter thinks it's found the perfect spot to reenter Jax market The Business Journals
Autozone,Komal Agrawal,Mass Merchandisers,Closing,AutoZone Stock Upgraded by BofA Ahead of Next Week's Earnings Release - MSN,https://news.google.com/rss/articles/CBMilwNBVV95cUxPYzlNR1FVNnJIeWFmdHd3Z1dQTUxXY1BKaUtIcUJYTUdnZjVXUkJvaXc5MldCQzB4Sl83ZU5VRjQzUG5PUW1fcDZ5akM2YUJHVU5POGRyR19mZTlkdXJtS1hpSlYzTFlYZnZFWnpFa2JQUHRPNjdtTHloZXVaOFhDM3dvdFo3bGhWdlNyd2M2NUdodFR2ZUNRQnhrZHRISTJEOVRXZy13TGlKeHhwMjFWczhnZmJWbVNIQTQxZzJiNWdRTGNjWTh6dlRHRGo1WVh5NzFvb0RydENJemcwb0Qwd1FEVk5uT2pLWloxdV9TcjZqMGtyN1RKZlhqQ0VPZHl2SjFOenY4Ri0ySmRLVE10M2hzTDI2ZGJpSkpEVkxObzJNSUxidUZUbGN1dUJPdmY5RGhhMTkwdV9QeTBvMV9sN0Y0TlFrN2o3WWx5YW95S29DT1laZFRvUDQ2UGoxamZjTWpKNDJaYzVZLUJGbjBSTzExVDBQUlh5MXhUTEhaTkVJcldiTk8zNEhONnk1NlVrM2k4RmprOA?oc=5,"Sat, 25 Apr 2026 01:48:04 GMT",AutoZone Stock Upgraded by BofA Ahead of Next Week's Earnings Release MSN
Harveys Supermarket,Komal Agrawal,Grocery,Opening,"Grand opening set for new Winn-Dixie, site of former Harveys store - AOL.com",https://news.google.com/rss/articles/CBMid0FVX3lxTFA3VHozU00weERoaUdBbmJqZ2ZHeVVSbHQwWHg4SkptLVRjck9RUDlFSk1NQmdZaDYxS3F4Y2VVcGxmMWtjSkJfR1JsSzB6eFNlMVI0TTYxZTNNMXNkV1BYMlBKaDlqZE1nVEVrMGgxQ0NOaHVhVktZ?oc=5,"Fri, 24 Apr 2026 14:32:45 GMT","Grand opening set for new Winn-Dixie, site of former Harveys store AOL.com"
Lowe's,Rahul Vasaya,Mass Merchandisers,Opening,Twin tower retail and residential high-rises break ground in Upper Kirby - AOL.com,https://news.google.com/rss/articles/CBMif0FVX3lxTFBCNmVsNG5SRFVFUFNwTUgzRXp3VUZ3aWhTZFlXX090c0g3VEtkLUV3WGs1WkNtRWE3S3V1X0lkOV95R2ZRRG1NVm5GcktvMG1SQ1p3eEdTS1BRM05sS3Iwc04ySGxOUzdxY2Q4ZnEyXy1hUkFlSzNSR2l4eENOVEE?oc=5,"Fri, 24 Apr 2026 22:49:00 GMT",Twin tower retail and residential high-rises break ground in Upper Kirby AOL.com
Lowe's,Rahul Vasaya,Mass Merchandisers,Opening,Hillsborough County breaks ground on $1.6B wastewater infrastructure project in Lithia - AOL.com,https://news.google.com/rss/articles/CBMigAFBVV95cUxQX2tWQVN6Mk9iUV9fN0lOYk5yMW4tQm9VS0hZQzRlMGt1WGhIX0lKY2hLbGxQcHZDUHJCWXhvWnRNTEtZZnVTWHdJT1F0UHcyTVNyVnpjaDc3M051RVdpOFBrRVNUaUp0Y3Ywa2JxOHg3dlU5OVJNSVcyMHNFX0FwTg?oc=5,"Fri, 24 Apr 2026 20:33:03 GMT",Hillsborough County breaks ground on $1.6B wastewater infrastructure project in Lithia AOL.com
Lowe's,Rahul Vasaya,Mass Merchandisers,Opening,Home Depot rival set to open 5 new stores across US states in massive wave of expansion - the-sun.com,https://news.google.com/rss/articles/CBMikAFBVV95cUxNY0lVejEwX21wVHhma0JJYW9ZQ3dzVTlmQW1KUU0zVHhBNnRiSXRIRWkxQ2FGd1U3dkh5WldEal84SllaUi1QaEVidFNDeFdWSzRqNnhDOVZMN1lRNjNORFh4ZTFQY2dWaU83YkhBUzl4R3FJRHRIZkJRek93ZDE1Y05tNnQxNFJJcjFZRWYyZ1o?oc=5,"Fri, 24 Apr 2026 08:04:36 GMT",Home Depot rival set to open 5 new stores across US states in massive wave of expansion the-sun.com
Chick-fil-a,Rahul Vasaya,Restaurants,Opening,Chick-fil-A to open new location in Northwest Side. Here's where and when. - San Antonio Express-News,https://news.google.com/rss/articles/CBMijgFBVV95cUxQbWJabGdVQUJUUnJ3X254NnZwTnRtWERlWG9iZllmLUdxSGhBemxHQldod2hYM3ZGZzFXY2thOFcwTEhxU3V5eFJ0VEhVU3B1cmNITTJfYXFUNjhyUUJDY2xINGlwbjhnOVViRVZQZUpEZ1RWVU1JTjNVXzZBbkNydUtBVzItcHg0OFNPWFR3?oc=5,"Sat, 25 Apr 2026 18:22:48 GMT",Chick-fil-A to open new location in Northwest Side. Here's where and when. San Antonio Express-News
Chick-fil-a,Rahul Vasaya,Restaurants,Opening,Chick-fil-A opens a second location at Boston Logan Airport. What terminal? - The Patriot Ledger,https://news.google.com/rss/articles/CBMixAFBVV95cUxNZ0d0bDNGXzY3WlBwcEtZaldIdFRVdVVQSnFaMzF1a1czU2pHLWhRWE4wNnRkVko2QlNyZExvMUJFakMzYURfVW8tUGhBeXppWHJpcExmcTJPSTBxMlhJS0Y0VzhaSEt3Yll4Yi1tQTJWX1N0OHhLOU1LM2ZDN2dhTzE2YVdZWjd2UFQtRlZWNDYtclIzNGlGaVRJSkpYVkpGSkl5WUpKR2xpdWxoTl9iZ2dsSWpLVUhkalJBenNWenBzajFF?oc=5,"Fri, 24 Apr 2026 13:25:00 GMT",Chick-fil-A opens a second location at Boston Logan Airport. What terminal? The Patriot Ledger
Chick-fil-a,Rahul Vasaya,Restaurants,Opening,Whatcom Roundup: New restaurant in Lynden; Chick-Fil-A opening date set - Bellingham Herald,https://news.google.com/rss/articles/CBMic0FVX3lxTFBiM0hfR1BqRVNaVkE5VFRKOHpya29VaEV0ZkZhNHY4eUhZODA1Q0VSOXVkUlltaHV6OEJjTWZFeUZESWNHdzZxRkF2aE9JanZ6a0VRdndtTVpyTEJWcmxBR05CU2ZXUlJub25yb0tvWVNxSlHSAXNBVV95cUxNQzVMbEc1Z0tXU3BSOVZEMXItZnFHTlp3Tm9tbWs1NHZ6MjBkdldYcnBMUU1neTl3cmh2STZCcG4zZzBhd1FnTDljX3F0M2FUcDVIcHdwMFJPb1NWODBYVFpNWmQ2aC1FZ1EyVm9RUzVqdW4w?oc=5,"Fri, 24 Apr 2026 12:15:00 GMT",Whatcom Roundup: New restaurant in Lynden; Chick-Fil-A opening date set Bellingham Herald
Chick-fil-a,Rahul Vasaya,Restaurants,Closing,"What will replace Chick-fil-A? SEMO Students try new food concepts, share opinions - southeastarrow.com",https://news.google.com/rss/articles/CBMiwwFBVV95cUxOVE9fV3BQZ2RLaWNRLW80bHJXWVZYOFdqTHk0a0lmSFVwSDFRZUVGNWlkY01nN0VFSWliTWRJQWVGdF9FYmhGNWtsR1MtWmMyVmJGeWFZaGhFWkxvdFp0dXc0ZW00eVcyQ1hTZkJQbnQzdmtxc0tBTC1rMVp4TWxONE1KTWdOWmlWWjhnTzRTLW4tS1BjbjBBVGJHZkRpb2F4b05feVhGYUdzQUMwOFoxUVhvbzhBeTlNSHdJem9yZm1CUjg?oc=5,"Fri, 24 Apr 2026 19:07:42 GMT","What will replace Chick-fil-A? SEMO Students try new food concepts, share opinions southeastarrow.com"
Meijer,Bhavesh Phulwani,Mass Merchandisers,Opening,"After legal fight, Metro Detroit Meijer expected to open by late summer 2026 - MLive.com",https://news.google.com/rss/articles/CBMiwAFBVV95cUxNclQweE1rM1d1Q0otaDFRLXlDOGh5OHU1WVh6dC1LbG9aUWM1WWtpcXhFaFJiSXY2QVg2aHc4SU5QS0k0WTZBdDhpdHE5blpDQkktcnZfS0g0UC1aSDRJc2ozRnFpRlBBaVh1YzVkbURsY0Mtdy05T3BadzRqUkNOWEhNRU9vZU1xbFZTcWlTWkRpX0Vsd1o5ZFY5QndCOGZKdXhfR0pSSGkwRmpJaldDaTdad0NCU2JFUDZ2ZHpOVkzSAdQBQVVfeXFMTzQ2a09pcGxMUExVdXdSM2lZRVJnblVjM1E4N1pCVWVmZm9vb080RDU3REF2blpWT2ZmYndWbF9xbkg3VGZoRTNQa2RTYzYtaFdzSk1UX0tMZVZoT1A2QmNuUmhDbjhJcEpLSWRabVZlYjVYRnpfRkQ3UjBnTVZydnpZNFVvX2RZdkVTT25wUHVpRG1taWRmMTVmV1l2ZDItaHJhVjlhbEczclRlRnJSTjM4TzNieEtQZklfS0p3WEpiNDRtNXpialdGYlN6S0NGdXNSbms?oc=5,"Fri, 24 Apr 2026 13:07:00 GMT","After legal fight, Metro Detroit Meijer expected to open by late summer 2026 MLive.com"
O'Reilly Auto Parts,Bhavesh Phulwani,Mass Merchandisers,Opening,No opening date set for new O'Reilly Auto Parts in Rome - Rome Sentinel,https://news.google.com/rss/articles/CBMi0gFBVV95cUxOZ1FPMWsyUTZWWDUwdUFTdUNJU1JjTnVRLXhOSzFYNXRLVktVT0NUNWZnQllCWnFKMWZsZmZmd0I0LVI2YnRPZFZpQkEyOXMxNVNBa2x4RUV1LWlqR25fWmc4NWgwVW54Sm5HcTEzQ25EVFJESG42SlA5SGgweEtiU0VDVUViY25yNkhEWk1FUnNYYzl1b0dRUGd3QmZyaWZBWjhLTER1aFFCbnN1T0ltNEhsMGVSX01WWjUzN3AyazJndnR6dWlhRG9DX3Yzd3dtVXc?oc=5,"Fri, 24 Apr 2026 17:30:00 GMT",No opening date set for new O'Reilly Auto Parts in Rome Rome Sentinel
O'Reilly Auto Parts,Bhavesh Phulwani,Mass Merchandisers,Closing,MILFORD SCOOP: LA Fitness closing Milford gym - The Connecticut Scoop,https://news.google.com/rss/articles/CBMiqwFBVV95cUxOaUFlV1lFcFNvSFVqWEstWU1oSngteDlTUjVYdVlSTWRLMjVGdkE2SmNDQmV2dlpTZHpUTS13TUpXZ1hQUkh4MlRqTWZ1X1g2V24tRTRjRDBwTlBWNGk2ZEpaR25nVGNOTmR5ajJ3SkJNdUFKazB0ZnpaUUxkbXVpaUVvNjhUQWlKWjBqSjN3dVhQTUsydUhaamp2U18tSDFUbFIzYTY1SUJ0MGs?oc=5,"Sat, 25 Apr 2026 20:49:46 GMT",MILFORD SCOOP: LA Fitness closing Milford gym The Connecticut Scoop
Office Depot,Dhiraj Manghani,Mass Merchandisers,Closing,Closing time for the owner of Office Depot and OfficeMax in the public markets - MSN,https://news.google.com/rss/articles/CBMi_wJBVV95cUxNcWtnQ3lncHJxcktqSWJHVjh1WE83cmVzSmY0WUpxS3lYVzBxUEZKc01JMG1zTTIzTmRfcmh1ejRHcHF5NTZ1QWtwQ1RTd0E3OFdQeHhTaXBjbTRuQTlSWEw2ZFBlN3ZKeGVkT2tHNDl3Z2hzYzR1VVN6Z2RuSHpxbXBYZjN0OHdtRktuY2ZvTHdTZVdpaVNTVmtxLVJTdTJmc18wWElXNWtKYUllREN5VkNWRC1sNEpJUS03bi1yajUzQlY2S2tUSUVpNnR0WlRheG5TUGo1VndINmYwQ2gtVWdaRUYwYW5fQXh0NmRXdzF2bGpUbWZFbmpkSnR5ZnNld2J0aWxIY2IyZWJIVkpFRG9lZS1TVXFUNmZGbDNPSXE1WjBxNFlreGZIUVpXWUVYbkU4YmQ1WlFaOUNPeEJubjZkejhJX20zd1A4REMtM3Q3TmRaZzVraFpuZzNGQkF6MEFDTS1JMmU1R2JYdnNIekk3LVJKQkg4Y3QzRG5oRQ?oc=5,"Sat, 25 Apr 2026 22:02:34 GMT",Closing time for the owner of Office Depot and OfficeMax in the public markets MSN
Party City,Dhiraj Manghani,Mass Merchandisers,Closing,"Party City is reappearing inside another big-box retailer, Staples, after closing last year. - Modern Ghana",https://news.google.com/rss/articles/CBMiYkFVX3lxTE1EdGVMTE9qT285UC1BRGM4NlQ4VHFRb0VaMUFOcVRiLXN2Mkh4bFkxZ0JXbVl1ZEJSNDlCalU3V1VCeXBWOU1FZTJvSGRPbHgtWWZoa0ZZRVdFRGtNa3RHUWF30gFcQVVfeXFMTU9Ua2VOSTFYbWlGbTI1d3BSd1RkQTVha0Z0V082MjRlcEswTUNnUGNFT0wxelItWFFQVmNDSWhvQ01wTXdSeS1sZURtV2tjM1lFZDF5SWxDM3JWSzM?oc=5,"Sat, 25 Apr 2026 00:51:36 GMT","Party City is reappearing inside another big-box retailer, Staples, after closing last year. Modern Ghana"
Party City,Dhiraj Manghani,Mass Merchandisers,Closing,Party City returning in 17 Georgia stores after shutting down. See where - Savannah Morning News,https://news.google.com/rss/articles/CBMiywFBVV95cUxPOFJITmJ2eUk0YUJRTEJxUERyYi16Rnc3MndpajBxa1lEcnpRMVdFOFphcldILTU3MzZmZkdhRmpYU0EzQlk2dXRvbkRWS3RmcUxCanVhS2s0QVVEYnZNbXZuOGpCV1FrWTBYcmdpQjhicjBwQlFHcXhsZ2E5Yk5EYnc0Q1laQWJVdEp3UktvNTNrTWE4Zjgwd3ZBVjdpOXFpM2oxWWZHQWJnNU5FQWtWUk9oSmNpazdVYVBSWW5VSXNSc2xLSUVOaHFraw?oc=5,"Fri, 24 Apr 2026 18:40:00 GMT",Party City returning in 17 Georgia stores after shutting down. See where Savannah Morning News
Party City,Dhiraj Manghani,Mass Merchandisers,Closing,Popular Retailer Plans PA Comeback After Closing All Stores - Patch,https://news.google.com/rss/articles/CBMiogFBVV95cUxPQ3FqU0twaHlTeGxHTTlJU3lLRTYxR2ZmLTgzRUF4ejhjanlLY1JnaTY0Q21na0dnWDZPbDZwRnZuU09ZNnJYZWdsSkFGUDFtNnE4Rmh2ZHpRYV9ZYmdRdi1na2dYTEtYSmJrR3VZektvWXUwMzd4M1pzOWlTX21hZ2U4WEtxY3RVb1dzMXhCVFdQUElNeWhmYnRiLVdmLXZRWkHSAbMBQVVfeXFMTjc0V3phbTRXZmZiZU4yU3lZUHlKdDJTbkJzcDlCLTdoQWpwYkI3ZFg5V1N5eE9Gd3FRVzhxcTNwanRTcmVoX0t0aS1xN2NIakRoX2J6T1p6SWZZMlRZSjlfdFU2cVBFWVpYX1Q4TW5QVXcyRnBFRzZpQ2lHTklsTk1NdEs3NDBKNlZySGpXVVpQNjhSS0FrWXl3U2d0Q2RXclBSR3Voa0dWN1JyNDN4V3FkWjg?oc=5,"Fri, 24 Apr 2026 17:00:54 GMT",Popular Retailer Plans PA Comeback After Closing All Stores Patch
Sam's Club,Dhiraj Manghani,Mass Merchandisers,Opening,Limited Time 10% Off Disney Gift Card Deal Coming Soon - WDW News Today,https://news.google.com/rss/articles/CBMihwFBVV95cUxQemkxU0hBRkhTY3B2SU5JNHc1WlAyTW16el9pT2hSajZnbXgzRGlBUW9ocHFqTHAzVFNZbWhDRzlOTUVvc0hsMlUzYVFvRGxWTlJuVlBKVFBzLUxGUUtlWElCV0dRTGY2UEJhRlBheDlTSEdUdDhhTlZVNUMwV1cyTDJyMlBqdGM?oc=5,"Fri, 24 Apr 2026 14:02:31 GMT",Limited Time 10% Off Disney Gift Card Deal Coming Soon WDW News Today
Sam's Club,Dhiraj Manghani,Mass Merchandisers,Closing,"Walmart warehouse, in former Sam's Club off Route 146, closing - AOL.com",https://news.google.com/rss/articles/CBMif0FVX3lxTFB0LVdwZHdGYWlXaldxajZ3a1MwbGloa0VFUXNJdWgwSzNNT19reFlPN3lPTGN3M21WVGdqcXdGemFTNmxSYUhKQlJ5UjZDQkpBUXhvUVFNZEFPMnZ3TlpBT09vaUhmaGZabHRDN2V5ZlRoWWxEMi1PRUZEMExMMU0?oc=5,"Fri, 24 Apr 2026 16:35:29 GMT","Walmart warehouse, in former Sam's Club off Route 146, closing AOL.com"
T.J. Maxx,Dhiraj Manghani,Mass Merchandisers,Opening,TJ Maxx sister store to open new location in days - with even more to come - the-sun.com,https://news.google.com/rss/articles/CBMingFBVV95cUxNbWl2QkctTzBoeW81OUhYbUQzSy1Qb0FmamMydm9FY05uWmxtRnpoZk9rMkhNZkIzUU1zUlBPSmUxZFB2bWd3YnFQQ1F2N25Va0FYNjl6Nk1SWEhyRVozaHJvdzhfR0dieWdIVXpMU1pPUHBaSVlCZlhDM1NPUkpkcTRCQ21Yc3E1anQ2M1ZLSU5ZY2QtdUlTM1FTc2VBUQ?oc=5,"Sat, 25 Apr 2026 12:27:45 GMT",TJ Maxx sister store to open new location in days - with even more to come the-sun.com
T.J. Maxx,Dhiraj Manghani,Mass Merchandisers,Closing,TJ Maxx closing two popular locations in the new year on the East Coast - MSN,https://news.google.com/rss/articles/CBMi9wJBVV95cUxOT05USC1RVGpnQVdHWExMTm01QWJqaklzSktuemFyMHk3cUFBS2M1RlpRb2lzMGxwOUl0Q082SklwSzFsQkFjQnZUVUNrZWxrcEFTVTdoeFlWUTJEaHdTV3dyaFRtX21PS1c5RHE3NHdnaDBoMFBMc1VWZE9Gai04TEFVS1ZET19GUUthZGI0SHVCLWMyaXdnaFFtWVhuYVBmNHh2blhJOG8zRDhBSG1qbUlXODhYM2x5SHhBelRoUVN1cGlRVWw5Yll5WEk4d25wSXNraVRURmVEVWZ0bWM1d2JPSkhsbnZ4aWpYVS1JOG1SQm9xWkN2cTJOR3I4QTJFclVOTEVpdnZhMzdfekJ2dFRUeko5dWh4d3FjbmpVX2dsVHdISXd0OVhRTEdiUkdIbGcwWDltU3RNUTR5TUFleXp0Q1J6VGhOMVJRdkVpWVJMeUpIX1JpeHFkNUdtb1A5dDI3RzM4djlBRTZlUmh2ZlYxWW5uY1U?oc=5,"Sat, 25 Apr 2026 12:06:39 GMT",TJ Maxx closing two popular locations in the new year on the East Coast MSN
The Container Store,Dhiraj Manghani,Mass Merchandisers,Opening,"Bed Bath & Beyond to Open New Stores in LA, OC - MyNewsLA.com",https://news.google.com/rss/articles/CBMioAFBVV95cUxQRDBiWmNIVDhkTjFWWFFzVVVxZ0t6amotZklvQjFkOHhrV1lXa1M0QlhPMmpSZVBTekJHMEZzSmpRd1Jycjl2eW1wWW5FX29zSVRrcXUyMVZaWHNiR3dfamtFRmlNb1oyUWxfeTZHUTVjbmNsRFZ3Ti1GNHVUS0pSY3F5WDZCdzVyTnFCcnotRjJJNkprTE5XM0J1OWczbFhM?oc=5,"Fri, 24 Apr 2026 06:58:00 GMT","Bed Bath & Beyond to Open New Stores in LA, OC MyNewsLA.com"
The Container Store,Dhiraj Manghani,Mass Merchandisers,Closing,Another blow for troubled big box Texas retailer that conquered the country as it shutters stores - MSN,https://news.google.com/rss/articles/CBMiuwNBVV95cUxONk9VNk1xZ3RBWXZaWVJhRkNyNE9QaG1sa24tdHJlX3poSzZheE9tNDhBUG82Si02UG1qbzBPRjFneTZRWUZ0cnk2aWV3VjktYnVBbTVwWE9zaDRzVjNjTnZDUzB2WHF3MURmSmR4eGVMLTR5V3lyNWJzaFU5ekxsR0N0S1ZTUnVYcktNWE5nMG82VTlUazYzR2VLQzdzOVl5MER5U1ZlWTFlc2tRS3VfWkl6cWdQODhIQmlEYVp3U2p4RjBKY3FNZTRURmc3a0M5QXdqOFhOSmRNcERqUTNXTFZmdHRRYzUyWm9Ma1gxWFUtUURSNFQ2Mk1qaUVZbFJIdllhRTRWZnVzc3UtaHo0b1R4Q0dLOXREeEhZeDROX211NzZQS3V4TmZGczNCeU9RbUxaUGFsN25CZ2E0ajROd19LYWRKcWFVSjlnelYwbUl4RDhjcmRUSnhLN0c1RGpWSVI4Q0FQZUdmNGpsYk5VVnpUQ0pacW9HVjZROG1zMXRoSS1oU05pVFdoTVJvUnF0bThKWnNCTUZCWkhyRkRXS3gxNzdjYjFTYkQ5dHNINTVxQ2pJaUd1YUItNA?oc=5,"Sat, 25 Apr 2026 14:59:54 GMT",Another blow for troubled big box Texas retailer that conquered the country as it shutters stores MSN
Target,Vishwas Shah,Mass Merchandisers,Opening,Target is betting on home to break its slump - MSN,https://news.google.com/rss/articles/CBMi0wJBVV95cUxQX1hRbFZKR09qajltUVBWZ25qSExOUGRGbG1xdk1UZVd0dDZiNDZiSFNWeXhIb1JkSFBYSXFnZG5tSlhLSXBtTjUwNmF3cnYxNVJHekNPcndWVC01ODRDNC1mWUM2SlJFYVVJZWhad3pvMkNLQkg1Znlnb19QdjJYVC1QMi1LbE0xVkZqNDdiMmtKM3RlWm00UkxVTTRvYzlTSlVwUHJlTjA4VlpQcUo0Vy1MX295ZU9fRzdqR1lVLWNWYXl0VmJxY2JHS3hRckdkeGhXaHM3MFZ6Tm1ES2d0WHFPUWM3bkJ4LVJHckw5SmdjNklDd3dJOXpzOHdNSjVTcjdmYU95Z1g1Tnl6c1RIZU5wS19KYUxEdlktLUtSUEUtVGpHeXd5N0Uyd0pvdHdQZ2hKRGs4MUZ4VUphZTZwbXZkN0owNFNoenhjMDYyRWxHSjQ?oc=5,"Sat, 25 Apr 2026 14:09:36 GMT",Target is betting on home to break its slump MSN
Wawa,Ayushi Chandel,Convenience Stores / Distributors,Closing,Wawa is closing another Philly store after its new format fell flat - MSN,https://news.google.com/rss/articles/CBMiiANBVV95cUxQYWNsc1BBX3h6WGxKSThONzRhVDhuekkyVUU2NEdCelVTbmNPOVphdXpkc1VMWUNiaENOWElBS2ljZTc3QnppOFQ1R0RMQWFKcVF3MS1waHVyOUxoUmxuSU1QODFjNHNnY0VTS21LUEJIa3ZNaTdrMjNTWmk2X1Y1bDc2VVdrQXppZHlOMkZUbjRmSmVBLWpyMTVDNnpBYnVMUEhRZ09OY0QtYjF1V3oyaXpfSnBEN3pfSGdRU3RSWVhxMzR4ZXRQTXlIMWdrbnpxRzFpQkVsS08zR1hDXzAtYm5BSlFZeklwaTNiRGZJS2d3aGVBTEpQd05NSmo0NGNGMGRjN1JLWEZTYWRZeUhUcE5PZnpGN0d6TlY0TFFTalE2Und2SjZQT2FNOGNaRUpqcGNucFZxclJvaDFiUmZ2MzZrTENKN1MtLU1CUVU5ems3UjNZc0dIRExvVjRJYlo1eG5aQ29oWEZ4ZG83TVNBYUZ5OVV6OHBKeXFPLWtEUTdHYlpMcXBWeA?oc=5,"Sat, 25 Apr 2026 12:12:20 GMT",Wawa is closing another Philly store after its new format fell flat MSN
Dillard's,Ankit Rawat,Department Stores,Opening,Dillard’s sets grand opening date for new Miami Valley location - MSN,https://news.google.com/rss/articles/CBMi7AJBVV95cUxNQldXR19Db1lidzg4QWM4UDVyWUZQVkN1V3VvM3ZTczJhQ0IwUERoRHo5UF9SNklfdVFDSFpLV0loeUZTcXhYWFp3YlZiZi1PTV9oWFJNaDVaV2dreGk5SnF1TklrOHdSeTdiN0luTTZqVHprNGt6aDVTQWE4OXdXUDJ6aGtKUng3NjFKem82RWZ3THZZb0xhZF9WblgtUTliZjI4SHFpMUhVdGx6N0dabmlKSGxpbjlzQlhxT295OHJ5MEt0dFRjTXA3Mk54VkJ4VmNCdV9ocmdjOXZyT1FweWFDRHpGWlk4MXFCcHk4SmVBTHFMam9zMnllcW1IZ1EtMTk2QUFLcjQ3RHBhNENrYjY3dmhaVHRaQWpVQjQzU1JnUERWZUdtWmg4REpjeDF2dGQtUzRjckI0bTI0cDdRekp6Q0xobFJReFAtWWJCSWpYdmswOFRzLTVBQVFvZlBSelg3MjZLNXgyV2E0?oc=5,"Sat, 25 Apr 2026 22:57:49 GMT",Dillard’s sets grand opening date for new Miami Valley location MSN
Dillard's,Ankit Rawat,Department Stores,Opening,Dillard’s opens new store in Beavercreek with ribbon-cutting; hundreds of shoppers attend - MSN,https://news.google.com/rss/articles/CBMijANBVV95cUxNbHd5bDRnNmEtcG1TVGV4dEUtNzcxSXhURV9CNl9STm5EVktwYVlOLVR1QVJnZTBQZG1tYU9GdkVUUFBmUEJxYWEwaTBJQnpadWNZUGRyTWVvS1BZVzdMaUhUeDNESGtEMzNCSzc5Rm1zYjZ0b2Fyc002ZDN6d3BqVThfRG5YMGhkTnUyTVpJWU9GRWV0WFJmNGMzVXhIVlhjSGlzTmh2d0NUVlVkYXNjakN4UUcxNDQzcXZ6elBqaXNWc2xaN3pabmRCOE5CelVQNUlfYlhlaDYtUk5XNzBQd3g4TWdfMmc4TWVQbjVyRXlHWGRsSjk1NzBFLUR1RXhVdDdmOWJGYzQzODJjc1JLbWZNQmN5Ri1IeW1NM0VDWnNzb2FSM1I3aHlSQ2JRWm4tTWNkX0RXbHhQYm1aWllMbXl6WkdQSzNVU1JFeXdrQkx4RE5UTThzUXZTRmtxeElROXJzRER6NzY2TFRxanlDUmt3RVlsM0hRd1lJMnR6eGtPX2syWU9zLUF3V0g?oc=5,"Sat, 25 Apr 2026 18:06:44 GMT",Dillard’s opens new store in Beavercreek with ribbon-cutting; hundreds of shoppers attend MSN
Macy's,Harsimranjeet Singh Ghelani,Department Stores,Closing,Liquidation sales reach 80% off as Macy’s permanently to close 14 stores - the-sun.com,https://news.google.com/rss/articles/CBMimwFBVV95cUxQYnlfaktTUVB4VEpFMjkxLUpHLUpLNDdEeUlXQ2I2ZjRobWdVOFA2XzhQdm56QmtfZFAyOG9DRE5LNTZoTVM3SVQ5RWlEb2xWUHNZMzVBOWtPbW1sMnV1aGZuZ01icmlsTVBfV1I1bHR0TXNiNjd1eTJGQ3NMS3dzbmNiTHcwbFNBcEFqd2NkOElocW5DR2gyM2ZzUQ?oc=5,"Sat, 25 Apr 2026 11:27:22 GMT",Liquidation sales reach 80% off as Macy’s permanently to close 14 stores the-sun.com
Macy's,Harsimranjeet Singh Ghelani,Department Stores,Closing,NC mall losing Macy's and Saks Fifth Avenue at Triangle Town Center in Raleigh; what's future of the shopping spot - ABC11 Raleigh-Durham,https://news.google.com/rss/articles/CBMiuwFBVV95cUxQakNBdnpsTFFSMkN0NWExNkRwM0drUmxtd1RZdGlxQnNpcV9PeTVFM2JNdFdRMzVNdXN6X2p5Y2F4VERGUFI4Z3poZUxNT3RXUXRzUFJSQWRtbWpCQWdaZnM4SDdTMXJFdVZ0Z1Z2QWI0cDhLQXhOMUZiQ2h0V05qcnVKbTVvM0pMNEREOUY5X2lkX1drQ2FSWWFRU3V3cV92YWVwQ3lfckRxcU1VYkpoalhEYUFJaFFWVTVj0gHAAUFVX3lxTE11QV9uWUd1WUlPb0loZjVvalhxRHphOFhiaUljUHZBMjBNUHVkOHlaMHFRNHBsbWZUczRVV29MZ0FEQ0FLQ2pxMmZVRG5zVENkalBTdEFSNXp6ZUhmRG0yakFJaXJ0cndJakl4SkJmMndxN0dKQjhWc3BDcy02X1RDUlo0Z05WN2lfVkhjdDZkWlc0X24zZ0dRYW9hM1ljQ1BHejY3R0NYdVY1WVN5ODlDZFRXbkFyLUVJZTU4dEhhZg?oc=5,"Sat, 25 Apr 2026 01:10:17 GMT",NC mall losing Macy's and Saks Fifth Avenue at Triangle Town Center in Raleigh; what's future of the shopping spot ABC11 Raleigh-Durham
Saks Fifth Avenue,Harsimranjeet Singh Ghelani,Department Stores,Closing,Saks Fifth Avenue in Bala Cynwyd is closing - MSN,https://news.google.com/rss/articles/CBMi0gJBVV95cUxNd2lodEVlaDVLYkt2R2JwSWhUR1hFY2tGUGhGZ0hocVI3VFREMkxhUjdSV1Ytam0wYlZPV0ZlamV0VkJUSW5raXNQSFZ3MkYyV0hwd29sYmVDMWFab2FfbVpfallXVHdCbkJmc3JHdlJuWTZYLTRZT2hkNVZiNndBeG9Sdlg5U1FSMnFTV1hnWjVONUl3LXE4M09fLVZxV1lXOURPZmw2VmxIaTVfd2VXSHkwek94bGUyTUhadndmUi00TjVaODlyVjZTZUNEc0pjRE1YSHI1d0prbzc4bWNRVkc2Vk9oc2t4VlQ2TUE0aEpHeEFtY0VFMnZQR2lZVXpEclFtcW8tTE40aERUbkVxNFJPWDlhT3lpekx6Nm5NcFdpbThIWjBURF9TQXVIal9LR3cwdWs3U09DeUFfRm5nR0tXYnkyVmNYVmhENWFGcTN0Zw?oc=5,"Sat, 25 Apr 2026 22:14:38 GMT",Saks Fifth Avenue in Bala Cynwyd is closing MSN
Saks Fifth Avenue,Harsimranjeet Singh Ghelani,Department Stores,Closing,NC mall losing Macy's and Saks Fifth Avenue at Triangle Town Center in Raleigh; what's future of the shopping spot - ABC11 Raleigh-Durham,https://news.google.com/rss/articles/CBMiuwFBVV95cUxQakNBdnpsTFFSMkN0NWExNkRwM0drUmxtd1RZdGlxQnNpcV9PeTVFM2JNdFdRMzVNdXN6X2p5Y2F4VERGUFI4Z3poZUxNT3RXUXRzUFJSQWRtbWpCQWdaZnM4SDdTMXJFdVZ0Z1Z2QWI0cDhLQXhOMUZiQ2h0V05qcnVKbTVvM0pMNEREOUY5X2lkX1drQ2FSWWFRU3V3cV92YWVwQ3lfckRxcU1VYkpoalhEYUFJaFFWVTVj0gHAAUFVX3lxTE11QV9uWUd1WUlPb0loZjVvalhxRHphOFhiaUljUHZBMjBNUHVkOHlaMHFRNHBsbWZUczRVV29MZ0FEQ0FLQ2pxMmZVRG5zVENkalBTdEFSNXp6ZUhmRG0yakFJaXJ0cndJakl4SkJmMndxN0dKQjhWc3BDcy02X1RDUlo0Z05WN2lfVkhjdDZkWlc0X24zZ0dRYW9hM1ljQ1BHejY3R0NYdVY1WVN5ODlDZFRXbkFyLUVJZTU4dEhhZg?oc=5,"Sat, 25 Apr 2026 01:10:17 GMT",NC mall losing Macy's and Saks Fifth Avenue at Triangle Town Center in Raleigh; what's future of the shopping spot ABC11 Raleigh-Durham
ConocoPhillips,Harsimranjeet Singh Ghelani,Convenience Stores / Distributors,Opening,Exclusive: Inside the $93M transformation of a former BP and ConocoPhillips tower into luxury apartments - MSN,https://news.google.com/rss/articles/CBMixANBVV95cUxOOGtfVmpnbjlKZU96eW9RaGhQM2pHZnFLbGlfcHZkOXJDRmI0UnFhRENvS0FGaWcxRWpnQlVSMG9pVENWUjNsbUZXRTdrUkFSSzJZNXBQWG9TNEtKcU95eDJYOVh2aGh6aXp5aVdzSXBHZmNoU2tGX2FCNzZWaXZmWDJNVDNlaWh6Rkg5U0RzZE1GSi1HWHdYM2c1TWhTal9BZUQxNHkxNHNlTDBfNDdObmFfODYzajV0RHVHRzRiUEQtQkJ0M1F4TVlTVUlsZ0hmUm9aQnBUUkN4M3dVbERKbE5ITmhfMDlCaHJaa3gyaTl0VUlRY1pXME4wRFVKT1hwZE5rX0FHQk5hS1NZRC0yYlBaWklfT01MbVRCcVQycTJGNkstQkxSYjJ4RTZVTHJXSEZlX19TN2l5cC1TbVN4NElHU0xvRWFnZkxKRWFXamhuRnN0bllrcFJjTXpweWFRRnlNM0hIejFteUEyNENtejZ3QmlQbVFOZW9HbHVKQzBrNjNzMzNqa0VEVzlEYjFCc2R5WU0wTzM2am5hVjcxdlFFLWNPMWJMT0VBRkQ0OVRJSmpRSFlnb3N4QmRZSVJOZmRqZQ?oc=5,"Sat, 25 Apr 2026 13:04:17 GMT",Exclusive: Inside the $93M transformation of a former BP and ConocoPhillips tower into luxury apartments MSN
ConocoPhillips,Harsimranjeet Singh Ghelani,Convenience Stores / Distributors,Closing,ConocoPhillips (COP) Advances While Market Declines: Some Information for Investors - MSN,https://news.google.com/rss/articles/CBMigwNBVV95cUxQVFpoTEdUTHVnczFrN1g5YkFUUVZrZ2hMMGkwLTVvVzNOZ05JbGdUM3ZTaU5HcS1nNzRRNWV3QXFtcTUyR0hrQi1NRGUtSHhoVEpRM2RhTjFHRVc4OTdPeXh3X0FKUXpMTG4zZFNzWUIyLXZHODZ2VUxRM0MzQVg2cjFpNWY4UHc1bF9JX0gtUTRRTkdRUFBUMGJsbjFiTHJneGtWejI5Q3BKSUxVbG9BdkRmeHpra0NtYlFBaTVSUG9aREVSQ1FTMjktQXY1UUJiUWxfNmtwVENjNnBHeUl4WFJCaHBXLUpCdExXUTRXRGlkWWUySE1SeUxzalU3czVCRWpUc29MTUdfa2hOeE15cG9QV245eEhXeHNPbUdjZ2tFM2Z3a0JsNUtzVEpRYzRLWUJFTk03SlduSjZwajRicnZUSkZlTjNndy1EQUtFTmNiZjZiUGpCRU9icnJnRVpqc0l2U3pQM1FTQ0M1Y0hmVU5DeTBPZXItQTRoN2lsR0ZMQlk?oc=5,"Sat, 25 Apr 2026 18:53:10 GMT",ConocoPhillips (COP) Advances While Market Declines: Some Information for Investors MSN
