Store,Analyst,Industry,Type,Title,Link,Published,Summary
Academy Sports + Outdoors,Ashwin Nair,Mass Merchandisers,Closing,Academy Sports prices $500M debt deal to repay loans and 2027 notes - Stock Titan,https://news.google.com/rss/articles/CBMiswFBVV95cUxQdlY1SDF4TzlCZS1Zc0NyWmE1WVZLdXd0cTRya3gyRDZBaUtwbHZLWjF2QXFGOVJoSllud09HTEFseHhaUjRfbXlaVDIxYnlJa3YwUUJfYi1DQ29LOERmR3dTenRWOE9hc0JCck1keUNaNkdKek1yLTNYa21OaVl6d2hpR0ljY3J6Rmx2M0tPODFNSURLMkp6SDhKbldxMEMyZmdzZzY1ejNWMlk4ODVyOERhcw?oc=5,"Mon, 04 May 2026 20:57:46 GMT",Academy Sports prices $500M debt deal to repay loans and 2027 notes Stock Titan
Academy Sports + Outdoors,Ashwin Nair,Mass Merchandisers,Closing,Academy Sports + Outdoors Announces Pricing of Senior Secured Notes - Yahoo Finance Singapore,https://news.google.com/rss/articles/CBMilAFBVV95cUxQRHB6dzRrRS0zVGVCb1JRVTk3WUllcE44LUdIMDFZYU1rMlppY2czemFiSnowd25KVzdwbzdjZlFRSGtnRm5pZEprQ2w0U1otUV85VGhTQzlzcWVOU01XVDgweUxtTW1WVzRsbXJBaEJjWWFFZE03T3luYUxlY1RFQWdCd2ZOU2pyVXp1X1ZmLXZnUy00?oc=5,"Mon, 04 May 2026 20:54:00 GMT",Academy Sports + Outdoors Announces Pricing of Senior Secured Notes Yahoo Finance Singapore
Barnes and Noble,Ashwin Nair,Mass Merchandisers,Opening,Barnes and Noble to open brand new bookstore with cafe in sprawling development in WEEKS - the-sun.com,https://news.google.com/rss/articles/CBMifkFVX3lxTFAyWlY3OEZGblV4T1ZRV0pYS0libG8zdkhyT3g5RDJ2R0d0cHZFMzFLdS10UnZWVXNPNnJOQmw3SWdWX0VpcGxpbllBM2Z0eFA4NlZ0NE5CNnJUQ0V1QWhiM3ZIaEc2OHpiTUtFbnNaQzlhZ2xHQXNMVVJISnFiUQ?oc=5,"Sun, 03 May 2026 12:31:36 GMT",Barnes and Noble to open brand new bookstore with cafe in sprawling development in WEEKS the-sun.com
BJ's Wholesale Club,Ashwin Nair,Mass Merchandisers,Opening,BJ’s Wholesale Club eyes second Texas location - Drug Store News,https://news.google.com/rss/articles/CBMie0FVX3lxTFBXOEVjNUNzRjJYX0RRRDJOX0tHUmxZYVlBeEVBWVBjdWp2c2tCWkpfVm9CRG9JYzFicWV0ZkZab09iVlF3amx6Q05mNzBIOGR5SjBDV1lyYTViOEZ4SVZNa2l4bkRfQWpyajNQSFlZeWRKR3hFVjlXZEJvcw?oc=5,"Mon, 04 May 2026 18:54:22 GMT",BJ’s Wholesale Club eyes second Texas location Drug Store News
BJ's Wholesale Club,Ashwin Nair,Mass Merchandisers,Closing,BJ’s Wholesale Club eyes second Texas location - Drug Store News,https://news.google.com/rss/articles/CBMie0FVX3lxTFBXOEVjNUNzRjJYX0RRRDJOX0tHUmxZYVlBeEVBWVBjdWp2c2tCWkpfVm9CRG9JYzFicWV0ZkZab09iVlF3amx6Q05mNzBIOGR5SjBDV1lyYTViOEZ4SVZNa2l4bkRfQWpyajNQSFlZeWRKR3hFVjlXZEJvcw?oc=5,"Mon, 04 May 2026 18:54:22 GMT",BJ’s Wholesale Club eyes second Texas location Drug Store News
Burlington Stores,Ashwin Nair,Mass Merchandisers,Opening,Burlington opening 26 new US locations in May. Here's where - USA Today,https://news.google.com/rss/articles/CBMimgFBVV95cUxPR2MtMkp1ZndORk15ODF1ZFFrS2p0UXBJX1dmaWVCekJ2eVdJcHpETjI0Mkk4TlFnd0oyenQ3V2p1QS1NZGl5TDExZEs2NXRhSWRLT1Q1TklBNmZvWUttVkY1UmRXcFlNMzg3dDdaaTlLcmdKSVhwVVVtLWs0MVJ5MGdpTmpaMWVHRWNkMTZKVXo5WXRtUUZqNlFB?oc=5,"Mon, 04 May 2026 22:27:00 GMT",Burlington opening 26 new US locations in May. Here's where USA Today
Costco Wholesale Corp.,Ashwin Nair,Mass Merchandisers,Opening,Costco closes on land purchase in Franklin for new store - The Business Journals,https://news.google.com/rss/articles/CBMiqAFBVV95cUxNbHRLb3l6Rkh6ek9HcTZ4NDVvSnJsQTN6X0FHOG51RGFXUjlHekRzMEJRZmlXS2lkSXRjMGwxaVF5VmE0WktoV3U0Wi1vT2JwSWpNS1MwWlRaaFlGQlh1Mm1SSnZpUGQxcnJidmR3UERrVnJPcUMwWjEwTGR5bWZ3a0hla2U0anY3Wk1wU1MwR2pqWmE5QmJGVXhhMTRHZU1sSXc4eWRFSlc?oc=5,"Mon, 04 May 2026 15:41:00 GMT",Costco closes on land purchase in Franklin for new store The Business Journals
Dick's Sporting Goods,Ashwin Nair,Mass Merchandisers,Opening,8 things to know: Former Bed Bath & Beyond in Towson gets new tenant - The Business Journals,https://news.google.com/rss/articles/CBMirgFBVV95cUxNTUMxeUs2VEFySVhmbGN5MU5yQmFkeHN1YjktdURCVEFNSWdLYmhaczV3U0pfdk42OUV0b2hBblowYXFxUFYzM3pEZDdrZFdSTFNjemhLWXk4aGN2dEtwQjhsTG5wUzJhVWFGX2MyQTd5M0RfZVRfdTV0WlZmb2ZlUTJENFo3T3hUYzZ5T3hWM2JmNEVOZTd3QlBHOHlZdWk4SERKMktMWFd3enIzc2c?oc=5,"Mon, 04 May 2026 10:25:00 GMT",8 things to know: Former Bed Bath & Beyond in Towson gets new tenant The Business Journals
Dick's Sporting Goods,Ashwin Nair,Mass Merchandisers,Closing,Dick's Sporting Goods Pittsburgh Marathon Weekend: Road closures & Detours - WTAE,https://news.google.com/rss/articles/CBMijAFBVV95cUxQOXFwTnFES285Vlo1cGRRRVc0UXhfRHVwTnA2VTIxZkxIYUNqZHZRSFdsT0YtVEVpM29oaDF5SFBvd1lVcU4yUXpGaEVNNzFvWVBhZkdjTkp6dlcwcUpPWFM5cnNRUUZ0dV92cUFTUHU0M2tjWnhSQktYZ01Bc2szZlcxU3FxemdvWDFDeg?oc=5,"Sun, 03 May 2026 08:39:00 GMT",Dick's Sporting Goods Pittsburgh Marathon Weekend: Road closures & Detours WTAE
Publix Super Markets,Ashwin Nair,Grocery,Closing,Is Publix Open on Easter 2026? Stores Closed as Chain Honors Longstanding Holiday Tradition - International Business Times Australia,https://news.google.com/rss/articles/CBMitwFBVV95cUxPazFHN1ZSQ0JWa000aVUxQ3lIdDNUUE5Ib3R5emZDbS1zLTBXd19EVE8wWkhYUnJwMFRrT3Z6dEhJdVNkM1NfbjBFQ3VoZE9BVVp0VlhHS2JqMXh4ZDJvNnBWbnJRMGhfVlp1WGJZMTA1bnRlSU5mcGctNmUwbmhqZ3NaaWN1bF9pWHhRREQwM0FHQjRaR1FZTWdVazZ1Q2h3czYxd2kwRDQ3Y1RyMERraGhfSzNscUk?oc=5,"Sun, 03 May 2026 15:39:00 GMT",Is Publix Open on Easter 2026? Stores Closed as Chain Honors Longstanding Holiday Tradition International Business Times Australia
Walgreens,Komal Agrawal,Drug Retailers,Closing,Walgreens closing 27th & North Milwaukee location June 23rd - WTMJ,https://news.google.com/rss/articles/CBMilgFBVV95cUxPQTRxeExDUlpoWWJnN2F2NmxhM3pCZmp1bG5Gdl93emFKS0cxWlBtMVZZaFNxQUYzYldyYTdVZXhvcFhsTl9tQkFOdzhWanV0RXd6NkZqQ1pJVzZXYktJTm52NWhxblZQVVA1WGZaaUw1VFFpVzlUR25YZXcwRUkwM3pkdE5WTnk0ZmlVOGt0TWZlNTk1a0E?oc=5,"Mon, 04 May 2026 23:36:29 GMT",Walgreens closing 27th & North Milwaukee location June 23rd WTMJ
Walgreens,Komal Agrawal,Drug Retailers,Closing,"Walgreens is shutting down this Milwaukee store due to ""safety concerns"" - WISN",https://news.google.com/rss/articles/CBMirAFBVV95cUxNaDhkd3lwdGRfWHJUYzlMSGZvcDZ2X2ExMmFOQTBCVVFxcmwtMHRpaENwdmhNcDdEZnhwWUV0RXh4N0pqVmxhMUZlZi1hMVNxX2NYUnp4RGJHS0tIRVRLZl9EZHNEbDB0SFFfVWpzNDhfdXVpR0pJMnZzQ21pS20zWmhzc1NDWHRLMjFlWElKTDBneGNQcmJSRXA1LUR3dGlhcW1fX2l5U1pyak83?oc=5,"Mon, 04 May 2026 23:06:00 GMT","Walgreens is shutting down this Milwaukee store due to ""safety concerns"" WISN"
Walgreens,Komal Agrawal,Drug Retailers,Closing,"Walgreens closing Chatham location, citing theft and violence - NBC 5 Chicago",https://news.google.com/rss/articles/CBMiswFBVV95cUxOSzBjNFBkX3YxLUtLSEV6bkdPZHNOTUJfZUN6WDNQN3ZpTDRTZWtwSk1ONHpYQ0hLdHdtUGlxdzJyOWR4ODdmZXRGelJlZVp0dHZUT0NkbVFrODhZcjhGV01UZ08yYm12d0ZERDFlYTI2S3dMdUdwYmRRQjlmNHZTU1dLN2RjUV9RQ2Z4ZlN6R2hFQlhrY3JMN2RwQVJSVjJGTXB6S0FFeGtiNmVRdUloNGxyUdIBuwFBVV95cUxNYVhGa1Y3VUhPYlczNFVMRlpqWTFaYWZjb0lSN1V2UVUzR0x5REdfeHh0T181RWxtLUlYeDI0UWxFN0FUSGNvSHNnaW51M0JfMFUzMkRINWFJUEJvcHdQeFBhQVFHUmY0ODZqOVd0VUsxQ0NSOWY4UmlwMFRUWEgyT3JOYVFrSW5ickZiVGp5YU5GdWpTWVRuOUR2aS0tdHAxOUhzT01icC1US0NUODkxbV82ZzBYRE02eHR3?oc=5,"Mon, 04 May 2026 21:16:11 GMT","Walgreens closing Chatham location, citing theft and violence NBC 5 Chicago"
Walgreens,Komal Agrawal,Drug Retailers,Closing,"Walgreens Closing Chatham Store At 86th And Cottage Grove Due To Violence, Theft - Patch",https://news.google.com/rss/articles/CBMiqgFBVV95cUxNUF8xTUdqUDhha21lWUFrUm1zRDRPQlRuYlpyd0N5bl8zQnl3cllDaFp2RzZBM3pRWHZ1YklhWVJPdU51WXBvXzQ2VWJpTTVkSGpDMFEyRGpqeFV4QnJsQWRydWlQeUdnYnY4R3dfWlFCaDVfOHVsZ1FFelRjd1o3UGRYZjVRUGpWWlF2dEFGNjg5YzZZYVByVlNzYWItTENxU0RzdVdXRHpmdw?oc=5,"Mon, 04 May 2026 16:19:55 GMT","Walgreens Closing Chatham Store At 86th And Cottage Grove Due To Violence, Theft Patch"
Walgreens,Komal Agrawal,Drug Retailers,Closing,"Walgreens closing Chatham store due to violence, theft - CBS News",https://news.google.com/rss/articles/CBMilwFBVV95cUxOcUNwX1cwT0VSU0JzUkowNVJudEo2N1hGUG42dFFMV3VtMk1mRHJyUDZJZG5vd2lqM05RU3FxaXBJUlFudjcxdktWTF9TUlFzU1BaMEJnemhtRmplWDNGdE1aY2dyMENfUksyQXptalFxYU5qRGx3cWVZa1h0WFB6SXVmMHdsSGZnSFU0Z0F4T0JUUG9lXzB3?oc=5,"Mon, 04 May 2026 14:36:00 GMT","Walgreens closing Chatham store due to violence, theft CBS News"
Walgreens,Komal Agrawal,Drug Retailers,Closing,"Walgreens closing Chatham store at 86th and Cottage Grove due to violence, theft - CBS News",https://news.google.com/rss/articles/CBMilgFBVV95cUxNeDFkLUZrY216MnJhRVE5TEQwOW5mOWZfbG11NktaMFJUNzB4UVZTSVB4RGdqeFpEOC1samFoQ0xtOEwtbFlLeTRJRjgxY0dJNmdvYS1IbkwzaVMzVF9lOHNFMWczLVRIMmlfUlVfU1Y0OWItb1ZfdmFXOGpZd3V3OFkyNmpFQWwyckRqajFvODdIeTF1d0E?oc=5,"Mon, 04 May 2026 13:48:00 GMT","Walgreens closing Chatham store at 86th and Cottage Grove due to violence, theft CBS News"
Walgreens,Komal Agrawal,Drug Retailers,Closing,"Walgreens 86th and Cottage Grove: Leaders speak out ahead of Chatham, Chicago Walgreens pharmacy closing - ABC7 Chicago",https://news.google.com/rss/articles/CBMiwAFBVV95cUxNTDJhQ0JHbXlxcURXNVl1Mk9RSlJSOHh6NjNpdlNsSEhLc0N2cGl4V1FlaHRXZGJYVS11NE1oOTJEb0U0Ynp6Q2x3Rmtpc0phb08yUFhoYzlsdUlDU1B0MkM5ckYtOXJPdXdjaDctaXRDeXZQdlBFRjIzSTA5ZlViN21aWG9CUnRQdUNQVmRKVjdVUURnVXBtS1dIUGFIVTRmMnQxejVkRGpleEdqUFdTN3NUUXdjc2l6S2F1ZFRYaGPSAcYBQVVfeXFMTkw2SGw1TkNBdFd0aU9hTmhPeE9JUTBKbEY5OXRsZWxtOVdxSVVkY1ZMYmYwU3ptc3RHbzNXX3R4R3pobWxhYkRwdjlGMk9PRXJrNENyS1A1YXdnNVlGNWtoZVcxUzB2M1RtRzE5ZWFYYkU4cjVMTUduLXVzNmE0Zm9VT1hXeEstMGZVenltTU5oODNLUElPRnlULUNrN0NldXFITGxhdkZJR2JCY1pxU0hnMEVELTNVWTNMSHhQTEk0bU5rWXdR?oc=5,"Mon, 04 May 2026 13:46:58 GMT","Walgreens 86th and Cottage Grove: Leaders speak out ahead of Chatham, Chicago Walgreens pharmacy closing ABC7 Chicago"
O'Reilly Auto Parts,Bhavesh Phulwani,Mass Merchandisers,Opening,What's that planned by O'Reilly Auto Parts on Thomas St. in Memphis? - The Commercial Appeal,https://news.google.com/rss/articles/CBMivAFBVV95cUxNbzM1MXVGT1RKTkdNZ1pwaXMwdWdXbzdXZVlJdERvWGRrVlZMcWNQX24zWHVsS0poN2lQcHBOTGk1U3FNbF8taENPYUJtNjFRMGFqVm4zdndGSWdIRU1FeEFWYl9YYTdOYmRHSjJzdGsxNW11OUR1UURueVRJelhIaGtZV3FYNV9iMWxMVUhnX3ZIX0dMV1VOQ2ZLSkViTGhFcGl4ZWdvXzhWeVNteGVDWDRyLXNpQVhtUVpoTg?oc=5,"Mon, 04 May 2026 10:01:00 GMT",What's that planned by O'Reilly Auto Parts on Thomas St. in Memphis? The Commercial Appeal
O'Reilly Auto Parts,Bhavesh Phulwani,Mass Merchandisers,Closing,Kyle Larson leaps to O’Reilly Series win at Texas; Dash 4 Cash prize to Crews - NASCAR.com,https://news.google.com/rss/articles/CBMirAFBVV95cUxPUHRYc0gydE5wNGhXT1J6N0lXcE1mamhVWUVBa05Rd3docEkzRTQxNG5mcGExTkM1V1ZGS1UxM0xETEI1QlhUNTRrblN5a050eVR4SlpJVUpaNnlfN0c4RDNvek9VdnhZTWRRVG5tenhFZDk1RGFNakFTNHhXVE1Cam9yN0plZ0xUVEtIeFAzR1lBSTJpSjhCSmxHaTNydW9aNDFWeDQ2QWRzZUdh?oc=5,"Sun, 03 May 2026 01:18:24 GMT",Kyle Larson leaps to O’Reilly Series win at Texas; Dash 4 Cash prize to Crews NASCAR.com
PetSmart,Ayushi Chandel,Mass Merchandisers,Closing,Manitowoc's top business news in April included new restaurant opening - Herald Times Reporter,https://news.google.com/rss/articles/CBMivAFBVV95cUxQeVE0OE55NmphNVJxZ1RHWVduWWNmWkxjUFMxV0o4S3dod0g5Z0NGajNJNzc1T01qd2x3QlJSZkN6THpSMl9BLV9QUUJJWWV5Qk01MFpqdmdzMms4ZFl3c0RReG0tcDYwVzFRRHdWTWtaTmROYlVqSFhnUF9xNld3Nkl2RVpvbHUxSTRVb0otMV9qdWtsajZiQl9pTTM5eVp0cEpFbUxmODViLUZxV21SSzA0ei1XdDJnMGVmVQ?oc=5,"Mon, 04 May 2026 10:02:00 GMT",Manitowoc's top business news in April included new restaurant opening Herald Times Reporter
Wawa,Ayushi Chandel,Convenience Stores / Distributors,Closing,Chapleau Temporary Road Closures - Wawa-news.com,https://news.google.com/rss/articles/CBMiggFBVV95cUxObmdFeHdKbFFTMGpxVVFDQm54eEU0TGd3UkZFeHE2eElrQzJEbHJ2b1RNbFIzcU0yNHZxWWxRWF8zbnR5Q05yQnVPWUI5bzBDNEI3cGdfbnNNa1BaODJXYmk4Q3BPVTVUVjhsWk5fNFdyZll4U0pBMGgyb0dRYkh0QWtn?oc=5,"Sun, 03 May 2026 04:38:34 GMT",Chapleau Temporary Road Closures Wawa-news.com
Sam's Club,Dhiraj Manghani,Mass Merchandisers,Opening,Good news. Sam's Club's 'on track' to open Lebanon store this summer - MSN,https://news.google.com/rss/articles/CBMiuAFBVV95cUxOYVNsdlU1UVI3YzVpTUNRVjRRMGhvMlFBc1BlQTR6OW95c3JlR3hYMDJwRkdWUEdIZ3dNeGc0UVlPQ1VzeV9STjF5TndJRDRvQTRfU1FWN0ZOQTZ3ZDVnRU4taDVvbVlJbHdWeTVKX3dGRVJITVlQcmJ1RVlPaHFOSVdnVG5pQVZRRk1HVWxtam5zVUxDU0ZYMVhoTEpqcTg4czRtUU16ZmM1Z3lSSWlGdlNtd3JVQlFn?oc=5,"Sun, 03 May 2026 09:10:04 GMT",Good news. Sam's Club's 'on track' to open Lebanon store this summer MSN
T.J. Maxx,Dhiraj Manghani,Mass Merchandisers,Opening,TJ Maxx confirms date for sprawling new store after sitting empty for years - the-sun.com,https://news.google.com/rss/articles/CBMimwFBVV95cUxQZDVDMjFYbC1wckpKa1RnaVNVcE1TUmxGcXFfeFR3Vy0zcVczRC1IQ1UyajZraWFnNi0ydU5fRklEOG1mdWl6ZFN5anZxNDRwQURlZVVCV09xZ2x4Y0RMN18wTXlHekp0UWlVZmxqRDBOanRCN0tJd2hqWFZCX0dtNFktUllwUWJnTEZXakwyRUkwX19Vcko4TjMzOA?oc=5,"Mon, 04 May 2026 17:47:32 GMT",TJ Maxx confirms date for sprawling new store after sitting empty for years the-sun.com
ARCO,Harsimranjeet Singh Ghelani,Convenience Stores / Distributors,Closing,"Director at Arcos Dorados (ARCO) cash-settles 4,988 phantom RSUs - Stock Titan",https://news.google.com/rss/articles/CBMivAFBVV95cUxQcVB6enBnRlVxdzdqbHZEUFVINTNzOEpuQ1BCVlNQU3c5OUwyNmxpNjkwTHdoeVZGTjJGTVF0SWhMdHFuTU44NE9ITEJlRzAtMTZVbkExNGZ4cXJuQnZkYlRXTGxWenpnYlJtai1QdmVqeU5vUW9SNUk1ZWg4c3NnM2RQOUxuVjlYVDE4TjN5TVhTUDFGUjl2Z1hfU1l0YlR0WXFyRnlaZjdpazdhXzdYTkd5MFRMTnRvNnF1bQ?oc=5,"Mon, 04 May 2026 17:42:37 GMT","Director at Arcos Dorados (ARCO) cash-settles 4,988 phantom RSUs Stock Titan"
Love's Travel Stops and Country Stores,Harsimranjeet Singh Ghelani,Convenience Stores / Distributors,Closing,This Buc-ee's competitor is making a $6M investment in its Texas rest stops - MSN,https://news.google.com/rss/articles/CBMixgFBVV95cUxQa09BMHJIdmpOWnc2QTlLQXdwS1dJLUtKTGJBNmk2VnVCeHpZMDF0QUYxejZ6U0pOQTEwazBtTTlOUlZyUnhkZGV3dG41UU51cDJFVWlJdldVOGNCMGkweEFsdGEwSDFOT3Bna0dUeE4xZlBEclNqYTBxbUpXVjE2enlVLWJEZVBfNXhsOFpTQkR2eGd2di1mNmRWbTFNenlCSkZvZzczbDBDSmVYa1phR01sR1ZRem1Fa05HOFI2T3JCWXV1RHc?oc=5,"Sun, 03 May 2026 02:06:40 GMT",This Buc-ee's competitor is making a $6M investment in its Texas rest stops MSN
Piggly Wiggly,Harsimranjeet Singh Ghelani,Grocery,Closing,"How a closing Bi-Lo, Piggly Wiggly launched Black-owned butchery - MSN",https://news.google.com/rss/articles/CBMizgFBVV95cUxOTjVYaVQ0MmNvZXYxRndkZmFPOERuekk5cHRhQ215emYwUHNzQkFaSWkwd0FRdlNVeW9RZnpYVy1lWGYyRnZ2a3kzazdESWdCWjN6VGlnbjNjOXlpaXF3NnBVejhSS2ZRTmVSRGJzTVdaLWM3N19ycTRiQWxGZEFzc2pPX05pb1Jtb2NqUHRwcEROT3ozWmwyNy1kdWhHRmNHMUZxN0d4YkVCd2c2REt3VHZrRFltV2pEbUtlZ3QtbE1UNTdQLS1nVGlYQTZzdw?oc=5,"Sun, 03 May 2026 09:10:27 GMT","How a closing Bi-Lo, Piggly Wiggly launched Black-owned butchery MSN"
Pilot Travel Centers,Kabeer Pandya,Convenience Stores / Distributors,Opening,"Pilot’s QSRs and mobile ordering now open, available around the clock - CSP Daily News",https://news.google.com/rss/articles/CBMiogFBVV95cUxNU2dHQ2dWajRENGI3dVFtVXBUcUZuVlFsZVZJbUFrWENYUGRQbzYtNmhsSzl2RlUxS3R3Ml90dEVEMUI0QW04TGo4OGFybFZ5b2kteURZNEJnSTgweXpyRnNFa21pampBQWZmS0lGSzQ4VmYzbXBiX0ZCWjFvTzhFU01oUmdVRUhtZ3c5Z1FxaGxIclktZkxyT2lpTjlHSklBSUE?oc=5,"Mon, 04 May 2026 16:36:26 GMT","Pilot’s QSRs and mobile ordering now open, available around the clock CSP Daily News"
Popeyes Louisiana Kitchen,Kabeer Pandya,Restaurants,Closing,Clucked out: National restaurant chain bows out of the Cicero Chicken War - Syracuse.com,https://news.google.com/rss/articles/CBMitgFBVV95cUxPNmZGNkFkVzNJdkxlZGxmaFYwRldPLWgzS0pPVWpfaExvWDUyeFlUT1dEeDI3eVZQdmNIRVk2TWpFQzhYVy1HcEFva1JBeTU3aHNMcnV2NnBwbU1HRFpjQXN0MlhvNElrUWFVWGdRdHJEYUJJZm5zbXhoSkdJMFNOakR4WGNGbWR0Snp3UXhuVFI0ZWJORy1uVXVjR2cyZ1hLNzI3M3cxbVJELU5LNUpwV1V2WXV1Z9IBygFBVV95cUxPdU9CQzM3ZmVMQzdMMGZEMnVDQzBXdXZ0bF9md2tDcDJGNzEzMWl3dkl4S0g1a0F2REpNOHdyRnpnTHI2QVJ4QWlST0VSSjQyYzBvMThfaDJHZlotMHpwaks4Tmx3MDBMS2Rkd3F2emhXeTR1TUZTaXkzd2kzVzh4UVpZVHdWallsQlNMTkNvMUZJd2dCWjRxYVR1WmVzMjhRbTlBRE5PdGhtdzllNGIxbTJuZmV3YUFDUEZTVW1YVDBuOV9xb19uWXVR?oc=5,"Mon, 04 May 2026 15:37:00 GMT",Clucked out: National restaurant chain bows out of the Cicero Chicken War Syracuse.com
Joe V's Smart Shop,Moksh Kashyap,Grocery,Closing,Schnucks closing another small-format store - Grocery Dive,https://news.google.com/rss/articles/CBMijAFBVV95cUxPTndLNzVYb2NJYU83LVkyQmZmZnFQN1Y5OGpHUmtQOV9WN3ZQMWlOSjN4R1ZHcHdLY0JocVNfOVR6b3RCTWlUUlEybFZFajVrc2J3aEZjQnJZSGdCanFmWV92YXZOY2R5dUxtSW5WTVhvNTd0MGF1VC1BSjlpR25ZejJWaXZYZkZURWlYQQ?oc=5,"Mon, 04 May 2026 15:14:46 GMT",Schnucks closing another small-format store Grocery Dive
Circle K,Moksh Kashyap,Convenience Stores / Distributors,Opening,This bustling Lexington highway has a new location of a prolific national store - AOL.com,https://news.google.com/rss/articles/CBMijAFBVV95cUxQanZjRFRLY3AzNWd5MUQ5TlFqREtXNkg4OUJXeUJlYmZBeVJhS0RDS1VUdUlaRG0wVnJ5RjE5bDBlOENMMzFmaDJDR3I2WkFDMFVvYmRhbUhKSl9LTWZTVU4tLU5jdG9YVGU2TE1TVXdwX3JaNzZlMGx6ajZHa2dCc3FxRGNMVzNXUE5VZQ?oc=5,"Sun, 03 May 2026 17:05:20 GMT",This bustling Lexington highway has a new location of a prolific national store AOL.com
Schnucks,Ankit Rawat,Grocery,Closing,Schnucks closing another small-format store - Grocery Dive,https://news.google.com/rss/articles/CBMijAFBVV95cUxPTndLNzVYb2NJYU83LVkyQmZmZnFQN1Y5OGpHUmtQOV9WN3ZQMWlOSjN4R1ZHcHdLY0JocVNfOVR6b3RCTWlUUlEybFZFajVrc2J3aEZjQnJZSGdCanFmWV92YXZOY2R5dUxtSW5WTVhvNTd0MGF1VC1BSjlpR25ZejJWaXZYZkZURWlYQQ?oc=5,"Mon, 04 May 2026 15:14:46 GMT",Schnucks closing another small-format store Grocery Dive
Trader Joe's,Rahul Shinde,Grocery,Opening,A new Trader Joe’s is coming to this fast-growing Fort Worth suburb - Fort Worth Star-Telegram,https://news.google.com/rss/articles/CBMiggFBVV95cUxNdml2V1l1N2ZtaFFhd3BqNXgyQ3lmSWdUOFY0bjJlM3V0TU9tWFNqMHZXcDIzNE05ZHNSRHBDVERFZ2FaU2EwQ2dFYTgyanpLdTJaUjFhcG9STng0WlBZaEdjU2N5Q0Y4UmlOZFVtUXBlaTBsU1dsMERwb1R2bGowQ01R?oc=5,"Mon, 04 May 2026 22:18:00 GMT",A new Trader Joe’s is coming to this fast-growing Fort Worth suburb Fort Worth Star-Telegram
Trader Joe's,Rahul Shinde,Grocery,Opening,"West Palm Beach to welcome Trader Joe's, new photos, video of store - The Palm Beach Post",https://news.google.com/rss/articles/CBMiyAFBVV95cUxPSG5LTkRaQjcyVF9rOE9EVnJOMWsydEVrRkhaOGk5UXlKVUN6dm84RWJySTNtbF9wZFhoQ013cVl6S1F2bERuYmxZYW1JRWdsTG55WFJNZ1U2YnJaU3VZd0MwQkx5TGNkaHVHLTdPRlNNdThNbXNNbVZRdFFkMDc0Rm9ibzdHeWdJZEF0bWM4TGlCektCU3hULW1nQjAwN3M5R1Rpak1vck9lSExJUkpMVTNLXzVJZ1NRcFJESTdydVR2NWg3dDUyZA?oc=5,"Mon, 04 May 2026 21:07:00 GMT","West Palm Beach to welcome Trader Joe's, new photos, video of store The Palm Beach Post"
Trader Joe's,Rahul Shinde,Grocery,Opening,Notoriously secretive Trader Joe’s confirms plans for new store near Daybreak - Building Salt Lake,https://news.google.com/rss/articles/CBMiqgFBVV95cUxPYVctZUF4RmMwbzdYN200TUs5RUxYdUpjdjJES2VIZERUMEtkUjU0TGpLMmQ0VnRRaXVYZ1BLN2FUekVyT2dlOTJYNzhFOXNfTDAwZVhQTUE5eHE0TUY3RmtiQ21zeHp0UWRpUHJaUVZVbVZpOUQ1S28yR0k3MGFEa09sR0diQmdYRlBLNUsxeXc0MUhMUFJzUUZpdG5VSmRuV1ZvdkVtcUxRZw?oc=5,"Mon, 04 May 2026 13:15:14 GMT",Notoriously secretive Trader Joe’s confirms plans for new store near Daybreak Building Salt Lake
Trader Joe's,Rahul Shinde,Grocery,Closing,The ‘Busiest Trader Joe’s In The World’ Is Closing For A Major Remodel—Here’s What We Know - Delish,https://news.google.com/rss/articles/CBMiiwFBVV95cUxNTTFMalVHLUpjMk5DQzh3X0tqZnN4QUU1RWFEWDFjUzBnUDJXR0xqWmxtZjZfYzJjTTZFMTQtU3JPallNbWZoS2xiNUkxWnNIQWFBMGFiYUxzQkdvUURrVHJvMVV2RXoxZ3ZSc3FlVlFXSmR6Mk05aHpiTWFZRzE0ZlRLUGVaYVJHMmtZ?oc=5,"Sun, 03 May 2026 12:00:00 GMT",The ‘Busiest Trader Joe’s In The World’ Is Closing For A Major Remodel—Here’s What We Know Delish
Trader Joe's,Rahul Shinde,Grocery,Closing,The ‘busiest Trader Joe’s in the world’ is temporarily shutting down - The Independent,https://news.google.com/rss/articles/CBMirgFBVV95cUxONU1YTzc0WHZwWV94OFBrWVRqQXVJMmViSlctRkR3TnN6bGNHUHlyVTFRX0NXWlItZm9LRFdhb0hQRmt3NVBPdjNMSUhEbWUyZnZFSld2a3praS1KU2FKcmQ3eHg4eDctdHktaTc3T3Q5Z3l4T3FSSmtIZkZqZ01wQzRWQ1plZEpMV3NMSHNETjFLMUpJQWJkdEV0YXkzemFReVREZ0QwLWtYNW5xcGc?oc=5,"Sun, 03 May 2026 00:04:00 GMT",The ‘busiest Trader Joe’s in the world’ is temporarily shutting down The Independent
Trader Joe's,Rahul Shinde,Grocery,Closing,'World's busiest' Trader Joe's to shut down for months - what to know - Daily Express US,https://news.google.com/rss/articles/CBMijwFBVV95cUxPVUtGNzZlY0t2R2lBdnlvUGYwRHcySkhvanlYNC1zWTlhMTltaUk1Wk1GM0Y0bC11ZFJ6d2paR3hmRHloVUxxZGdMeDhZeVFnQjlVazVZODU1TW1YN0hPeDRGYTZXQ0M1djh0Y2pxUi1NdUkzaWV4M3NPcE9DMlE4X2pIOS0telVsLWI5RHFNb9IBlAFBVV95cUxOT2trQ1lYcm1JdjlJaWpheVJKenpjWE94RWlpcEcwNE4zd3R4NE9reG9mZTRrRkcwOUtXWkYyT01LcjA1X0NabjEzeXZNT2EzUkdFdGZ6MDRIZlpvcnJkOWl5ZnhCSGNyRFlZTGxYV1N4b0lzUEcxV05STHU2Zkp2amt0b0pwM2tIUlctQWVTaTIwb1hj?oc=5,"Mon, 04 May 2026 14:41:30 GMT",'World's busiest' Trader Joe's to shut down for months - what to know Daily Express US
Whole Foods Market,Rahul Shinde,Grocery,Opening,Whole Foods Market plans new store near Lakewood Ranch - The Business Journals,https://news.google.com/rss/articles/CBMijwFBVV95cUxPb1hzbXlxWGtpSTBfUmhyczdueXpnMFRWalk1dEI3VkxJMWxZNm9kU1YxTVR4WmpKbWlQXzNVSHFkSkFlQnAxemRUeWpKTEhYX0hxZFRRVGtTQktOX0ZOenR4ZllqQTlLVzZQNFFySG5UaUlOZUFNbGVWdmpmVG1LWDhYelNaNXh2UkNBZl9YZw?oc=5,"Mon, 04 May 2026 16:44:00 GMT",Whole Foods Market plans new store near Lakewood Ranch The Business Journals
Grocery Outlet,Rahul Shinde,Grocery,Closing,Patterson residents fighting to keep Grocery Outlet from closing - FOX40,https://news.google.com/rss/articles/CBMinwFBVV95cUxPYTBDMWRSQmF6Y1JpU2RaTW9lZEFxZ092ZExlaVVFbG14YkR4dDRobG9OazhDRWFWWGthMHRnQXhJSTNsZ1VlcEdsd3lmYnlPbFJqSDRQR0YwbjlZUkN2MFRxSkJFUk9qREZnU2dkLUZaZjlhMHk1RktRa3lJVGVESDNrX3dGRHRzSnNjeTQ1MHNjLWYwbC11V0kzdUR0SDQ?oc=5,"Sun, 03 May 2026 14:11:44 GMT",Patterson residents fighting to keep Grocery Outlet from closing FOX40
Grocery Outlet,Rahul Shinde,Grocery,Closing,Grocery Outlet plans store closures as part of 'optimization' plan - Chain Store Age,https://news.google.com/rss/articles/CBMijAFBVV95cUxNaUI4OGhuY0lhMU1fQlNrMXFqbklVajBHWVVsZk1sTWNsVWphc2NsNFAwVl9xbHBXdTlpNnhMc1hwbWY1aDZvM0xCNTdLUVFPVFB4dVN1aVdCRUdBdDJlUHhYMGZmMXhITkd5aVR0RVBkSXlKWFF5SXVkYXE3TWlydmpDUkZfd09GSVBiRg?oc=5,"Sun, 03 May 2026 07:00:00 GMT",Grocery Outlet plans store closures as part of 'optimization' plan Chain Store Age
Rite Aid,Shuvechha Dere,Drug Retailers,Opening,"Goodwill snaps up former Rite Aid location and swings doors open to sprawling 18,200-square-foot store - the-sun.com",https://news.google.com/rss/articles/CBMijwFBVV95cUxOdWY2WF9xQng0QnA2RmJuZFNLYWlNREZiLXRoNmpfLXpzOWdIeWh2cjN2QVpxN0tNeXdDcVZoTHNaOVdIalpwYy1hN0c4Wm5LVmIyaUtTR1AwQ0dKWnBQV1dXRm5iTm5kWVU5OUUxc09ldkRlNWt3OFZnV2hmdGZNUENJQ01GYm8tVHZCaGVmTQ?oc=5,"Sun, 03 May 2026 22:36:54 GMT","Goodwill snaps up former Rite Aid location and swings doors open to sprawling 18,200-square-foot store the-sun.com"
Taco Bell,Kashish Kasar,Restaurants,Closing,"'We lived, laughed, and loved mas': West Seattle viral artist holds funeral for long-closed Taco Bell - MyNorthwest.com",https://news.google.com/rss/articles/CBMie0FVX3lxTE1qci14c1N6UWNZTHNobHZIZEJoMDVndWs5T3psTktsNHJEYzgtODdLZF9qRHpRaDUzNDJ5c0ltbDRwekxOUDF6LTZKNnRaanpXc3pSMkhvWGxzdmlnRFg4S0ZwNzhiS2ttb0dHUUQ5V0dQUEUyTXdkdkVicw?oc=5,"Mon, 04 May 2026 01:53:46 GMT","'We lived, laughed, and loved mas': West Seattle viral artist holds funeral for long-closed Taco Bell MyNorthwest.com"
Chick-fil-a,Rahul Vasaya,Restaurants,Opening,"Chick-Fil-A in Lawrenceville, NJ Giving Community Heroes Free Food This Week - 94.5 PST",https://news.google.com/rss/articles/CBMicEFVX3lxTE5QYmtRNDNQUU9nUERZWTBkWWF1ZTk3emZCWGVyNUVsSXg2d3EyeGRiby1rbi1xUmxkaERRYkVWWFNLNnJ5N3pWeXc2S2hWejJtT2NqTmVnR19hdzBFcVpTUWFldENaeU5mbVFlaUtzc0o?oc=5,"Mon, 04 May 2026 17:15:31 GMT","Chick-Fil-A in Lawrenceville, NJ Giving Community Heroes Free Food This Week 94.5 PST"
