Store,Analyst,Type,Title,Link,Published,Summary
Barnes and Noble,Ashwin Nair,Opening,Seattle's New Downtown Barnes & Noble to Debut With Grand Opening Celebration This April - Secret Seattle,https://news.google.com/rss/articles/CBMidkFVX3lxTFAtcGlYX0lnb0IyN1pVUzQwWXZBT0UtQ0FTVk51aVhhTGFFSkw2ekJzZFFVSk5JdGI5bV9pYzBaa2pfWFlNX2UyUzYta0llOXh1ZnJzc1ljN0IydzFLTWU1WFExalV1Ry1jV3lZNFRtbXRYTGlIVWc?oc=5,"Tue, 14 Apr 2026 03:10:06 GMT",Seattle's New Downtown Barnes & Noble to Debut With Grand Opening Celebration This April Secret Seattle
Burlington Stores,Ashwin Nair,Opening,Popular Off-Price Retailer to Open Another Georgia Store This Spring - WhatNow,https://news.google.com/rss/articles/CBMipwFBVV95cUxPbUxLandCQUdSajVFZG84Z3VDQjhfOS1Dc1NPZ1V2UTN5T0hmY0FQemU1dmtVR2M3ZnA0NG1xS2loVVRLOUg5NldvV180RXJEN2lwYzNzRW1iRUVVaWQ4TjlXRDhFUUxuS3hWUHNzNFFIVlA2WjZTSXRlbERWUFZ2eFVEMGx3bmgzb3p4UFJ5UTBsV2R3YTlzR19rbmtxbmpvaDJIVzAyaw?oc=5,"Wed, 15 Apr 2026 17:37:49 GMT",Popular Off-Price Retailer to Open Another Georgia Store This Spring WhatNow
Burlington Stores,Ashwin Nair,Opening,When will Burlington open in Lady Lake? Grand opening announced - Leesburg Daily Commercial,https://news.google.com/rss/articles/CBMizgFBVV95cUxPSTBxTEdTNHJDN285UFdScTdPZXF2TV8zcC1POUl3c1RwbkJybUR6MTY3Vks0a281MWlWX0gtODdLQ1JHOUpBaHVieDd6QlhnSTVCMWhLejNua18wcWNCcXZ3RHZUVnB5M2dLQVQwd3dZWXNXQ1U3VTFWR0tKYjQzZ2hoVmlwbEtsTkxkWTVoMUdsT21JX2NXell0SDhNUWIxY0M1SlJWS3RoS1hTUjhITmI0Qk5jVUU3OW4wZmI2NVg5ZlFKSTJWZkRqWlRwZw?oc=5,"Tue, 14 Apr 2026 16:42:00 GMT",When will Burlington open in Lady Lake? Grand opening announced Leesburg Daily Commercial
Dick's Sporting Goods,Ashwin Nair,Opening,Dick's House of Sport to Open in Sarasota - National Today,https://news.google.com/rss/articles/CBMinwFBVV95cUxNRTNYRk50TVRVV0k2TEMwbGQ3SXpfVVJyRGM0amNCZU51a2lrckV5N19tbW5sVFdOaGxiYXdoSk5rQndBaTMtVnBhWDg5b2Y5cHZjVGk1eTRVYkRsc1dlcU8xWWVRU3pWd1libGpBYllGTGNNR1RIaVJBVFZPRVIyb2h0eUhrekZBdGRzOTR4akxoUTB0QWdTSGRFZ0R0OUk?oc=5,"Tue, 14 Apr 2026 02:47:49 GMT",Dick's House of Sport to Open in Sarasota National Today
Fred Meyer,Ashwin Nair,Closing,Concerns Over Fred Meyer Closures In Western WA | FOX 13 Seattle Quetta Gladiators Vs Hyderabad Kingsmen (YA2dNHlSxK) - Mshale,https://news.google.com/rss/articles/CBMie0FVX3lxTE13cmF0WGxNbmZCZzM4UEg2cWpjcFhwTFBPTGRfd0RtbTFmeUtGREpmN1VVSXRET3dkWktsYmdoRkM3R05fbVJEbU81bm5nZ0JmRHRWRUZzN1JvdEY2TDJzX3BiM2RYUDhseGdjNFpBWWhBUm9EcUdqdFBIMA?oc=5,"Wed, 15 Apr 2026 06:02:42 GMT",Concerns Over Fred Meyer Closures In Western WA | FOX 13 Seattle Quetta Gladiators Vs Hyderabad Kingsmen (YA2dNHlSxK) Mshale
O'Reilly Auto Parts,Bhavesh Phulwani,Closing,"Connor Zilisch beats Kyle Larson, Brent Crews to win NASCAR O'Reilly Series race at Bristol - MSN",https://news.google.com/rss/articles/CBMi4AFBVV95cUxNQ0tkUmQtNlE1anQ1TGZRVkNKRHFCZ3dxUGF1a3NtWXRseDE2UW5MelJLaER1VWlEZ0o4MXNZX2s4Ym92ZGV2aWI1Z1RFdHVhR3JNM3BTcUg0ZG9JY1g3WHJVTnlHdi1UVEY0c181QmR0YXRkU0Z0bzhHMk45cG5Ja3NXY3dkems4SjN4aTNBWnBWMUNROE4wdDFVSnR0aUZkNGV6X3pLTE5kaDRmM0hCcHBhQ3JuMzBYVVQ0Y1BLMUNYT1E1T19RMm13VG11ajQ2RlVEaWwxMk9mMGp3UVF6dw?oc=5,"Wed, 15 Apr 2026 09:16:46 GMT","Connor Zilisch beats Kyle Larson, Brent Crews to win NASCAR O'Reilly Series race at Bristol MSN"
Office Depot,Dhiraj Manghani,Closing,Eugene's Office Depot is closing next month - The Register-Guard,https://news.google.com/rss/articles/CBMiqwFBVV95cUxNZWdPRG1kak9ZN1hKQmtjZHpMVzFoSEVRMk5jempEVGV6di16ZGM2b3E5dlZvVXkwNW1VbDN4V3dIZW9KemRNNFJId3hnS1AzdGlGWk5aTHUzdm00cTF4N0FFOTk0bmcyMVBkanNHQ1MyTUdWaFE4SW5vM0UzeEZnRk9jVGFLNTRlcWxoLUNaeXowY0hvOUNUTE1Razd0ODYxU0hvN0NSdDQwN28?oc=5,"Wed, 15 Apr 2026 11:02:00 GMT",Eugene's Office Depot is closing next month The Register-Guard
Sam's Club,Dhiraj Manghani,Opening,"Sam's Club announces plans to remodel all 600 locations, open 15 stores per year - AOL.com",https://news.google.com/rss/articles/CBMid0FVX3lxTE5FeWlRVHAtbHk1LVBXaE1nMnpXRnJ2M1A5aDUtNTB5blNOZ1htS2lKbTFUbTJhdDZVQ0dIOFpoQ08zMFR3VXpQd3VkcFh6SWk2VmdMRjdKZTVqZ3RnS1pYRjlqOHoxQTREY3NtWGZvbEpjRzViYUtr?oc=5,"Tue, 14 Apr 2026 16:00:21 GMT","Sam's Club announces plans to remodel all 600 locations, open 15 stores per year AOL.com"
T.J. Maxx,Dhiraj Manghani,Opening,Marshalls ‘sister store’ takes over sprawling retail space in booming center - the-sun.com,https://news.google.com/rss/articles/CBMihwFBVV95cUxQMVJISGhDbUxacUp4SDVCV2VPX2gwTTAzd19Tdk5JY3dKb0FaeXBZbEN3X0RMSzdYeWw0VjJYSTR1ZGV0Vm9vRDJ2LWdxTEZ1Nm9iOFVaOHAyX0JxbF92ZnQ1WDBHcEY3dFZyUDFYU3hVNThOY24xZ2FTWXlnZV9fNWVmYVoyczg?oc=5,"Tue, 14 Apr 2026 16:32:24 GMT",Marshalls ‘sister store’ takes over sprawling retail space in booming center the-sun.com
Domino's Pizza,Dhiraj Manghani,Opening,Domino's set to officially arrive in Largs as company marks major milestone - Largs and Millport News,https://news.google.com/rss/articles/CBMioAFBVV95cUxPeDVyWHZtYXhEVkpLTU4tUU03cEFtdi1feGkyb0pwejN3UmZYX2VfRnRTT2dqRERQaVhvekZ5SURwckZ1LU5PTFIxWmdiNzA3LVl6RjVoUmxFdUg2cWlMZ1hwaFVZeXJVTTNBZ2RSNzJkc3hIUWNIbG1WNmZ4QlhoNzZpaGJfYm9ZSXpzemc0SkFfakFxcGo3RTMyX2JtWG1L?oc=5,"Tue, 14 Apr 2026 15:05:34 GMT",Domino's set to officially arrive in Largs as company marks major milestone Largs and Millport News
Target,Vishwas Shah,Opening,"Tron Pursues Quantum-Resistant Upgrade, Says Roadmap Coming Soon - bloomingbit",https://news.google.com/rss/articles/CBMiVEFVX3lxTE8zZDdyOHNPcU10ZFRSbkh3SWJad1FDRXUzbjREeUFQSXZURjBEeFBkeDRZUjQ0Y0RjekZESnlrOEJ6VDJTWEo3OUZlTEhMUFRRWXNYNw?oc=5,"Wed, 15 Apr 2026 07:30:38 GMT","Tron Pursues Quantum-Resistant Upgrade, Says Roadmap Coming Soon bloomingbit"
Target,Vishwas Shah,Closing,Atmofizer & Power Leaves Announce Signing of Definitive Business Combination Agreement; Target Closing in Q2 2026 - TMX Newsfile,https://news.google.com/rss/articles/CBMi6gFBVV95cUxOem8teHdWcXIxM1Y1ekh0aVRyWjlneGp1Zm84dlBWU3VWQkZfNjkycnVGNjl2OGFqdVhqb2hCTkV1ODJjQzNKVllTWkY0RXlGS0tyYk45ZDB2N0YyUFJFZmplU2lta0ZVZUxCdXZBejJzNjBzWGx2MmpwRnFuYUl1bHJHNXp3ZmNzSW5pZFdnWVg0ZkxRTXlubEM4X0d1a1ByMi0xZDd5ZFhCenJjUGhkdG5HcTRISEVwZF9fYWVjZ0pXRVJnTEJKdmpZWEttU0swRjVqbGdLMDhQcDRqUmJ6d1Zrb1hDSXoyNFE?oc=5,"Wed, 15 Apr 2026 16:22:00 GMT",Atmofizer & Power Leaves Announce Signing of Definitive Business Combination Agreement; Target Closing in Q2 2026 TMX Newsfile
Papa John's,Vishwas Shah,Closing,Papa John’s Confirms Permanent Closure of Market Harborough Store - HFM – Local Radio For Market Harborough,https://news.google.com/rss/articles/CBMilwFBVV95cUxQRGNlbDBKWWVnRWxGdG5UZFdxSTNLcXRvbkhHVFI4Mzc2T3U3SHl3cUZXb0JEekZFbVFzS3Bfc1JVTlhWbHByREk4ZFpOVXkwbzRZOGJTVi1STnpIVmFsMDJJdFBPUEFubkJjX1VvTTRGRWlyT0pYM2c0NUdoeWxQaG5HUG9oR0hUWTE3ZEdjaUJHQ0pmRDkw?oc=5,"Wed, 15 Apr 2026 17:10:43 GMT",Papa John’s Confirms Permanent Closure of Market Harborough Store HFM – Local Radio For Market Harborough
ULTA Beauty,Kashish Kasar,Opening,Cosrx booth fire at Ulta Beauty World rattles Orlando consumer show - glossy.co,https://news.google.com/rss/articles/CBMitAFBVV95cUxQWXdMUk8xbWZGZXQ2N3U4MU1ubEVRSVFIUE1zeXpfR3pqUTl0YnZTRHpLMURDdU16aU42YWEzSlZXT3JJZWVndko5Z1JJSWdtSGk1b2M4S0J3STRPcGw5Ny1qblNlY1lpZzE0ZlZaUXJxdUl3WHZsTEh6MW9ETGRaaE5YVHdra3NUV0VuM3pNWWJTREpHMTlWOU50c1FpbFNrMzZILVM5ektLU2w3cUZmeXV0M0I?oc=5,"Wed, 15 Apr 2026 20:40:44 GMT",Cosrx booth fire at Ulta Beauty World rattles Orlando consumer show glossy.co
Walmart,Rahul Vasaya,Closing,"Waco Sees Snack Shop, Grocery Closures, and Walmart Milk Plant Opening - National Today",https://news.google.com/rss/articles/CBMivwFBVV95cUxOMjdEdnRLRHZ4S3hIRzE4bmFmcFdiSlh4U0d3Y2VGV1FMTWlzeThoX2g1RHdsazkxdS1YemhySUlRakFfWlRuT2lXUGVpbk9zdHdEQThNaGU3enBFdVl1TEhnN2hfYjMxQ2dzTkJRTUpsejBrdFFwREhVUkdMSVZyNHVxYzMxYUJsNHg3a1V0dGE4aFE1WTN4U2I1Y0d2YmJLS2lZbHFwMjY3VHotZnRBVy1oZW02VG81aTJfTV9rcw?oc=5,"Tue, 14 Apr 2026 13:35:27 GMT","Waco Sees Snack Shop, Grocery Closures, and Walmart Milk Plant Opening National Today"
Walmart,Rahul Vasaya,Closing,"Walmart to close Dorval location as competition tightens with Maxi, Super C - Montreal Gazette",https://news.google.com/rss/articles/CBMivwFBVV95cUxObGF1amlkVXliVlBvMk13U0Q4dnhWclV6WTRPTE5ZSENjZm5lX0EwNU05VGhzUmdGeG1mWnZHb3d1b0NmU1pjdkc2eEs4Sm10XzdHWnhqY05id20zRzNaenZ5RlFWT1hNckNHYzgxOWdiVnZDazI4LXd6NllFNmNXR3ZZRmNLQ0dOMlk2Rms3bmxLQmxkMXRla21sNW1WYUJXWlF1RkQ0SzZxdVFROG1INnhYNWcyOEhUT25uYnotdw?oc=5,"Tue, 14 Apr 2026 00:48:49 GMT","Walmart to close Dorval location as competition tightens with Maxi, Super C Montreal Gazette"
Casey's General Stores,Rahul Vasaya,Closing,7-Eleven Plans Closure of 645 North American Stores in 2026 - HarianBasis.co,https://news.google.com/rss/articles/CBMidkFVX3lxTE1JY2lZU2tWQlVZNDlNMlRTTFIyV1dibFA2Nm1IMzF4STNnTEJXckRPcm9tNzBRYjRRVzh5NVQ3bzUwbU9TRXpaRlMwRWVLUDVkTUl1SjFHMmF3TmRUTEMtTWdtQ3J0ZlNlY2FvSDFBbzBKQjlSZVE?oc=5,"Wed, 15 Apr 2026 18:50:26 GMT",7-Eleven Plans Closure of 645 North American Stores in 2026 HarianBasis.co
Casey's General Stores,Rahul Vasaya,Closing,Casey's General Stores' recipe for growth earns new bull at BofA - MSN,https://news.google.com/rss/articles/CBMizAJBVV95cUxQSDJxVzg0TlR1eWtIVUdUMGpZeFhBMkVXbTNoWk1FQ3hCNlA0a29idVFpZXVqV3pObmg3VjhrTWl6ZVZNcVRBakZmSXV4M1RJbmt5R01HbmNaakFqRDNlVzNDa1QwVnBITnl2SFJQNnhROUkwRmpmb0Q0YllkNHdpOXJGeHM5X0lCRzlmV2VEMmlQUUM5Y1JhYlYtTXpWdW8xVl9fN2ZScjJrV0tUYnpjU1lBMjdVdXBpeGJ4U3hIZl8wcXZ6UExBUXZUZFFRTVVLV19rSEQ2SWEydVZISm9wbXRCRElOcWJ4ZURvcEpsaXpXY2tNLS03NzJRVThZQlhkSlh5NW95ZGhqUEkyUmR2MGhGR3A5SVBwcW1oS3RkR3BMWFJnT29Id0pQVVV1UEp3MlNSbFpTYzJWdlVmdUxBUFRJeDljOElEUnpidg?oc=5,"Wed, 15 Apr 2026 17:41:11 GMT",Casey's General Stores' recipe for growth earns new bull at BofA MSN
Sprouts Farmers Market,Rahul Vasaya,Opening,Sprouts Farmers Market ready to open its latest Bay Area store - MSN,https://news.google.com/rss/articles/CBMizAJBVV95cUxQb0tGOWRiUGcxRkpBeU5HaWR5bGRLREdCaF9wQkJ6R2hVMTlXUm9wTF9ham05ZEVJbXdWbWN1eDg5Y3U4WXJBakg3OXgyLXFKSXNtYms0ZkZSa1NFZ196aElJQjVpLUNaaHA2SVZGTzh1d3ZQQ0VsNU02YVl5S0VvUWJ0RC1DNG44WG9CUnJWY1pqZnpUQS1fY3JlRjlwOE1rT1czenpYUEpQdjRNQkNqbEtrRGpLaHBRLXNmM2o0YmFqa2hLVGlVMTJJdm0tY0w5N0pmdWxaQ1Z1cmREM0hlcURpQzBkdkV2UjdNTTJPV3pHZkNDNHFjdzBKNFpKcS1zY1FaTUFrSmxzWG1nMC1JeS1aRFhKTTZMNXZKenNmTW5RWTFFWjlMMldMbW45cHdDMzh2SFhLLWVUQ2pYNlhBaXBzbmh4N1h4WXlIQQ?oc=5,"Tue, 14 Apr 2026 14:53:48 GMT",Sprouts Farmers Market ready to open its latest Bay Area store MSN
Quiktrip,Ankit Rawat,Opening,Hillcrest HealthCare System issues statement on U.S. Labor Department findings - fox23.com,https://news.google.com/rss/articles/CBMi6gFBVV95cUxNZkdES0ZSenRiVzVqYXN3bnFSc3N3UVAzWTFJRDlOVjhQY0xZLUsyN3VjQnpteHN0WXRYdzktV2Fld3VmdWhzRmlXSkFaUHZxUEpGWWNuWnRfT2thZXpkWndWb3BvU2szRFNzMFpEYWY2eFg0blpXRVk5SGRVaElvV0xWaXNZUWJ3X3RtUU00Rk5uUFdxeGNjZGFVS1ZvOXJqSVJSMGl2N2NlRXdYRE51YWlOTTVTcnYxaDlUczZTMUNhRUlJU1p1UjNLRER0c05taEdWSHBEV2VGVHYyVE1RY2VDbVNKR3lsQWc?oc=5,"Tue, 14 Apr 2026 15:00:00 GMT",Hillcrest HealthCare System issues statement on U.S. Labor Department findings fox23.com
Wawa,Ayushi Chandel,Closing,Two More Wawa Philadelphia Stores Are Closing This Month - MSN,https://news.google.com/rss/articles/CBMixAJBVV95cUxPb0s2cHpOckowV2l5cFFtQXNndEgzcmV1amFTSFdtdzR1eXRsaXZaMkVKU0JPc21DZnlsTUo3SUlqaFNRM1p3Z0lfWHVnanFxLVFOd01BM0UtM1BuT0d0WVlaWnNmNnBtVmtCQWdDeU1MOHBoT3JESjJKRTZ2eDlUdHRlT3RRZzJDNDN3VjRueVdBR3BVRGt2VXB4MDZuUVZ4b3lpaTY0cDAxbjJVM0g3LThCQjVKNmhONHlVWmhJblhjMHoxekFHZFhVRDlGd0dlOUdEZDRQWmN0TG9LMlNTN0NLdFh5R2dsaktFQ0VleXExbW9QbTl1WGpQaW4yMS1ZVUprOXpzRnFIUVJGaWpRUUhRc05UQjh6bFBDQnVORnc1RUw1TjJoTnVTUzRsS2g1TXE5MGRqVWkxdGczbEVQZE1GZzc?oc=5,"Tue, 14 Apr 2026 16:34:23 GMT",Two More Wawa Philadelphia Stores Are Closing This Month MSN
Macy's,Harsimranjeet Singh Ghelani,Closing,Macys Closing Another MI Store: Heres Where - Patch,https://news.google.com/rss/articles/CBMihwFBVV95cUxNMDRFYlczeEk5djEwM1B3V1h4SEE1cVlwcDRWTkstREItTlpYeHNvdElIN21OdzBzZlRpZ3JhN2tWSU90NUlIay1EZTMzZHNfMmwzVmlHcmlWN1Z4aXZBYkt4cmQtQWkzT2tRNy1CUFpTcjYxeTRKZXJLemRzeTdjWXRZdHJyajjSAZgBQVVfeXFMTUstUlQwQTV0bmZiSW1mNVE3aVo1ZUJRWXAxUmN4Ty1rMlBtWlEyVFJ1bGVieHZtZ2tuZk9URE52OXNhY3hJMWJHNXJVMHRIVHZHSGs3Rng2NUJTZzRWSVdaUlNOQUVwT1drZkhRLTVVMTg4MTFTMEFueU1ORFRQZF9HY1NZNl9GTGRMemZQR2IwNEZ2akx0Mkg?oc=5,"Wed, 15 Apr 2026 17:07:58 GMT",Macys Closing Another MI Store: Heres Where Patch
Macy's,Harsimranjeet Singh Ghelani,Closing,Macy’s is closing more stores in 2026: See an updated list of locations that will shutter soon - Fast Company,https://news.google.com/rss/articles/CBMikAFBVV95cUxPM29XSWZzMXM5R3Z1djBvV2t2cjdxcnlVcmoxX0hJVkFiVEZsVW1zZ1dlT1lRREdpREhkME5FN2ltVURqb0k1bHlMeFJZLUVNOTlVRFExMFBFLW52TTFZbU8xZ3gyWloxczZPaEVQOEsyNkdyOGhXZjFYQjdyZExzeHBVRGYtNjFaaEhRYTVkeXY?oc=5,"Wed, 15 Apr 2026 14:35:14 GMT",Macy’s is closing more stores in 2026: See an updated list of locations that will shutter soon Fast Company
Macy's,Harsimranjeet Singh Ghelani,Closing,Macy’s to shutter store in this city in April amid 2026 closures - USA Today,https://news.google.com/rss/articles/CBMijAFBVV95cUxNYVNyUDNCVXpMa0tBbExfZVpVTjRxMlNVNEJ4Q1FoajUyUFdQUk40YV94R2pSbnUxaU5uMGFRM09OallKcFJPS1hrdkV4NXBQU0FLYVJQUzNkWlRiWDZzaFRQLWc1aEtGQzROMnNyRVpVTktTaG12NVNjVGV0Vkg5dXZjLTMtVFVwd0FlTQ?oc=5,"Wed, 15 Apr 2026 01:23:00 GMT",Macy’s to shutter store in this city in April amid 2026 closures USA Today
Macy's,Harsimranjeet Singh Ghelani,Closing,Macy's closing more stores. Are any in Florida? - Naples Daily News,https://news.google.com/rss/articles/CBMiuwFBVV95cUxPRzZLWGZpRDl0NkNjNUI3bDEySDlFVVQzaHpjVXd6MjlUdGl5dlhUMklwaW5leERCaHlYQVU0a3A1MldoMGQ4VFZwcGFSZ3d4YVppUTRDNlJtUnc0OG8xelk1dDQ4SDVjUzhwb1I3VEZIc0JHbTN5ZlJhc1hxYnIzNHExQnMzdncwaXNEdUw0djZxMVViMVlNVzhmZnV4bFloVy1vWXZWVUtBV0Y3VEk4Ql9kaDRoMk05aS1R?oc=5,"Tue, 14 Apr 2026 22:55:00 GMT",Macy's closing more stores. Are any in Florida? Naples Daily News
Macy's,Harsimranjeet Singh Ghelani,Closing,Macys to close this PA store by end of April; 13 more Macys to shutter - PhillyBurbs,https://news.google.com/rss/articles/CBMi4wFBVV95cUxPcEo0M0tlMDdaNWctV3AzTHhyQkVkWnVIVHFFRWJCVENjLTJSdDY3Z1pGUGhlbHFaNzh0MXdUU0NteWxTa3hzOUczRjllOTk3dVpjNFZHeWdIeWVhdzQzdklQV1hJR1YxZEdXUnFRekgyM1ZncVYzemF1UnZlS3dwOUlHZllnWkpkVXZLbjhlZU9lbUNzTFUtMEtZUXo0eUtRMWJGcFM1TjQ4WkNBYmlkWUlVcDNRMll5a1RTVHhpVTZqU1VKQzlJUnBKQnpfbDFDVW5DSWZ6d0cyamtCSVRsMUIyZw?oc=5,"Tue, 14 Apr 2026 22:32:00 GMT",Macys to close this PA store by end of April; 13 more Macys to shutter PhillyBurbs
Macy's,Harsimranjeet Singh Ghelani,Closing,Macy’s to close 14 stores by end of year — including 2 California locations - New York Post,https://news.google.com/rss/articles/CBMihgFBVV95cUxNOE1lUjVZQnlMdFI1YWJOTmJlc0kwbUR6TGJOQmJmRHJUNEpYYm1WMU1Ld29OTzllMnRlYVlQTWxCMXE0RHBWOVpfaW01YjByYlkxUU9OcDNNdDZGbTEzY1pCYVZUSl9JOHh6REktZXJ3Z1BnRE9jenh3NndQSHBQMHE0QS1CZw?oc=5,"Tue, 14 Apr 2026 21:53:00 GMT",Macy’s to close 14 stores by end of year — including 2 California locations New York Post
Macy's,Harsimranjeet Singh Ghelani,Closing,Macy’s leaves RiverTown Crossings as redevelopment plans take shape - FOX 17 West Michigan News,https://news.google.com/rss/articles/CBMi2AFBVV95cUxQT0kxYVRQVkpvdk92ZHMzWVcwMmRwdG1KUDBQUW5HMGozWnZDeHZUT2RiNHQwSjNLTHRCSjZvNm9nRC1idkRFdFVnQWU5QkUtQkV4SWZYbmpPWXA1WlVGTm9fWVBWQTdGbzJkNGpzSVVPZVNxaFlSajMtS2pUT1pzenRLUGxMLXQ1blhOMEJEV0dNRlBqOF9lY19feGd6R0tvQkRPeUtPbjFIc1BobzJBa3VJNElkdHJIWWRBUW1ITDkwclp5TFAxSWR0VnRUZk5BR1EyVG5xYjM?oc=5,"Tue, 14 Apr 2026 20:53:50 GMT",Macy’s leaves RiverTown Crossings as redevelopment plans take shape FOX 17 West Michigan News
Macy's,Harsimranjeet Singh Ghelani,Closing,Macy's closing more stores. Are any in Michigan? - Lansing State Journal,https://news.google.com/rss/articles/CBMi5gFBVV95cUxOQnFocS1SS3JRWW9jeFNzSWdZT2VSblVXQ3VadEtUaGZoZlZuazJ5Tk9MVmZTUS1leDBlQ1VoYUhZNEkyVDZoTGkycHdudldxRWtMeUh3V2FZNllLWEFKZ29LUEN4RTNpUS11VUFaVXBSVFVFWjBrWG9RZVBab25rbDh2X0ZpVERnYWQ0OVB0Z0haTWxPNEFSVkk1bDNITE5Ka0VydUFvYklpdVBzUmZXdGtBS0xPLWFLZkRvY05USmtpR0xqSk9nZ0UtSnFieEhQVy1NYnowLVZKZDZvTjlzT29IYkFLUQ?oc=5,"Tue, 14 Apr 2026 19:30:00 GMT",Macy's closing more stores. Are any in Michigan? Lansing State Journal
Macy's,Harsimranjeet Singh Ghelani,Closing,Macy's closing more stores. Are any in California? - The Desert Sun,https://news.google.com/rss/articles/CBMi4AFBVV95cUxNcGZwN1BGNTlGdG9BWEwtUjlHS093eDJGUnV4clRkbVNRSTBoWHRJakR3YnNiMk5IVGdnNzk2T1ozVDFBZS1HNW9FMDZ6T3pBLTZqdGhDRzJUWWtzYmZaTHd4bHNoRFhHLUFISFBIa0p3X2lmQUM2Ny1mUHlhOHlkSXdxUlVFdXplb3dZUFplaUNIVk1pMjhSMTNGVHR1Z19GNDRXYnF0SW5RenJYWkNUTnJyWWVsa3ZhZzJHSEF1VV9IS2lta0RrMjlNbkozbEtrNXBzdUszaGluVWN6N29nOQ?oc=5,"Tue, 14 Apr 2026 18:11:00 GMT",Macy's closing more stores. Are any in California? The Desert Sun
Macy's,Harsimranjeet Singh Ghelani,Closing,Macy's Closing More Stores Across Michigan - National Today,https://news.google.com/rss/articles/CBMiqgFBVV95cUxQLUN3SE5FOERvWTl3YkxObEx3dkF6T2k3aFk5LXFUamtCNkNsdV85R29NVk1ZbXJ4UjQ1ZWlyNjVVQ0V5eUNpeHYwTEFyanR4eFZKYi1UMkhzR1Zvb3BRcmxaVVEyclRqZHBXVkh6SFFsZmVuUTlRVjh5NFRoT0FqbldNcjNmNnVFdUNKY2NwN3A5dFMwaGdPbmVtM2RPZnVjcEhORHhUSXZrUQ?oc=5,"Tue, 14 Apr 2026 14:43:03 GMT",Macy's Closing More Stores Across Michigan National Today
Macy's,Harsimranjeet Singh Ghelani,Closing,Macy's closing more stores. Are any in Florida? - AOL.com,https://news.google.com/rss/articles/CBMigwFBVV95cUxOMEt0aXp4bkRVTndudlQxVXJmelhieDM5dGhkaU02NXc5STUwbWx6T19xM3BTR1hiY1NsRDk1WXAwLVBSanQtUlBZaFJIejI1T3BBbHhqNFFSZGtOSGhtOGdPcEstNjR3RklYNTdRMWI1ZVFhMHY0SUZGbVQ3T0VGT2d6Zw?oc=5,"Tue, 14 Apr 2026 11:25:56 GMT",Macy's closing more stores. Are any in Florida? AOL.com
Neiman marcus,Harsimranjeet Singh Ghelani,Closing,Final curtains for Saks stores as chain confirms more closures after bankruptcy - the-sun.com,https://news.google.com/rss/articles/CBMijgFBVV95cUxNZEZBalpHellzeFRyZnpSSUZNcngwWjh2a1BSd3NkbmhFb1p4WkoyQXFfRHh1eDJPTi1HOGZVY2tiM3VlX1lMN1FuRHdtM2F0M2VYd1ZPa0oxSFRBSHJBYjNWYzc2TUFUWFV0eTNlTDNpUnFPZzVjZEkxdHluOUdwMDZLejd1YWd0aW44M3ln?oc=5,"Tue, 14 Apr 2026 07:02:14 GMT",Final curtains for Saks stores as chain confirms more closures after bankruptcy the-sun.com
Saks Fifth Avenue,Harsimranjeet Singh Ghelani,Closing,Inside Saks Fifth Avenue’s last days of business in New Orleans: ‘Sad to see it go’ - NOLA.com,https://news.google.com/rss/articles/CBMitAFBVV95cUxOVzBlcExmMUhtY0RSVTZ2bk5tdU5Za21ubDlVaEcxT2pIT0gwMzVoenhCV1oySmdxcWdOZmNGLVo5Z3NqQXozM3d4a1JGcFZpVUdPbjNuUElOSjR2N0pCeENCR3B3YklqejROWVZQZXh1Q0pCTzFQdjdBTlBQT0VrOGx3Y2VnRVM4NGNZQ3ZubGNHZ3F3NmdfVE1ZSFowbTNmdUVzOHpISWcwOXpvRnVFX2c0ZjfSAboBQVVfeXFMUE9WX3dTNjhHd1ZqZDl5MWpDYTVFSWFTTGJHSjFRYllyeGFTZTRwZ2JUWDlBSTcwYVY3aWJuR0JMZnh1a0tWSjdnUnhnT2JxdjM4aC11NDRHdE9EM3NHUEVSQ2xzRTczdTR1bG04WDYwUXJjWmhmcXZoazFTM2hYN0ozOHlDaFA5bERWQmMzUFd0eW5IbDhESnNTazFJamx4a1BjbDZxNEVUM2ltbGdEQ3MxWTFRdDdlR1dR?oc=5,"Wed, 15 Apr 2026 09:00:00 GMT",Inside Saks Fifth Avenue’s last days of business in New Orleans: ‘Sad to see it go’ NOLA.com
Saks Fifth Avenue,Harsimranjeet Singh Ghelani,Closing,"More than 2,000 stores are set to close across the US in 2026. Here's the list. - Business Insider Africa",https://news.google.com/rss/articles/CBMiwwFBVV95cUxNZjFtLVRsdFIwSXNOSS1tdG9yR0JWUGNnWTNlRzNKU3FrcXpvaDh3eFVpc1pNOWlCQWhTMHliQjN5STRCVVFjcXdZbkcwakJkNFdQMEZ0dG85eTBYUC1UN0VZdjlwNE54SlpaNG1qS292ekdQUUNCOEMtR09mN1E5Q2g1NDNGNFpUVW9FY1NfVTZrMFVoS0NPSVBPZXUxN3NQT19ZcV9SZEl0cEVobkt4NzB5WnlDd05RYnhmT0JYWHNOY3M?oc=5,"Tue, 14 Apr 2026 15:21:15 GMT","More than 2,000 stores are set to close across the US in 2026. Here's the list. Business Insider Africa"
Saks Fifth Avenue,Harsimranjeet Singh Ghelani,Closing,"More than 2,000 stores are set to close across the US in 2026. Here's the list. - Business Insider",https://news.google.com/rss/articles/CBMia0FVX3lxTE9SUTdiM1JqclMzakxVV3hnTHU3N0ZOdHQ2UFhvc0RMS0kwM1FQQnFKd3RUb3ctOWpLSHRyc2o4d3pDX2lVQUdRcEJ3bzhKNWZzT1VuNEY0MGk2XzVXLTVHanRNMHBRRWM5aVVN?oc=5,"Tue, 14 Apr 2026 15:21:00 GMT","More than 2,000 stores are set to close across the US in 2026. Here's the list. Business Insider"
Saks Fifth Avenue,Harsimranjeet Singh Ghelani,Closing,Final curtains for Saks stores as chain confirms more closures after bankruptcy - the-sun.com,https://news.google.com/rss/articles/CBMijgFBVV95cUxNZEZBalpHellzeFRyZnpSSUZNcngwWjh2a1BSd3NkbmhFb1p4WkoyQXFfRHh1eDJPTi1HOGZVY2tiM3VlX1lMN1FuRHdtM2F0M2VYd1ZPa0oxSFRBSHJBYjNWYzc2TUFUWFV0eTNlTDNpUnFPZzVjZEkxdHluOUdwMDZLejd1YWd0aW44M3ln?oc=5,"Tue, 14 Apr 2026 07:02:14 GMT",Final curtains for Saks stores as chain confirms more closures after bankruptcy the-sun.com
Nordstrom,Rishi Nagar,Opening,Nordstrom to open 'Local' service hub in Danville - MSN,https://news.google.com/rss/articles/CBMimAFBVV95cUxPTVBUSWZvZ2VjcG5VM3ZXYm9XaUNmdWZJZWVCMDREUWl0Ymh5SnYzLUQ4eFBkRC1ZTTNUREpHSVFTUko4YVVjSkJDWUFWLTN0YUF4R2ppdnFScjgtRnlBZkhXUkl2bFp4azJURm5JTUpwYUdsRmRlQzRPbjRWVHFEbWhqbFVQYnF0dFZYRGpBSlROYXg4Z3VjOQ?oc=5,"Wed, 15 Apr 2026 11:28:29 GMT",Nordstrom to open 'Local' service hub in Danville MSN
Giant Food Stores,Komal Agrawal,Opening,Why is Giant building a new store in Central PA? - Delawareonline.com,https://news.google.com/rss/articles/CBMitwFBVV95cUxONTdQbmNOeHVfVXhQNmY3Z3Q4V2IzLUJWU0lOOG4tYXM0QmJVV0lldzZBVlpnWXFQR05QSmtzeU8yMFhybmV3cWJLTGtLVUFiOHFWdXlrYXNFMmtJeTFXMlAtVWhRSUFYVnQ1cUREdldFSllhMlBzVXNXSmx6UHRNRThLTlhFQ1VhUEJqaHVHeHZqVi1LWUVSa2s5SVRGbkd1SFVRbXI2aGJFNFhHY2ZzSHc0S09NRzA?oc=5,"Wed, 15 Apr 2026 21:19:00 GMT",Why is Giant building a new store in Central PA? Delawareonline.com
Kroger,Moksh Kashyap,Closing,Kroger is closing 60 locations by the end of 2026. Are any of those in Kentucky? - MSN,https://news.google.com/rss/articles/CBMi4gJBVV95cUxQcU02WVFKajNPMURvX1Z4UVBPVVpoQzVsQ0xZOXVac04wVnJ5b0IyTlBGemV0TjViZmNueFBxb3ZOeUFYQm1FMHZpSndqSDJkUGJsamFSbXhWcS11ckhIbFd3SjBGUFY4cW5hZWVGTmV1NW5za1kxMDJnWXg3UGh4Um9xeER1Tk5SUzB4N2diWm0tekQ3RVFxWEx4c2x5UWNZZWhGaDB6NzZwbnJOSkx4QW1OUndqdmFLU0tDMk1CdEpCNFc4T2h4N1NlOUJ6MWk0NFE3cnJyNktrdnMyYkNXc25vXzFIcktXckh4Q1NDeWlDeXJCbTJFTkd0Z05ELTUtbXJ4LUZ4MTVTdFNEYXRwRWw5N3QzZTNfQUxwMTIxaFJMeGdEbHMweHJSclN2SHhiZGJ0MENldnBPaElFUlVuMEw3LW1yQUZsVWthcjFYX1NHSXU2dmZWQWRoazVOTFVMM1E?oc=5,"Tue, 14 Apr 2026 10:32:43 GMT",Kroger is closing 60 locations by the end of 2026. Are any of those in Kentucky? MSN
Circle K,Moksh Kashyap,Opening,IONNA and Circle K Partner to Launch 350+ High-Power EV Charging Sites Across the U.S. - Electric Cars Report,https://news.google.com/rss/articles/CBMiwgFBVV95cUxOSDdFRXZRUXprbUJkM3diWUdTX0pacnBtMnp0bU13X2VSVk9uVHIwaTRPVnBEZXZERU1yUW9EaVNWVGhuSERZRXY2TTBSS0dNMVBZX1FTaE5kb2trRzdERXVNeHFpamYxRVJhRkF3eDc3MFBhUjZqM1ZxRGRoVGxKWGpaeE4tTnFWX09hM0RVQXlTZTVQa09Mb01FaUFtSzBocUJMOUR3YzlhMlptQlVnS2lkVVc2c3pLd2hEZndCX2p0dw?oc=5,"Wed, 15 Apr 2026 17:18:21 GMT",IONNA and Circle K Partner to Launch 350+ High-Power EV Charging Sites Across the U.S. Electric Cars Report
Market District,Kabeer Pandya,Opening,Market District roundabout to open next Monday after road closures impact sales for surrounding businesses - WTXL ABC 27 Tallahassee News,https://news.google.com/rss/articles/CBMi4wFBVV95cUxOUGY3MWZ6ZmlvNEdfaS11VlVzRzJ4T0dZUm0ydlpPMy1yLVA4M19peTZuVkNETldtbi1Ic2pBeGxEdXR5TWdyV1VHRElvQVBQMHBUSGNQelBQd29NS2tZMUlPZnloQVR4NnU1M21YLTlNMi1LYjd0UUdPY3NSc19iU1lodjF5bUFmVkF0MU9SWko2R0FYYUFyYThNT0Jjd2hheUhWMEp1VWt5ZVY5OVZZWDlVNEFseUkxc0JoZ25FTG9rRDlTV0tjckJNQU5pTU1mZVoyLUhIUVpTdjlvZ3B4eGUtUQ?oc=5,"Tue, 14 Apr 2026 12:47:14 GMT",Market District roundabout to open next Monday after road closures impact sales for surrounding businesses WTXL ABC 27 Tallahassee News
Market District,Kabeer Pandya,Closing,Market District roundabout to open Monday after road closures impact sales for surrounding businesses - WTXL ABC 27 Tallahassee News,https://news.google.com/rss/articles/CBMi5gFBVV95cUxQNGRkUXk2OUdOdlowTUN2U2p3SEVNQ2lDN0h3ck94bGNVQ0ZiNzdJWS1FWUM0ZC0tUUJjVHYyYk92RzV2a1BhOWh6NTRDbmpDUXRoVFBibHVtdk1hMEhxdTJIbzZJQjQweXVlY3NkVlhJRE8yb2lmb1NEWDZhb2JZM25JcVZvbTRiRFBWc25JTmhpOHliOExmSFI0RE5MMUlMTHBLd1dMNVJWZzUzeGpOYVBRU0I4blJyZlJ4bjd2MnBBanEzZEFhUVh3Nkl4TjB2aDl6b3hramVDRjcxaXBsLU13V0E1UQ?oc=5,"Tue, 14 Apr 2026 12:49:32 GMT",Market District roundabout to open Monday after road closures impact sales for surrounding businesses WTXL ABC 27 Tallahassee News
Market District,Kabeer Pandya,Closing,Market District roundabout to open next Monday after road closures impact sales for surrounding businesses - WTXL ABC 27 Tallahassee News,https://news.google.com/rss/articles/CBMi4wFBVV95cUxOUGY3MWZ6ZmlvNEdfaS11VlVzRzJ4T0dZUm0ydlpPMy1yLVA4M19peTZuVkNETldtbi1Ic2pBeGxEdXR5TWdyV1VHRElvQVBQMHBUSGNQelBQd29NS2tZMUlPZnloQVR4NnU1M21YLTlNMi1LYjd0UUdPY3NSc19iU1lodjF5bUFmVkF0MU9SWko2R0FYYUFyYThNT0Jjd2hheUhWMEp1VWt5ZVY5OVZZWDlVNEFseUkxc0JoZ25FTG9rRDlTV0tjckJNQU5pTU1mZVoyLUhIUVpTdjlvZ3B4eGUtUQ?oc=5,"Tue, 14 Apr 2026 12:47:14 GMT",Market District roundabout to open next Monday after road closures impact sales for surrounding businesses WTXL ABC 27 Tallahassee News
Market District,Kabeer Pandya,Closing,Market District roundabout to open Monday after road closures impact sales for surrounding businesses - Yahoo,https://news.google.com/rss/articles/CBMikAFBVV95cUxOVHJJN090RFpWdDBEaUVUVXdnR19KOXg3NTZkejk0R2F0VklIS0FtdlJJNEwzYXJLZV94N21wUzc2VDJaSkNWZ3VvbkgzaWUzZHh2UklFdFl1TG1FSzk1TjlEZDJwMTBmMkJrT1ZEOHNLVDVhMVJsc3U5SDV6eXJGR1RHRG5iQnd2MmVZaV9wdjU?oc=5,"Tue, 14 Apr 2026 12:35:09 GMT",Market District roundabout to open Monday after road closures impact sales for surrounding businesses Yahoo
Stop & Shop,Rahul Shinde,Opening,Indian grocery chain set to open in former Stop & Shop in Shrewsbury - MSN,https://news.google.com/rss/articles/CBMizgJBVV95cUxOWkhob1pYREVNR2hBQTdNMjFFWnByUm01TDgxclRlSEE2X0VkX2QzZnFHZjIxVmFwM3FsZ2x4ZnpBZFhacGZBbnNFblN4RnU0QVEzMm0wU3lVbE4tQ3VXWjRJMTd1cU93MHJnbFZHRnUtVm5hRzRpbFZCQnRBeU9CUGJLbFBHMC1SWXhOMXN3eW9qbDc5ZXQtYTlna1E1RkNRRl9CR21NUl9YRFdYU1JZNkg2R1ZFNVZPZm80Rmt3SEZYN0c2ZkxXVUlNS0ZGTk1ucmlwUXhYT1B6cTVFNVM5WVhpY195ckJmMFQ1SnJLTkFxamptcDNSMndaRXFEV3R3XzNiNmJScnUyQk5PRHpCdjd6LU9NMjdpc2xwRnN1NHN3aGwyQzdURE15WWVIdzB0b3BwRkh3WXZVTE1VS3RnamNkM2RKc2NsdUJjeUpB?oc=5,"Wed, 15 Apr 2026 04:30:50 GMT",Indian grocery chain set to open in former Stop & Shop in Shrewsbury MSN
