Store,Analyst,Type,Title,Link,Published,Summary
Albertsons,Kabeer Pandya,Closing,This Vons store in San Diego County is closing and laying off 65 - San Diego Union-Tribune,https://news.google.com/rss/articles/CBMiswFBVV95cUxPWFFIbklXcGdHTEJoQWc1aUZmRGhfY0pMSE01TlhZZVlQYndneVpsUmJWaTU3WS12b3BMamwzQmZNM0V4ZXliN1JoUzk1S2JtMlF1RWlvT1hCeExzLWJ3ZFZaT25tTElSRHRqWEJ3VXdXbEctYnpCaVlXRkxLdF80QXF4QzFQT1ZWNGlkVHVjbF9nVk94NGhiemhGNGI4UDdOSzktdkNGTUlCM015ZHo4WUNiVQ?oc=5,"Tue, 03 Mar 2026 23:29:44 GMT",This Vons store in San Diego County is closing and laying off 65 San Diego Union-Tribune
Central Market,Kabeer Pandya,Opening,Oda Central Market to open on March 15 - Graphic Online,https://news.google.com/rss/articles/CBMioAFBVV95cUxNMnM0a3c3c2RqbnFpMWF5emFtWVdDVFBVdTVfYWFnZEgwTW8tOGpoeUlVbVNGNGxTcXlpSEtQckxjUWZkY1ZNN1JsTVNKVDhHeHhfM0JjZVVHcFRSclBtR2NuNkZDTGVGN2ZzU2Y3OGxRVkVVbTJITlh4UEtKMjV4ZUtFd2x1Slg5RTdWT1p5MkhrMmNNMXpfZG5OR0dVaVU0?oc=5,"Mon, 02 Mar 2026 09:58:07 GMT",Oda Central Market to open on March 15 Graphic Online
H-E-B,Komal Agrawal,Closing,H-E-B shuts down viral online rumor about its San Antonio store - MySA,https://news.google.com/rss/articles/CBMijgFBVV95cUxOdWg3cjg1RHRVWGo1MDNKbUM4UDlzcWgzWFVDU1htSHNxVDA0ZTQ1VzdUR2xZdXJxaWZTV3lrVWtQRmxEUkdmdUpMSm5pLWtTWS04U0FKTDduUHByS19DaUpFT2VBWkpYaFQtOUJpRjJzWjgzal9Ua05LVlVnSmt3dmlUVlRob01UUlY5ZHVn?oc=5,"Tue, 03 Mar 2026 21:10:24 GMT",H-E-B shuts down viral online rumor about its San Antonio store MySA
Harris Teeter,Komal Agrawal,Opening,Points At BP Harris Teeter Offering Gas Discount With Grand Opening Of Summerville Location Harris Teeter Fuel Station Near Me - bussmagasinet.no,https://news.google.com/rss/articles/CBMicEFVX3lxTE9aRkpBd0IwelctUUdXd284UTN6aWw2Vm1YcS1EdWdSSG1tYVJlMS1FYUxxd0txcnBIX3drS0Fzb1UyX2Z5NXRtQ3ZGclRoamUxem9SWkRLa1dzanppR0N4Nl9HUUEyeEJvR2gtTGxPLXE?oc=5,"Wed, 04 Mar 2026 12:32:37 GMT",Points At BP Harris Teeter Offering Gas Discount With Grand Opening Of Summerville Location Harris Teeter Fuel Station Near Me bussmagasinet.no
Harris Teeter,Komal Agrawal,Closing,Harris Teeter is closing a Triangle grocery store. Here’s where & when to visit - Raleigh News & Observer,https://news.google.com/rss/articles/CBMickFVX3lxTFB4dDV1eU45ZTFDNHN6YVViYTJLdmlKNTRXa21nMFJtdFU3N0psSUhhX2NQQUp3Vk5nSG5ZQUVIWFMxRXlnVzc1cENob0ZZcDBvVUVtdjFOTWp0MFBNdURQSzV6ZDhqalhoYVhfdzdZelBYUQ?oc=5,"Wed, 04 Mar 2026 20:22:10 GMT",Harris Teeter is closing a Triangle grocery store. Here’s where & when to visit Raleigh News & Observer
Harris Teeter,Komal Agrawal,Closing,Say goodbye to grocery store as popular chain makes way for rival and bosses confirm final day - the-sun.com,https://news.google.com/rss/articles/CBMiigFBVV95cUxPQ0ppczIyTGxaRzZ0cWYwT2g5M0Z1VVdQd2lHWDF6TVkta2N6MGg0d0V5QS1IdXlpZ2Q5aDlnRnhmQ25YZGVEZC1TSHpMSlRrN3dNZkYxWXRvMFZONFo1RXdvOFlKOXRzMml0bWx3U21Rb2lFQ0lIeGpveVZGLUt5U2FzX0VuUEdYZ1E?oc=5,"Mon, 02 Mar 2026 16:27:47 GMT",Say goodbye to grocery store as popular chain makes way for rival and bosses confirm final day the-sun.com
Joe V's Smart Shop,Moksh Kashyap,Opening,H-E-B plans North Texas expansion with new low-price value store - MySA,https://news.google.com/rss/articles/CBMiiAFBVV95cUxQcGdEcDJubFZjcHdfZ3JwdTUxSHpXc0dLcDBCWHd6bEFNWFVQNmt5TEJ2WWg4TFhhT2pPLWY5NG5TODJZLUEwM2hxdGRnRkVmYUtzdk4wWkc5R0RySEpPU2lRclpXb2JZRzZva3RNcVFEQTRkNk9NaElKbGtCdlhxZGdwbWFrZ1Ja?oc=5,"Mon, 02 Mar 2026 00:20:43 GMT",H-E-B plans North Texas expansion with new low-price value store MySA
King Soopers,Moksh Kashyap,Closing,"King Soopers Store Map FirstBank Closing 15 Colorado Locations, Most In King Soopers Stores King Soopers Locations Denver - bussmagasinet.no",https://news.google.com/rss/articles/CBMicEFVX3lxTFB4N01acEl2bnNuZ2FqSk1mcVB3RVNJM0pSTEQxNXVQa1ByQk54cTJKcC1vWXFMb2ZEWnBKbVREU2pUaTFVd0JXbDNvTldmc252ZGdoanJmVmxmWVYxWGJBWkxIaTl1SnlEb2RSUFdOTjc?oc=5,"Wed, 04 Mar 2026 12:15:33 GMT","King Soopers Store Map FirstBank Closing 15 Colorado Locations, Most In King Soopers Stores King Soopers Locations Denver bussmagasinet.no"
Kroger,Moksh Kashyap,Closing,Kroger to Close 60 Locations. Here’s the List So Far - AOL.com,https://news.google.com/rss/articles/CBMic0FVX3lxTE1nbjJ5RGxTTjdpc003czZWdy1iN1VSSTNONlNkcjhFeTlhQkJMQXhpdjRkRFZ5OFNmRXdlMHZyMzA4VGgtbmJoMWpTZnpHWlN0QklRYktkZmJZZ0lObzh1T0hCSFI1WldmTDlWMlhJOThmeU0?oc=5,"Wed, 04 Mar 2026 23:52:42 GMT",Kroger to Close 60 Locations. Here’s the List So Far AOL.com
Market Basket,Moksh Kashyap,Opening,Maine’s Market Basket Expansion: Could Bangor Be Next? - Q106.5,https://news.google.com/rss/articles/CBMiaEFVX3lxTFBKOEQ4c01pT1BWcDRWUGdFbmhlcFpUZ2FWckJiYkptZmFldzliSHV6X1BKQWduSHljUThsQkkyZ1hrc2VGSHZDdlBldkJZanBGRjNTRUtWTUR2MkdPT2hnNS1nM2ttbjBU?oc=5,"Wed, 04 Mar 2026 14:28:48 GMT",Maine’s Market Basket Expansion: Could Bangor Be Next? Q106.5
Sprouts Farmers Market,Rahul Vasaya,Opening,Sprouts Plans Highland Park Location At Former 99 Cents Store - Patch,https://news.google.com/rss/articles/CBMipgFBVV95cUxQS3RVeWQ2WGoxRzNXc2xTcWlIOGtrS1RocVY5ZFROZ3RwcmxKZnFvQ0xlMmJlUHZ2elB6dUVJdThkMEhnTTZYNWw1NnR2Und1eVo3S19tdWY3SjdYb3VjQXN5eFJ1ZGxpc1N5X2N2ZU9lc1FvZXpvbzE0T1BUSDNIMWJNeS1IbXVlT1RuSHJCbGFRSVhKYW5EVmh6czFtUmI5MWw3ZU930gG7AUFVX3lxTE0zTHZodzEyWjV1QjdHUzJwNnlBcXNGM2dVem1MRGpDbHJkczE1eHkzYjQtVzZyckNuU2NjblpzMTFyYXZtLU5VREhsRjc1dUFIalRXTTRObzRpWDRjMGRQYWp4QVhNd2tNM1Z0Qjd3X25Lc2FmWk5UeHBTdWt4bEJVVFd1eGVXQVhZenpueTM1SlNoazlwUmNNMnhnZHhlMjFrUmdzLUVMc00wZWQxR24wSmFJaFlFbHdRcW8?oc=5,"Wed, 04 Mar 2026 23:22:02 GMT",Sprouts Plans Highland Park Location At Former 99 Cents Store Patch
Trader Joe's,Rishi Nagar,Opening,Trader Joe’s Officially Opening New Store in Jersey City - Jersey Digs,https://news.google.com/rss/articles/CBMiZkFVX3lxTE9keEYzRlJrdmNTb2YzODlYVnlaMW4zOFd4TW1Od1hwWEJmT0xVUGRFQVpKT0F2bC10N2V0YnEwLURwdU8tVzZPWi1qekktS1hwQURKa3BHZ05FY0t1V1NMRnZ4Z0JsZw?oc=5,"Wed, 04 Mar 2026 14:30:22 GMT",Trader Joe’s Officially Opening New Store in Jersey City Jersey Digs
Trader Joe's,Rishi Nagar,Opening,Another Trader Joe’s in Stanislaus County? Here’s where the second location will be - Modesto Bee,https://news.google.com/rss/articles/CBMijgFBVV95cUxQM3hiY0R6SnRYanFZcjlIMXBFcE1Oa0loSkE1LTRFWkZfdzdmMjhtUnpjMUI5OHhEbUlKYUFVRjV1YWJaamRWckRNcHRFYVRQcXY5bF9WU2UtWE5MX1VHOUg4Q2F3cVVncVdncWtYdTZyenZYRHNnZ1JmQ3l0MnhELWFqZGZIX2E1cHlzcGd30gGOAUFVX3lxTE5GdFVLcndqNTI3RVRJT3UyalJCdVlSNnNMVS1iWjdKaXBNMTVhZGJFMF9CblFEaXR4cUc2RG5JYTJYLW4zblpEYms0dGV3VEI4cXpFU0JzRjltLVJkV0dnb3RZT3VUUjZwZHo0WUE3SDhPWHNBS1YtWEVCcE9SY0d6a0tmMHhmQ3dCTkpENlE?oc=5,"Tue, 03 Mar 2026 19:32:18 GMT",Another Trader Joe’s in Stanislaus County? Here’s where the second location will be Modesto Bee
Trader Joe's,Rishi Nagar,Opening,"Trader Joe's to open in Riverbank's Crossroads West development, city officials say - CBS News",https://news.google.com/rss/articles/CBMinAFBVV95cUxNSlBBNERpQTAzODNiQWxKXzVuZVY4bDNwMERidlY1NVhVMXJMNjNfenRBdEVpZW9LeERiVWxCLUwxT3JQenhIUmFna2d0TkxwcHV0M1U5cTJzc3R1c0hXZGZmdjVfaFZVMXRGSzhIOE1wX05xNE85Rm9SMTU0eHU5ekhIcWdoc3phWEt6UkxqNUI3NGxFa2JSTVdYdi0?oc=5,"Tue, 03 Mar 2026 19:17:00 GMT","Trader Joe's to open in Riverbank's Crossroads West development, city officials say CBS News"
Whole Foods Market,Rishi Nagar,Opening,Whole Foods Market opens its easternmost Long Island store in Holbrook - Mass Market Retailers,https://news.google.com/rss/articles/CBMipgFBVV95cUxNSzB2aVB1ZHJFa2FTbVJLSjNfdjcwNWZBbXJVTE96Si1NdFJvdWl0OEdTR09OTHRRNFJrb0pHQ1hLUEd2SS1mN2xrRmF3SVAwOUFaNDJxVWxsLW5FSmhfLVpiMWtrTHJITmJiTF9fbmtCbnplYmRzbzZGbHRxdEpINi1xN0k2SlpKeGFXQTREQTRMUTdEdmNhMmRLMkFEZ1RLWlZNZmtn?oc=5,"Wed, 04 Mar 2026 20:46:55 GMT",Whole Foods Market opens its easternmost Long Island store in Holbrook Mass Market Retailers
Whole Foods Market,Rishi Nagar,Opening,Whole Foods Set To Open Thursday At The Shoppes At SunVet In Holbrook - Patch,https://news.google.com/rss/articles/CBMikAFBVV95cUxQUWg2ZE1VV0ppTDZheXhQRWJsaXhGdUpYTzVWSTM1T2hIWFdsZDhCdU41UUJCTEJTNERKRmhkU01XbnBlLUtSSHhzVHJ4UFNPM1daTzIwQ2IzQjlvWEMxYl84UFZ0WmlBaHlyaDdmcUNyTmlmVjNKS3kzUFFscnp5d1RrdnpWT0F1allFc1JhaknSAbcBQVVfeXFMUEtVbktiQ0hZMHJVMGRZLTlNQnhYQTRMalkzM2g2SHVkNmg1d2c0Ymo5c2t4YV9sSU5nUGF1S2o1SFJjeUdmYm9NMGt6U3h1VWlCaDdEQUpLMEZVUHpFRWt5alBnWUpoc3p1UFNBT3RHZGttemRzYmRGMzlOQmlpYTN2UGJkUVFuemtuSFhwcTNjXy03eGpjaGlOLWZnWnoxMXhMTEd1WG9rVmJkbWNwS1hxZ3k0d2Ew?oc=5,"Wed, 04 Mar 2026 17:17:36 GMT",Whole Foods Set To Open Thursday At The Shoppes At SunVet In Holbrook Patch
Whole Foods Market,Rishi Nagar,Opening,Whole Foods plans long-awaited West Side Albuquerque store - Albuquerque Journal,https://news.google.com/rss/articles/CBMipAFBVV95cUxQLVpFVFdfUng1RjJnMzRib211RHdsdWxlelJ4VG9KTjF2Q1ZFMDE5bFEwLUZ0NktFRHFyd1lnTU5UeWdzN0JGLWN5TkRycjFWdjA3elR6Nnp6azNtUEJCdXZaVWJ3dG9iUjJwdEo5RWtyMm1kY2w1aUJIVVpYU3g4WnNBMUdpMzhFakxkdkoxb0FReHl1SkNmbU8zYXlGU1Fpb1dRRw?oc=5,"Wed, 04 Mar 2026 00:30:00 GMT",Whole Foods plans long-awaited West Side Albuquerque store Albuquerque Journal
Whole Foods Market,Rishi Nagar,Opening,New Whole Foods Market to open in Holbrook - News12 | Hudson Valley,https://news.google.com/rss/articles/CBMimwFBVV95cUxNQThGYmZnSlhJS1g0OEpKd0NFalZEdkFCb0xveDQ4U25fYnQ5ZnNKNS1ZNXA3QUpvMzB4N2VVbV9EQWsyTWt3akp4ZGZFOXh0VWUwSjJKbXlSM2RpMXlZTlc3VlBaQ3NxclBhdjFuSEVRUElKVkI0RWdZbldwMGd6bHh3Rm9pUnJGN0I5ZHBoeDBFVHc2TDc0N2xqSQ?oc=5,"Mon, 02 Mar 2026 16:59:19 GMT",New Whole Foods Market to open in Holbrook News12 | Hudson Valley
Whole Foods Market,Rishi Nagar,Opening,Long Island | New Whole Foods Market to open in Holbrook - News12 | Long Island,https://news.google.com/rss/articles/CBMimAFBVV95cUxPUzdDMzZ2aVVvU0swU2szTmFuX1dOQzc3N19qckJlNVYwVEROR0ZKVGxoemQ1ZE42dFk2VWdCLUJWRUlLaVl2eHpnVG1MaTlPLTd3YWtjSFdJMWJHY0JtcnVYTmlGc2RCTkNtRjR0MlVybUYyQXFkMHNNN2ZOQ01VZlFvSkoyYUtpTGFUeXRZamdjQXZDSlE1Xw?oc=5,"Mon, 02 Mar 2026 08:00:00 GMT",Long Island | New Whole Foods Market to open in Holbrook News12 | Long Island
Whole Foods Market,Rishi Nagar,Opening,Project Snapshot: Whole Foods-anchored Midlothian Depot nears completion - Richmond BizSense,https://news.google.com/rss/articles/CBMisgFBVV95cUxOOTg5cU1oZkdnYTVQblQ2bkUxaEZleGtpX25VbmdONlM5SnUxYkdUMGx4UVV6dVZYekh0UU1GVTZkdWpjbmIxLTFRNFpKQ3lyT2wybG44bkFXS0Z6SjBENU9PekRuTjNrR19BSnNOOHZRNnlhenBMdlBGVlFiT3hnYksyWENYclJXU3FqbWdYMVA3RGs5c1FEYVVJSVhRMURlUGhmX3lLQ2NDODJhRTR0VVBR?oc=5,"Mon, 02 Mar 2026 07:00:18 GMT",Project Snapshot: Whole Foods-anchored Midlothian Depot nears completion Richmond BizSense
At Home,Rishi Nagar,Opening,Severson breaks 3rd-period tie in the Blue Jackets' 3-2 win over the Predators - TownAndCountryToday.com,https://news.google.com/rss/articles/CBMiyAFBVV95cUxNeHR3MzZWNXpRa05UejRBbzRwaUR2ZXNxV1NFMFZyRW9lUk12eWs4UE03aWFYM1VoeDVGRkRSMXA1WmI2aWVWaGRnVGpnYmtBQ0xwVWdBak5Wa0phOGJidEg1Uld5RXkwVUxpSl9BVEduazI3Vm9PUm9aeHJVOE1CZGJTSDY2YmlEUm4zTEF4V2pQWThjZ1daN2RfVEhtc0d3YXg2S2tjNW80TUpQMjNISy1SZWZCNlcwQ2hSZXhhTHFvaHFlQWJfRg?oc=5,"Wed, 04 Mar 2026 03:03:22 GMT",Severson breaks 3rd-period tie in the Blue Jackets' 3-2 win over the Predators TownAndCountryToday.com
CVS,Rishi Nagar,Closing,Tennessee bill to bar PBM-owned pharmacies advances as CVS warns of closures - WTVC,https://news.google.com/rss/articles/CBMisgFBVV95cUxQWnJhSVQyLWlLRkFWa1h0NjhoYmRFTXBvX2hBYmt6Y2ZHYU9LVXFZN2JPNmR2dkhoMnJmZTdBN2pZRjVqS3R0eWMzMjVwblR0S3d6czlxcHJvbTN0dmdRZXBzV1RhTEI3NmZ3RVdIX2Q4LUU1THYyVVhUQkoxdGV0SDdnR0pEVEN5ZE9FVkNOOXJPbVl0UTNheVdfVDJubzF4c29QeGc1NDcyRlVVdXI4dzN3?oc=5,"Wed, 04 Mar 2026 22:15:41 GMT",Tennessee bill to bar PBM-owned pharmacies advances as CVS warns of closures WTVC
CVS,Rishi Nagar,Closing,CVS warns bill would force shutdown of 134 pharmacies in this state - USA Today,https://news.google.com/rss/articles/CBMingFBVV95cUxPVHR4dU1rLUhFZ3dINDgtcTVFVXBuMFN5d2dwdUN3WXhJRFpkQzY4Y2tpZVFlZE10RTdTbGNfektPRjdXaEdzeWVLTkxuU3BxT2daX29DdFVPbng0LXRsYW5ndnpzbFc3WDAtSFVUQmh3N3F3R2pUMFdMbkl6ZUs1OEwtQm9ZN3dmNlF2X2xxdFdzaHFUR1E3OFh1N0Uzdw?oc=5,"Wed, 04 Mar 2026 20:39:00 GMT",CVS warns bill would force shutdown of 134 pharmacies in this state USA Today
CVS,Rishi Nagar,Closing,CVS says 134 Tennessee locations will close if 'conflict of interest' bill passes - WZTV,https://news.google.com/rss/articles/CBMi-wFBVV95cUxOeU9xOTl2YThUVndZSUJ3OWFrMkZOQ2UtcWd0SFg0N2l0T3ZuWlRTR2g3V01qZ2lhME91QmFMbDdKQThwZW9VYXd6SzFrMWhfRjB5cVR0cUdVUGR0alFMdE9QWjI4b3V3TTF0bjFjTV9iRjZxdXY3NmF5c1FLbjkzSGpucGdCTXZnSkNNNnctSzNfUnlNLUZDeVRNZHRWN3R5TDBWTmxkZ0dIdDJ4ck4zY0d2c0FNM2x6Ty1kN3VxZTRtNGMwTVAyTlNhcXZSd0tCUlZ2bmlZSGFsX05adDBXN09VSkVRYXhLUVN4LTAyZDJwcjV1ZndEWGM4MA?oc=5,"Wed, 04 Mar 2026 11:51:38 GMT",CVS says 134 Tennessee locations will close if 'conflict of interest' bill passes WZTV
CVS,Rishi Nagar,Closing,Major Pharmacy Chains Close Hundreds of Stores Nationwide - Newsweek,https://news.google.com/rss/articles/CBMifkFVX3lxTE9JdUtzZW1rRm15QkZVTHBZaTh2LWh4WFRpSVZYc3AxNVRib0U1VTBFS0p4bUpXdzNPUjRhQnRMZUoyM05vQXo5Rk10UUhnMXZiWlpCQ254X3lEVW5WbzRxeng1WW1NV25EUkMzTl9fUmtyZWYyMGVqTTFzVGVMUQ?oc=5,"Tue, 03 Mar 2026 16:01:00 GMT",Major Pharmacy Chains Close Hundreds of Stores Nationwide Newsweek
CVS,Rishi Nagar,Closing,"CVS, Walgreens and Rite Aid Closing Stores in Florida as Nationwide Pharmacy Cuts Accelerate - Florida Daily",https://news.google.com/rss/articles/CBMiuAFBVV95cUxOMnRVVVNHSEdwWnNENlJKYkNlcmhvRzUzSFFBejRPNFV0NXcxY0ZVZkNHRWZPclhSc0Z3STA5TTNJa0wxVmJ5TG1JblBhb3hoSWlrbUduajZZSkJNVXllWFlhbjQ1Q1BHZ2Y0MmdEQmZtNlhvVE40cXJyT1hlM0ZTWmpUSG1MZjlaR1FtV3ZMUHRMUTdKUTdldG41SXZxYjJSUjNZZ2lSaC03QXdla0lWZVpneExoMG5t?oc=5,"Tue, 03 Mar 2026 16:00:17 GMT","CVS, Walgreens and Rite Aid Closing Stores in Florida as Nationwide Pharmacy Cuts Accelerate Florida Daily"
CVS,Rishi Nagar,Closing,TN bill targeting pharmacy benefit managers would shut down 100+ CVS stores - Local 3 News,https://news.google.com/rss/articles/CBMi9AFBVV95cUxOQ1Bxa0NSN0pVLWMtcU81Y3hoSmZoTTY1VkVrZU8zcm1mTXIwYXRMRXk1VHpoLTgtblZ4Wm84S0ZYTU1hUHVpMVAybXZyRDg1V2NLdW1KQW1KQ3dLeUJLbVQ3Z1VYR1Rxd0ttcm9MTXRZYTFhemM4MXNPcVpZdWg0QUJoWXFxOHctUC00aVBRcU9uU0xXMlZ5XzZKSTZmaU1mSXB4NnQzSVo0Rmd3UjNJWWJwUWVvSjFmOGhobzBRWVhzc2ZUem5adkZ6TFZMdUNackRXQ1hLLUZsSEdqRjV2NGlqTVhMOFRRdGgwc1JzWVNpQ09y?oc=5,"Tue, 03 Mar 2026 01:49:24 GMT",TN bill targeting pharmacy benefit managers would shut down 100+ CVS stores Local 3 News
CVS,Rishi Nagar,Closing,3 biggest pharmacies to close 880 locations – and the next wave is already underway - the-sun.com,https://news.google.com/rss/articles/CBMikAFBVV95cUxNZUpmQnEwOThFS2FLY0VmUFZVajZTMHo2NUxMQUZMdDUtcV82SG52Q0IzVTdYY2xZaEFVcExzc0JobmRaR3B3aE9YbktFdHUxUlhsMTZKaUhEZy1hSHgycm0ydC1jUVVRTzZxb2pJZGZDOXFFRk1wY19YV2tsdmVaMWlVQ2lEQS0zR3JlM2tBWDc?oc=5,"Mon, 02 Mar 2026 20:23:12 GMT",3 biggest pharmacies to close 880 locations – and the next wave is already underway the-sun.com
CVS,Rishi Nagar,Closing,Week in Politics: CVS warns 134 pharmacies could close if bill passes - The Tennessean,https://news.google.com/rss/articles/CBMirwFBVV95cUxQdHB5d2pYMUNGVkxQLXpaWThPZ3ZGa2plQVpnRzR0YkZRckZ3WFFkVWVWM2JpOWJrV0cwSW5YZWp1cmlTdnF6ZkhQS3ZaRHIxc3J1R09QSnRxWkRVaEk3OFcxSTVLMDJIZXBPZGlLVnVZSHEtRkdwSGNyQThzSEhaMWF6QW9XSXpWRThHeFdCUlZvLTZaX2l5dzlJOV9iZTd4amoxVkZmVlhsODVZOWNB?oc=5,"Mon, 02 Mar 2026 11:00:00 GMT",Week in Politics: CVS warns 134 pharmacies could close if bill passes The Tennessean
Grocery Outlet,Rishi Nagar,Opening,Another discount grocery chain is opening multiple stores in Hampton Roads - The Virginian-Pilot,https://news.google.com/rss/articles/CBMitAFBVV95cUxPOGVtSmhRQmZqUzJJenN6Y1BOREdFM3NYRTFFMEw3RXl3QlpsTEdYVVlsODAxWkhXV3E2TjM2eWlhX0I1ZGgzLXAwbTcwZ29kTF9EWkRBeTVDd2dRZi1adTZDcURoTDlmWk5tOGp1UFhyZW9XbzFHU19rbklwR01nUEN2OTBzUnF0NUM5dFB4TFFpbGdEeFFTWjhaWFVobU0yZnpwcHBnZmdqZkJucktVTm1fSmE?oc=5,"Tue, 03 Mar 2026 15:55:14 GMT",Another discount grocery chain is opening multiple stores in Hampton Roads The Virginian-Pilot
Northgate Gonzalez Market,Shuvechha Dere,Closing,Two Hospitalized in Del Rey Shooting - Yo! Venice!,https://news.google.com/rss/articles/CBMieEFVX3lxTE4wZ1ZyVkpOX2FvN3ZJbXZYVTBDdUc3NTRuWndHemtaa0xaWm9zOE1STTB0MFFFTnFhZ2Fya2Q5aWxuN0UxNkNfV044NW40OFhyTThGNGd4eFFGYmU5MG1XZ01iaHV5Rm13cmszb2xZenRTRHpTeGdlaA?oc=5,"Mon, 02 Mar 2026 05:08:52 GMT",Two Hospitalized in Del Rey Shooting Yo! Venice!
Rite Aid,Shuvechha Dere,Opening,"Former Chowchilla Rite Aid pharmacist opens new pharmacy, hires old co-workers - Yahoo",https://news.google.com/rss/articles/CBMijwFBVV95cUxOVlhMbTBXWTl1RThGWWxvU2FZd0RCT2VaeTVXSGZaRXpFU1plamNLS0EwS1lQUkp5SVl1SENfZGlBZDl1WnllY1RESlgtd2Y4cXdYUUdtNXNzVDdqSlNWb0oxc2wtSzZKazFLOXJ5VTdKbTdtYzlKQWx6WlVWVmdKRmlXa3BfTENaWGpFNk1fUQ?oc=5,"Tue, 03 Mar 2026 02:28:00 GMT","Former Chowchilla Rite Aid pharmacist opens new pharmacy, hires old co-workers Yahoo"
Rite Aid,Shuvechha Dere,Closing,"CVS, Walgreens and Rite Aid Closing Stores in Florida as Nationwide Pharmacy Cuts Accelerate - Florida Daily",https://news.google.com/rss/articles/CBMiuAFBVV95cUxOMnRVVVNHSEdwWnNENlJKYkNlcmhvRzUzSFFBejRPNFV0NXcxY0ZVZkNHRWZPclhSc0Z3STA5TTNJa0wxVmJ5TG1JblBhb3hoSWlrbUduajZZSkJNVXllWFlhbjQ1Q1BHZ2Y0MmdEQmZtNlhvVE40cXJyT1hlM0ZTWmpUSG1MZjlaR1FtV3ZMUHRMUTdKUTdldG41SXZxYjJSUjNZZ2lSaC03QXdla0lWZVpneExoMG5t?oc=5,"Tue, 03 Mar 2026 16:00:17 GMT","CVS, Walgreens and Rite Aid Closing Stores in Florida as Nationwide Pharmacy Cuts Accelerate Florida Daily"
Rite Aid,Shuvechha Dere,Closing,Another major pharmacy chain closes stores nationwide - thestreet.com,https://news.google.com/rss/articles/CBMinAFBVV95cUxNVkYtYnJ1VmxXamVVT0lwNDZhMkQyRTZXa1Y3SWR5ck4zMlBjTEsxWWZyZGNMd1NLSW5yT1VfRWZpdVhtdS1Bc2pRdkFUbTFCME5DR01kalQtYnpmZEJyaFNsSkdtWk9ZQ2RxNFhrZDRzWkF0aEhnM3lVUVhLelNJTGV2NEd0bkNIMDJ4Q2dEbmVieDc4MHhSSmdiM3k?oc=5,"Tue, 03 Mar 2026 13:42:43 GMT",Another major pharmacy chain closes stores nationwide thestreet.com
Rite Aid,Shuvechha Dere,Closing,3 biggest pharmacies to close 880 locations – and the next wave is already underway - the-sun.com,https://news.google.com/rss/articles/CBMikAFBVV95cUxNZUpmQnEwOThFS2FLY0VmUFZVajZTMHo2NUxMQUZMdDUtcV82SG52Q0IzVTdYY2xZaEFVcExzc0JobmRaR3B3aE9YbktFdHUxUlhsMTZKaUhEZy1hSHgycm0ydC1jUVVRTzZxb2pJZGZDOXFFRk1wY19YV2tsdmVaMWlVQ2lEQS0zR3JlM2tBWDc?oc=5,"Mon, 02 Mar 2026 20:23:12 GMT",3 biggest pharmacies to close 880 locations – and the next wave is already underway the-sun.com
Dollar General,Shuvechha Dere,Opening,Dollar General now open in McGregor - MessageMedia.co,https://news.google.com/rss/articles/CBMi2gFBVV95cUxOcFhRQlhXUUxjc0twbjZxVVJldzNsRFgtWWtFMGVaZmVFRDlBNDNDYThiWXdBVWdyeWxWYzJMZkxSOFlCX29wQjNTeldZM3dKNzlTeDJweVNJaUVJeDdBRFd5YkxYdFFjRkJOVk45ZlhjVjA5TTBYaDFBNzQ5NjZoZWtLcVRtNmJKblppNTVQSk5mVm5qdXdqbV9NUW5wbFJzR1o2aEpoSG4tNHlhRWJ1WmFJaWdxR0ZBSHd2dmpHZGZ4bm4wRDNuTGtoV1FObUpITmhYZXAxRUdsQQ?oc=5,"Tue, 03 Mar 2026 14:16:00 GMT",Dollar General now open in McGregor MessageMedia.co
Dollar General,Shuvechha Dere,Opening,Dollar General opens new Shippensburg store. Grand opening event soon - Yahoo,https://news.google.com/rss/articles/CBMilAFBVV95cUxQY0t1aFJCQW5BUll0QlF2Y3FyOVFLSEdDeDRSUnJFU3NsV0duaVZ3N1o2UnF4TEhCY2hyM1J1UHMyWks3UzNHYmZiNmxMRVFoOFZiODNJdGtDMkRhcWZvTllPS0Q0dnFCelBNODJrdHRZWUVBMlhnb2p2R3VRZ0tTRWhWWFVDVUZMYXprdEhUMjBkOTZs?oc=5,"Tue, 03 Mar 2026 10:05:51 GMT",Dollar General opens new Shippensburg store. Grand opening event soon Yahoo
Choice Pet Supply,Shuvechha Dere,Opening,CHESHIRE SCOOP: Lovesac coming to The Shops at Stonebridge! - The Connecticut Scoop,https://news.google.com/rss/articles/CBMirAFBVV95cUxNMThLM2lULUdEQVN2VnhzWUpGR1BnRkFVRTktYlJqamZlQ3V1VWp2YTRJRktWRWRnRWs0Q3d3dEkzQ3k1VV9oa0s3SWFmbVdkTkVnZnEycjBFRFhJVGh1VmhDaEQ0eDVJeGhnZVpSRHRXSzIwX0tqeldENGp6YUJxQmt1ck8xWjhSRi1OVFM3VnN6SGZhbWJybVFfUkprU1h2RzNlWTZ6cHFXcEda?oc=5,"Tue, 03 Mar 2026 21:15:32 GMT",CHESHIRE SCOOP: Lovesac coming to The Shops at Stonebridge! The Connecticut Scoop
Three Dog Bakery,Vishwas Shah,Closing,French-Inspired Paris Baguette bakery sets timer for downtown KC opening; B&B shutters historic theater down the block - Startland News,https://news.google.com/rss/articles/CBMic0FVX3lxTFBDZ09oNGFSTy1kdWZkRHNINnhzRFhMaFo0LTNLUnpOSE01TWJfTTBMOEpjaW9PUmR0MldRbDU1LWU2Tk4tbHhHRFVTOXNDS0luS3ItMHlhYkRMUUdBWEZMNlIxQTduUEx1WDB2cFR2TTBWN0k?oc=5,"Mon, 02 Mar 2026 19:55:23 GMT",French-Inspired Paris Baguette bakery sets timer for downtown KC opening; B&B shutters historic theater down the block Startland News
Domino's Pizza,Vishwas Shah,Opening,Dominos Pizza to open new branch at former tanning salon in Kirkham town centre - Lancashire Evening Post,https://news.google.com/rss/articles/CBMikAFBVV95cUxQeV9qWW9wbFZESl95bFBoVnVTMlFVcjFkSmxHbGQ5LUNNNXBGdU4zWVdaQWhEckxZTGN1N1hrdXJWOHF0aXdaUWJyMUdrOUUxcERlekRZZlZ3OVU0cGd6UV9RcnRuQ3cwNE1XV1U3VU4yNmlYa1VQRTJHUU93bEJlYVNwcXRXRXpVYjFaaFlMSzA?oc=5,"Tue, 03 Mar 2026 14:13:00 GMT",Dominos Pizza to open new branch at former tanning salon in Kirkham town centre Lancashire Evening Post
Domino's Pizza,Vishwas Shah,Opening,Domino's To Open Second Aberdeen Location - Aberdeen Insider,https://news.google.com/rss/articles/CBMieEFVX3lxTFBkRUtkLXgtWXF3Wm41V1JrNlRvWDRFTlNoVzJmM0FZSkkyZHJZdDJETGRiZm1qdTNnYWR6M3dSRDd1RURyTnhDZmpoVHphMUlMQ0x5eXYzNGk0QmpkZzlnWE9Xd3FYVk9TZmNsM1Foek9LRlFyRzNYMg?oc=5,"Tue, 03 Mar 2026 12:00:09 GMT",Domino's To Open Second Aberdeen Location Aberdeen Insider
Domino's Pizza,Vishwas Shah,Closing,Pizza Hut rival closing 300 locations nationwide - thestreet.com,https://news.google.com/rss/articles/CBMijwFBVV95cUxQS19JSmFET1FpT0NvZklMVEpidEVyb3Z3UnpwVllzWVZSQXViWkNnWkhGeDFCTUgyeDlfRXFldFVIUzYtWnJMY2llQ1FaN2U4bV8zczhVYXhWWWdsY0FWQ0tvVXBsUHN6SUNESmNsYXYteTUydE9ZMHI1Zk5GMFp2NGZBdTJLdURxSUxzV1NZUQ?oc=5,"Tue, 03 Mar 2026 18:00:35 GMT",Pizza Hut rival closing 300 locations nationwide thestreet.com
Domino's Pizza,Vishwas Shah,Closing,Domino's tightens grip on pizza wars as main rival shutters hundreds of stores - Daily Mail,https://news.google.com/rss/articles/CBMisAFBVV95cUxQalVTWHJIdGZyNV9CdWo2bS0zY21oRU4wVExSUGc1QWlsekZfTFcxZTM1RXZ6aUpzR2tfYW5RTzl4amlUQXVMMXZWT1ZYczhiZkc5djRkWEt2aEFKSUh0UHJlSDhDa3JNdEdJS2diTk11NEVpeVR4eDJhQS1MZWZ5eFhzQS1lTGc5ZE1LMTNsZ0IxUUk2WFllanNhU3B2dF8wdkpHMUw4bXVtREs3MHVzMtIBtgFBVV95cUxQZ2pic1MxRWpwX3k5SFRvblFlN1hzS0pkenoxWUlWbHQwVDItS3pfcFNmM2ZZV3VTeGtDZ3NwTWoyMlRjY2ljZkJwZVZ5MzRpbkZMRmZnMllpemxHUi1xZ0JpeThELWUwVjFuQVI3dkhzQjhiMmxvQVR1c1FYQ3FvLTBzQ05XVEQwcEpXUEwyZlJSeWVESlVDbEthTHZSSThGUlNwWEt5SUgxSVF1NmpnUG1PU0RHZw?oc=5,"Mon, 02 Mar 2026 06:16:24 GMT",Domino's tightens grip on pizza wars as main rival shutters hundreds of stores Daily Mail
Papa John's,Vishwas Shah,Closing,5 things to know about Papa John's closing 300 restaurants - nwitimes.com,https://news.google.com/rss/articles/CBMiiAFBVV95cUxOU3pDc1NlWDRDYjktYlNSSzlGMWxDdXZEY1NOcTQxaG12TzVPUEN6YV9rZTdJTUEwd3gzS1cxQW81a055UlJmLTFyR1Jndk5lUXhqOUtTdzkxWF9MODN4ejNwNlJHbkxjZVlPSFFKM0pmTF9WYmdZb01kQ2RId1RTaVZIMXBjamRO?oc=5,"Wed, 04 Mar 2026 17:00:00 GMT",5 things to know about Papa John's closing 300 restaurants nwitimes.com
Papa John's,Vishwas Shah,Closing,Chain restaurants are closing hundreds of locations across the US in 2026. See the list. - Business Insider,https://news.google.com/rss/articles/CBMifEFVX3lxTE13UXZtQmpDa2FmNnNncWk0ZTczN2hhYlV4dXFHU2pWd1BKT01mcktHV2JSSUNyMGxCN1dTdWpWbjZ0UmpWaVZNaXhSS09Bc3ZaU3g5aElESGhSeUNnTHJOUzlOd0JsU1B5SnFiOHh1S3dWWDZ5cnNqUE4ydFA?oc=5,"Wed, 04 Mar 2026 13:52:00 GMT",Chain restaurants are closing hundreds of locations across the US in 2026. See the list. Business Insider
Papa John's,Vishwas Shah,Closing,"Florida Papa John's restaurants closing, about 300 nationwide - Treasure Coast News",https://news.google.com/rss/articles/CBMigAJBVV95cUxPa0JSNWxfbi1BNUtuZlEwZmVvcGQxbU9zM093OWRpeW5uM19rQ1BZT2d6R0FYcFlta2RoWnRnVTI3dERjbktHd2d5Y1NSS0FkR3hWTVkwZkxiakdiQk00LTloX2ZwVTRlOWFwR0R2a0tyM3dYSTQ2ZnA5VEY4Ny1DMDR4U0JMM1A1dUlyRE9pSzRJYTN2ZEMybkpQNlYxU3RQQ2hMa25VVW5MTnh4dW8yekwtcnZzLW8zSTNxQjUyMkVrQ3RLVXlWUnZPdkt4WjFYQUZYaGtLSVdqT0hER2ZFYnNFNERiMkZmM2g3NWZWRTFIb19SOWZvckVGc3JxSnVt?oc=5,"Wed, 04 Mar 2026 10:02:00 GMT","Florida Papa John's restaurants closing, about 300 nationwide Treasure Coast News"
Papa John's,Vishwas Shah,Closing,Papa John’s Plans to Close 300 U.S. Locations by 2027 - AOL.com,https://news.google.com/rss/articles/CBMieEFVX3lxTE9HdkMwTkJ3SWM4UHFQR21ZbnU4US04RGxnajFrOXF6SHR2Mzl6QTAtV21xODFlM1pwcmtXMkZacnZKbVNnX21ZUW54c1BzUHhDeVBBbThreDJvZk1EMS1Gb1N1WGwzbHJ4UXlUcHdISG91S0VoZHI0UA?oc=5,"Wed, 04 Mar 2026 09:45:00 GMT",Papa John’s Plans to Close 300 U.S. Locations by 2027 AOL.com
Papa John's,Vishwas Shah,Closing,Papa John's to Close Nearly 300 Restaurants by End of 2027 - NTD News,https://news.google.com/rss/articles/CBMidEFVX3lxTE5Hd3BqR0ZHUHdsY3M0aWxHclI1bHJBUXdMek9CZGFoblhycWF2alBwRmJFdUMzNkdIcDhMRHdtM2JHSGs5WWdiZjJrTmlpMXcxbWcwcURmZXluSmZsdU9UaWJxamhpS1Z4MGZCc0Z2UWY0WWJz?oc=5,"Tue, 03 Mar 2026 21:07:01 GMT",Papa John's to Close Nearly 300 Restaurants by End of 2027 NTD News
Papa John's,Vishwas Shah,Closing,Papa John's to Close 200 Pizzerias in 2026 - NTD News,https://news.google.com/rss/articles/CBMif0FVX3lxTE1RZzJfemtBMW9PNzFwallnYUlUMTduaWV2MVoteDZGTEdUMlgwY3RhMktmUXptZUtvZW5TR0t2Zl9pQVBlU2FkTkFseGpycnFPWFBVS09CUXdMbWN1MG9hNXN5bTV4SFhFSWQyamlWNVJVWnUyZWxwbnpZU1pVb2M?oc=5,"Tue, 03 Mar 2026 21:07:01 GMT",Papa John's to Close 200 Pizzerias in 2026 NTD News
Papa John's,Vishwas Shah,Closing,Papa John's to close hundreds of restaurants - Fox Business,https://news.google.com/rss/articles/CBMigAFBVV95cUxOeVU4UW1uT2NtOTRLQVdtaVcwSzhQeHpxUkdBU1ZkVGZNc1o2YXk4QmJHdWFiS1NtYWdWVFUtMS1uUlppNE5fcWpxMExmNGFyaG1kbU42LWpJTW9Ca2liNjRicXJqcTJrMnAyeElfUHlOdzJ1TU54Y3V5SG1YUWVrWdIBhgFBVV95cUxQTjJJM0NueVRRZUs1Wk5UanFnQ2JXM0twSmE1RXVIRzg4UG8zSktLM3dYbHU3NFl0X1R4Sl9kb2R3Q3N0bHNQSHY5TkpPWjJQcE1TU2ZqSUJnZlVIMjVMWk9TNzFob09tNmEycHA0bDRFSS00NUpOdGJMYnVHd3hDMDFyZS1Bdw?oc=5,"Tue, 03 Mar 2026 18:34:00 GMT",Papa John's to close hundreds of restaurants Fox Business
