Store,Analyst,Type,Title,Link,Published,Summary
Barnes and Noble,Ashwin Nair,Opening,Barnes and Noble opens new store near Powers - FOX21 News Colorado,https://news.google.com/rss/articles/CBMiigFBVV95cUxPMnAteElpZnQwOTlubHVpLWYybVB1a2tiYmh5cnJ3a2lDT0Q0ZllEbU95MXBrVnlneC1SVHUyR3JjclJFUi1taGVtbTMtLW56MGs2dDktQzNuYVVUS1VLRmdjTFM2VEJnYzdlRjNPOG13V0liRmdVSlRtRlo4WWtHNm45ZjYxZkh6c1HSAY8BQVVfeXFMT244eEpOa0pJM3U3b2xiU0Y3N1NNVlpFaERCZGROaDljVW1ER0tWZ3M0Q2xWbFFkSGlFSGljbldJMUZRSTdnX0xDVmpCNWdXdlhxZ2V3d21NTkM2dkhyZmdLa19VdFl3S00xdmZLYlB1dFRDa19YOEF4Qy1odG5RUmlTNHJ4aUo5eDVQbzIwYzg?oc=5,"Wed, 04 Mar 2026 19:53:21 GMT",Barnes and Noble opens new store near Powers FOX21 News Colorado
Barnes and Noble,Ashwin Nair,Closing,Beloved San Bruno Bookstore to Shut Down After 20 Years - WhatNow,https://news.google.com/rss/articles/CBMingFBVV95cUxPT3NfYXdPSTFOR1RxYTlGVjVpYVNVTjVDd19SSzRGNlVPNUJzZ0VSNl9RYU5BQVNUY0J3TnZucVhDYXNfSkw3R0VadGFXR2NFQ2ppOEZoZjFtcUhkcXZIOU1BTHdnTTE3aGRpODVwSHhjOGNXZXFPRmtISzBjWG9OVlRCVVJOcW1lYWpoc0J5dDB2cklha1AxSEVqZzRsdw?oc=5,"Mon, 02 Mar 2026 17:06:21 GMT",Beloved San Bruno Bookstore to Shut Down After 20 Years WhatNow
Burlington Stores,Ashwin Nair,Opening,New Burlington store to open on El Paso's East Side; how to apply - El Paso Times,https://news.google.com/rss/articles/CBMivwFBVV95cUxQdEdld3g1NmZ2VnFlVlpLOHRQQUxmNVR1Z0RvY1FJM19SZHl6cms1b1E3MExlVXFRaE5VeXNrdEpsNHVlRmx3bHB4Y3NpMGlrUkFnRlJmS0E4dk41VVdpYjN1bTZrY2xZRFZybnFoNENEYklsNXZ3TTA2SjlqTnNkOXJHWktPYXE3OGVzVDR0akFOS3QzOWg2aEdlVDJsMnZ0WWdLRWw5U0N5UzRUUVZJS2hzZ0hUV3NWUDdJNFVJMA?oc=5,"Tue, 03 Mar 2026 21:29:00 GMT",New Burlington store to open on El Paso's East Side; how to apply El Paso Times
Burlington Stores,Ashwin Nair,Opening,Burlington Stores announce new location in East El Paso - KVIA,https://news.google.com/rss/articles/CBMikwFBVV95cUxPNTdJQlpPNmM0ZGNWdTgwYVJ5eXQwTjFVZTlZT3pVU3cwNUJvUTdpSmdZRlVyYnRGM01hYkhqUDJDX0l4MUFHR0VWTHZDeDJnVXE2NFJ0dWF0SkpiOHY0aGZUSktiNHBRaVVLWE1LVUJiYk1ydnBBbVM3OFg3bjdkOEhGWVlNWjQwT0hqTjY3VVNkc0k?oc=5,"Tue, 03 Mar 2026 18:23:44 GMT",Burlington Stores announce new location in East El Paso KVIA
Burlington Stores,Ashwin Nair,Opening,New Burlington store set to open this spring at Yarbrough Plaza in east El Paso - KFOX,https://news.google.com/rss/articles/CBMirgFBVV95cUxPWDhqS2MxMUdKRVFOVUJIN2V0enpIdkNaZHUtajc0VlVndFdsTXhVNWJZZjdjaGJhS091cTZXUE1nSW80c0lBV3RHT2dmcW85QjdMSk9kUWZpbG1aRkR6U1hQWlo3TlJTVzY0SFZLdXQwaXJiZHFySWVZVVRIc1FPSExTbDRsa25pOFFncXh2SWNxQzV5Z1dUM092N1dXYWNwUm5pQy1YdUJrUVNCbGc?oc=5,"Tue, 03 Mar 2026 16:40:22 GMT",New Burlington store set to open this spring at Yarbrough Plaza in east El Paso KFOX
Burlington Stores,Ashwin Nair,Opening,Burlington Stores Opening First Wyoming Location This Spring - K2 Radio,https://news.google.com/rss/articles/CBMiYkFVX3lxTE9ISUg1bzdZd2phVXotWndFLXl6a3UyZjF1N01tcElmSVd0NnRJaDNTcmVHQTVfSnJRVmFDX1M4aUFLY3RJMVRUamlTSklKOEhxUzJxdkhUOHlRTmd6cWppeTJR?oc=5,"Mon, 02 Mar 2026 17:50:03 GMT",Burlington Stores Opening First Wyoming Location This Spring K2 Radio
Costco Wholesale Corp.,Ashwin Nair,Closing,"Archer, Riot, Rigetti and More Stocks With Earnings This Week - Sahm",https://news.google.com/rss/articles/CBMisAFBVV95cUxQT3kxb0FDUWxXUXpCUlkyZ3lvTHprNFptdks0R3dlNnZZcWdMbkxoYmhwVG1EN3ZQMml5WnBzTlc1MzExN3ctem1maU1tb1BMVi10Q2J1ZkVDcVBvZnRlZTViVnlwUWx0bF9yVHFCZllObV9BZ3NQU3RzRGxOZ085dG43WWxocnh0UGVHV1VIOFlBdmlpU1J3OVdfbVNFTGpnWTdOa2Z0VFl0Z21uZ0NNVQ?oc=5,"Mon, 02 Mar 2026 08:00:00 GMT","Archer, Riot, Rigetti and More Stocks With Earnings This Week Sahm"
dd's DISCOUNTS,Ashwin Nair,Closing,Ross Stores (ROST) Q4 2025 Earnings Transcript - The Globe and Mail,https://news.google.com/rss/articles/CBMiyAFBVV95cUxOcmJaSlJEaHZ1VEtzZ3N6VkVEQkJOWE9ISFZMU3ltUHlqTGZHaFAzY3VLWlB0TGRzVlpjbjVLZ21Vby1mbEc5OUVCTlFRTEhfNXAxamw5NFRQNlZxVk5sZTZud3BGWjY1Q1otMTVXa3Z0Vk5wZjRvVkF2VjhtTUxNNEJTZFdPRkk2cWpDQmVnRkphMTJQNmpiYUxCYk5SUFJiRHdqZDdXSXJZZXdza2F6TllCcmtsNFVGMXNmZEhjOEhuRkZ5dnQwNQ?oc=5,"Tue, 03 Mar 2026 23:08:14 GMT",Ross Stores (ROST) Q4 2025 Earnings Transcript The Globe and Mail
Dick's Sporting Goods,Ashwin Nair,Opening,Relocated Dick’s Sporting Goods to host grand opening in Kingston - NEWS10 ABC,https://news.google.com/rss/articles/CBMitwFBVV95cUxQN1R0MGhiVnVfTVpaVm03UWZCMG9ralBJd2llTEc4d0VqTzBQUzlfeDdqZ2pRVVZGaDJkcWN3SUtzck43M1NyRVJOZGxYTXRkVXRiRkE4Ql9TR3N3Y0pzdm4zTFUtbkJua3BwQ01kN3gzdWVua2RvclkxSlMteDRxbFJvdjFVV3Q4bWlPZjU3b0FVV3B2N2VzVXV2ejZSMEJkYlhuX0V4bDYtblIwWnlzRjRFSWI5NDTSAbcBQVVfeXFMUDdUdDBoYlZ1X01aWlZtN1FmQjBva2pQSXdpZUxHOHdFak8wUFM5X3g3amdqUVVWRmgyZHFjd0lLc3JONzNTckVSTmRsWE10ZFV0YkZBOEJfU0dzd2NKc3ZuM0xVLW5CbmtwcENNZDd4M3Vlbmtkb3JZMUpTLXg0cWxSb3YxVVd0OG1pT2Y1N29BVVdwdjdlc1V1dno2UjBCZGJYbl9FeGw2LW5SMFp5c0Y0RUliOTQ0?oc=5,"Wed, 04 Mar 2026 11:00:32 GMT",Relocated Dick’s Sporting Goods to host grand opening in Kingston NEWS10 ABC
Dick's Sporting Goods,Ashwin Nair,Closing,38-Year-Old Sporting Goods Giant Closing Stores - thestreet.com,https://news.google.com/rss/articles/CBMiowFBVV95cUxNQmZDczhvaUxfZHpsYlhRMzFBY2lQR3pTM05uSEczTjM4RTd5dnVsSlU1NTFESGxfc0FpbkU4MXlYdVlTSW1pdHEwN3gtM1V3MmdmTEdua0FLUkhWUjIxYWhnWVo1U0o3c0pSaGlPdmpLcE9XLWdGN2ZXVnJKR2xPQ3R4WmtWMnpEVXFmcGhlSHFUWVduRFBoNnJVOU9sSklsWDlj?oc=5,"Wed, 04 Mar 2026 23:16:09 GMT",38-Year-Old Sporting Goods Giant Closing Stores thestreet.com
Dick's Sporting Goods,Ashwin Nair,Closing,Dick's Sporting Goods at Sunrise Mall closing in April - Newsday,https://news.google.com/rss/articles/CBMiiwFBVV95cUxQSXNOUXBUTTZuZjNCbHFLQUYtUmp6YmZMaUdfV0pSNDBNczc2andZTDJNWVBLQXBtdU1IU1hRWmV3MXZqTDlJRmlnbDNFa0RDa2pXdnRjZzM3d2hSNlY2cDRSRU1xUE1CcG9XWi1Wc2ExRjdhWnU2emphLWctTFYwU1F3QmRRVVdzNzNv?oc=5,"Tue, 03 Mar 2026 12:30:03 GMT",Dick's Sporting Goods at Sunrise Mall closing in April Newsday
Walgreens,Ashwin Nair,Opening,Walgreens Alliance Website Walgreens Pharmacy Editorial Photo. Image Of Window Walgreens Location Close To Me - bussmagasinet.no,https://news.google.com/rss/articles/CBMicEFVX3lxTE5RV0hDWWxNbVJabGV4dU9LTGxFaU5sYXNQR05PRDBBWHVhQWFLSlNneWE4NVZ0dEpERWJ2QUNuTzVRU1c1Q2JMM3FscnFLMDc2N1RMNm91NFRtc3hrbV93T2ZLeUYzdmVpSkZveDU3TWY?oc=5,"Mon, 02 Mar 2026 17:20:33 GMT",Walgreens Alliance Website Walgreens Pharmacy Editorial Photo. Image Of Window Walgreens Location Close To Me bussmagasinet.no
Walgreens,Ashwin Nair,Closing,"Northside Walgreens overwhelmed after store closures, customers say - Action News Jax",https://news.google.com/rss/articles/CBMi0AFBVV95cUxPVmE3Y2dzaDJZN2J1VFRIU2RQUjFQM3FiR0s1a1dLZnRtR2t5MzIwZkktQ3RhNmVxeGRvSGpPTmlNTTVVUExES3VJTzN6ZXpSOXIyd1A1aFVPb0IySThkYndCVkhYS0t6OVFmTXVnNklIRDJYSFBmTXBjNHRnVl8xN2VFVS1Rek43aUVfb3Jmd2ZiY25PeTNlM0J0cXJnSGdLTDBwSEFJS2hNLUVKSHdtU1cxbzNIVldFNEE2V0t3emFkQ2VVX0drS1dfd1o4NmRx0gHkAUFVX3lxTE5PN2hub2RmNV82aUZoTXpQZ2hZVnBSRTBrZXc4WVo0RE1SMUJ6UE05YVZZbGJzNlFpQ3djaWJMbVBab2hwSHZXYzVlTTZ2SUFBSmdJSVQwaGpVUHpKOVVaMTRqN1c1N2FKU2ZERGc4OGNfUldXamVyV080VlU4S3V6aG9rb2VYVzB2RzZrQV83RGUxaWtNMkM2VHZFbzNDMElPaEdQVFlxeVNkSTd5RE9jTE05Uml6ck50YXpOR2l5VHZqa3dXcmVzWFhRdnByVFBMZG44eUZyV08wT21NNEpYS2VqeA?oc=5,"Wed, 04 Mar 2026 02:40:00 GMT","Northside Walgreens overwhelmed after store closures, customers say Action News Jax"
Walgreens,Ashwin Nair,Closing,Walgreens to Lay Off Workers as Store Closures Loom - Newsweek,https://news.google.com/rss/articles/CBMijgFBVV95cUxQUGR4UEVUMjZTUnZqLWk3MzlDZlNKMkI4MVZvc3FxRmFxMXBXU1c2dEJoOTZrZDJIN0lQa3BnN29rU0dzSGRjREhKckhhaXVSRW42Q1ZTTWhIdWRGNmlVaHN3anJJY1dJOWFJNDlfRWp5b1ltSEtyVFRteGl1aVdYSV9HOWFUc2J1SG1tNHhn?oc=5,"Tue, 03 Mar 2026 16:48:00 GMT",Walgreens to Lay Off Workers as Store Closures Loom Newsweek
Walgreens,Ashwin Nair,Closing,"CVS, Walgreens and Rite Aid Closing Stores in Florida as Nationwide Pharmacy Cuts Accelerate - Florida Daily",https://news.google.com/rss/articles/CBMiuAFBVV95cUxOMnRVVVNHSEdwWnNENlJKYkNlcmhvRzUzSFFBejRPNFV0NXcxY0ZVZkNHRWZPclhSc0Z3STA5TTNJa0wxVmJ5TG1JblBhb3hoSWlrbUduajZZSkJNVXllWFlhbjQ1Q1BHZ2Y0MmdEQmZtNlhvVE40cXJyT1hlM0ZTWmpUSG1MZjlaR1FtV3ZMUHRMUTdKUTdldG41SXZxYjJSUjNZZ2lSaC03QXdla0lWZVpneExoMG5t?oc=5,"Tue, 03 Mar 2026 16:00:17 GMT","CVS, Walgreens and Rite Aid Closing Stores in Florida as Nationwide Pharmacy Cuts Accelerate Florida Daily"
Walgreens,Ashwin Nair,Closing,Another major pharmacy chain closes stores nationwide - thestreet.com,https://news.google.com/rss/articles/CBMinAFBVV95cUxNVkYtYnJ1VmxXamVVT0lwNDZhMkQyRTZXa1Y3SWR5ck4zMlBjTEsxWWZyZGNMd1NLSW5yT1VfRWZpdVhtdS1Bc2pRdkFUbTFCME5DR01kalQtYnpmZEJyaFNsSkdtWk9ZQ2RxNFhrZDRzWkF0aEhnM3lVUVhLelNJTGV2NEd0bkNIMDJ4Q2dEbmVieDc4MHhSSmdiM3k?oc=5,"Tue, 03 Mar 2026 13:42:43 GMT",Another major pharmacy chain closes stores nationwide thestreet.com
Dollar Tree,Ashwin Nair,Opening,Grocery chain dubbed ‘cheaper than Dollar Tree’ to open new location March 26 - the-sun.com,https://news.google.com/rss/articles/CBMijwFBVV95cUxNOW1xTHl2WkVDNEhTS1RON1VSUjJNRWdFRHJpWHpPRUdmS1JSTHBXV2tQeExZUGFndElwS1lWTE5PVjRGZ0Y4bzluWkdXQUhRd0pMY2hNWFZodFphTDdZTUp2WEhKTndKaFFYdzJJWWpKQzJsdFd1dWhBOTFPd25OWGdJaG1USjNmOTFPV2wyRQ?oc=5,"Wed, 04 Mar 2026 17:45:23 GMT",Grocery chain dubbed ‘cheaper than Dollar Tree’ to open new location March 26 the-sun.com
Dollar Tree,Ashwin Nair,Opening,Dollar Tree eyeing Huntley location for new store - Shaw Local,https://news.google.com/rss/articles/CBMipwFBVV95cUxQTDdmaXBycHBBOTVtam9IX3BuOFFzOWNRWGdEc1RIWVBlY0E5eGFkWGpxSHJzWWlnc0dPRVFueFF0NXhNR1lqVEs2ZzY4Slh2WTlycjFpMnZ5cURSdXRMOXVTTmEwU1JfcHNETjI1VlIxT0h0S3BpM2l5Z0dDZG1lM1IzblpKaWpjMFRyeTBmb3BHWklMSHpWblBzeUlQYU5BTmliMXFMRQ?oc=5,"Mon, 02 Mar 2026 23:37:14 GMT",Dollar Tree eyeing Huntley location for new store Shaw Local
Dollar Tree,Ashwin Nair,Opening,Retail giant dubbed ‘cheaper than Dollar Tree’ to open another location in days - the-sun.com,https://news.google.com/rss/articles/CBMihwFBVV95cUxPbVVNTGl5X2VGLVRRQk9CRlRvbHlJMUdTQXF3TWVUYjhXeFpySTZBOWI0czNQcmdzWTJURE4xTTgxTUdLVVhWYXh5eHV2RGowYlJaWDZ4bUtuanVvZ2VhbS1RejFVenYzbnI0UnpEckFNeWFtekowXy1WVzRONHZwU3Nqc3I2RFU?oc=5,"Mon, 02 Mar 2026 16:28:14 GMT",Retail giant dubbed ‘cheaper than Dollar Tree’ to open another location in days the-sun.com
Fred Meyer,Ashwin Nair,Opening,Fred Meyer is expanding in Caldwell with a new store. Here’s when it could open - Idaho Statesman,https://news.google.com/rss/articles/CBMidEFVX3lxTFB3Tm9fVURuODJvMGtIRGV0a1psa2NxYy1xc1F6OVJZYWczX3dYb0RqZTlFNkpOX25tSFNKTEhQRmdoWWJYMnZjSzVWMUs3emNwRzJRSUNJQ3BVcHk2S1FBZ2lGWW1yU0VNeDViYkxFQnBNMkxG0gF0QVVfeXFMTmR2a0pjZmFXTzZfTTFXMFNfTUlsOUlyRENvUVFjWHpvaXowSllXQmhGcjlVaFlPQ0F0M0R5bjB4dERZOEVBZy1uSEVhUHdDYVJzNVcyNkdVcVExNzJ6VUV1UDV0ZFRFamlWLWVpdEZUUDJYX18?oc=5,"Wed, 04 Mar 2026 21:30:37 GMT",Fred Meyer is expanding in Caldwell with a new store. Here’s when it could open Idaho Statesman
Marshalls,Bhavesh Phulwani,Opening,Say hello to Marshalls ‘sister store’ as another new location to open up in 2026 - the-sun.com,https://news.google.com/rss/articles/CBMinwFBVV95cUxOQWpWY0FrV0swSGdJYTR6Nk04b3FEeTNseU9mSUt5cV8yR2tfMVJwdVdLb19vVmk1U1FMOXF0T0ZjNVR2MnhwVVFzVDVXRzFicjRLdXVzeVFta05iaXdDNzl0cXpxb19YYlc1RVpvNjV1bThGRnF0N2tEUVVwZ1lnQ2pScEhDVmVOMGRnTE1tQndmMFBLdVFneXA0WXYzMXc?oc=5,"Tue, 03 Mar 2026 21:50:57 GMT",Say hello to Marshalls ‘sister store’ as another new location to open up in 2026 the-sun.com
O'Reilly Auto Parts,Bhavesh Phulwani,Opening,New Dairy Queen Grill & Chill opened Sunday in St. Marys - PressReader,https://news.google.com/rss/articles/CBMihAFBVV95cUxQQVlGSWJNRUVBQURGMEFoRlMtNDB3emlKbmxOVWVGVEFqX0tReXJ5SEtHSUt2elpqVkhTNUFlQTd4ZWxrbXc4RkV1bDFfN3VHNkNVcnlIRVV1OGh3Nzl6cFVPYUM4NjNkWHJTS1hVRHpvbmhWZkdWRFVKQWE4YmwxaEc2Q3Y?oc=5,"Tue, 03 Mar 2026 09:34:35 GMT",New Dairy Queen Grill & Chill opened Sunday in St. Marys PressReader
O'Reilly Auto Parts,Bhavesh Phulwani,Opening,FULL CELEBRATION: Tyler Reddick celebrates becoming FIRST Driver to win FIRST 3 races to open season - FOX Sports,https://news.google.com/rss/articles/CBMiYkFVX3lxTE1EVHN1a3cxT3BRQjRkN3BzYjFiNWpfd28ycGZ5cHVEVk5PNzdiSlBqNWUteGtuUmNacV9fRmduMWNUSmZPZkhJX2FJVGk2R213YXZRYzNFMWlaMjdyYXBKY3NR?oc=5,"Mon, 02 Mar 2026 00:43:23 GMT",FULL CELEBRATION: Tyler Reddick celebrates becoming FIRST Driver to win FIRST 3 races to open season FOX Sports
O'Reilly Auto Parts,Bhavesh Phulwani,Closing,Sick Alex Bowman had to find relief driver in closing laps at COTA - Yardbarker,https://news.google.com/rss/articles/CBMixgFBVV95cUxNaU1DSnRTay00Y2ZfemxaT0VYenExWWZ6Yl9TbV9odGV0VFFOM0JCcThPbzVRZ1c4NmFTQTBDUGZMQUtJRlp5VkNtZ3NwT0tpRWp3U1haZGtoX0tXaEg0WlZER3B3SEdkWHA2dTZRSy0yd1VwNDd1OEFqRWxVcHRINC1jWmk0WkxtSmZBSXV1d0FzS2ZlQmxNLThjb0JHT29HU3EzTVVjR1RfUnF0bVVEZzJqMW9sNmY1MXA2bDVEUUU5MW9ITFE?oc=5,"Mon, 02 Mar 2026 00:33:29 GMT",Sick Alex Bowman had to find relief driver in closing laps at COTA Yardbarker
Office Depot,Dhiraj Manghani,Closing,Office supply chain’s shrinking streak continues with 13 closures in 4 months - the-sun.com,https://news.google.com/rss/articles/CBMipAFBVV95cUxORnlYTW85X1JpLWx0UHQ3bi1XemZkeXFhZF9xa1RDRURkOTJUOEhEeE91QVVpcGppZkk4SXZSTTNWT0JZXzVZUDJjX0lvNlMya2ZpRkh1cFVodnJvMGtjUWZKTklUeFJ6OXB0dVp4OXRrZmpSZFpyTVhpYXlJQkN3VHZVYkFZV2ZfR2Q3anlSM0hETW4tOU1GbU5LbjlTODdtSW8tQw?oc=5,"Wed, 04 Mar 2026 20:04:20 GMT",Office supply chain’s shrinking streak continues with 13 closures in 4 months the-sun.com
Party City,Dhiraj Manghani,Opening,Defunct San Antonio Party City may be getting a new life — with Teso Life - Houston Chronicle,https://news.google.com/rss/articles/CBMiqwFBVV95cUxOZzhyaWlVeUt2RTV3T0dGNWNFZ0dDWFpkMDVjeEFrbFVpWm1vQUkzSFBIQkdZWi1FS3FfS0FmemR5MjhDZnNLZWpCWVlIWlhfVVBMS1RMbzNnZlBkODRZQ0h2RVdPRnBidEtCZER5Z0kxWERLcHRlM2pYREpPLWs2Qjl4Sno1Y2NxUHVJWlpGZTdYNlJNZUhVYVlWUG82VzdkUUNUVEFudWJNZzg?oc=5,"Mon, 02 Mar 2026 16:03:09 GMT",Defunct San Antonio Party City may be getting a new life — with Teso Life Houston Chronicle
Ross Stores,Dhiraj Manghani,Opening,"Ross Q4 sales jump, cites ‘very strong start’ to spring season; to open 110 stores - Chain Store Age",https://news.google.com/rss/articles/CBMinwFBVV95cUxOYXFlS3RWcm5fWDluNkdpUFBTYU1lQkVDb1RlaW53eG1jcjl4cnB5NWhvdS1lUjFyeUc1aUFsSXBhZFpqeWNJd3JGd05ZdGxqQ1pNT0FDVlNHUWZLRWJjVjNteUdTNVY0RE10VlpFWGh3cUkyR1N5Qk1hdXpVWW91UUdMa29kRkQyZVF0WWo1eVJ3S3lucDh1Yjh3Rmx0MkE?oc=5,"Wed, 04 Mar 2026 17:22:02 GMT","Ross Q4 sales jump, cites ‘very strong start’ to spring season; to open 110 stores Chain Store Age"
Ross Stores,Dhiraj Manghani,Closing,Ross accelerating store growth in 2026 - Home Textiles Today,https://news.google.com/rss/articles/CBMiiAFBVV95cUxNNlhJZi1lR1Z6VWk1Z21UZ2dLQUl6WlhualhTUExtTXFTSUlpVGV1RlBpY0VDZ1RrN0JCMWhDaTRVRzVDVWN5ZjZjeXVaWkZra3BtbVBETEpaUEVJRmRKSDgzYXJ5Q3V0YUF3dnQydm9SSUVGRVlzTDRJV3E3TVJNNFNYb0s2dTdF?oc=5,"Wed, 04 Mar 2026 17:21:50 GMT",Ross accelerating store growth in 2026 Home Textiles Today
Staples,Dhiraj Manghani,Closing,"Iconic national office retailer closing stores, no bankruptcy - thestreet.com",https://news.google.com/rss/articles/CBMipgFBVV95cUxONnBFbVhuVWN1dUxqNWFQQTI2UDU4bUtfUW91SlRLSkdkajFYTDAteGcwQjhibkpCaGJ3U0tZcF9YYktPQzZIWFZXUUc4WWh3ZzgwWW1jVlZsamJmb2NKMEtUSTM3UEIzYnJJclJndEtYRjRWVnJlSGZKaUU1WTZXOV9idDBhTHRwWjRpaFE2cnl3WnBXM0ZwbWR0ZHNOZDJpMzZXS2x3?oc=5,"Wed, 04 Mar 2026 13:07:00 GMT","Iconic national office retailer closing stores, no bankruptcy thestreet.com"
Staples,Dhiraj Manghani,Closing,"Waterville, Maine Staples Closing as Urgent Care is Planned For Building - 92 Moose",https://news.google.com/rss/articles/CBMiYkFVX3lxTFBkSDhDLThiOFpnOVgzeDJ4Sl9VUW1GSkpPbGtxUDFHTm1EYURwNXNKX0NYWGdPLWRGcnJFNmJPdzhkdkxNbldSd05OeWpHYVBxZjhFakN3X0ZiUkJMWG9aYWdn?oc=5,"Wed, 04 Mar 2026 11:12:16 GMT","Waterville, Maine Staples Closing as Urgent Care is Planned For Building 92 Moose"
Staples,Dhiraj Manghani,Closing,Waterville Staples is closing. Here’s what shoppers need to know - Centralmaine.com,https://news.google.com/rss/articles/CBMimgFBVV95cUxNVXBrV0VUTVZXdnROcWRWa2hsZjBFMUlLbWN4bUdFSkV3VWxfRE9DLVNJaTktMmFjMnYxNTlJYjMxbHJnbm5qNElCbHFLQ2pyVVlVaEd6bHd5aTdad21RRFo4WjEwd29EelhRWjNvMDJ1TlI2YTlZMUtEZ3ZPbXRtZnh0NHBQQ0R5ZDFId1Y3aEhJcUp1d010enJR?oc=5,"Wed, 04 Mar 2026 09:00:00 GMT",Waterville Staples is closing. Here’s what shoppers need to know Centralmaine.com
T.J. Maxx,Dhiraj Manghani,Opening,Say hello to Marshalls ‘sister store’ as another new location to open up in 2026 - the-sun.com,https://news.google.com/rss/articles/CBMinwFBVV95cUxOQWpWY0FrV0swSGdJYTR6Nk04b3FEeTNseU9mSUt5cV8yR2tfMVJwdVdLb19vVmk1U1FMOXF0T0ZjNVR2MnhwVVFzVDVXRzFicjRLdXVzeVFta05iaXdDNzl0cXpxb19YYlc1RVpvNjV1bThGRnF0N2tEUVVwZ1lnQ2pScEhDVmVOMGRnTE1tQndmMFBLdVFneXA0WXYzMXc?oc=5,"Tue, 03 Mar 2026 21:50:57 GMT",Say hello to Marshalls ‘sister store’ as another new location to open up in 2026 the-sun.com
Target,Dhiraj Manghani,Closing,Prediction: Georgia trending for 4-star target closing in a decision - On3,https://news.google.com/rss/articles/CBMiogFBVV95cUxPcHV2QlNDbUZvWkR4aEhSZnl4bHVkakwzUV85ejZibzRxX3AydDNELU90T1N1R08tMkZrbmNObEM2M0xlbkJFVy1DTHpPbzNYSEcwZ2dqaHEyVk10QzM4QUpnb1hVWlpZaFZVWEo4RGp6U19QZnlwRWFPaXZfTVcyTlBkeG9TWFI2QzhkaWw1ZkdBM3JHVXRUSTdQanpybHBCakE?oc=5,"Mon, 02 Mar 2026 07:53:59 GMT",Prediction: Georgia trending for 4-star target closing in a decision On3
Wawa,Digvijay Singh,Closing,"Old-school Wawa in Hammonton, NJ, Likely to Be Replaced - WPG Talk Radio 95.5 FM",https://news.google.com/rss/articles/CBMicEFVX3lxTFBCLWpvQUluak02TkdhMXBjRG96dmhYN09ZZVRYWHNSOEdRRkE4SVRVRl9TVlJaaUdJTHFtRVpfS0syeUlWX0I2VzV2Tm5hQ1A3bUN1Tk0zb055akhiOEhLMVFTelpIallMSW1lZXRkTy0?oc=5,"Tue, 03 Mar 2026 17:41:45 GMT","Old-school Wawa in Hammonton, NJ, Likely to Be Replaced WPG Talk Radio 95.5 FM"
Dillard's,Digvijay Singh,Opening,88-year-old department store 'nicer than Macy's' to open new spot in busy mall - the-sun.com,https://news.google.com/rss/articles/CBMimAFBVV95cUxPTFNaOXd4aDBWWXBUWTJHSDFoQTJ2QzdidzZoSndtWEpKNDhiZnlTRzlyMmlZV0N3cFg0WDNGSVRWcFBIWFhKTl9pRVdLOVZsSWdHeEVmSlgtWVVmQlpoWE1iZFNzMmdCY0dvbkotVFJKekNvSHc1STZFd3BlazVXRG9mUE9qemk3Z2lzbGh6SVotc1dmVWl1Yw?oc=5,"Wed, 04 Mar 2026 16:28:10 GMT",88-year-old department store 'nicer than Macy's' to open new spot in busy mall the-sun.com
Macy's,Harsimranjeet Singh Ghelani,Opening,88-year-old department store 'nicer than Macy's' to open new spot in busy mall - the-sun.com,https://news.google.com/rss/articles/CBMimAFBVV95cUxPTFNaOXd4aDBWWXBUWTJHSDFoQTJ2QzdidzZoSndtWEpKNDhiZnlTRzlyMmlZV0N3cFg0WDNGSVRWcFBIWFhKTl9pRVdLOVZsSWdHeEVmSlgtWVVmQlpoWE1iZFNzMmdCY0dvbkotVFJKekNvSHc1STZFd3BlazVXRG9mUE9qemk3Z2lzbGh6SVotc1dmVWl1Yw?oc=5,"Wed, 04 Mar 2026 16:28:10 GMT",88-year-old department store 'nicer than Macy's' to open new spot in busy mall the-sun.com
Macy's,Harsimranjeet Singh Ghelani,Closing,168-year-old mall anchor closing more stores - thestreet.com,https://news.google.com/rss/articles/CBMiiwFBVV95cUxQZlgyVmNWQXVuemticFVHZlRPWld5ZkdnOWlOb2M0VFpHX3k4QVhvWHFYSG5HazFublFhU2dRU0I3aUN5SE1Qd2lDdlA2U19LM1lmaHpLVzk3bE9kTUcxY0VJWkFSSWlpQ0FLR1RxMVlJbm5oanpUaGd3bEV4VXpoYktETTNUR2FteWgw?oc=5,"Mon, 02 Mar 2026 21:39:45 GMT",168-year-old mall anchor closing more stores thestreet.com
Nordstrom,Harsimranjeet Singh Ghelani,Closing,Nordstrom Grill closing. Reminisce about department store restaurants - Delawareonline.com,https://news.google.com/rss/articles/CBMi1AFBVV95cUxNYi1fc0dGNFBKTWJXZTZFX3JXb09vbW9VM0FIR2stbE1SbllEQ3N3Z2hsUDdsT05iUUFMYmMwcXZZZTBDdzBhZlB0WkUzUWo3T1hkNF9DbUlHa2gtMjFFY0xOb05xUXV3QzdCRmxERGdxRGRHZ0trY1ZyamwzbnhORlUtQUNRbS1FbGFxdVRGQ1JoeWpZa2gxZXJhR09iVXFUYW5VMFVoTGFjVUNvUGVLbnd0cFdaUG1yWUtqemNQU0gycGJkOGd3SFk5OEV0aUlSYzZnUA?oc=5,"Tue, 03 Mar 2026 10:09:00 GMT",Nordstrom Grill closing. Reminisce about department store restaurants Delawareonline.com
Nordstrom,Harsimranjeet Singh Ghelani,Closing,Delaware's only Nordstrom is closing - Inquirer.com,https://news.google.com/rss/articles/CBMingFBVV95cUxQUXJteHZFZFBDRHlrSzdmcnNSLXhYQWtPY19yTFAzRjljcHlmTHhSZ0NCUkl4UGtLaDdjallYQXZoenloOVFLeEg5TjBObjVxRE1ENldYalZCOTVNMWV4OXJlRWhpdU1KQUtZR0VxazVURTZXNW8yN1YtakVmSkVqRTlIajlodFVIUmtwQV9Ga24tUEdPUF9tXzNLUWN1dw?oc=5,"Mon, 02 Mar 2026 19:06:44 GMT",Delaware's only Nordstrom is closing Inquirer.com
Saks Fifth Avenue,Harsimranjeet Singh Ghelani,Closing,Hundreds more laid off in Pa. due to Saks Fifth Avenue closures - 28/22 News,https://news.google.com/rss/articles/CBMimAFBVV95cUxPV2ItaC0wN1dhY2VnRDNXS3p0MWxhbGZqS0VSLThIdUZSZjBndndCZ3BELUY3V2huVk8tZGFEYmRYNENKLU1BMV9oYjdWRG5seUxzaHhXUWl1VVhmQXlMQkQtUEhXdGRUVjhqWkxlMVVzamY2VlhxM0JWRDAzbnJpOEE3ZFBQNXdTcllsNHpmVGRSeS1CVGJ6VtIBngFBVV95cUxQQzVjY0FORkNOTHV4eU9BS2JXVlJwRmpVeDZEdUpRYU9GSFdmcFpyRl9JcXBySXhvc2JQd09IOV9SaktyRDg1SF8wX1FZVzZ1ZEZfSVppcHF4enk4MkhITTd5dzFWTlgxenFpTUVzU0pFUDRZN0t6ZlhTMzhuTzRmVHNfVWNzcVJXTEZHaU1BaVlKSzBWa1RzeHVKV0VJZw?oc=5,"Wed, 04 Mar 2026 17:38:46 GMT",Hundreds more laid off in Pa. due to Saks Fifth Avenue closures 28/22 News
Saks Fifth Avenue,Harsimranjeet Singh Ghelani,Closing,"Saks Fifth Avenue Closing PA Locations, Hundreds Of Workers Impacted - AOL.com",https://news.google.com/rss/articles/CBMifEFVX3lxTE5Fa0Vlb1dKb1JGek8yemo4TjU0V1VUWTR1UW5xMWZCdlM5d3BLRDNvU1JEaHRQS3dhSWp5NmxndXRudklXTk1pWDJJTEFGd3R2c3FvNm1Tb1hsWW1Xd2R2QjFiS1hlVTR0bEJkcEJzLWY1SVQyZ3FXQVdwQTc?oc=5,"Wed, 04 Mar 2026 14:41:36 GMT","Saks Fifth Avenue Closing PA Locations, Hundreds Of Workers Impacted AOL.com"
Saks Fifth Avenue,Harsimranjeet Singh Ghelani,Closing,Saks Fifth Avenue Closes New Jersey Store at American Dream Mall - National Today,https://news.google.com/rss/articles/CBMiyAFBVV95cUxPc2dhdFJneVg4TTdEcGtPY2VGVU8xSmd2eVR1OERwMXo4RkZwVkZnSnhMeVhRS3k0dXhoemVKQ084YldMazQ2MS1YLW9FOXBKWG1Bd0dNd01OY0ZzNGtBMjg1V3QwblVwNWp1MUJtWjdyNzItSnhhNVo4dS03LTZlLVV2NnZpZTR1aGNFdUdKNGx3aXlCMnU1aG11SjB2TWlFQ2xFLXdoMm93THYyYWd1SnZ5a1RzYVJTb09OcmxxMElEbjNyZEJfZg?oc=5,"Mon, 02 Mar 2026 11:31:01 GMT",Saks Fifth Avenue Closes New Jersey Store at American Dream Mall National Today
ARCO,Harsimranjeet Singh Ghelani,Opening,Oasis to open Tulsa’s first downtown grocery store in a decade - The Journal Record,https://news.google.com/rss/articles/CBMijAFBVV95cUxNNjgwNVVXOS1GR0hpaXpXRldzZk5IZXJ1ZDZUYi1faFVZU0hVZkxWb0Y0TEJodkswSlJrSHp5ZDh6aExhZVZMb29BR3U4NUpvWGoyNjBpSkZvbE5Ub3VlYWdrVlVmYWhqSDk3WXNRWXhYa0dkeVUwUDRfZ3Q4eEpPanNMWXROUWkwalhwTQ?oc=5,"Tue, 03 Mar 2026 18:25:38 GMT",Oasis to open Tulsa’s first downtown grocery store in a decade The Journal Record
ConocoPhillips,Harsimranjeet Singh Ghelani,Closing,ConocoPhillips (Ondo Tokenized Stock) Analytics - CryptoRank,https://news.google.com/rss/articles/CBMif0FVX3lxTFBWQUJ1WFktak1jOTJNRDF3R3pFTWMzdmNwQlRhanctdmV0dUt1SUkyTnQ0cmdOdlpZb1psNFM3eGlkNzJDUUtaVnVWQ2czRU5ZRkpEVEJmVmJpQjJibGFfQ3lQM3BMOW5QSkFRVWx4TW1sdldydEI3cE9JV04weEk?oc=5,"Wed, 04 Mar 2026 15:28:27 GMT",ConocoPhillips (Ondo Tokenized Stock) Analytics CryptoRank
ConocoPhillips,Harsimranjeet Singh Ghelani,Closing,ConocoPhillips stock jumps 4% as oil spikes on Iran conflict — what COP investors watch next - TechStock²,https://news.google.com/rss/articles/CBMirwFBVV95cUxOdk05S1J6dVptWUhsZTBGZkhqU003SEk0dUJNSFhFQ3l2cmxNUWFEX3VBOElndVVxTFRkaldDaFNsWkg3Nko5SEg5UDFKNGpvUWM4aGxxOEN6U3pXSENqM0RrMzVDcnZJMzRub085TUpPTWszNTdRU09fMHNfa1g0VUlIdjZFSFdpQk1neEI0ZDFTVHFDbHZxdmJObklNWGNQNWhVZ0JzaUUzSXpEYzNN?oc=5,"Mon, 02 Mar 2026 23:45:00 GMT",ConocoPhillips stock jumps 4% as oil spikes on Iran conflict — what COP investors watch next TechStock²
ConocoPhillips,Harsimranjeet Singh Ghelani,Closing,UBS (AMUB) offers autocallable ConocoPhillips notes maturing 2029 - Stock Titan,https://news.google.com/rss/articles/CBMinAFBVV95cUxQS1Etc09INUExeC1ZSW1vbmxPWUt3N3lnb1lINW56WE9KeEUyUExYSWY4LXVOdkticzhjVW9yMmxIcTlBVFpaTEhaM19mRmhRX0dObDZzWXRPUXVfcXJiRmhtVXNwZFNQWkk2TnJ1dVlRNXcyQUlSVDd2a01SN1pLM3lkRkVSVHE2WE81bUtpSVpSLXNBWE9zWk43M2M?oc=5,"Mon, 02 Mar 2026 21:38:42 GMT",UBS (AMUB) offers autocallable ConocoPhillips notes maturing 2029 Stock Titan
Pilot Travel Centers,Kabeer Pandya,Opening,Pilot Travel Centers launch robust new foodservice program - Restaurant Business,https://news.google.com/rss/articles/CBMipwFBVV95cUxPUFJmUV9SWWVRUlhMWUs0NFdDX2tibnBMeVBXQW1ZY2N1clVKYndmYlgzaUJZQm4tOE54MS1pR2lCc09MTEFpRkFsY3c3RDctVG8wYzIzdzBTNWZUR3JrZk1pekNlVTMwd3V4WFF0UXowc2k0Rk1NTkhMNUFwazdpWmVwWUlUdldGS0Jsd0ExZi1FeDE0MG5GWDRBVERRVGpoX2lwWGJBaw?oc=5,"Tue, 03 Mar 2026 21:49:52 GMT",Pilot Travel Centers launch robust new foodservice program Restaurant Business
Pilot Travel Centers,Kabeer Pandya,Opening,IdleAir Says 16 Sites Now Operational - Heavy Duty Trucking,https://news.google.com/rss/articles/CBMie0FVX3lxTE1DMjE3R0pJSGo0UlNzdjdEWDROaEdIMktsNU5Qd3RNc1RaQVNwVUhOTGNRck9leWVYOTYzWUc0cDZMWlBOa2REdElmc2MwS3NidThZVnBDMWV6LVFXM1lxcjJod0ktSy0xS1dsUDZqOUJvZ0FTVGFBeDRvUQ?oc=5,"Tue, 03 Mar 2026 06:30:11 GMT",IdleAir Says 16 Sites Now Operational Heavy Duty Trucking
Pilot Travel Centers,Kabeer Pandya,Closing,Williams Signs Accord To Sell Its 60 Travel Centers - Heavy Duty Trucking,https://news.google.com/rss/articles/CBMijgFBVV95cUxPS2JuVGk3X3N0bjFLc2hlWWxZVTdseGhnTVVac3RtQ3o1dWdCWk00R2M0eFRZRnI3Mko1VUZodUF6VjNOeDZhdEJMZFdhUmRKalhGTnZxTWdjQlRNVWdIMUpUT3AyZzdVU2ktSTFJTmtzaVhpMlZCeml6RndOOUVNcjVBZDlvVFRpM2ZmNklR?oc=5,"Wed, 04 Mar 2026 16:45:42 GMT",Williams Signs Accord To Sell Its 60 Travel Centers Heavy Duty Trucking
Pilot Travel Centers,Kabeer Pandya,Closing,"Refinery Closures Mean Higher Prices For Diesel, Gas - Heavy Duty Trucking",https://news.google.com/rss/articles/CBMijgFBVV95cUxNOEVqem5LTVpySkpWSTlqc2lVS2dFTXM0R0RQdTNhYmNiNmFid2hHSFA2aTBWQXRXMHg0eFFYREhXRWV2djBVc0JPTzhLX3NnRWxDMTExWVFHWDZpd25ITmdmMEczN0M0ck9XblZ5RmVORGJpdFZ3T3haeElQWEVIdGFDQU5XVHJJWTRQdkhB?oc=5,"Tue, 03 Mar 2026 06:25:49 GMT","Refinery Closures Mean Higher Prices For Diesel, Gas Heavy Duty Trucking"
